[3567662 ms] UsbSnoop - FilterAddDevice(0dd60008) : DriverObject 09d16c60, pdo 0a3d8060
[3567662 ms] UsbSnoop - FilterDispatchPnp(0dd6020c) : IRP_MJ_PNP (IRP_MN_QUERY_DEVICE_RELATIONS)
[3567662 ms] UsbSnoop - FdoHookDispatchPnp(0dd6020c) : IRP_MJ_PNP (IRP_MN_QUERY_DEVICE_RELATIONS)
[3567662 ms] UsbSnoop - FilterDispatchPnp(0dd6020c) : IRP_MJ_PNP (IRP_MN_QUERY_INTERFACE)
[3567662 ms] UsbSnoop - FdoHookDispatchPnp(0dd6020c) : IRP_MJ_PNP (IRP_MN_QUERY_INTERFACE)
[3567662 ms] UsbSnoop - FilterDispatchPnp(0dd6020c) : IRP_MJ_PNP (IRP_MN_QUERY_LEGACY_BUS_INFORMATION)
[3567663 ms] UsbSnoop - FdoHookDispatchPnp(0dd6020c) : IRP_MJ_PNP (IRP_MN_QUERY_LEGACY_BUS_INFORMATION)
[3567663 ms] UsbSnoop - FilterDispatchPnp(0dd6020c) : IRP_MJ_PNP (IRP_MN_QUERY_RESOURCE_REQUIREMENTS)
[3567663 ms] UsbSnoop - FdoHookDispatchPnp(0dd6020c) : IRP_MJ_PNP (IRP_MN_QUERY_RESOURCE_REQUIREMENTS)
[3567663 ms] UsbSnoop - FilterDispatchPnp(0dd6020c) : IRP_MJ_PNP (IRP_MN_FILTER_RESOURCE_REQUIREMENTS)
[3567663 ms] UsbSnoop - FdoHookDispatchPnp(0dd6020c) : IRP_MJ_PNP (IRP_MN_FILTER_RESOURCE_REQUIREMENTS)
[3567663 ms] UsbSnoop - FilterDispatchPnp(0dd6020c) : IRP_MJ_PNP (IRP_MN_START_DEVICE)
[3567663 ms] UsbSnoop - FdoHookDispatchPnp(0dd6020c) : IRP_MJ_PNP (IRP_MN_START_DEVICE)
[3567664 ms] UsbSnoop - FilterDispatchPnp(0dd6020c) : IRP_MJ_PNP (IRP_MN_START_DEVICE)
[3567664 ms] UsbSnoop - FdoHookDispatchPnp(0dd6020c) : IRP_MJ_PNP (IRP_MN_START_DEVICE)
[3567664 ms] UsbSnoop - FilterDispatchAny(0dd57b90) : IRP_MJ_INTERNAL_DEVICE_CONTROL
[3567664 ms] UsbSnoop - FdoHookDispatchInternalIoctl(0dd57f8c) : fdo=0dffcad0, Irp=0e3549b0, IRQL=0
[3567664 ms]  >>>  URB 1 going down  >>> 
-- URB_FUNCTION_GET_DESCRIPTOR_FROM_DEVICE:
  TransferBufferLength = 00000012
  TransferBuffer       = 06dd3b40
  TransferBufferMDL    = 00000000
  Index                = 00000000
  DescriptorType       = 00000001 (USB_DEVICE_DESCRIPTOR_TYPE)
  LanguageId           = 00000000
[3567665 ms] UsbSnoop - MyInternalIOCTLCompletion(0dd57ddc) : fido=00000000, Irp=0e3549b0, Context=0abca400, IRQL=2
[3567665 ms]  <<<  URB 1 coming back  <<< 
-- URB_FUNCTION_CONTROL_TRANSFER:
  PipeHandle           = 0dd6be40
  TransferFlags        = 0000000b (USBD_TRANSFER_DIRECTION_IN, USBD_SHORT_TRANSFER_OK)
  TransferBufferLength = 00000012
  TransferBuffer       = 06dd3b40
  TransferBufferMDL    = 07260510
    00000000: 12 01 00 02 00 00 00 40 88 1c 3c 00 00 01 01 02
    00000010: 03 01
  UrbLink              = 00000000
  SetupPacket          =
    00000000: 80 06 00 01 00 00 12 00
[3567665 ms] UsbSnoop - FilterDispatchAny(0dd57b90) : IRP_MJ_INTERNAL_DEVICE_CONTROL
[3567665 ms] UsbSnoop - FdoHookDispatchInternalIoctl(0dd57f8c) : fdo=0dffcad0, Irp=0e3549b0, IRQL=0
[3567665 ms]  >>>  URB 2 going down  >>> 
-- URB_FUNCTION_GET_DESCRIPTOR_FROM_DEVICE:
  TransferBufferLength = 00000009
  TransferBuffer       = 06e98d00
  TransferBufferMDL    = 00000000
  Index                = 00000000
  DescriptorType       = 00000002 (USB_CONFIGURATION_DESCRIPTOR_TYPE)
  LanguageId           = 00000000
[3567665 ms] UsbSnoop - MyInternalIOCTLCompletion(0dd57ddc) : fido=00000000, Irp=0e3549b0, Context=0abca400, IRQL=2
[3567665 ms]  <<<  URB 2 coming back  <<< 
-- URB_FUNCTION_CONTROL_TRANSFER:
  PipeHandle           = 0dd6be40
  TransferFlags        = 0000000b (USBD_TRANSFER_DIRECTION_IN, USBD_SHORT_TRANSFER_OK)
  TransferBufferLength = 00000009
  TransferBuffer       = 06e98d00
  TransferBufferMDL    = 0e028ba0
    00000000: 09 02 32 00 01 01 00 80 fa
  UrbLink              = 00000000
  SetupPacket          =
    00000000: 80 06 00 02 00 00 09 00
[3567665 ms] UsbSnoop - FilterDispatchAny(0dd57b90) : IRP_MJ_INTERNAL_DEVICE_CONTROL
[3567665 ms] UsbSnoop - FdoHookDispatchInternalIoctl(0dd57f8c) : fdo=0dffcad0, Irp=0e3549b0, IRQL=0
[3567665 ms]  >>>  URB 3 going down  >>> 
-- URB_FUNCTION_GET_DESCRIPTOR_FROM_DEVICE:
  TransferBufferLength = 00000042
  TransferBuffer       = 0d75e1d0
  TransferBufferMDL    = 00000000
  Index                = 00000000
  DescriptorType       = 00000002 (USB_CONFIGURATION_DESCRIPTOR_TYPE)
  LanguageId           = 00000000
[3567665 ms] UsbSnoop - MyInternalIOCTLCompletion(0dd57ddc) : fido=00000000, Irp=0e3549b0, Context=0abca400, IRQL=2
[3567665 ms]  <<<  URB 3 coming back  <<< 
-- URB_FUNCTION_CONTROL_TRANSFER:
  PipeHandle           = 0dd6be40
  TransferFlags        = 0000000b (USBD_TRANSFER_DIRECTION_IN, USBD_SHORT_TRANSFER_OK)
  TransferBufferLength = 00000032
  TransferBuffer       = 0d75e1d0
  TransferBufferMDL    = 0e028ba0
    00000000: 09 02 32 00 01 01 00 80 fa 09 04 00 00 00 ff ff
    00000010: ff 00 09 04 00 01 01 ff ff ff 00 07 05 82 05 ff
    00000020: 03 01 09 04 00 02 01 ff ff ff 00 07 05 82 05 00
    00000030: 14 01
  UrbLink              = 00000000
  SetupPacket          =
    00000000: 80 06 00 02 00 00 42 00
[3567665 ms] UsbSnoop - FilterDispatchAny(0dd57b90) : IRP_MJ_INTERNAL_DEVICE_CONTROL
[3567665 ms] UsbSnoop - FdoHookDispatchInternalIoctl(0dd57f8c) : fdo=0dffcad0, Irp=0e3549b0, IRQL=0
[3567665 ms]  >>>  URB 4 going down  >>> 
-- URB_FUNCTION_SELECT_CONFIGURATION:
  ConfigurationDescriptor = 0x0d75e1d0 (configure)
  ConfigurationDescriptor : bLength             = 9
  ConfigurationDescriptor : bDescriptorType     = 0x00000002
  ConfigurationDescriptor : wTotalLength        = 0x00000032
  ConfigurationDescriptor : bNumInterfaces      = 0x00000001
  ConfigurationDescriptor : bConfigurationValue = 0x00000001
  ConfigurationDescriptor : iConfiguration      = 0x00000000
  ConfigurationDescriptor : bmAttributes        = 0x00000080
  ConfigurationDescriptor : MaxPower            = 0x000000fa
  ConfigurationHandle     = 0x00000000
  Interface[0]: Length            = 24
  Interface[0]: InterfaceNumber   = 0
  Interface[0]: AlternateSetting  = 0
[3567665 ms] UsbSnoop - MyInternalIOCTLCompletion(0dd57ddc) : fido=00000000, Irp=0e3549b0, Context=0abca400, IRQL=0
[3567665 ms]  <<<  URB 4 coming back  <<< 
-- URB_FUNCTION_SELECT_CONFIGURATION:
  ConfigurationDescriptor = 0x0d75e1d0 (configure)
  ConfigurationDescriptor : bLength             = 9
  ConfigurationDescriptor : bDescriptorType     = 0x00000002
  ConfigurationDescriptor : wTotalLength        = 0x00000032
  ConfigurationDescriptor : bNumInterfaces      = 0x00000001
  ConfigurationDescriptor : bConfigurationValue = 0x00000001
  ConfigurationDescriptor : iConfiguration      = 0x00000000
  ConfigurationDescriptor : bmAttributes        = 0x00000080
  ConfigurationDescriptor : MaxPower            = 0x000000fa
  ConfigurationHandle     = 0x0e24e8a0
  Interface[0]: Length            = 24
  Interface[0]: InterfaceNumber   = 0
  Interface[0]: AlternateSetting  = 0
  Interface[0]: Class             = 0x000000ff
  Interface[0]: SubClass          = 0x000000ff
  Interface[0]: Protocol          = 0x000000ff
  Interface[0]: InterfaceHandle   = 0x0bc3da90
  Interface[0]: NumberOfPipes     = 0
[3567665 ms] UsbSnoop - FilterDispatchAny(0dd57b90) : IRP_MJ_INTERNAL_DEVICE_CONTROL
[3567665 ms] UsbSnoop - FdoHookDispatchInternalIoctl(0dd57f8c) : fdo=0dffcad0, Irp=0e3549b0, IRQL=0
[3567665 ms]  >>>  URB 5 going down  >>> 
-- URB_FUNCTION_VENDOR_DEVICE:
  TransferFlags          = 00000003 (USBD_TRANSFER_DIRECTION_IN, USBD_SHORT_TRANSFER_OK)
  TransferBufferLength = 00000002
  TransferBuffer       = 0379b4b0
  TransferBufferMDL    = 00000000
  UrbLink                 = 00000000
  RequestTypeReservedBits = 00000000
  Request                 = 00000001
  Value                   = 00000001
  Index                   = 00000000
[3567666 ms] UsbSnoop - MyInternalIOCTLCompletion(0dd57ddc) : fido=00000000, Irp=0e3549b0, Context=0abca400, IRQL=2
[3567666 ms]  <<<  URB 5 coming back  <<< 
-- URB_FUNCTION_CONTROL_TRANSFER:
  PipeHandle           = 0dd6be40
  TransferFlags        = 0000000b (USBD_TRANSFER_DIRECTION_IN, USBD_SHORT_TRANSFER_OK)
  TransferBufferLength = 00000002
  TransferBuffer       = 0379b4b0
  TransferBufferMDL    = 0e028ba0
    00000000: 01 03
  UrbLink              = 00000000
  SetupPacket          =
    00000000: c0 01 01 00 00 00 02 00
[3567666 ms] UsbSnoop - FilterDispatchAny(0dd57b90) : IRP_MJ_INTERNAL_DEVICE_CONTROL
[3567666 ms] UsbSnoop - FdoHookDispatchInternalIoctl(0dd57f8c) : fdo=0dffcad0, Irp=0e3549b0, IRQL=0
[3567666 ms]  >>>  URB 6 going down  >>> 
-- URB_FUNCTION_VENDOR_DEVICE:
  TransferFlags          = 00000002 (USBD_TRANSFER_DIRECTION_OUT, USBD_SHORT_TRANSFER_OK)
  TransferBufferLength = 0000000d
  TransferBuffer       = 0379b3c0
  TransferBufferMDL    = 00000000
    00000000: 0b 00 00 82 01 00 3a 80 f0 b3 79 03 80
  UrbLink                 = 00000000
  RequestTypeReservedBits = 00000000
  Request                 = 00000001
  Value                   = 0000000b
  Index                   = 00000000
[3567666 ms] UsbSnoop - MyInternalIOCTLCompletion(0dd57ddc) : fido=00000000, Irp=0e3549b0, Context=0abca400, IRQL=2
[3567666 ms]  <<<  URB 6 coming back  <<< 
-- URB_FUNCTION_CONTROL_TRANSFER:
  PipeHandle           = 0dd6be40
  TransferFlags        = 0000000a (USBD_TRANSFER_DIRECTION_OUT, USBD_SHORT_TRANSFER_OK)
  TransferBufferLength = 0000000d
  TransferBuffer       = 0379b3c0
  TransferBufferMDL    = 0dc7b320
  UrbLink              = 00000000
  SetupPacket          =
    00000000: 40 01 0b 00 00 00 0d 00
[3567666 ms] UsbSnoop - FilterDispatchAny(0dd57b90) : IRP_MJ_INTERNAL_DEVICE_CONTROL
[3567666 ms] UsbSnoop - FdoHookDispatchInternalIoctl(0dd57f8c) : fdo=0dffcad0, Irp=0e3549b0, IRQL=0
[3567666 ms]  >>>  URB 7 going down  >>> 
-- URB_FUNCTION_VENDOR_DEVICE:
  TransferFlags          = 00000002 (USBD_TRANSFER_DIRECTION_OUT, USBD_SHORT_TRANSFER_OK)
  TransferBufferLength = 0000000d
  TransferBuffer       = 0379b3c0
  TransferBufferMDL    = 00000000
    00000000: 0b 00 00 82 01 00 3b 00 f0 b3 79 03 80
  UrbLink                 = 00000000
  RequestTypeReservedBits = 00000000
  Request                 = 00000001
  Value                   = 0000000b
  Index                   = 00000000
[3567666 ms] UsbSnoop - MyInternalIOCTLCompletion(0dd57ddc) : fido=00000000, Irp=0e3549b0, Context=0abca400, IRQL=2
[3567666 ms]  <<<  URB 7 coming back  <<< 
-- URB_FUNCTION_CONTROL_TRANSFER:
  PipeHandle           = 0dd6be40
  TransferFlags        = 0000000a (USBD_TRANSFER_DIRECTION_OUT, USBD_SHORT_TRANSFER_OK)
  TransferBufferLength = 0000000d
  TransferBuffer       = 0379b3c0
  TransferBufferMDL    = 0dc7b320
  UrbLink              = 00000000
  SetupPacket          =
    00000000: 40 01 0b 00 00 00 0d 00
[3567666 ms] UsbSnoop - FilterDispatchAny(0dd57b90) : IRP_MJ_INTERNAL_DEVICE_CONTROL
[3567666 ms] UsbSnoop - FdoHookDispatchInternalIoctl(0dd57f8c) : fdo=0dffcad0, Irp=0e3549b0, IRQL=0
[3567666 ms]  >>>  URB 8 going down  >>> 
-- URB_FUNCTION_VENDOR_DEVICE:
  TransferFlags          = 00000002 (USBD_TRANSFER_DIRECTION_OUT, USBD_SHORT_TRANSFER_OK)
  TransferBufferLength = 0000000d
  TransferBuffer       = 0379b3c0
  TransferBufferMDL    = 00000000
    00000000: 0b 00 00 82 01 00 34 01 f0 b3 79 03 80
  UrbLink                 = 00000000
  RequestTypeReservedBits = 00000000
  Request                 = 00000001
  Value                   = 0000000b
  Index                   = 00000000
[3567666 ms] UsbSnoop - MyInternalIOCTLCompletion(0dd57ddc) : fido=00000000, Irp=0e3549b0, Context=0abca400, IRQL=2
[3567666 ms]  <<<  URB 8 coming back  <<< 
-- URB_FUNCTION_CONTROL_TRANSFER:
  PipeHandle           = 0dd6be40
  TransferFlags        = 0000000a (USBD_TRANSFER_DIRECTION_OUT, USBD_SHORT_TRANSFER_OK)
  TransferBufferLength = 0000000d
  TransferBuffer       = 0379b3c0
  TransferBufferMDL    = 0dc7b320
  UrbLink              = 00000000
  SetupPacket          =
    00000000: 40 01 0b 00 00 00 0d 00
[3567666 ms] UsbSnoop - FilterDispatchAny(0dd57b90) : IRP_MJ_INTERNAL_DEVICE_CONTROL
[3567666 ms] UsbSnoop - FdoHookDispatchInternalIoctl(0dd57f8c) : fdo=0dffcad0, Irp=0e3549b0, IRQL=0
[3567666 ms]  >>>  URB 9 going down  >>> 
-- URB_FUNCTION_VENDOR_DEVICE:
  TransferFlags          = 00000002 (USBD_TRANSFER_DIRECTION_OUT, USBD_SHORT_TRANSFER_OK)
  TransferBufferLength = 0000000d
  TransferBuffer       = 0379b3c0
  TransferBufferMDL    = 00000000
    00000000: 0b 00 00 82 01 00 35 00 f0 b3 79 03 80
  UrbLink                 = 00000000
  RequestTypeReservedBits = 00000000
  Request                 = 00000001
  Value                   = 0000000b
  Index                   = 00000000
[3567667 ms] UsbSnoop - MyInternalIOCTLCompletion(0dd57ddc) : fido=00000000, Irp=0e3549b0, Context=0abca400, IRQL=2
[3567667 ms]  <<<  URB 9 coming back  <<< 
-- URB_FUNCTION_CONTROL_TRANSFER:
  PipeHandle           = 0dd6be40
  TransferFlags        = 0000000a (USBD_TRANSFER_DIRECTION_OUT, USBD_SHORT_TRANSFER_OK)
  TransferBufferLength = 0000000d
  TransferBuffer       = 0379b3c0
  TransferBufferMDL    = 0dc7b320
  UrbLink              = 00000000
  SetupPacket          =
    00000000: 40 01 0b 00 00 00 0d 00
[3567667 ms] UsbSnoop - FilterDispatchPnp(0dd6020c) : IRP_MJ_PNP (IRP_MN_QUERY_INTERFACE)
[3567667 ms] UsbSnoop - FdoHookDispatchPnp(0dd6020c) : IRP_MJ_PNP (IRP_MN_QUERY_INTERFACE)
[3567668 ms] UsbSnoop - FilterDispatchPnp(0dd6020c) : IRP_MJ_PNP (IRP_MN_QUERY_CAPABILITIES)
[3567668 ms] UsbSnoop - FdoHookDispatchPnp(0dd6020c) : IRP_MJ_PNP (IRP_MN_QUERY_CAPABILITIES)
[3567669 ms] UsbSnoop - FilterDispatchPnp(0dd6020c) : IRP_MJ_PNP (IRP_MN_QUERY_PNP_DEVICE_STATE)
[3567669 ms] UsbSnoop - FdoHookDispatchPnp(0dd6020c) : IRP_MJ_PNP (IRP_MN_QUERY_PNP_DEVICE_STATE)
[3567669 ms] UsbSnoop - FilterDispatchPnp(0dd6020c) : IRP_MJ_PNP (IRP_MN_QUERY_DEVICE_RELATIONS)
[3567669 ms] UsbSnoop - FdoHookDispatchPnp(0dd6020c) : IRP_MJ_PNP (IRP_MN_QUERY_DEVICE_RELATIONS)
[3567669 ms] UsbSnoop - FilterDispatchAny(0dd57b90) : IRP_MJ_SYSTEM_CONTROL
