[8014345 ms] UsbSnoop - FilterAddDevice(0dd60008) : DriverObject 09d16c60, pdo 098f2060
[8014345 ms] UsbSnoop - FilterDispatchPnp(0dd6020c) : IRP_MJ_PNP (IRP_MN_QUERY_DEVICE_RELATIONS)
[8014345 ms] UsbSnoop - FdoHookDispatchPnp(0dd6020c) : IRP_MJ_PNP (IRP_MN_QUERY_DEVICE_RELATIONS)
[8014345 ms] UsbSnoop - FilterDispatchPnp(0dd6020c) : IRP_MJ_PNP (IRP_MN_QUERY_INTERFACE)
[8014345 ms] UsbSnoop - FdoHookDispatchPnp(0dd6020c) : IRP_MJ_PNP (IRP_MN_QUERY_INTERFACE)
[8014345 ms] UsbSnoop - FilterDispatchPnp(0dd6020c) : IRP_MJ_PNP (IRP_MN_QUERY_LEGACY_BUS_INFORMATION)
[8014345 ms] UsbSnoop - FdoHookDispatchPnp(0dd6020c) : IRP_MJ_PNP (IRP_MN_QUERY_LEGACY_BUS_INFORMATION)
[8014345 ms] UsbSnoop - FilterDispatchPnp(0dd6020c) : IRP_MJ_PNP (IRP_MN_QUERY_RESOURCE_REQUIREMENTS)
[8014345 ms] UsbSnoop - FdoHookDispatchPnp(0dd6020c) : IRP_MJ_PNP (IRP_MN_QUERY_RESOURCE_REQUIREMENTS)
[8014345 ms] UsbSnoop - FilterDispatchPnp(0dd6020c) : IRP_MJ_PNP (IRP_MN_FILTER_RESOURCE_REQUIREMENTS)
[8014345 ms] UsbSnoop - FdoHookDispatchPnp(0dd6020c) : IRP_MJ_PNP (IRP_MN_FILTER_RESOURCE_REQUIREMENTS)
[8014345 ms] UsbSnoop - FilterDispatchPnp(0dd6020c) : IRP_MJ_PNP (IRP_MN_START_DEVICE)
[8014345 ms] UsbSnoop - FdoHookDispatchPnp(0dd6020c) : IRP_MJ_PNP (IRP_MN_START_DEVICE)
[8014347 ms] UsbSnoop - FilterDispatchPnp(0dd6020c) : IRP_MJ_PNP (IRP_MN_START_DEVICE)
[8014347 ms] UsbSnoop - FdoHookDispatchPnp(0dd6020c) : IRP_MJ_PNP (IRP_MN_START_DEVICE)
[8014347 ms] UsbSnoop - FilterDispatchAny(0dd57b90) : IRP_MJ_INTERNAL_DEVICE_CONTROL
[8014347 ms] UsbSnoop - FdoHookDispatchInternalIoctl(0dd57f8c) : fdo=0e0d7ab0, Irp=0e5e9b40, IRQL=0
[8014347 ms]  >>>  URB 1 going down  >>> 
-- URB_FUNCTION_GET_DESCRIPTOR_FROM_DEVICE:
  TransferBufferLength = 00000012
  TransferBuffer       = 0e0872b0
  TransferBufferMDL    = 00000000
  Index                = 00000000
  DescriptorType       = 00000001 (USB_DEVICE_DESCRIPTOR_TYPE)
  LanguageId           = 00000000
[8014347 ms] UsbSnoop - MyInternalIOCTLCompletion(0dd57ddc) : fido=00000000, Irp=0e5e9b40, Context=0c522240, IRQL=2
[8014347 ms]  <<<  URB 1 coming back  <<< 
-- URB_FUNCTION_CONTROL_TRANSFER:
  PipeHandle           = 0d567060
  TransferFlags        = 0000000b (USBD_TRANSFER_DIRECTION_IN, USBD_SHORT_TRANSFER_OK)
  TransferBufferLength = 00000012
  TransferBuffer       = 0e0872b0
  TransferBufferMDL    = 071a2450
    00000000: 12 01 00 02 00 00 00 40 88 1c 3c 00 00 01 01 02
    00000010: 03 01
  UrbLink              = 00000000
  SetupPacket          =
    00000000: 80 06 00 01 00 00 12 00
[8014347 ms] UsbSnoop - FilterDispatchAny(0dd57b90) : IRP_MJ_INTERNAL_DEVICE_CONTROL
[8014347 ms] UsbSnoop - FdoHookDispatchInternalIoctl(0dd57f8c) : fdo=0e0d7ab0, Irp=0e5e9b40, IRQL=0
[8014347 ms]  >>>  URB 2 going down  >>> 
-- URB_FUNCTION_GET_DESCRIPTOR_FROM_DEVICE:
  TransferBufferLength = 00000009
  TransferBuffer       = 09d61c00
  TransferBufferMDL    = 00000000
  Index                = 00000000
  DescriptorType       = 00000002 (USB_CONFIGURATION_DESCRIPTOR_TYPE)
  LanguageId           = 00000000
[8014347 ms] UsbSnoop - MyInternalIOCTLCompletion(0dd57ddc) : fido=00000000, Irp=0e5e9b40, Context=0e020650, IRQL=2
[8014347 ms]  <<<  URB 2 coming back  <<< 
-- URB_FUNCTION_CONTROL_TRANSFER:
  PipeHandle           = 0d567060
  TransferFlags        = 0000000b (USBD_TRANSFER_DIRECTION_IN, USBD_SHORT_TRANSFER_OK)
  TransferBufferLength = 00000009
  TransferBuffer       = 09d61c00
  TransferBufferMDL    = 0db7da40
    00000000: 09 02 32 00 01 01 00 80 fa
  UrbLink              = 00000000
  SetupPacket          =
    00000000: 80 06 00 02 00 00 09 00
[8014347 ms] UsbSnoop - FilterDispatchAny(0dd57b90) : IRP_MJ_INTERNAL_DEVICE_CONTROL
[8014347 ms] UsbSnoop - FdoHookDispatchInternalIoctl(0dd57f8c) : fdo=0e0d7ab0, Irp=0e5e9b40, IRQL=0
[8014347 ms]  >>>  URB 3 going down  >>> 
-- URB_FUNCTION_GET_DESCRIPTOR_FROM_DEVICE:
  TransferBufferLength = 00000042
  TransferBuffer       = 078552d0
  TransferBufferMDL    = 00000000
  Index                = 00000000
  DescriptorType       = 00000002 (USB_CONFIGURATION_DESCRIPTOR_TYPE)
  LanguageId           = 00000000
[8014347 ms] UsbSnoop - MyInternalIOCTLCompletion(0dd57ddc) : fido=00000000, Irp=0e5e9b40, Context=09d1e8b0, IRQL=2
[8014347 ms]  <<<  URB 3 coming back  <<< 
-- URB_FUNCTION_CONTROL_TRANSFER:
  PipeHandle           = 0d567060
  TransferFlags        = 0000000b (USBD_TRANSFER_DIRECTION_IN, USBD_SHORT_TRANSFER_OK)
  TransferBufferLength = 00000032
  TransferBuffer       = 078552d0
  TransferBufferMDL    = 098a7cd0
    00000000: 09 02 32 00 01 01 00 80 fa 09 04 00 00 00 ff ff
    00000010: ff 00 09 04 00 01 01 ff ff ff 00 07 05 82 05 ff
    00000020: 03 01 09 04 00 02 01 ff ff ff 00 07 05 82 05 00
    00000030: 14 01
  UrbLink              = 00000000
  SetupPacket          =
    00000000: 80 06 00 02 00 00 42 00
[8014347 ms] UsbSnoop - FilterDispatchAny(0dd57b90) : IRP_MJ_INTERNAL_DEVICE_CONTROL
[8014347 ms] UsbSnoop - FdoHookDispatchInternalIoctl(0dd57f8c) : fdo=0e0d7ab0, Irp=0e5e9b40, IRQL=0
[8014347 ms]  >>>  URB 4 going down  >>> 
-- URB_FUNCTION_SELECT_CONFIGURATION:
  ConfigurationDescriptor = 0x078552d0 (configure)
  ConfigurationDescriptor : bLength             = 9
  ConfigurationDescriptor : bDescriptorType     = 0x00000002
  ConfigurationDescriptor : wTotalLength        = 0x00000032
  ConfigurationDescriptor : bNumInterfaces      = 0x00000001
  ConfigurationDescriptor : bConfigurationValue = 0x00000001
  ConfigurationDescriptor : iConfiguration      = 0x00000000
  ConfigurationDescriptor : bmAttributes        = 0x00000080
  ConfigurationDescriptor : MaxPower            = 0x000000fa
  ConfigurationHandle     = 0x00000000
  Interface[0]: Length            = 24
  Interface[0]: InterfaceNumber   = 0
  Interface[0]: AlternateSetting  = 0
[8014348 ms] UsbSnoop - MyInternalIOCTLCompletion(0dd57ddc) : fido=00000000, Irp=0e5e9b40, Context=0abca400, IRQL=0
[8014348 ms]  <<<  URB 4 coming back  <<< 
-- URB_FUNCTION_SELECT_CONFIGURATION:
  ConfigurationDescriptor = 0x078552d0 (configure)
  ConfigurationDescriptor : bLength             = 9
  ConfigurationDescriptor : bDescriptorType     = 0x00000002
  ConfigurationDescriptor : wTotalLength        = 0x00000032
  ConfigurationDescriptor : bNumInterfaces      = 0x00000001
  ConfigurationDescriptor : bConfigurationValue = 0x00000001
  ConfigurationDescriptor : iConfiguration      = 0x00000000
  ConfigurationDescriptor : bmAttributes        = 0x00000080
  ConfigurationDescriptor : MaxPower            = 0x000000fa
  ConfigurationHandle     = 0x0df2a4e0
  Interface[0]: Length            = 24
  Interface[0]: InterfaceNumber   = 0
  Interface[0]: AlternateSetting  = 0
  Interface[0]: Class             = 0x000000ff
  Interface[0]: SubClass          = 0x000000ff
  Interface[0]: Protocol          = 0x000000ff
  Interface[0]: InterfaceHandle   = 0x073264a0
  Interface[0]: NumberOfPipes     = 0
[8014348 ms] UsbSnoop - FilterDispatchAny(0dd57b90) : IRP_MJ_INTERNAL_DEVICE_CONTROL
[8014348 ms] UsbSnoop - FdoHookDispatchInternalIoctl(0dd57f8c) : fdo=0e0d7ab0, Irp=0e5e9b40, IRQL=0
[8014348 ms]  >>>  URB 5 going down  >>> 
-- URB_FUNCTION_VENDOR_DEVICE:
  TransferFlags          = 00000003 (USBD_TRANSFER_DIRECTION_IN, USBD_SHORT_TRANSFER_OK)
  TransferBufferLength = 00000002
  TransferBuffer       = 0379b4b0
  TransferBufferMDL    = 00000000
  UrbLink                 = 00000000
  RequestTypeReservedBits = 00000000
  Request                 = 00000001
  Value                   = 00000001
  Index                   = 00000000
[8014348 ms] UsbSnoop - MyInternalIOCTLCompletion(0dd57ddc) : fido=00000000, Irp=0e5e9b40, Context=0e1574f0, IRQL=2
[8014348 ms]  <<<  URB 5 coming back  <<< 
-- URB_FUNCTION_CONTROL_TRANSFER:
  PipeHandle           = 0d567060
  TransferFlags        = 0000000b (USBD_TRANSFER_DIRECTION_IN, USBD_SHORT_TRANSFER_OK)
  TransferBufferLength = 00000002
  TransferBuffer       = 0379b4b0
  TransferBufferMDL    = 098a7cd0
    00000000: 01 03
  UrbLink              = 00000000
  SetupPacket          =
    00000000: c0 01 01 00 00 00 02 00
[8014348 ms] UsbSnoop - FilterDispatchAny(0dd57b90) : IRP_MJ_INTERNAL_DEVICE_CONTROL
[8014348 ms] UsbSnoop - FdoHookDispatchInternalIoctl(0dd57f8c) : fdo=0e0d7ab0, Irp=0e5e9b40, IRQL=0
[8014348 ms]  >>>  URB 6 going down  >>> 
-- URB_FUNCTION_VENDOR_DEVICE:
  TransferFlags          = 00000002 (USBD_TRANSFER_DIRECTION_OUT, USBD_SHORT_TRANSFER_OK)
  TransferBufferLength = 0000000d
  TransferBuffer       = 0379b3c0
  TransferBufferMDL    = 00000000
    00000000: 0b 00 00 82 01 00 3a 80 f0 b3 79 03 80
  UrbLink                 = 00000000
  RequestTypeReservedBits = 00000000
  Request                 = 00000001
  Value                   = 0000000b
  Index                   = 00000000
[8014348 ms] UsbSnoop - MyInternalIOCTLCompletion(0dd57ddc) : fido=00000000, Irp=0e5e9b40, Context=09bd0440, IRQL=2
[8014348 ms]  <<<  URB 6 coming back  <<< 
-- URB_FUNCTION_CONTROL_TRANSFER:
  PipeHandle           = 0d567060
  TransferFlags        = 0000000a (USBD_TRANSFER_DIRECTION_OUT, USBD_SHORT_TRANSFER_OK)
  TransferBufferLength = 0000000d
  TransferBuffer       = 0379b3c0
  TransferBufferMDL    = 098a7cd0
  UrbLink              = 00000000
  SetupPacket          =
    00000000: 40 01 0b 00 00 00 0d 00
[8014348 ms] UsbSnoop - FilterDispatchAny(0dd57b90) : IRP_MJ_INTERNAL_DEVICE_CONTROL
[8014348 ms] UsbSnoop - FdoHookDispatchInternalIoctl(0dd57f8c) : fdo=0e0d7ab0, Irp=0e5e9b40, IRQL=0
[8014348 ms]  >>>  URB 7 going down  >>> 
-- URB_FUNCTION_VENDOR_DEVICE:
  TransferFlags          = 00000002 (USBD_TRANSFER_DIRECTION_OUT, USBD_SHORT_TRANSFER_OK)
  TransferBufferLength = 0000000d
  TransferBuffer       = 0379b3c0
  TransferBufferMDL    = 00000000
    00000000: 0b 00 00 82 01 00 3b 00 f0 b3 79 03 80
  UrbLink                 = 00000000
  RequestTypeReservedBits = 00000000
  Request                 = 00000001
  Value                   = 0000000b
  Index                   = 00000000
[8014348 ms] UsbSnoop - MyInternalIOCTLCompletion(0dd57ddc) : fido=00000000, Irp=0e5e9b40, Context=09bd0440, IRQL=2
[8014348 ms]  <<<  URB 7 coming back  <<< 
-- URB_FUNCTION_CONTROL_TRANSFER:
  PipeHandle           = 0d567060
  TransferFlags        = 0000000a (USBD_TRANSFER_DIRECTION_OUT, USBD_SHORT_TRANSFER_OK)
  TransferBufferLength = 0000000d
  TransferBuffer       = 0379b3c0
  TransferBufferMDL    = 098a7cd0
  UrbLink              = 00000000
  SetupPacket          =
    00000000: 40 01 0b 00 00 00 0d 00
[8014348 ms] UsbSnoop - FilterDispatchAny(0dd57b90) : IRP_MJ_INTERNAL_DEVICE_CONTROL
[8014348 ms] UsbSnoop - FdoHookDispatchInternalIoctl(0dd57f8c) : fdo=0e0d7ab0, Irp=0e5e9b40, IRQL=0
[8014348 ms]  >>>  URB 8 going down  >>> 
-- URB_FUNCTION_VENDOR_DEVICE:
  TransferFlags          = 00000002 (USBD_TRANSFER_DIRECTION_OUT, USBD_SHORT_TRANSFER_OK)
  TransferBufferLength = 0000000d
  TransferBuffer       = 0379b3c0
  TransferBufferMDL    = 00000000
    00000000: 0b 00 00 82 01 00 34 01 f0 b3 79 03 80
  UrbLink                 = 00000000
  RequestTypeReservedBits = 00000000
  Request                 = 00000001
  Value                   = 0000000b
  Index                   = 00000000
[8014349 ms] UsbSnoop - MyInternalIOCTLCompletion(0dd57ddc) : fido=00000000, Irp=0e5e9b40, Context=09bd0440, IRQL=2
[8014349 ms]  <<<  URB 8 coming back  <<< 
-- URB_FUNCTION_CONTROL_TRANSFER:
  PipeHandle           = 0d567060
  TransferFlags        = 0000000a (USBD_TRANSFER_DIRECTION_OUT, USBD_SHORT_TRANSFER_OK)
  TransferBufferLength = 0000000d
  TransferBuffer       = 0379b3c0
  TransferBufferMDL    = 098a7cd0
  UrbLink              = 00000000
  SetupPacket          =
    00000000: 40 01 0b 00 00 00 0d 00
[8014349 ms] UsbSnoop - FilterDispatchAny(0dd57b90) : IRP_MJ_INTERNAL_DEVICE_CONTROL
[8014349 ms] UsbSnoop - FdoHookDispatchInternalIoctl(0dd57f8c) : fdo=0e0d7ab0, Irp=0e5e9b40, IRQL=0
[8014349 ms]  >>>  URB 9 going down  >>> 
-- URB_FUNCTION_VENDOR_DEVICE:
  TransferFlags          = 00000002 (USBD_TRANSFER_DIRECTION_OUT, USBD_SHORT_TRANSFER_OK)
  TransferBufferLength = 0000000d
  TransferBuffer       = 0379b3c0
  TransferBufferMDL    = 00000000
    00000000: 0b 00 00 82 01 00 35 00 f0 b3 79 03 80
  UrbLink                 = 00000000
  RequestTypeReservedBits = 00000000
  Request                 = 00000001
  Value                   = 0000000b
  Index                   = 00000000
[8014349 ms] UsbSnoop - MyInternalIOCTLCompletion(0dd57ddc) : fido=00000000, Irp=0e5e9b40, Context=09bd0440, IRQL=2
[8014349 ms]  <<<  URB 9 coming back  <<< 
-- URB_FUNCTION_CONTROL_TRANSFER:
  PipeHandle           = 0d567060
  TransferFlags        = 0000000a (USBD_TRANSFER_DIRECTION_OUT, USBD_SHORT_TRANSFER_OK)
  TransferBufferLength = 0000000d
  TransferBuffer       = 0379b3c0
  TransferBufferMDL    = 098a7cd0
  UrbLink              = 00000000
  SetupPacket          =
    00000000: 40 01 0b 00 00 00 0d 00
[8014349 ms] UsbSnoop - FilterDispatchPnp(0dd6020c) : IRP_MJ_PNP (IRP_MN_QUERY_INTERFACE)
[8014349 ms] UsbSnoop - FdoHookDispatchPnp(0dd6020c) : IRP_MJ_PNP (IRP_MN_QUERY_INTERFACE)
[8014351 ms] UsbSnoop - FilterDispatchPnp(0dd6020c) : IRP_MJ_PNP (IRP_MN_QUERY_CAPABILITIES)
[8014351 ms] UsbSnoop - FdoHookDispatchPnp(0dd6020c) : IRP_MJ_PNP (IRP_MN_QUERY_CAPABILITIES)
[8014351 ms] UsbSnoop - FilterDispatchPnp(0dd6020c) : IRP_MJ_PNP (IRP_MN_QUERY_PNP_DEVICE_STATE)
[8014351 ms] UsbSnoop - FdoHookDispatchPnp(0dd6020c) : IRP_MJ_PNP (IRP_MN_QUERY_PNP_DEVICE_STATE)
[8014351 ms] UsbSnoop - FilterDispatchPnp(0dd6020c) : IRP_MJ_PNP (IRP_MN_QUERY_DEVICE_RELATIONS)
[8014351 ms] UsbSnoop - FdoHookDispatchPnp(0dd6020c) : IRP_MJ_PNP (IRP_MN_QUERY_DEVICE_RELATIONS)
[8014351 ms] UsbSnoop - FilterDispatchAny(0dd57b90) : IRP_MJ_SYSTEM_CONTROL
[8030111 ms] UsbSnoop - FilterDispatchAny(0dd57b90) : IRP_MJ_INTERNAL_DEVICE_CONTROL
[8030111 ms] UsbSnoop - FdoHookDispatchInternalIoctl(0dd57f8c) : fdo=0e0d7ab0, Irp=0d862b40, IRQL=0
[8030111 ms]  >>>  URB 10 going down  >>> 
-- URB_FUNCTION_VENDOR_DEVICE:
  TransferFlags          = 00000002 (USBD_TRANSFER_DIRECTION_OUT, USBD_SHORT_TRANSFER_OK)
  TransferBufferLength = 0000000d
  TransferBuffer       = 0e0b4248
  TransferBufferMDL    = 00000000
    00000000: 0b 00 20 82 01 30 80 1b e1 03 00 00 00
  UrbLink                 = 00000000
  RequestTypeReservedBits = 00000000
  Request                 = 00000001
  Value                   = 0000000b
  Index                   = 00000000
[8030111 ms] UsbSnoop - MyInternalIOCTLCompletion(0dd57ddc) : fido=00000000, Irp=0d862b40, Context=09bd0440, IRQL=2
[8030111 ms]  <<<  URB 10 coming back  <<< 
-- URB_FUNCTION_CONTROL_TRANSFER:
  PipeHandle           = 0d567060
  TransferFlags        = 0000000a (USBD_TRANSFER_DIRECTION_OUT, USBD_SHORT_TRANSFER_OK)
  TransferBufferLength = 0000000d
  TransferBuffer       = 0e0b4248
  TransferBufferMDL    = 07c938f0
  UrbLink              = 00000000
  SetupPacket          =
    00000000: 40 01 0b 00 00 00 0d 00
[8030111 ms] UsbSnoop - FilterDispatchAny(0dd57b90) : IRP_MJ_INTERNAL_DEVICE_CONTROL
[8030111 ms] UsbSnoop - FdoHookDispatchInternalIoctl(0dd57f8c) : fdo=0e0d7ab0, Irp=0d862b40, IRQL=0
[8030111 ms]  >>>  URB 11 going down  >>> 
-- URB_FUNCTION_VENDOR_DEVICE:
  TransferFlags          = 00000003 (USBD_TRANSFER_DIRECTION_IN, USBD_SHORT_TRANSFER_OK)
  TransferBufferLength = 0000000d
  TransferBuffer       = 0e0b4248
  TransferBufferMDL    = 00000000
  UrbLink                 = 00000000
  RequestTypeReservedBits = 00000000
  Request                 = 00000001
  Value                   = 0000000b
  Index                   = 00000000
[8030111 ms] UsbSnoop - MyInternalIOCTLCompletion(0dd57ddc) : fido=00000000, Irp=0d862b40, Context=09bd0440, IRQL=2
[8030111 ms]  <<<  URB 11 coming back  <<< 
-- URB_FUNCTION_CONTROL_TRANSFER:
  PipeHandle           = 0d567060
  TransferFlags        = 0000000b (USBD_TRANSFER_DIRECTION_IN, USBD_SHORT_TRANSFER_OK)
  TransferBufferLength = 0000000d
  TransferBuffer       = 0e0b4248
  TransferBufferMDL    = 0d3bb060
    00000000: 0b 00 20 82 01 30 80 80 e1 03 00 00 00
  UrbLink              = 00000000
  SetupPacket          =
    00000000: c0 01 0b 00 00 00 0d 00
[8030111 ms] UsbSnoop - FilterDispatchAny(0dd57b90) : IRP_MJ_INTERNAL_DEVICE_CONTROL
[8030111 ms] UsbSnoop - FdoHookDispatchInternalIoctl(0dd57f8c) : fdo=0e0d7ab0, Irp=0d862b40, IRQL=0
[8030111 ms]  >>>  URB 12 going down  >>> 
-- URB_FUNCTION_VENDOR_DEVICE:
  TransferFlags          = 00000002 (USBD_TRANSFER_DIRECTION_OUT, USBD_SHORT_TRANSFER_OK)
  TransferBufferLength = 0000000d
  TransferBuffer       = 0e0b4260
  TransferBufferMDL    = 00000000
    00000000: 0b 00 00 82 01 00 34 11 50 b3 df 02 00
  UrbLink                 = 00000000
  RequestTypeReservedBits = 00000000
  Request                 = 00000001
  Value                   = 0000000b
  Index                   = 00000000
[8030111 ms] UsbSnoop - MyInternalIOCTLCompletion(0dd57ddc) : fido=00000000, Irp=0d862b40, Context=09bd0440, IRQL=2
[8030111 ms]  <<<  URB 12 coming back  <<< 
-- URB_FUNCTION_CONTROL_TRANSFER:
  PipeHandle           = 0d567060
  TransferFlags        = 0000000a (USBD_TRANSFER_DIRECTION_OUT, USBD_SHORT_TRANSFER_OK)
  TransferBufferLength = 0000000d
  TransferBuffer       = 0e0b4260
  TransferBufferMDL    = 0dc04850
  UrbLink              = 00000000
  SetupPacket          =
    00000000: 40 01 0b 00 00 00 0d 00
[8030111 ms] UsbSnoop - FilterDispatchAny(0dd57b90) : IRP_MJ_INTERNAL_DEVICE_CONTROL
[8030111 ms] UsbSnoop - FdoHookDispatchInternalIoctl(0dd57f8c) : fdo=0e0d7ab0, Irp=0d862b40, IRQL=0
[8030111 ms]  >>>  URB 13 going down  >>> 
-- URB_FUNCTION_VENDOR_DEVICE:
  TransferFlags          = 00000002 (USBD_TRANSFER_DIRECTION_OUT, USBD_SHORT_TRANSFER_OK)
  TransferBufferLength = 0000000d
  TransferBuffer       = 0e0b4260
  TransferBufferMDL    = 00000000
    00000000: 0b 00 00 82 01 00 35 11 50 b3 df 02 00
  UrbLink                 = 00000000
  RequestTypeReservedBits = 00000000
  Request                 = 00000001
  Value                   = 0000000b
  Index                   = 00000000
[8030112 ms] UsbSnoop - MyInternalIOCTLCompletion(0dd57ddc) : fido=00000000, Irp=0d862b40, Context=09bd0440, IRQL=2
[8030112 ms]  <<<  URB 13 coming back  <<< 
-- URB_FUNCTION_CONTROL_TRANSFER:
  PipeHandle           = 0d567060
  TransferFlags        = 0000000a (USBD_TRANSFER_DIRECTION_OUT, USBD_SHORT_TRANSFER_OK)
  TransferBufferLength = 0000000d
  TransferBuffer       = 0e0b4260
  TransferBufferMDL    = 098deaf0
  UrbLink              = 00000000
  SetupPacket          =
    00000000: 40 01 0b 00 00 00 0d 00
[8030122 ms] UsbSnoop - FilterDispatchAny(0dd57b90) : IRP_MJ_INTERNAL_DEVICE_CONTROL
[8030122 ms] UsbSnoop - FdoHookDispatchInternalIoctl(0dd57f8c) : fdo=0e0d7ab0, Irp=0d862b40, IRQL=0
[8030122 ms]  >>>  URB 14 going down  >>> 
-- URB_FUNCTION_VENDOR_DEVICE:
  TransferFlags          = 00000002 (USBD_TRANSFER_DIRECTION_OUT, USBD_SHORT_TRANSFER_OK)
  TransferBufferLength = 0000000d
  TransferBuffer       = 0e0b4260
  TransferBufferMDL    = 00000000
    00000000: 0b 00 00 82 01 00 3a 80 88 ca d7 0d 80
  UrbLink                 = 00000000
  RequestTypeReservedBits = 00000000
  Request                 = 00000001
  Value                   = 0000000b
  Index                   = 00000000
[8030122 ms] UsbSnoop - MyInternalIOCTLCompletion(0dd57ddc) : fido=00000000, Irp=0d862b40, Context=09bd0440, IRQL=2
[8030122 ms]  <<<  URB 14 coming back  <<< 
-- URB_FUNCTION_CONTROL_TRANSFER:
  PipeHandle           = 0d567060
  TransferFlags        = 0000000a (USBD_TRANSFER_DIRECTION_OUT, USBD_SHORT_TRANSFER_OK)
  TransferBufferLength = 0000000d
  TransferBuffer       = 0e0b4260
  TransferBufferMDL    = 0d5e91c0
  UrbLink              = 00000000
  SetupPacket          =
    00000000: 40 01 0b 00 00 00 0d 00
[8030122 ms] UsbSnoop - FilterDispatchAny(0dd57b90) : IRP_MJ_INTERNAL_DEVICE_CONTROL
[8030122 ms] UsbSnoop - FdoHookDispatchInternalIoctl(0dd57f8c) : fdo=0e0d7ab0, Irp=0d862b40, IRQL=0
[8030122 ms]  >>>  URB 15 going down  >>> 
-- URB_FUNCTION_VENDOR_DEVICE:
  TransferFlags          = 00000002 (USBD_TRANSFER_DIRECTION_OUT, USBD_SHORT_TRANSFER_OK)
  TransferBufferLength = 0000000d
  TransferBuffer       = 0e0b4260
  TransferBufferMDL    = 00000000
    00000000: 0b 00 00 82 01 00 3b 80 88 ca d7 0d 80
  UrbLink                 = 00000000
  RequestTypeReservedBits = 00000000
  Request                 = 00000001
  Value                   = 0000000b
  Index                   = 00000000
[8030122 ms] UsbSnoop - MyInternalIOCTLCompletion(0dd57ddc) : fido=00000000, Irp=0d862b40, Context=09bd0440, IRQL=2
[8030122 ms]  <<<  URB 15 coming back  <<< 
-- URB_FUNCTION_CONTROL_TRANSFER:
  PipeHandle           = 0d567060
  TransferFlags        = 0000000a (USBD_TRANSFER_DIRECTION_OUT, USBD_SHORT_TRANSFER_OK)
  TransferBufferLength = 0000000d
  TransferBuffer       = 0e0b4260
  TransferBufferMDL    = 0d5e91c0
  UrbLink              = 00000000
  SetupPacket          =
    00000000: 40 01 0b 00 00 00 0d 00
[8030222 ms] UsbSnoop - FilterDispatchAny(0dd57b90) : IRP_MJ_INTERNAL_DEVICE_CONTROL
[8030222 ms] UsbSnoop - FdoHookDispatchInternalIoctl(0dd57f8c) : fdo=0e0d7ab0, Irp=0d862b40, IRQL=0
[8030222 ms]  >>>  URB 16 going down  >>> 
-- URB_FUNCTION_VENDOR_DEVICE:
  TransferFlags          = 00000002 (USBD_TRANSFER_DIRECTION_OUT, USBD_SHORT_TRANSFER_OK)
  TransferBufferLength = 0000000d
  TransferBuffer       = 0e0b4260
  TransferBufferMDL    = 00000000
    00000000: 0b 00 00 82 01 00 3a 80 88 ca d7 0d 80
  UrbLink                 = 00000000
  RequestTypeReservedBits = 00000000
  Request                 = 00000001
  Value                   = 0000000b
  Index                   = 00000000
[8030222 ms] UsbSnoop - MyInternalIOCTLCompletion(0dd57ddc) : fido=00000000, Irp=0d862b40, Context=09bd0440, IRQL=2
[8030222 ms]  <<<  URB 16 coming back  <<< 
-- URB_FUNCTION_CONTROL_TRANSFER:
  PipeHandle           = 0d567060
  TransferFlags        = 0000000a (USBD_TRANSFER_DIRECTION_OUT, USBD_SHORT_TRANSFER_OK)
  TransferBufferLength = 0000000d
  TransferBuffer       = 0e0b4260
  TransferBufferMDL    = 0d5e91c0
  UrbLink              = 00000000
  SetupPacket          =
    00000000: 40 01 0b 00 00 00 0d 00
[8030222 ms] UsbSnoop - FilterDispatchAny(0dd57b90) : IRP_MJ_INTERNAL_DEVICE_CONTROL
[8030222 ms] UsbSnoop - FdoHookDispatchInternalIoctl(0dd57f8c) : fdo=0e0d7ab0, Irp=0d862b40, IRQL=0
[8030222 ms]  >>>  URB 17 going down  >>> 
-- URB_FUNCTION_VENDOR_DEVICE:
  TransferFlags          = 00000002 (USBD_TRANSFER_DIRECTION_OUT, USBD_SHORT_TRANSFER_OK)
  TransferBufferLength = 0000000d
  TransferBuffer       = 0e0b4260
  TransferBufferMDL    = 00000000
    00000000: 0b 00 00 82 01 00 3b 00 88 ca d7 0d 80
  UrbLink                 = 00000000
  RequestTypeReservedBits = 00000000
  Request                 = 00000001
  Value                   = 0000000b
  Index                   = 00000000
[8030222 ms] UsbSnoop - MyInternalIOCTLCompletion(0dd57ddc) : fido=00000000, Irp=0d862b40, Context=09bd0440, IRQL=2
[8030222 ms]  <<<  URB 17 coming back  <<< 
-- URB_FUNCTION_CONTROL_TRANSFER:
  PipeHandle           = 0d567060
  TransferFlags        = 0000000a (USBD_TRANSFER_DIRECTION_OUT, USBD_SHORT_TRANSFER_OK)
  TransferBufferLength = 0000000d
  TransferBuffer       = 0e0b4260
  TransferBufferMDL    = 0b3a0ab0
  UrbLink              = 00000000
  SetupPacket          =
    00000000: 40 01 0b 00 00 00 0d 00
[8030234 ms] UsbSnoop - FilterDispatchAny(0dd57b90) : IRP_MJ_INTERNAL_DEVICE_CONTROL
[8030234 ms] UsbSnoop - FdoHookDispatchInternalIoctl(0dd57f8c) : fdo=0e0d7ab0, Irp=0e16e1a0, IRQL=0
[8030234 ms]  >>>  URB 18 going down  >>> 
-- URB_FUNCTION_VENDOR_DEVICE:
  TransferFlags          = 00000002 (USBD_TRANSFER_DIRECTION_OUT, USBD_SHORT_TRANSFER_OK)
  TransferBufferLength = 0000000d
  TransferBuffer       = 0e0b46b0
  TransferBufferMDL    = 00000000
    00000000: 0b 00 00 82 01 17 40 00 bd bf df 02 00
  UrbLink                 = 00000000
  RequestTypeReservedBits = 00000000
  Request                 = 00000001
  Value                   = 0000000b
  Index                   = 00000000
[8030235 ms] UsbSnoop - MyInternalIOCTLCompletion(0dd57ddc) : fido=00000000, Irp=0e16e1a0, Context=09bd0440, IRQL=2
[8030235 ms]  <<<  URB 18 coming back  <<< 
-- URB_FUNCTION_CONTROL_TRANSFER:
  PipeHandle           = 0d567060
  TransferFlags        = 0000000a (USBD_TRANSFER_DIRECTION_OUT, USBD_SHORT_TRANSFER_OK)
  TransferBufferLength = 0000000d
  TransferBuffer       = 0e0b46b0
  TransferBufferMDL    = 098a8b90
  UrbLink              = 00000000
  SetupPacket          =
    00000000: 40 01 0b 00 00 00 0d 00
[8030235 ms] UsbSnoop - FilterDispatchAny(0dd57b90) : IRP_MJ_INTERNAL_DEVICE_CONTROL
[8030235 ms] UsbSnoop - FdoHookDispatchInternalIoctl(0dd57f8c) : fdo=0e0d7ab0, Irp=0e16e1a0, IRQL=0
[8030235 ms]  >>>  URB 19 going down  >>> 
-- URB_FUNCTION_VENDOR_DEVICE:
  TransferFlags          = 00000002 (USBD_TRANSFER_DIRECTION_OUT, USBD_SHORT_TRANSFER_OK)
  TransferBufferLength = 0000000d
  TransferBuffer       = 0e0b46d0
  TransferBufferMDL    = 00000000
    00000000: 0b 00 00 82 01 00 3a 80 89 75 32 2f 00
  UrbLink                 = 00000000
  RequestTypeReservedBits = 00000000
  Request                 = 00000001
  Value                   = 0000000b
  Index                   = 00000000
[8030235 ms] UsbSnoop - MyInternalIOCTLCompletion(0dd57ddc) : fido=00000000, Irp=0e16e1a0, Context=09bd0440, IRQL=2
[8030235 ms]  <<<  URB 19 coming back  <<< 
-- URB_FUNCTION_CONTROL_TRANSFER:
  PipeHandle           = 0d567060
  TransferFlags        = 0000000a (USBD_TRANSFER_DIRECTION_OUT, USBD_SHORT_TRANSFER_OK)
  TransferBufferLength = 0000000d
  TransferBuffer       = 0e0b46d0
  TransferBufferMDL    = 098a8b90
  UrbLink              = 00000000
  SetupPacket          =
    00000000: 40 01 0b 00 00 00 0d 00
[8030235 ms] UsbSnoop - FilterDispatchAny(0dd57b90) : IRP_MJ_INTERNAL_DEVICE_CONTROL
[8030235 ms] UsbSnoop - FdoHookDispatchInternalIoctl(0dd57f8c) : fdo=0e0d7ab0, Irp=0e16e1a0, IRQL=0
[8030235 ms]  >>>  URB 20 going down  >>> 
-- URB_FUNCTION_VENDOR_DEVICE:
  TransferFlags          = 00000002 (USBD_TRANSFER_DIRECTION_OUT, USBD_SHORT_TRANSFER_OK)
  TransferBufferLength = 0000000d
  TransferBuffer       = 0e0b46d0
  TransferBufferMDL    = 00000000
    00000000: 0b 00 00 82 01 00 3b 00 89 75 32 2f 00
  UrbLink                 = 00000000
  RequestTypeReservedBits = 00000000
  Request                 = 00000001
  Value                   = 0000000b
  Index                   = 00000000
[8030235 ms] UsbSnoop - MyInternalIOCTLCompletion(0dd57ddc) : fido=00000000, Irp=0e16e1a0, Context=09bd0440, IRQL=2
[8030235 ms]  <<<  URB 20 coming back  <<< 
-- URB_FUNCTION_CONTROL_TRANSFER:
  PipeHandle           = 0d567060
  TransferFlags        = 0000000a (USBD_TRANSFER_DIRECTION_OUT, USBD_SHORT_TRANSFER_OK)
  TransferBufferLength = 0000000d
  TransferBuffer       = 0e0b46d0
  TransferBufferMDL    = 098a8b90
  UrbLink              = 00000000
  SetupPacket          =
    00000000: 40 01 0b 00 00 00 0d 00
[8030235 ms] UsbSnoop - FilterDispatchAny(0dd57b90) : IRP_MJ_INTERNAL_DEVICE_CONTROL
[8030235 ms] UsbSnoop - FdoHookDispatchInternalIoctl(0dd57f8c) : fdo=0e0d7ab0, Irp=0e16e1a0, IRQL=0
[8030235 ms]  >>>  URB 21 going down  >>> 
-- URB_FUNCTION_VENDOR_DEVICE:
  TransferFlags          = 00000002 (USBD_TRANSFER_DIRECTION_OUT, USBD_SHORT_TRANSFER_OK)
  TransferBufferLength = 0000000d
  TransferBuffer       = 0e0b46d0
  TransferBufferMDL    = 00000000
    00000000: 0b 00 00 82 01 00 34 01 89 75 32 2f 00
  UrbLink                 = 00000000
  RequestTypeReservedBits = 00000000
  Request                 = 00000001
  Value                   = 0000000b
  Index                   = 00000000
[8030235 ms] UsbSnoop - MyInternalIOCTLCompletion(0dd57ddc) : fido=00000000, Irp=0e16e1a0, Context=09bd0440, IRQL=2
[8030235 ms]  <<<  URB 21 coming back  <<< 
-- URB_FUNCTION_CONTROL_TRANSFER:
  PipeHandle           = 0d567060
  TransferFlags        = 0000000a (USBD_TRANSFER_DIRECTION_OUT, USBD_SHORT_TRANSFER_OK)
  TransferBufferLength = 0000000d
  TransferBuffer       = 0e0b46d0
  TransferBufferMDL    = 098a8b90
  UrbLink              = 00000000
  SetupPacket          =
    00000000: 40 01 0b 00 00 00 0d 00
[8030235 ms] UsbSnoop - FilterDispatchAny(0dd57b90) : IRP_MJ_INTERNAL_DEVICE_CONTROL
[8030235 ms] UsbSnoop - FdoHookDispatchInternalIoctl(0dd57f8c) : fdo=0e0d7ab0, Irp=0e16e1a0, IRQL=0
[8030236 ms]  >>>  URB 22 going down  >>> 
-- URB_FUNCTION_VENDOR_DEVICE:
  TransferFlags          = 00000002 (USBD_TRANSFER_DIRECTION_OUT, USBD_SHORT_TRANSFER_OK)
  TransferBufferLength = 0000000d
  TransferBuffer       = 0e0b46d0
  TransferBufferMDL    = 00000000
    00000000: 0b 00 00 82 01 00 35 00 89 75 32 2f 00
  UrbLink                 = 00000000
  RequestTypeReservedBits = 00000000
  Request                 = 00000001
  Value                   = 0000000b
  Index                   = 00000000
[8030236 ms] UsbSnoop - MyInternalIOCTLCompletion(0dd57ddc) : fido=00000000, Irp=0e16e1a0, Context=09bd0440, IRQL=2
[8030236 ms]  <<<  URB 22 coming back  <<< 
-- URB_FUNCTION_CONTROL_TRANSFER:
  PipeHandle           = 0d567060
  TransferFlags        = 0000000a (USBD_TRANSFER_DIRECTION_OUT, USBD_SHORT_TRANSFER_OK)
  TransferBufferLength = 0000000d
  TransferBuffer       = 0e0b46d0
  TransferBufferMDL    = 098a8b90
  UrbLink              = 00000000
  SetupPacket          =
    00000000: 40 01 0b 00 00 00 0d 00
[8030291 ms] UsbSnoop - FilterDispatchAny(0dd57b90) : IRP_MJ_INTERNAL_DEVICE_CONTROL
[8030291 ms] UsbSnoop - FdoHookDispatchInternalIoctl(0dd57f8c) : fdo=0e0d7ab0, Irp=098a5870, IRQL=0
[8030291 ms]  >>>  URB 23 going down  >>> 
-- URB_FUNCTION_VENDOR_DEVICE:
  TransferFlags          = 00000002 (USBD_TRANSFER_DIRECTION_OUT, USBD_SHORT_TRANSFER_OK)
  TransferBufferLength = 0000000d
  TransferBuffer       = 0e0b4248
  TransferBufferMDL    = 00000000
    00000000: 0b 00 20 82 01 30 80 1b 00 00 00 00 00
  UrbLink                 = 00000000
  RequestTypeReservedBits = 00000000
  Request                 = 00000001
  Value                   = 0000000b
  Index                   = 00000000
[8030292 ms] UsbSnoop - MyInternalIOCTLCompletion(0dd57ddc) : fido=00000000, Irp=098a5870, Context=09bd0440, IRQL=2
[8030292 ms]  <<<  URB 23 coming back  <<< 
-- URB_FUNCTION_CONTROL_TRANSFER:
  PipeHandle           = 0d567060
  TransferFlags        = 0000000a (USBD_TRANSFER_DIRECTION_OUT, USBD_SHORT_TRANSFER_OK)
  TransferBufferLength = 0000000d
  TransferBuffer       = 0e0b4248
  TransferBufferMDL    = 0b3a0ab0
  UrbLink              = 00000000
  SetupPacket          =
    00000000: 40 01 0b 00 00 00 0d 00
[8030292 ms] UsbSnoop - FilterDispatchAny(0dd57b90) : IRP_MJ_INTERNAL_DEVICE_CONTROL
[8030292 ms] UsbSnoop - FdoHookDispatchInternalIoctl(0dd57f8c) : fdo=0e0d7ab0, Irp=098a5870, IRQL=0
[8030292 ms]  >>>  URB 24 going down  >>> 
-- URB_FUNCTION_VENDOR_DEVICE:
  TransferFlags          = 00000003 (USBD_TRANSFER_DIRECTION_IN, USBD_SHORT_TRANSFER_OK)
  TransferBufferLength = 0000000d
  TransferBuffer       = 0e0b4248
  TransferBufferMDL    = 00000000
  UrbLink                 = 00000000
  RequestTypeReservedBits = 00000000
  Request                 = 00000001
  Value                   = 0000000b
  Index                   = 00000000
[8030292 ms] UsbSnoop - MyInternalIOCTLCompletion(0dd57ddc) : fido=00000000, Irp=098a5870, Context=09bd0440, IRQL=2
[8030292 ms]  <<<  URB 24 coming back  <<< 
-- URB_FUNCTION_CONTROL_TRANSFER:
  PipeHandle           = 0d567060
  TransferFlags        = 0000000b (USBD_TRANSFER_DIRECTION_IN, USBD_SHORT_TRANSFER_OK)
  TransferBufferLength = 0000000d
  TransferBuffer       = 0e0b4248
  TransferBufferMDL    = 0b3a0ab0
    00000000: 0b 00 20 82 01 30 80 80 00 00 00 00 00
  UrbLink              = 00000000
  SetupPacket          =
    00000000: c0 01 0b 00 00 00 0d 00
[8030292 ms] UsbSnoop - FilterDispatchAny(0dd57b90) : IRP_MJ_INTERNAL_DEVICE_CONTROL
[8030292 ms] UsbSnoop - FdoHookDispatchInternalIoctl(0dd57f8c) : fdo=0e0d7ab0, Irp=098a5870, IRQL=0
[8030292 ms]  >>>  URB 25 going down  >>> 
-- URB_FUNCTION_VENDOR_DEVICE:
  TransferFlags          = 00000002 (USBD_TRANSFER_DIRECTION_OUT, USBD_SHORT_TRANSFER_OK)
  TransferBufferLength = 0000000d
  TransferBuffer       = 0e0b4260
  TransferBufferMDL    = 00000000
    00000000: 0b 00 00 82 01 00 34 11 50 b3 df 02 00
  UrbLink                 = 00000000
  RequestTypeReservedBits = 00000000
  Request                 = 00000001
  Value                   = 0000000b
  Index                   = 00000000
[8030292 ms] UsbSnoop - MyInternalIOCTLCompletion(0dd57ddc) : fido=00000000, Irp=098a5870, Context=09bd0440, IRQL=2
[8030292 ms]  <<<  URB 25 coming back  <<< 
-- URB_FUNCTION_CONTROL_TRANSFER:
  PipeHandle           = 0d567060
  TransferFlags        = 0000000a (USBD_TRANSFER_DIRECTION_OUT, USBD_SHORT_TRANSFER_OK)
  TransferBufferLength = 0000000d
  TransferBuffer       = 0e0b4260
  TransferBufferMDL    = 0b3a0ab0
  UrbLink              = 00000000
  SetupPacket          =
    00000000: 40 01 0b 00 00 00 0d 00
[8030292 ms] UsbSnoop - FilterDispatchAny(0dd57b90) : IRP_MJ_INTERNAL_DEVICE_CONTROL
[8030292 ms] UsbSnoop - FdoHookDispatchInternalIoctl(0dd57f8c) : fdo=0e0d7ab0, Irp=098a5870, IRQL=0
[8030292 ms]  >>>  URB 26 going down  >>> 
-- URB_FUNCTION_VENDOR_DEVICE:
  TransferFlags          = 00000002 (USBD_TRANSFER_DIRECTION_OUT, USBD_SHORT_TRANSFER_OK)
  TransferBufferLength = 0000000d
  TransferBuffer       = 0e0b4260
  TransferBufferMDL    = 00000000
    00000000: 0b 00 00 82 01 00 35 11 50 b3 df 02 00
  UrbLink                 = 00000000
  RequestTypeReservedBits = 00000000
  Request                 = 00000001
  Value                   = 0000000b
  Index                   = 00000000
[8030293 ms] UsbSnoop - MyInternalIOCTLCompletion(0dd57ddc) : fido=00000000, Irp=098a5870, Context=09bd0440, IRQL=2
[8030293 ms]  <<<  URB 26 coming back  <<< 
-- URB_FUNCTION_CONTROL_TRANSFER:
  PipeHandle           = 0d567060
  TransferFlags        = 0000000a (USBD_TRANSFER_DIRECTION_OUT, USBD_SHORT_TRANSFER_OK)
  TransferBufferLength = 0000000d
  TransferBuffer       = 0e0b4260
  TransferBufferMDL    = 0b3a0ab0
  UrbLink              = 00000000
  SetupPacket          =
    00000000: 40 01 0b 00 00 00 0d 00
[8030302 ms] UsbSnoop - FilterDispatchAny(0dd57b90) : IRP_MJ_INTERNAL_DEVICE_CONTROL
[8030302 ms] UsbSnoop - FdoHookDispatchInternalIoctl(0dd57f8c) : fdo=0e0d7ab0, Irp=0a3cab40, IRQL=0
[8030302 ms]  >>>  URB 27 going down  >>> 
-- URB_FUNCTION_VENDOR_DEVICE:
  TransferFlags          = 00000002 (USBD_TRANSFER_DIRECTION_OUT, USBD_SHORT_TRANSFER_OK)
  TransferBufferLength = 0000000d
  TransferBuffer       = 0e0b4260
  TransferBufferMDL    = 00000000
    00000000: 0b 00 00 82 01 00 3a 80 98 fe 1f 0e 80
  UrbLink                 = 00000000
  RequestTypeReservedBits = 00000000
  Request                 = 00000001
  Value                   = 0000000b
  Index                   = 00000000
[8030302 ms] UsbSnoop - MyInternalIOCTLCompletion(0dd57ddc) : fido=00000000, Irp=0a3cab40, Context=09bd0440, IRQL=2
[8030302 ms]  <<<  URB 27 coming back  <<< 
-- URB_FUNCTION_CONTROL_TRANSFER:
  PipeHandle           = 0d567060
  TransferFlags        = 0000000a (USBD_TRANSFER_DIRECTION_OUT, USBD_SHORT_TRANSFER_OK)
  TransferBufferLength = 0000000d
  TransferBuffer       = 0e0b4260
  TransferBufferMDL    = 0b3a0ab0
  UrbLink              = 00000000
  SetupPacket          =
    00000000: 40 01 0b 00 00 00 0d 00
[8030302 ms] UsbSnoop - FilterDispatchAny(0dd57b90) : IRP_MJ_INTERNAL_DEVICE_CONTROL
[8030302 ms] UsbSnoop - FdoHookDispatchInternalIoctl(0dd57f8c) : fdo=0e0d7ab0, Irp=0a3cab40, IRQL=0
[8030302 ms]  >>>  URB 28 going down  >>> 
-- URB_FUNCTION_VENDOR_DEVICE:
  TransferFlags          = 00000002 (USBD_TRANSFER_DIRECTION_OUT, USBD_SHORT_TRANSFER_OK)
  TransferBufferLength = 0000000d
  TransferBuffer       = 0e0b4260
  TransferBufferMDL    = 00000000
    00000000: 0b 00 00 82 01 00 3b 80 98 fe 1f 0e 80
  UrbLink                 = 00000000
  RequestTypeReservedBits = 00000000
  Request                 = 00000001
  Value                   = 0000000b
  Index                   = 00000000
[8030302 ms] UsbSnoop - MyInternalIOCTLCompletion(0dd57ddc) : fido=00000000, Irp=0a3cab40, Context=09bd0440, IRQL=2
[8030302 ms]  <<<  URB 28 coming back  <<< 
-- URB_FUNCTION_CONTROL_TRANSFER:
  PipeHandle           = 0d567060
  TransferFlags        = 0000000a (USBD_TRANSFER_DIRECTION_OUT, USBD_SHORT_TRANSFER_OK)
  TransferBufferLength = 0000000d
  TransferBuffer       = 0e0b4260
  TransferBufferMDL    = 0b3a0ab0
  UrbLink              = 00000000
  SetupPacket          =
    00000000: 40 01 0b 00 00 00 0d 00
[8030402 ms] UsbSnoop - FilterDispatchAny(0dd57b90) : IRP_MJ_INTERNAL_DEVICE_CONTROL
[8030402 ms] UsbSnoop - FdoHookDispatchInternalIoctl(0dd57f8c) : fdo=0e0d7ab0, Irp=098a5870, IRQL=0
[8030402 ms]  >>>  URB 29 going down  >>> 
-- URB_FUNCTION_VENDOR_DEVICE:
  TransferFlags          = 00000002 (USBD_TRANSFER_DIRECTION_OUT, USBD_SHORT_TRANSFER_OK)
  TransferBufferLength = 0000000d
  TransferBuffer       = 0e0b4260
  TransferBufferMDL    = 00000000
    00000000: 0b 00 00 82 01 00 3a 80 98 fe 1f 0e 80
  UrbLink                 = 00000000
  RequestTypeReservedBits = 00000000
  Request                 = 00000001
  Value                   = 0000000b
  Index                   = 00000000
[8030402 ms] UsbSnoop - MyInternalIOCTLCompletion(0dd57ddc) : fido=00000000, Irp=098a5870, Context=09bd0440, IRQL=2
[8030402 ms]  <<<  URB 29 coming back  <<< 
-- URB_FUNCTION_CONTROL_TRANSFER:
  PipeHandle           = 0d567060
  TransferFlags        = 0000000a (USBD_TRANSFER_DIRECTION_OUT, USBD_SHORT_TRANSFER_OK)
  TransferBufferLength = 0000000d
  TransferBuffer       = 0e0b4260
  TransferBufferMDL    = 098d4a40
  UrbLink              = 00000000
  SetupPacket          =
    00000000: 40 01 0b 00 00 00 0d 00
[8030402 ms] UsbSnoop - FilterDispatchAny(0dd57b90) : IRP_MJ_INTERNAL_DEVICE_CONTROL
[8030402 ms] UsbSnoop - FdoHookDispatchInternalIoctl(0dd57f8c) : fdo=0e0d7ab0, Irp=098a5870, IRQL=0
[8030402 ms]  >>>  URB 30 going down  >>> 
-- URB_FUNCTION_VENDOR_DEVICE:
  TransferFlags          = 00000002 (USBD_TRANSFER_DIRECTION_OUT, USBD_SHORT_TRANSFER_OK)
  TransferBufferLength = 0000000d
  TransferBuffer       = 0e0b4260
  TransferBufferMDL    = 00000000
    00000000: 0b 00 00 82 01 00 3b 00 98 fe 1f 0e 80
  UrbLink                 = 00000000
  RequestTypeReservedBits = 00000000
  Request                 = 00000001
  Value                   = 0000000b
  Index                   = 00000000
[8030402 ms] UsbSnoop - MyInternalIOCTLCompletion(0dd57ddc) : fido=00000000, Irp=098a5870, Context=09bd0440, IRQL=2
[8030402 ms]  <<<  URB 30 coming back  <<< 
-- URB_FUNCTION_CONTROL_TRANSFER:
  PipeHandle           = 0d567060
  TransferFlags        = 0000000a (USBD_TRANSFER_DIRECTION_OUT, USBD_SHORT_TRANSFER_OK)
  TransferBufferLength = 0000000d
  TransferBuffer       = 0e0b4260
  TransferBufferMDL    = 0b3a0ab0
  UrbLink              = 00000000
  SetupPacket          =
    00000000: 40 01 0b 00 00 00 0d 00
[8030413 ms] UsbSnoop - FilterDispatchAny(0dd57b90) : IRP_MJ_INTERNAL_DEVICE_CONTROL
[8030413 ms] UsbSnoop - FdoHookDispatchInternalIoctl(0dd57f8c) : fdo=0e0d7ab0, Irp=0d862b40, IRQL=0
[8030413 ms]  >>>  URB 31 going down  >>> 
-- URB_FUNCTION_VENDOR_DEVICE:
  TransferFlags          = 00000002 (USBD_TRANSFER_DIRECTION_OUT, USBD_SHORT_TRANSFER_OK)
  TransferBufferLength = 0000000d
  TransferBuffer       = 0e0b46b0
  TransferBufferMDL    = 00000000
    00000000: 0b 00 00 82 01 17 40 00 bd bf df 02 00
  UrbLink                 = 00000000
  RequestTypeReservedBits = 00000000
  Request                 = 00000001
  Value                   = 0000000b
  Index                   = 00000000
[8030413 ms] UsbSnoop - MyInternalIOCTLCompletion(0dd57ddc) : fido=00000000, Irp=0d862b40, Context=09bd0440, IRQL=2
[8030413 ms]  <<<  URB 31 coming back  <<< 
-- URB_FUNCTION_CONTROL_TRANSFER:
  PipeHandle           = 0d567060
  TransferFlags        = 0000000a (USBD_TRANSFER_DIRECTION_OUT, USBD_SHORT_TRANSFER_OK)
  TransferBufferLength = 0000000d
  TransferBuffer       = 0e0b46b0
  TransferBufferMDL    = 0b3a0ab0
  UrbLink              = 00000000
  SetupPacket          =
    00000000: 40 01 0b 00 00 00 0d 00
[8030413 ms] UsbSnoop - FilterDispatchAny(0dd57b90) : IRP_MJ_INTERNAL_DEVICE_CONTROL
[8030413 ms] UsbSnoop - FdoHookDispatchInternalIoctl(0dd57f8c) : fdo=0e0d7ab0, Irp=0d862b40, IRQL=0
[8030413 ms]  >>>  URB 32 going down  >>> 
-- URB_FUNCTION_VENDOR_DEVICE:
  TransferFlags          = 00000002 (USBD_TRANSFER_DIRECTION_OUT, USBD_SHORT_TRANSFER_OK)
  TransferBufferLength = 0000000d
  TransferBuffer       = 0e0b46d0
  TransferBufferMDL    = 00000000
    00000000: 0b 00 00 82 01 00 3a 80 89 75 32 2f 00
  UrbLink                 = 00000000
  RequestTypeReservedBits = 00000000
  Request                 = 00000001
  Value                   = 0000000b
  Index                   = 00000000
[8030413 ms] UsbSnoop - MyInternalIOCTLCompletion(0dd57ddc) : fido=00000000, Irp=0d862b40, Context=09bd0440, IRQL=2
[8030413 ms]  <<<  URB 32 coming back  <<< 
-- URB_FUNCTION_CONTROL_TRANSFER:
  PipeHandle           = 0d567060
  TransferFlags        = 0000000a (USBD_TRANSFER_DIRECTION_OUT, USBD_SHORT_TRANSFER_OK)
  TransferBufferLength = 0000000d
  TransferBuffer       = 0e0b46d0
  TransferBufferMDL    = 0b3a0ab0
  UrbLink              = 00000000
  SetupPacket          =
    00000000: 40 01 0b 00 00 00 0d 00
[8030413 ms] UsbSnoop - FilterDispatchAny(0dd57b90) : IRP_MJ_INTERNAL_DEVICE_CONTROL
[8030413 ms] UsbSnoop - FdoHookDispatchInternalIoctl(0dd57f8c) : fdo=0e0d7ab0, Irp=0d862b40, IRQL=0
[8030413 ms]  >>>  URB 33 going down  >>> 
-- URB_FUNCTION_VENDOR_DEVICE:
  TransferFlags          = 00000002 (USBD_TRANSFER_DIRECTION_OUT, USBD_SHORT_TRANSFER_OK)
  TransferBufferLength = 0000000d
  TransferBuffer       = 0e0b46d0
  TransferBufferMDL    = 00000000
    00000000: 0b 00 00 82 01 00 3b 00 89 75 32 2f 00
  UrbLink                 = 00000000
  RequestTypeReservedBits = 00000000
  Request                 = 00000001
  Value                   = 0000000b
  Index                   = 00000000
[8030414 ms] UsbSnoop - MyInternalIOCTLCompletion(0dd57ddc) : fido=00000000, Irp=0d862b40, Context=09bd0440, IRQL=2
[8030414 ms]  <<<  URB 33 coming back  <<< 
-- URB_FUNCTION_CONTROL_TRANSFER:
  PipeHandle           = 0d567060
  TransferFlags        = 0000000a (USBD_TRANSFER_DIRECTION_OUT, USBD_SHORT_TRANSFER_OK)
  TransferBufferLength = 0000000d
  TransferBuffer       = 0e0b46d0
  TransferBufferMDL    = 0b3a0ab0
  UrbLink              = 00000000
  SetupPacket          =
    00000000: 40 01 0b 00 00 00 0d 00
[8030414 ms] UsbSnoop - FilterDispatchAny(0dd57b90) : IRP_MJ_INTERNAL_DEVICE_CONTROL
[8030414 ms] UsbSnoop - FdoHookDispatchInternalIoctl(0dd57f8c) : fdo=0e0d7ab0, Irp=0d862b40, IRQL=0
[8030414 ms]  >>>  URB 34 going down  >>> 
-- URB_FUNCTION_VENDOR_DEVICE:
  TransferFlags          = 00000002 (USBD_TRANSFER_DIRECTION_OUT, USBD_SHORT_TRANSFER_OK)
  TransferBufferLength = 0000000d
  TransferBuffer       = 0e0b46d0
  TransferBufferMDL    = 00000000
    00000000: 0b 00 00 82 01 00 34 01 89 75 32 2f 00
  UrbLink                 = 00000000
  RequestTypeReservedBits = 00000000
  Request                 = 00000001
  Value                   = 0000000b
  Index                   = 00000000
[8030414 ms] UsbSnoop - MyInternalIOCTLCompletion(0dd57ddc) : fido=00000000, Irp=0d862b40, Context=09bd0440, IRQL=2
[8030414 ms]  <<<  URB 34 coming back  <<< 
-- URB_FUNCTION_CONTROL_TRANSFER:
  PipeHandle           = 0d567060
  TransferFlags        = 0000000a (USBD_TRANSFER_DIRECTION_OUT, USBD_SHORT_TRANSFER_OK)
  TransferBufferLength = 0000000d
  TransferBuffer       = 0e0b46d0
  TransferBufferMDL    = 0b3a0ab0
  UrbLink              = 00000000
  SetupPacket          =
    00000000: 40 01 0b 00 00 00 0d 00
[8030414 ms] UsbSnoop - FilterDispatchAny(0dd57b90) : IRP_MJ_INTERNAL_DEVICE_CONTROL
[8030414 ms] UsbSnoop - FdoHookDispatchInternalIoctl(0dd57f8c) : fdo=0e0d7ab0, Irp=0d862b40, IRQL=0
[8030414 ms]  >>>  URB 35 going down  >>> 
-- URB_FUNCTION_VENDOR_DEVICE:
  TransferFlags          = 00000002 (USBD_TRANSFER_DIRECTION_OUT, USBD_SHORT_TRANSFER_OK)
  TransferBufferLength = 0000000d
  TransferBuffer       = 0e0b46d0
  TransferBufferMDL    = 00000000
    00000000: 0b 00 00 82 01 00 35 00 89 75 32 2f 00
  UrbLink                 = 00000000
  RequestTypeReservedBits = 00000000
  Request                 = 00000001
  Value                   = 0000000b
  Index                   = 00000000
[8030414 ms] UsbSnoop - MyInternalIOCTLCompletion(0dd57ddc) : fido=00000000, Irp=0d862b40, Context=09bd0440, IRQL=2
[8030414 ms]  <<<  URB 35 coming back  <<< 
-- URB_FUNCTION_CONTROL_TRANSFER:
  PipeHandle           = 0d567060
  TransferFlags        = 0000000a (USBD_TRANSFER_DIRECTION_OUT, USBD_SHORT_TRANSFER_OK)
  TransferBufferLength = 0000000d
  TransferBuffer       = 0e0b46d0
  TransferBufferMDL    = 0b3a0ab0
  UrbLink              = 00000000
  SetupPacket          =
    00000000: 40 01 0b 00 00 00 0d 00
