[365782 ms] UsbSnoop - FilterAddDevice(0dd60008) : DriverObject 09d16c60, pdo 09d5a060
[365782 ms] UsbSnoop - FilterDispatchPnp(0dd6020c) : IRP_MJ_PNP (IRP_MN_QUERY_DEVICE_RELATIONS)
[365782 ms] UsbSnoop - FdoHookDispatchPnp(0dd6020c) : IRP_MJ_PNP (IRP_MN_QUERY_DEVICE_RELATIONS)
[365782 ms] UsbSnoop - FilterDispatchPnp(0dd6020c) : IRP_MJ_PNP (IRP_MN_QUERY_INTERFACE)
[365782 ms] UsbSnoop - FdoHookDispatchPnp(0dd6020c) : IRP_MJ_PNP (IRP_MN_QUERY_INTERFACE)
[365782 ms] UsbSnoop - FilterDispatchPnp(0dd6020c) : IRP_MJ_PNP (IRP_MN_QUERY_LEGACY_BUS_INFORMATION)
[365782 ms] UsbSnoop - FdoHookDispatchPnp(0dd6020c) : IRP_MJ_PNP (IRP_MN_QUERY_LEGACY_BUS_INFORMATION)
[365782 ms] UsbSnoop - FilterDispatchPnp(0dd6020c) : IRP_MJ_PNP (IRP_MN_QUERY_RESOURCE_REQUIREMENTS)
[365782 ms] UsbSnoop - FdoHookDispatchPnp(0dd6020c) : IRP_MJ_PNP (IRP_MN_QUERY_RESOURCE_REQUIREMENTS)
[365782 ms] UsbSnoop - FilterDispatchPnp(0dd6020c) : IRP_MJ_PNP (IRP_MN_FILTER_RESOURCE_REQUIREMENTS)
[365782 ms] UsbSnoop - FdoHookDispatchPnp(0dd6020c) : IRP_MJ_PNP (IRP_MN_FILTER_RESOURCE_REQUIREMENTS)
[365782 ms] UsbSnoop - FilterDispatchPnp(0dd6020c) : IRP_MJ_PNP (IRP_MN_START_DEVICE)
[365782 ms] UsbSnoop - FdoHookDispatchPnp(0dd6020c) : IRP_MJ_PNP (IRP_MN_START_DEVICE)
[365784 ms] UsbSnoop - FilterDispatchPnp(0dd6020c) : IRP_MJ_PNP (IRP_MN_START_DEVICE)
[365784 ms] UsbSnoop - FdoHookDispatchPnp(0dd6020c) : IRP_MJ_PNP (IRP_MN_START_DEVICE)
[365784 ms] UsbSnoop - FilterDispatchAny(0dd57b90) : IRP_MJ_INTERNAL_DEVICE_CONTROL
[365784 ms] UsbSnoop - FdoHookDispatchInternalIoctl(0dd57f8c) : fdo=09b44040, Irp=0d89db40, IRQL=0
[365784 ms]  >>>  URB 1 going down  >>> 
-- URB_FUNCTION_GET_DESCRIPTOR_FROM_DEVICE:
  TransferBufferLength = 00000012
  TransferBuffer       = 0e01bb10
  TransferBufferMDL    = 00000000
  Index                = 00000000
  DescriptorType       = 00000001 (USB_DEVICE_DESCRIPTOR_TYPE)
  LanguageId           = 00000000
[365784 ms] UsbSnoop - MyInternalIOCTLCompletion(0dd57ddc) : fido=00000000, Irp=0d89db40, Context=0abca400, IRQL=2
[365784 ms]  <<<  URB 1 coming back  <<< 
-- URB_FUNCTION_CONTROL_TRANSFER:
  PipeHandle           = 0d937120
  TransferFlags        = 00000a6f (USBD_TRANSFER_DIRECTION_IN, USBD_SHORT_TRANSFER_OK)
  TransferBufferLength = 00000012
  TransferBuffer       = 0e01bb10
  TransferBufferMDL    = 0dbf8960
    00000000: 12 01 00 02 00 00 00 40 88 1c 07 00 00 01 01 02
    00000010: 03 01
  UrbLink              = 00000000
  SetupPacket          =
    00000000: 80 06 00 01 00 00 12 00
[365784 ms] UsbSnoop - FilterDispatchAny(0dd57b90) : IRP_MJ_INTERNAL_DEVICE_CONTROL
[365784 ms] UsbSnoop - FdoHookDispatchInternalIoctl(0dd57f8c) : fdo=09b44040, Irp=0d89db40, IRQL=0
[365784 ms]  >>>  URB 2 going down  >>> 
-- URB_FUNCTION_GET_DESCRIPTOR_FROM_DEVICE:
  TransferBufferLength = 00000009
  TransferBuffer       = 0d062a10
  TransferBufferMDL    = 00000000
  Index                = 00000000
  DescriptorType       = 00000002 (USB_CONFIGURATION_DESCRIPTOR_TYPE)
  LanguageId           = 00000000
[365784 ms] UsbSnoop - MyInternalIOCTLCompletion(0dd57ddc) : fido=00000000, Irp=0d89db40, Context=0abca400, IRQL=2
[365784 ms]  <<<  URB 2 coming back  <<< 
-- URB_FUNCTION_CONTROL_TRANSFER:
  PipeHandle           = 0d937120
  TransferFlags        = 00000a6f (USBD_TRANSFER_DIRECTION_IN, USBD_SHORT_TRANSFER_OK)
  TransferBufferLength = 00000009
  TransferBuffer       = 0d062a10
  TransferBufferMDL    = 098a1950
    00000000: 09 02 12 00 01 01 00 80 64
  UrbLink              = 00000000
  SetupPacket          =
    00000000: 80 06 00 02 00 00 09 00
[365784 ms] UsbSnoop - FilterDispatchAny(0dd57b90) : IRP_MJ_INTERNAL_DEVICE_CONTROL
[365784 ms] UsbSnoop - FdoHookDispatchInternalIoctl(0dd57f8c) : fdo=09b44040, Irp=0d89db40, IRQL=0
[365784 ms]  >>>  URB 3 going down  >>> 
-- URB_FUNCTION_GET_DESCRIPTOR_FROM_DEVICE:
  TransferBufferLength = 00000022
  TransferBuffer       = 0d9e4820
  TransferBufferMDL    = 00000000
  Index                = 00000000
  DescriptorType       = 00000002 (USB_CONFIGURATION_DESCRIPTOR_TYPE)
  LanguageId           = 00000000
[365784 ms] UsbSnoop - MyInternalIOCTLCompletion(0dd57ddc) : fido=00000000, Irp=0d89db40, Context=0abca400, IRQL=2
[365784 ms]  <<<  URB 3 coming back  <<< 
-- URB_FUNCTION_CONTROL_TRANSFER:
  PipeHandle           = 0d937120
  TransferFlags        = 00000a6f (USBD_TRANSFER_DIRECTION_IN, USBD_SHORT_TRANSFER_OK)
  TransferBufferLength = 00000012
  TransferBuffer       = 0d9e4820
  TransferBufferMDL    = 098a1950
    00000000: 09 02 12 00 01 01 00 80 64 09 04 00 00 00 ff ff
    00000010: ff 00
  UrbLink              = 00000000
  SetupPacket          =
    00000000: 80 06 00 02 00 00 22 00
[365784 ms] UsbSnoop - FilterDispatchAny(0dd57b90) : IRP_MJ_INTERNAL_DEVICE_CONTROL
[365784 ms] UsbSnoop - FdoHookDispatchInternalIoctl(0dd57f8c) : fdo=09b44040, Irp=0d89db40, IRQL=0
[365784 ms]  >>>  URB 4 going down  >>> 
-- URB_FUNCTION_SELECT_CONFIGURATION:
  ConfigurationDescriptor = 0x0d9e4820 (configure)
  ConfigurationDescriptor : bLength             = 9
  ConfigurationDescriptor : bDescriptorType     = 0x00000002
  ConfigurationDescriptor : wTotalLength        = 0x00000012
  ConfigurationDescriptor : bNumInterfaces      = 0x00000001
  ConfigurationDescriptor : bConfigurationValue = 0x00000001
  ConfigurationDescriptor : iConfiguration      = 0x00000000
  ConfigurationDescriptor : bmAttributes        = 0x00000080
  ConfigurationDescriptor : MaxPower            = 0x00000064
  ConfigurationHandle     = 0x00000000
  Interface[0]: Length            = 24
  Interface[0]: InterfaceNumber   = 0
  Interface[0]: AlternateSetting  = 0
[365785 ms] UsbSnoop - MyInternalIOCTLCompletion(0dd57ddc) : fido=00000000, Irp=0d89db40, Context=0abca400, IRQL=0
[365785 ms]  <<<  URB 4 coming back  <<< 
-- URB_FUNCTION_SELECT_CONFIGURATION:
  ConfigurationDescriptor = 0x0d9e4820 (configure)
  ConfigurationDescriptor : bLength             = 9
  ConfigurationDescriptor : bDescriptorType     = 0x00000002
  ConfigurationDescriptor : wTotalLength        = 0x00000012
  ConfigurationDescriptor : bNumInterfaces      = 0x00000001
  ConfigurationDescriptor : bConfigurationValue = 0x00000001
  ConfigurationDescriptor : iConfiguration      = 0x00000000
  ConfigurationDescriptor : bmAttributes        = 0x00000080
  ConfigurationDescriptor : MaxPower            = 0x00000064
  ConfigurationHandle     = 0x0798b8d0
  Interface[0]: Length            = 24
  Interface[0]: InterfaceNumber   = 0
  Interface[0]: AlternateSetting  = 0
  Interface[0]: Class             = 0x000000ff
  Interface[0]: SubClass          = 0x000000ff
  Interface[0]: Protocol          = 0x000000ff
  Interface[0]: InterfaceHandle   = 0x0d5dfa10
  Interface[0]: NumberOfPipes     = 0
[365785 ms] UsbSnoop - FilterDispatchAny(0dd57b90) : IRP_MJ_INTERNAL_DEVICE_CONTROL
[365785 ms] UsbSnoop - FdoHookDispatchInternalIoctl(0dd57f8c) : fdo=09b44040, Irp=0d89db40, IRQL=0
[365785 ms]  >>>  URB 5 going down  >>> 
-- URB_FUNCTION_VENDOR_DEVICE:
  TransferFlags          = 00000003 (USBD_TRANSFER_DIRECTION_IN, USBD_SHORT_TRANSFER_OK)
  TransferBufferLength = 00000002
  TransferBuffer       = 037714b0
  TransferBufferMDL    = 00000000
  UrbLink                 = 00000000
  RequestTypeReservedBits = 00000000
  Request                 = 00000001
  Value                   = 00000001
  Index                   = 00000000
[365785 ms] UsbSnoop - MyInternalIOCTLCompletion(0dd57ddc) : fido=00000000, Irp=0d89db40, Context=0abca400, IRQL=2
[365785 ms]  <<<  URB 5 coming back  <<< 
-- URB_FUNCTION_CONTROL_TRANSFER:
  PipeHandle           = 0d937120
  TransferFlags        = 0000000b (USBD_TRANSFER_DIRECTION_IN, USBD_SHORT_TRANSFER_OK)
  TransferBufferLength = 00000002
  TransferBuffer       = 037714b0
  TransferBufferMDL    = 0dbf8960
    00000000: 01 07
  UrbLink              = 00000000
  SetupPacket          =
    00000000: c0 01 01 00 00 00 02 00
[365785 ms] UsbSnoop - FilterDispatchAny(0dd57b90) : IRP_MJ_INTERNAL_DEVICE_CONTROL
[365785 ms] UsbSnoop - FdoHookDispatchInternalIoctl(0dd57f8c) : fdo=09b44040, Irp=0d89db40, IRQL=0
[365785 ms]  >>>  URB 6 going down  >>> 
-- URB_FUNCTION_VENDOR_DEVICE:
  TransferFlags          = 00000002 (USBD_TRANSFER_DIRECTION_OUT, USBD_SHORT_TRANSFER_OK)
  TransferBufferLength = 00000040
  TransferBuffer       = 03771400
  TransferBufferMDL    = 00000000
    00000000: 05 ff 0c 94 ce 00 ff ff ff ff ff ff ff ff ff ff
    00000010: ff ff ff ff ff ff ff ff ff ff ff ff ff ff ff ff
    00000020: ff ff ff ff ff ff ff ff ff ff ff ff ff ff 0c 94
    00000030: 72 06 ff ff ff ff ff ff ff ff ff ff ff ff ff ff
  UrbLink                 = 00000000
  RequestTypeReservedBits = 00000000
  Request                 = 00000001
  Value                   = 00000005
  Index                   = 00000000
[365785 ms] UsbSnoop - MyInternalIOCTLCompletion(0dd57ddc) : fido=00000000, Irp=0d89db40, Context=0abca400, IRQL=2
[365785 ms]  <<<  URB 6 coming back  <<< 
-- URB_FUNCTION_CONTROL_TRANSFER:
  PipeHandle           = 0d937120
  TransferFlags        = 0000000a (USBD_TRANSFER_DIRECTION_OUT, USBD_SHORT_TRANSFER_OK)
  TransferBufferLength = 00000040
  TransferBuffer       = 03771400
  TransferBufferMDL    = 098a1950
  UrbLink              = 00000000
  SetupPacket          =
    00000000: 40 01 05 00 00 00 40 00
[365785 ms] UsbSnoop - FilterDispatchAny(0dd57b90) : IRP_MJ_INTERNAL_DEVICE_CONTROL
[365785 ms] UsbSnoop - FdoHookDispatchInternalIoctl(0dd57f8c) : fdo=09b44040, Irp=0d89db40, IRQL=0
[365785 ms]  >>>  URB 7 going down  >>> 
-- URB_FUNCTION_VENDOR_DEVICE:
  TransferFlags          = 00000002 (USBD_TRANSFER_DIRECTION_OUT, USBD_SHORT_TRANSFER_OK)
  TransferBufferLength = 00000040
  TransferBuffer       = 03771400
  TransferBufferMDL    = 00000000
    00000000: 05 ff ff ff ff ff ff ff ff ff ff ff ff ff ff ff
    00000010: ff ff ff ff ff ff ff ff ff ff ff ff ff ff ff ff
    00000020: ff ff ff ff 00 01 02 03 04 05 06 07 08 09 0a 0b
    00000030: 0c 0d 0e 0f 77 00 00 00 00 00 00 00 00 00 00 48
  UrbLink                 = 00000000
  RequestTypeReservedBits = 00000000
  Request                 = 00000001
  Value                   = 00000005
  Index                   = 00000000
[365785 ms] UsbSnoop - MyInternalIOCTLCompletion(0dd57ddc) : fido=00000000, Irp=0d89db40, Context=0abca400, IRQL=2
[365785 ms]  <<<  URB 7 coming back  <<< 
-- URB_FUNCTION_CONTROL_TRANSFER:
  PipeHandle           = 0d937120
  TransferFlags        = 0000000a (USBD_TRANSFER_DIRECTION_OUT, USBD_SHORT_TRANSFER_OK)
  TransferBufferLength = 00000040
  TransferBuffer       = 03771400
  TransferBufferMDL    = 098a1950
  UrbLink              = 00000000
  SetupPacket          =
    00000000: 40 01 05 00 00 00 40 00
[365785 ms] UsbSnoop - FilterDispatchAny(0dd57b90) : IRP_MJ_INTERNAL_DEVICE_CONTROL
[365785 ms] UsbSnoop - FdoHookDispatchInternalIoctl(0dd57f8c) : fdo=09b44040, Irp=0d89db40, IRQL=0
[365785 ms]  >>>  URB 8 going down  >>> 
-- URB_FUNCTION_VENDOR_DEVICE:
  TransferFlags          = 00000002 (USBD_TRANSFER_DIRECTION_OUT, USBD_SHORT_TRANSFER_OK)
  TransferBufferLength = 00000040
  TransferBuffer       = 03771400
  TransferBufferMDL    = 00000000
    00000000: 05 ff 15 47 15 49 15 00 07 01 12 01 00 02 00 00
    00000010: 00 40 88 1c 3c 00 00 01 01 02 03 01 0a 06 00 02
    00000020: 00 00 00 40 01 00 09 02 32 00 01 01 00 80 fa 09
    00000030: 07 32 00 01 01 00 80 fa 09 04 00 00 00 ff ff ff
  UrbLink                 = 00000000
  RequestTypeReservedBits = 00000000
  Request                 = 00000001
  Value                   = 00000005
  Index                   = 00000000
[365786 ms] UsbSnoop - MyInternalIOCTLCompletion(0dd57ddc) : fido=00000000, Irp=0d89db40, Context=0abca400, IRQL=2
[365786 ms]  <<<  URB 8 coming back  <<< 
-- URB_FUNCTION_CONTROL_TRANSFER:
  PipeHandle           = 0d937120
  TransferFlags        = 0000000a (USBD_TRANSFER_DIRECTION_OUT, USBD_SHORT_TRANSFER_OK)
  TransferBufferLength = 00000040
  TransferBuffer       = 03771400
  TransferBufferMDL    = 098a1950
  UrbLink              = 00000000
  SetupPacket          =
    00000000: 40 01 05 00 00 00 40 00
[365786 ms] UsbSnoop - FilterDispatchAny(0dd57b90) : IRP_MJ_INTERNAL_DEVICE_CONTROL
[365786 ms] UsbSnoop - FdoHookDispatchInternalIoctl(0dd57f8c) : fdo=09b44040, Irp=0d89db40, IRQL=0
[365786 ms]  >>>  URB 9 going down  >>> 
-- URB_FUNCTION_VENDOR_DEVICE:
  TransferFlags          = 00000002 (USBD_TRANSFER_DIRECTION_OUT, USBD_SHORT_TRANSFER_OK)
  TransferBufferLength = 00000040
  TransferBuffer       = 03771400
  TransferBufferMDL    = 00000000
    00000000: 05 ff 00 09 04 00 01 01 ff ff ff 00 07 05 82 05
    00000010: ff 03 01 09 04 00 02 01 ff ff ff 00 07 05 82 05
    00000020: 00 14 01 07 05 82 05 ff 03 01 04 03 09 04 22 03
    00000030: 20 00 53 00 6f 00 6d 00 61 00 67 00 69 00 63 00
  UrbLink                 = 00000000
  RequestTypeReservedBits = 00000000
  Request                 = 00000001
  Value                   = 00000005
  Index                   = 00000000
[365786 ms] UsbSnoop - MyInternalIOCTLCompletion(0dd57ddc) : fido=00000000, Irp=0d89db40, Context=0abca400, IRQL=2
[365786 ms]  <<<  URB 9 coming back  <<< 
-- URB_FUNCTION_CONTROL_TRANSFER:
  PipeHandle           = 0d937120
  TransferFlags        = 0000000a (USBD_TRANSFER_DIRECTION_OUT, USBD_SHORT_TRANSFER_OK)
  TransferBufferLength = 00000040
  TransferBuffer       = 03771400
  TransferBufferMDL    = 098a1950
  UrbLink              = 00000000
  SetupPacket          =
    00000000: 40 01 05 00 00 00 40 00
[365786 ms] UsbSnoop - FilterDispatchAny(0dd57b90) : IRP_MJ_INTERNAL_DEVICE_CONTROL
[365786 ms] UsbSnoop - FdoHookDispatchInternalIoctl(0dd57f8c) : fdo=09b44040, Irp=0d89db40, IRQL=0
[365786 ms]  >>>  URB 10 going down  >>> 
-- URB_FUNCTION_VENDOR_DEVICE:
  TransferFlags          = 00000002 (USBD_TRANSFER_DIRECTION_OUT, USBD_SHORT_TRANSFER_OK)
  TransferBufferLength = 00000040
  TransferBuffer       = 03771400
  TransferBufferMDL    = 00000000
    00000000: 05 ff 2c 00 20 00 49 00 6e 00 63 00 2e 00 20 00
    00000010: 20 00 24 03 53 00 4d 00 49 00 20 00 47 00 72 00
    00000020: 61 00 62 00 62 00 65 00 72 00 20 00 44 00 45 00
    00000030: 56 00 20 00 00 00 2a 03 53 00 4d 00 49 00 47 00
  UrbLink                 = 00000000
  RequestTypeReservedBits = 00000000
  Request                 = 00000001
  Value                   = 00000005
  Index                   = 00000000
[365786 ms] UsbSnoop - MyInternalIOCTLCompletion(0dd57ddc) : fido=00000000, Irp=0d89db40, Context=0abca400, IRQL=2
[365786 ms]  <<<  URB 10 coming back  <<< 
-- URB_FUNCTION_CONTROL_TRANSFER:
  PipeHandle           = 0d937120
  TransferFlags        = 0000000a (USBD_TRANSFER_DIRECTION_OUT, USBD_SHORT_TRANSFER_OK)
  TransferBufferLength = 00000040
  TransferBuffer       = 03771400
  TransferBufferMDL    = 098a1950
  UrbLink              = 00000000
  SetupPacket          =
    00000000: 40 01 05 00 00 00 40 00
[365786 ms] UsbSnoop - FilterDispatchAny(0dd57b90) : IRP_MJ_INTERNAL_DEVICE_CONTROL
[365786 ms] UsbSnoop - FdoHookDispatchInternalIoctl(0dd57f8c) : fdo=09b44040, Irp=0d89db40, IRQL=0
[365786 ms]  >>>  URB 11 going down  >>> 
-- URB_FUNCTION_VENDOR_DEVICE:
  TransferFlags          = 00000002 (USBD_TRANSFER_DIRECTION_OUT, USBD_SHORT_TRANSFER_OK)
  TransferBufferLength = 00000040
  TransferBuffer       = 03771400
  TransferBufferMDL    = 00000000
    00000000: 05 ff 52 00 41 00 42 00 42 00 45 00 52 00 39 00
    00000010: 38 00 37 00 36 00 35 00 34 00 33 00 32 00 31 00
    00000020: 30 00 e2 00 e6 00 08 01 2c 01 01 00 00 00 53 4d
    00000030: 49 47 52 41 42 42 45 52 39 38 37 36 35 34 33 32
  UrbLink                 = 00000000
  RequestTypeReservedBits = 00000000
  Request                 = 00000001
  Value                   = 00000005
  Index                   = 00000000
[365786 ms] UsbSnoop - MyInternalIOCTLCompletion(0dd57ddc) : fido=00000000, Irp=0d89db40, Context=0abca400, IRQL=2
[365786 ms]  <<<  URB 11 coming back  <<< 
-- URB_FUNCTION_CONTROL_TRANSFER:
  PipeHandle           = 0d937120
  TransferFlags        = 0000000a (USBD_TRANSFER_DIRECTION_OUT, USBD_SHORT_TRANSFER_OK)
  TransferBufferLength = 00000040
  TransferBuffer       = 03771400
  TransferBufferMDL    = 098a1950
  UrbLink              = 00000000
  SetupPacket          =
    00000000: 40 01 05 00 00 00 40 00
[365786 ms] UsbSnoop - FilterDispatchAny(0dd57b90) : IRP_MJ_INTERNAL_DEVICE_CONTROL
[365786 ms] UsbSnoop - FdoHookDispatchInternalIoctl(0dd57f8c) : fdo=09b44040, Irp=0d89db40, IRQL=0
[365786 ms]  >>>  URB 12 going down  >>> 
-- URB_FUNCTION_VENDOR_DEVICE:
  TransferFlags          = 00000002 (USBD_TRANSFER_DIRECTION_OUT, USBD_SHORT_TRANSFER_OK)
  TransferBufferLength = 00000040
  TransferBuffer       = 03771400
  TransferBufferMDL    = 00000000
    00000000: 05 ff 31 30 00 53 4d 49 20 47 72 61 62 62 65 72
    00000010: 20 44 45 56 20 20 00 20 53 6f 6d 61 67 69 63 2c
    00000020: 20 49 6e 63 2e 20 20 00 00 00 cf ef df e0 cd bf
    00000030: de bf c0 54 d0 40 0a ea 08 83 00 24 ec e9 f1 e0
  UrbLink                 = 00000000
  RequestTypeReservedBits = 00000000
  Request                 = 00000001
  Value                   = 00000005
  Index                   = 00000000
[365787 ms] UsbSnoop - MyInternalIOCTLCompletion(0dd57ddc) : fido=00000000, Irp=0d89db40, Context=0abca400, IRQL=2
[365787 ms]  <<<  URB 12 coming back  <<< 
-- URB_FUNCTION_CONTROL_TRANSFER:
  PipeHandle           = 0d937120
  TransferFlags        = 0000000a (USBD_TRANSFER_DIRECTION_OUT, USBD_SHORT_TRANSFER_OK)
  TransferBufferLength = 00000040
  TransferBuffer       = 03771400
  TransferBufferMDL    = 098a1950
  UrbLink              = 00000000
  SetupPacket          =
    00000000: 40 01 05 00 00 00 40 00
[365787 ms] UsbSnoop - FilterDispatchAny(0dd57b90) : IRP_MJ_INTERNAL_DEVICE_CONTROL
[365787 ms] UsbSnoop - FdoHookDispatchInternalIoctl(0dd57f8c) : fdo=09b44040, Irp=0d89db40, IRQL=0
[365787 ms]  >>>  URB 13 going down  >>> 
-- URB_FUNCTION_VENDOR_DEVICE:
  TransferFlags          = 00000002 (USBD_TRANSFER_DIRECTION_OUT, USBD_SHORT_TRANSFER_OK)
  TransferBufferLength = 00000040
  TransferBuffer       = 03771400
  TransferBufferMDL    = 00000000
    00000000: 05 ff 12 e0 e3 3f f1 07 11 f0 01 92 fb cf 00 83
    00000010: e0 e6 f0 e0 a0 e6 b0 e0 11 e0 ec 39 f1 07 21 f0
    00000020: c8 95 31 96 0d 92 f9 cf 0e 94 33 04 ff cf 0e 94
    00000030: 7a 0e 22 24 20 92 72 00 20 90 da 02 20 92 c5 01
  UrbLink                 = 00000000
  RequestTypeReservedBits = 00000000
  Request                 = 00000001
  Value                   = 00000005
  Index                   = 00000000
[365787 ms] UsbSnoop - MyInternalIOCTLCompletion(0dd57ddc) : fido=00000000, Irp=0d89db40, Context=0abca400, IRQL=2
[365787 ms]  <<<  URB 13 coming back  <<< 
-- URB_FUNCTION_CONTROL_TRANSFER:
  PipeHandle           = 0d937120
  TransferFlags        = 0000000a (USBD_TRANSFER_DIRECTION_OUT, USBD_SHORT_TRANSFER_OK)
  TransferBufferLength = 00000040
  TransferBuffer       = 03771400
  TransferBufferMDL    = 098a1950
  UrbLink              = 00000000
  SetupPacket          =
    00000000: 40 01 05 00 00 00 40 00
[365787 ms] UsbSnoop - FilterDispatchAny(0dd57b90) : IRP_MJ_INTERNAL_DEVICE_CONTROL
[365787 ms] UsbSnoop - FdoHookDispatchInternalIoctl(0dd57f8c) : fdo=09b44040, Irp=0d89db40, IRQL=0
[365787 ms]  >>>  URB 14 going down  >>> 
-- URB_FUNCTION_VENDOR_DEVICE:
  TransferFlags          = 00000002 (USBD_TRANSFER_DIRECTION_OUT, USBD_SHORT_TRANSFER_OK)
  TransferBufferLength = 00000040
  TransferBuffer       = 03771400
  TransferBufferMDL    = 00000000
    00000000: 05 ff 85 ec 91 e0 90 93 ed 02 80 93 ec 02 80 91
    00000010: d9 02 81 39 21 f5 81 e0 80 93 00 16 20 90 70 00
    00000020: 20 92 c0 01 20 90 c7 02 20 92 c1 01 20 90 c8 02
    00000030: 20 92 c2 01 20 90 c9 02 20 92 c3 01 20 90 ca 02
  UrbLink                 = 00000000
  RequestTypeReservedBits = 00000000
  Request                 = 00000001
  Value                   = 00000005
  Index                   = 00000000
[365787 ms] UsbSnoop - MyInternalIOCTLCompletion(0dd57ddc) : fido=00000000, Irp=0d89db40, Context=0abca400, IRQL=2
[365787 ms]  <<<  URB 14 coming back  <<< 
-- URB_FUNCTION_CONTROL_TRANSFER:
  PipeHandle           = 0d937120
  TransferFlags        = 0000000a (USBD_TRANSFER_DIRECTION_OUT, USBD_SHORT_TRANSFER_OK)
  TransferBufferLength = 00000040
  TransferBuffer       = 03771400
  TransferBufferMDL    = 098a1950
  UrbLink              = 00000000
  SetupPacket          =
    00000000: 40 01 05 00 00 00 40 00
[365787 ms] UsbSnoop - FilterDispatchAny(0dd57b90) : IRP_MJ_INTERNAL_DEVICE_CONTROL
[365787 ms] UsbSnoop - FdoHookDispatchInternalIoctl(0dd57f8c) : fdo=09b44040, Irp=0d89db40, IRQL=0
[365787 ms]  >>>  URB 15 going down  >>> 
-- URB_FUNCTION_VENDOR_DEVICE:
  TransferFlags          = 00000002 (USBD_TRANSFER_DIRECTION_OUT, USBD_SHORT_TRANSFER_OK)
  TransferBufferLength = 00000040
  TransferBuffer       = 03771400
  TransferBufferMDL    = 00000000
    00000000: 05 ff 20 92 c4 01 80 ec 91 e0 90 93 ed 02 80 93
    00000010: ec 02 85 e0 90 e0 90 93 f1 02 80 93 f0 02 ab c0
    00000020: 40 91 c5 01 55 27 4b 30 e0 e0 5e 07 09 f4 3f c0
    00000030: 4c 30 e0 e0 5e 07 09 f4 3a c0 4d 30 e0 e0 5e 07
  UrbLink                 = 00000000
  RequestTypeReservedBits = 00000000
  Request                 = 00000001
  Value                   = 00000005
  Index                   = 00000000
[365787 ms] UsbSnoop - MyInternalIOCTLCompletion(0dd57ddc) : fido=00000000, Irp=0d89db40, Context=0abca400, IRQL=2
[365787 ms]  <<<  URB 15 coming back  <<< 
-- URB_FUNCTION_CONTROL_TRANSFER:
  PipeHandle           = 0d937120
  TransferFlags        = 0000000a (USBD_TRANSFER_DIRECTION_OUT, USBD_SHORT_TRANSFER_OK)
  TransferBufferLength = 00000040
  TransferBuffer       = 03771400
  TransferBufferMDL    = 098a1950
  UrbLink              = 00000000
  SetupPacket          =
    00000000: 40 01 05 00 00 00 40 00
[365787 ms] UsbSnoop - FilterDispatchAny(0dd57b90) : IRP_MJ_INTERNAL_DEVICE_CONTROL
[365787 ms] UsbSnoop - FdoHookDispatchInternalIoctl(0dd57f8c) : fdo=09b44040, Irp=0d89db40, IRQL=0
[365787 ms]  >>>  URB 16 going down  >>> 
-- URB_FUNCTION_VENDOR_DEVICE:
  TransferFlags          = 00000002 (USBD_TRANSFER_DIRECTION_OUT, USBD_SHORT_TRANSFER_OK)
  TransferBufferLength = 00000040
  TransferBuffer       = 03771400
  TransferBufferMDL    = 00000000
    00000000: 05 ff b1 f1 8d e0 90 e0 84 17 95 07 2c f0 41 30
    00000010: e0 e0 5e 07 39 f0 77 c0 4b 3f e0 e0 5e 07 09 f4
    00000020: 66 c0 71 c0 80 91 e7 02 83 30 21 f4 83 e0 80 93
    00000030: c6 01 17 c0 80 91 e7 02 85 30 21 f4 85 e0 80 93
  UrbLink                 = 00000000
  RequestTypeReservedBits = 00000000
  Request                 = 00000001
  Value                   = 00000005
  Index                   = 00000000
[365788 ms] UsbSnoop - MyInternalIOCTLCompletion(0dd57ddc) : fido=00000000, Irp=0d89db40, Context=0abca400, IRQL=2
[365788 ms]  <<<  URB 16 coming back  <<< 
-- URB_FUNCTION_CONTROL_TRANSFER:
  PipeHandle           = 0d937120
  TransferFlags        = 0000000a (USBD_TRANSFER_DIRECTION_OUT, USBD_SHORT_TRANSFER_OK)
  TransferBufferLength = 00000040
  TransferBuffer       = 03771400
  TransferBufferMDL    = 098a1950
  UrbLink              = 00000000
  SetupPacket          =
    00000000: 40 01 05 00 00 00 40 00
[365788 ms] UsbSnoop - FilterDispatchAny(0dd57b90) : IRP_MJ_INTERNAL_DEVICE_CONTROL
[365788 ms] UsbSnoop - FdoHookDispatchInternalIoctl(0dd57f8c) : fdo=09b44040, Irp=0d89db40, IRQL=0
[365788 ms]  >>>  URB 17 going down  >>> 
-- URB_FUNCTION_VENDOR_DEVICE:
  TransferFlags          = 00000002 (USBD_TRANSFER_DIRECTION_OUT, USBD_SHORT_TRANSFER_OK)
  TransferBufferLength = 00000040
  TransferBuffer       = 03771400
  TransferBufferMDL    = 00000000
    00000000: 05 ff c6 01 0f c0 80 91 e7 02 82 30 21 f4 82 e0
    00000010: 80 93 c6 01 07 c0 80 91 e7 02 84 30 19 f4 84 e0
    00000020: 80 93 c6 01 82 e0 90 e0 90 93 f1 02 80 93 f0 02
    00000030: 4d c0 20 90 bc 01 20 92 c6 01 20 90 bd 01 20 92
  UrbLink                 = 00000000
  RequestTypeReservedBits = 00000000
  Request                 = 00000001
  Value                   = 00000005
  Index                   = 00000000
[365788 ms] UsbSnoop - MyInternalIOCTLCompletion(0dd57ddc) : fido=00000000, Irp=0d89db40, Context=0abca400, IRQL=2
[365788 ms]  <<<  URB 17 coming back  <<< 
-- URB_FUNCTION_CONTROL_TRANSFER:
  PipeHandle           = 0d937120
  TransferFlags        = 0000000a (USBD_TRANSFER_DIRECTION_OUT, USBD_SHORT_TRANSFER_OK)
  TransferBufferLength = 00000040
  TransferBuffer       = 03771400
  TransferBufferMDL    = 098a1950
  UrbLink              = 00000000
  SetupPacket          =
    00000000: 40 01 05 00 00 00 40 00
[365788 ms] UsbSnoop - FilterDispatchAny(0dd57b90) : IRP_MJ_INTERNAL_DEVICE_CONTROL
[365788 ms] UsbSnoop - FdoHookDispatchInternalIoctl(0dd57f8c) : fdo=09b44040, Irp=0d89db40, IRQL=0
[365788 ms]  >>>  URB 18 going down  >>> 
-- URB_FUNCTION_VENDOR_DEVICE:
  TransferFlags          = 00000002 (USBD_TRANSFER_DIRECTION_OUT, USBD_SHORT_TRANSFER_OK)
  TransferBufferLength = 00000040
  TransferBuffer       = 03771400
  TransferBufferMDL    = 00000000
    00000000: 05 ff c7 01 20 90 be 01 20 92 c8 01 20 90 bf 01
    00000010: 20 92 c9 01 80 91 be 01 8f 70 42 2d 48 0f 66 27
    00000020: 0f c0 8c e9 91 e0 e6 2f ff 27 e8 0f f9 1f 20 80
    00000030: 8a ec 91 e0 e6 2f ff 27 e8 0f f9 1f 20 82 63 95
  UrbLink                 = 00000000
  RequestTypeReservedBits = 00000000
  Request                 = 00000001
  Value                   = 00000005
  Index                   = 00000000
[365788 ms] UsbSnoop - MyInternalIOCTLCompletion(0dd57ddc) : fido=00000000, Irp=0d89db40, Context=0abca400, IRQL=2
[365788 ms]  <<<  URB 18 coming back  <<< 
-- URB_FUNCTION_CONTROL_TRANSFER:
  PipeHandle           = 0d937120
  TransferFlags        = 0000000a (USBD_TRANSFER_DIRECTION_OUT, USBD_SHORT_TRANSFER_OK)
  TransferBufferLength = 00000040
  TransferBuffer       = 03771400
  TransferBufferMDL    = 098a1950
  UrbLink              = 00000000
  SetupPacket          =
    00000000: 40 01 05 00 00 00 40 00
[365788 ms] UsbSnoop - FilterDispatchAny(0dd57b90) : IRP_MJ_INTERNAL_DEVICE_CONTROL
[365788 ms] UsbSnoop - FdoHookDispatchInternalIoctl(0dd57f8c) : fdo=09b44040, Irp=0d89db40, IRQL=0
[365788 ms]  >>>  URB 19 going down  >>> 
-- URB_FUNCTION_VENDOR_DEVICE:
  TransferFlags          = 00000002 (USBD_TRANSFER_DIRECTION_OUT, USBD_SHORT_TRANSFER_OK)
  TransferBufferLength = 00000040
  TransferBuffer       = 03771400
  TransferBufferMDL    = 00000000
    00000000: 05 ff 64 17 78 f3 20 91 c5 01 33 27 2b 50 30 40
    00000010: 01 e0 10 e0 0e 94 93 0e 80 2f 91 2f 88 0f 99 1f
    00000020: 88 0f 99 1f 88 0f 99 1f 05 96 90 93 f1 02 80 93
    00000030: f0 02 0e c0 81 e0 80 93 e3 02 80 93 c6 01 82 e0
  UrbLink                 = 00000000
  RequestTypeReservedBits = 00000000
  Request                 = 00000001
  Value                   = 00000005
  Index                   = 00000000
[365788 ms] UsbSnoop - MyInternalIOCTLCompletion(0dd57ddc) : fido=00000000, Irp=0d89db40, Context=0abca400, IRQL=2
[365788 ms]  <<<  URB 19 coming back  <<< 
-- URB_FUNCTION_CONTROL_TRANSFER:
  PipeHandle           = 0d937120
  TransferFlags        = 0000000a (USBD_TRANSFER_DIRECTION_OUT, USBD_SHORT_TRANSFER_OK)
  TransferBufferLength = 00000040
  TransferBuffer       = 03771400
  TransferBufferMDL    = 098a1950
  UrbLink              = 00000000
  SetupPacket          =
    00000000: 40 01 05 00 00 00 40 00
[365788 ms] UsbSnoop - FilterDispatchAny(0dd57b90) : IRP_MJ_INTERNAL_DEVICE_CONTROL
[365788 ms] UsbSnoop - FdoHookDispatchInternalIoctl(0dd57f8c) : fdo=09b44040, Irp=0d89db40, IRQL=0
[365788 ms]  >>>  URB 20 going down  >>> 
-- URB_FUNCTION_VENDOR_DEVICE:
  TransferFlags          = 00000002 (USBD_TRANSFER_DIRECTION_OUT, USBD_SHORT_TRANSFER_OK)
  TransferBufferLength = 00000040
  TransferBuffer       = 03771400
  TransferBufferMDL    = 00000000
    00000000: 05 ff 90 e0 90 93 f1 02 80 93 f0 02 02 c0 0e 94
    00000010: 0b 09 22 24 20 92 bc 01 20 92 bd 01 20 92 be 01
    00000020: 20 92 9c 01 20 92 9d 01 20 92 9e 01 20 92 9f 01
    00000030: 20 92 a0 01 20 92 a1 01 20 92 a2 01 20 92 a3 01
  UrbLink                 = 00000000
  RequestTypeReservedBits = 00000000
  Request                 = 00000001
  Value                   = 00000005
  Index                   = 00000000
[365789 ms] UsbSnoop - MyInternalIOCTLCompletion(0dd57ddc) : fido=00000000, Irp=0d89db40, Context=0abca400, IRQL=2
[365789 ms]  <<<  URB 20 coming back  <<< 
-- URB_FUNCTION_CONTROL_TRANSFER:
  PipeHandle           = 0d937120
  TransferFlags        = 0000000a (USBD_TRANSFER_DIRECTION_OUT, USBD_SHORT_TRANSFER_OK)
  TransferBufferLength = 00000040
  TransferBuffer       = 03771400
  TransferBufferMDL    = 098a1950
  UrbLink              = 00000000
  SetupPacket          =
    00000000: 40 01 05 00 00 00 40 00
[365789 ms] UsbSnoop - FilterDispatchAny(0dd57b90) : IRP_MJ_INTERNAL_DEVICE_CONTROL
[365789 ms] UsbSnoop - FdoHookDispatchInternalIoctl(0dd57f8c) : fdo=09b44040, Irp=0d89db40, IRQL=0
[365789 ms]  >>>  URB 21 going down  >>> 
-- URB_FUNCTION_VENDOR_DEVICE:
  TransferFlags          = 00000002 (USBD_TRANSFER_DIRECTION_OUT, USBD_SHORT_TRANSFER_OK)
  TransferBufferLength = 00000040
  TransferBuffer       = 03771400
  TransferBufferMDL    = 00000000
    00000000: 05 ff 80 91 73 00 84 30 49 f0 81 e0 80 93 73 00
    00000010: 22 24 33 24 30 92 ef 02 20 92 ee 02 0e 94 6b 0e
    00000020: 08 95 22 24 20 92 72 00 85 ec 91 e0 90 93 ed 02
    00000030: 80 93 ec 02 20 90 de 02 30 90 df 02 30 92 f1 02
  UrbLink                 = 00000000
  RequestTypeReservedBits = 00000000
  Request                 = 00000001
  Value                   = 00000005
  Index                   = 00000000
[365789 ms] UsbSnoop - MyInternalIOCTLCompletion(0dd57ddc) : fido=00000000, Irp=0d89db40, Context=0abca400, IRQL=2
[365789 ms]  <<<  URB 21 coming back  <<< 
-- URB_FUNCTION_CONTROL_TRANSFER:
  PipeHandle           = 0d937120
  TransferFlags        = 0000000a (USBD_TRANSFER_DIRECTION_OUT, USBD_SHORT_TRANSFER_OK)
  TransferBufferLength = 00000040
  TransferBuffer       = 03771400
  TransferBufferMDL    = 098a1950
  UrbLink              = 00000000
  SetupPacket          =
    00000000: 40 01 05 00 00 00 40 00
[365789 ms] UsbSnoop - FilterDispatchAny(0dd57b90) : IRP_MJ_INTERNAL_DEVICE_CONTROL
[365789 ms] UsbSnoop - FdoHookDispatchInternalIoctl(0dd57f8c) : fdo=09b44040, Irp=0d89db40, IRQL=0
[365789 ms]  >>>  URB 22 going down  >>> 
-- URB_FUNCTION_VENDOR_DEVICE:
  TransferFlags          = 00000002 (USBD_TRANSFER_DIRECTION_OUT, USBD_SHORT_TRANSFER_OK)
  TransferBufferLength = 00000040
  TransferBuffer       = 03771400
  TransferBufferMDL    = 00000000
    00000000: 05 ff 20 92 f0 02 80 91 73 00 84 30 49 f0 82 e0
    00000010: 80 93 73 00 22 24 33 24 30 92 ef 02 20 92 ee 02
    00000020: 08 95 0e 94 74 0e 28 97 80 e1 8f 83 80 91 c5 01
    00000030: 81 30 09 f0 88 c0 22 24 20 92 38 15 20 92 3c 15
  UrbLink                 = 00000000
  RequestTypeReservedBits = 00000000
  Request                 = 00000001
  Value                   = 00000005
  Index                   = 00000000
[365789 ms] UsbSnoop - MyInternalIOCTLCompletion(0dd57ddc) : fido=00000000, Irp=0d89db40, Context=0abca400, IRQL=2
[365789 ms]  <<<  URB 22 coming back  <<< 
-- URB_FUNCTION_CONTROL_TRANSFER:
  PipeHandle           = 0d937120
  TransferFlags        = 0000000a (USBD_TRANSFER_DIRECTION_OUT, USBD_SHORT_TRANSFER_OK)
  TransferBufferLength = 00000040
  TransferBuffer       = 03771400
  TransferBufferMDL    = 098a1950
  UrbLink              = 00000000
  SetupPacket          =
    00000000: 40 01 05 00 00 00 40 00
[365789 ms] UsbSnoop - FilterDispatchAny(0dd57b90) : IRP_MJ_INTERNAL_DEVICE_CONTROL
[365789 ms] UsbSnoop - FdoHookDispatchInternalIoctl(0dd57f8c) : fdo=09b44040, Irp=0d89db40, IRQL=0
[365789 ms]  >>>  URB 23 going down  >>> 
-- URB_FUNCTION_VENDOR_DEVICE:
  TransferFlags          = 00000002 (USBD_TRANSFER_DIRECTION_OUT, USBD_SHORT_TRANSFER_OK)
  TransferBufferLength = 00000040
  TransferBuffer       = 03771400
  TransferBufferMDL    = 00000000
    00000000: 05 ff 20 90 c6 01 20 92 e7 02 82 2d 83 30 c9 f4
    00000010: 85 e2 80 93 31 15 80 91 30 15 89 7f 80 93 30 15
    00000020: 28 2e 20 92 30 15 85 e1 80 93 21 15 80 91 20 15
    00000030: 89 7f 80 93 20 15 82 60 80 93 20 15 0e 94 01 05
  UrbLink                 = 00000000
  RequestTypeReservedBits = 00000000
  Request                 = 00000001
  Value                   = 00000005
  Index                   = 00000000
[365789 ms] UsbSnoop - MyInternalIOCTLCompletion(0dd57ddc) : fido=00000000, Irp=0d89db40, Context=0abca400, IRQL=2
[365789 ms]  <<<  URB 23 coming back  <<< 
-- URB_FUNCTION_CONTROL_TRANSFER:
  PipeHandle           = 0d937120
  TransferFlags        = 0000000a (USBD_TRANSFER_DIRECTION_OUT, USBD_SHORT_TRANSFER_OK)
  TransferBufferLength = 00000040
  TransferBuffer       = 03771400
  TransferBufferMDL    = 0994a540
  UrbLink              = 00000000
  SetupPacket          =
    00000000: 40 01 05 00 00 00 40 00
[365789 ms] UsbSnoop - FilterDispatchAny(0dd57b90) : IRP_MJ_INTERNAL_DEVICE_CONTROL
[365789 ms] UsbSnoop - FdoHookDispatchInternalIoctl(0dd57f8c) : fdo=09b44040, Irp=0d89db40, IRQL=0
[365789 ms]  >>>  URB 24 going down  >>> 
-- URB_FUNCTION_VENDOR_DEVICE:
  TransferFlags          = 00000002 (USBD_TRANSFER_DIRECTION_OUT, USBD_SHORT_TRANSFER_OK)
  TransferBufferLength = 00000040
  TransferBuffer       = 03771400
  TransferBufferMDL    = 00000000
    00000000: 05 ff 56 c0 80 91 e7 02 82 30 c9 f4 85 e2 80 93
    00000010: 21 15 80 91 20 15 89 7f 80 93 20 15 28 2e 20 92
    00000020: 20 15 85 e1 80 93 31 15 80 91 30 15 89 7f 80 93
    00000030: 30 15 82 60 80 93 30 15 0e 94 f4 04 39 c0 80 91
  UrbLink                 = 00000000
  RequestTypeReservedBits = 00000000
  Request                 = 00000001
  Value                   = 00000005
  Index                   = 00000000
[365790 ms] UsbSnoop - MyInternalIOCTLCompletion(0dd57ddc) : fido=00000000, Irp=0d89db40, Context=0abca400, IRQL=2
[365790 ms]  <<<  URB 24 coming back  <<< 
-- URB_FUNCTION_CONTROL_TRANSFER:
  PipeHandle           = 0d937120
  TransferFlags        = 0000000a (USBD_TRANSFER_DIRECTION_OUT, USBD_SHORT_TRANSFER_OK)
  TransferBufferLength = 00000040
  TransferBuffer       = 03771400
  TransferBufferMDL    = 098a1950
  UrbLink              = 00000000
  SetupPacket          =
    00000000: 40 01 05 00 00 00 40 00
[365790 ms] UsbSnoop - FilterDispatchAny(0dd57b90) : IRP_MJ_INTERNAL_DEVICE_CONTROL
[365790 ms] UsbSnoop - FdoHookDispatchInternalIoctl(0dd57f8c) : fdo=09b44040, Irp=0d89db40, IRQL=0
[365790 ms]  >>>  URB 25 going down  >>> 
-- URB_FUNCTION_VENDOR_DEVICE:
  TransferFlags          = 00000002 (USBD_TRANSFER_DIRECTION_OUT, USBD_SHORT_TRANSFER_OK)
  TransferBufferLength = 00000040
  TransferBuffer       = 03771400
  TransferBufferMDL    = 00000000
    00000000: 05 ff e7 02 85 30 c9 f4 85 e2 80 93 31 15 80 91
    00000010: 30 15 89 7f 80 93 30 15 28 2e 20 92 30 15 85 e1
    00000020: 80 93 21 15 80 91 20 15 89 7f 80 93 20 15 82 60
    00000030: 80 93 20 15 0e 94 0c 05 1c c0 80 91 e7 02 84 30
  UrbLink                 = 00000000
  RequestTypeReservedBits = 00000000
  Request                 = 00000001
  Value                   = 00000005
  Index                   = 00000000
[365790 ms] UsbSnoop - MyInternalIOCTLCompletion(0dd57ddc) : fido=00000000, Irp=0d89db40, Context=0abca400, IRQL=2
[365790 ms]  <<<  URB 25 coming back  <<< 
-- URB_FUNCTION_CONTROL_TRANSFER:
  PipeHandle           = 0d937120
  TransferFlags        = 0000000a (USBD_TRANSFER_DIRECTION_OUT, USBD_SHORT_TRANSFER_OK)
  TransferBufferLength = 00000040
  TransferBuffer       = 03771400
  TransferBufferMDL    = 098a1950
  UrbLink              = 00000000
  SetupPacket          =
    00000000: 40 01 05 00 00 00 40 00
[365790 ms] UsbSnoop - FilterDispatchAny(0dd57b90) : IRP_MJ_INTERNAL_DEVICE_CONTROL
[365790 ms] UsbSnoop - FdoHookDispatchInternalIoctl(0dd57f8c) : fdo=09b44040, Irp=0d89db40, IRQL=0
[365790 ms]  >>>  URB 26 going down  >>> 
-- URB_FUNCTION_VENDOR_DEVICE:
  TransferFlags          = 00000002 (USBD_TRANSFER_DIRECTION_OUT, USBD_SHORT_TRANSFER_OK)
  TransferBufferLength = 00000040
  TransferBuffer       = 03771400
  TransferBufferMDL    = 00000000
    00000000: 05 ff c1 f4 85 e2 80 93 21 15 80 91 20 15 89 7f
    00000010: 80 93 20 15 28 2e 20 92 20 15 85 e1 80 93 31 15
    00000020: 80 91 30 15 89 7f 80 93 30 15 82 60 80 93 30 15
    00000030: 0e 94 fa 04 20 90 1c 15 27 fc fc cf 22 24 20 92
  UrbLink                 = 00000000
  RequestTypeReservedBits = 00000000
  Request                 = 00000001
  Value                   = 00000005
  Index                   = 00000000
[365790 ms] UsbSnoop - MyInternalIOCTLCompletion(0dd57ddc) : fido=00000000, Irp=0d89db40, Context=0abca400, IRQL=2
[365790 ms]  <<<  URB 26 coming back  <<< 
-- URB_FUNCTION_CONTROL_TRANSFER:
  PipeHandle           = 0d937120
  TransferFlags        = 0000000a (USBD_TRANSFER_DIRECTION_OUT, USBD_SHORT_TRANSFER_OK)
  TransferBufferLength = 00000040
  TransferBuffer       = 03771400
  TransferBufferMDL    = 098a1950
  UrbLink              = 00000000
  SetupPacket          =
    00000000: 40 01 05 00 00 00 40 00
[365790 ms] UsbSnoop - FilterDispatchAny(0dd57b90) : IRP_MJ_INTERNAL_DEVICE_CONTROL
[365790 ms] UsbSnoop - FdoHookDispatchInternalIoctl(0dd57f8c) : fdo=09b44040, Irp=0d89db40, IRQL=0
[365790 ms]  >>>  URB 27 going down  >>> 
-- URB_FUNCTION_VENDOR_DEVICE:
  TransferFlags          = 00000002 (USBD_TRANSFER_DIRECTION_OUT, USBD_SHORT_TRANSFER_OK)
  TransferBufferLength = 00000040
  TransferBuffer       = 03771400
  TransferBufferMDL    = 00000000
    00000000: 05 ff 1b 15 80 91 1c 15 80 68 80 93 1c 15 9d c1
    00000010: 40 91 c9 01 80 91 c8 01 8f 70 e8 2e 20 90 c8 01
    00000020: 27 fe 02 c0 82 30 79 f4 80 91 c7 01 80 7c 80 38
    00000030: 11 f4 ee 20 41 f4 80 91 c7 01 80 7c 80 3c 31 f4
  UrbLink                 = 00000000
  RequestTypeReservedBits = 00000000
  Request                 = 00000001
  Value                   = 00000005
  Index                   = 00000000
[365790 ms] UsbSnoop - MyInternalIOCTLCompletion(0dd57ddc) : fido=00000000, Irp=0d89db40, Context=0abca400, IRQL=2
[365790 ms]  <<<  URB 27 coming back  <<< 
-- URB_FUNCTION_CONTROL_TRANSFER:
  PipeHandle           = 0d937120
  TransferFlags        = 0000000a (USBD_TRANSFER_DIRECTION_OUT, USBD_SHORT_TRANSFER_OK)
  TransferBufferLength = 00000040
  TransferBuffer       = 03771400
  TransferBufferMDL    = 0da71dc0
  UrbLink              = 00000000
  SetupPacket          =
    00000000: 40 01 05 00 00 00 40 00
[365790 ms] UsbSnoop - FilterDispatchAny(0dd57b90) : IRP_MJ_INTERNAL_DEVICE_CONTROL
[365790 ms] UsbSnoop - FdoHookDispatchInternalIoctl(0dd57f8c) : fdo=09b44040, Irp=0d8d3010, IRQL=0
[365790 ms]  >>>  URB 28 going down  >>> 
-- URB_FUNCTION_VENDOR_DEVICE:
  TransferFlags          = 00000002 (USBD_TRANSFER_DIRECTION_OUT, USBD_SHORT_TRANSFER_OK)
  TransferBufferLength = 00000040
  TransferBuffer       = 03771400
  TransferBufferMDL    = 00000000
    00000000: 05 ff 8e 2d 81 30 19 f0 0e 94 0b 09 7f c1 20 90
    00000010: c8 01 27 fe 9d c0 20 90 c7 01 25 fe 5b c0 20 90
    00000020: ca 01 2e 82 20 90 cb 01 2d 82 20 90 ca 01 20 92
    00000030: 9c 01 20 90 cb 01 20 92 9d 01 cc 24 37 c0 24 2e
  UrbLink                 = 00000000
  RequestTypeReservedBits = 00000000
  Request                 = 00000001
  Value                   = 00000005
  Index                   = 00000000
[365791 ms] UsbSnoop - MyInternalIOCTLCompletion(0dd57ddc) : fido=00000000, Irp=0d8d3010, Context=0abca400, IRQL=2
[365791 ms]  <<<  URB 28 coming back  <<< 
-- URB_FUNCTION_CONTROL_TRANSFER:
  PipeHandle           = 0d937120
  TransferFlags        = 0000000a (USBD_TRANSFER_DIRECTION_OUT, USBD_SHORT_TRANSFER_OK)
  TransferBufferLength = 00000040
  TransferBuffer       = 03771400
  TransferBufferMDL    = 0994a540
  UrbLink              = 00000000
  SetupPacket          =
    00000000: 40 01 05 00 00 00 40 00
[365791 ms] UsbSnoop - FilterDispatchAny(0dd57b90) : IRP_MJ_INTERNAL_DEVICE_CONTROL
[365791 ms] UsbSnoop - FdoHookDispatchInternalIoctl(0dd57f8c) : fdo=09b44040, Irp=0d8d3010, IRQL=0
[365791 ms]  >>>  URB 29 going down  >>> 
-- URB_FUNCTION_VENDOR_DEVICE:
  TransferFlags          = 00000002 (USBD_TRANSFER_DIRECTION_OUT, USBD_SHORT_TRANSFER_OK)
  TransferBufferLength = 00000040
  TransferBuffer       = 03771400
  TransferBufferMDL    = 00000000
    00000000: 05 ff 33 24 4d 80 5e 80 42 0c 53 1c 86 e0 96 e1
    00000010: 84 15 95 05 e8 f0 8d 81 9e 81 80 30 e6 e1 9e 07
    00000020: b8 f0 80 91 00 16 83 70 81 30 91 f4 87 ec 92 e0
    00000030: ec 2d ff 27 e8 0f f9 1f 20 80 8e e9 91 e0 ec 2d
  UrbLink                 = 00000000
  RequestTypeReservedBits = 00000000
  Request                 = 00000001
  Value                   = 00000005
  Index                   = 00000000
[365791 ms] UsbSnoop - MyInternalIOCTLCompletion(0dd57ddc) : fido=00000000, Irp=0d8d3010, Context=0abca400, IRQL=2
[365791 ms]  <<<  URB 29 coming back  <<< 
-- URB_FUNCTION_CONTROL_TRANSFER:
  PipeHandle           = 0d937120
  TransferFlags        = 0000000a (USBD_TRANSFER_DIRECTION_OUT, USBD_SHORT_TRANSFER_OK)
  TransferBufferLength = 00000040
  TransferBuffer       = 03771400
  TransferBufferMDL    = 0994a540
  UrbLink              = 00000000
  SetupPacket          =
    00000000: 40 01 05 00 00 00 40 00
[365791 ms] UsbSnoop - FilterDispatchAny(0dd57b90) : IRP_MJ_INTERNAL_DEVICE_CONTROL
[365791 ms] UsbSnoop - FdoHookDispatchInternalIoctl(0dd57f8c) : fdo=09b44040, Irp=0d8d3010, IRQL=0
[365791 ms]  >>>  URB 30 going down  >>> 
-- URB_FUNCTION_VENDOR_DEVICE:
  TransferFlags          = 00000002 (USBD_TRANSFER_DIRECTION_OUT, USBD_SHORT_TRANSFER_OK)
  TransferBufferLength = 00000040
  TransferBuffer       = 03771400
  TransferBufferMDL    = 00000000
    00000000: 05 ff ff 27 e8 0f f9 1f 20 82 81 e0 80 93 c7 02
    00000010: 0e c0 2c 2c 33 24 ed 81 fe 81 e2 0d f3 1d 20 80
    00000020: 8e e9 91 e0 ec 2d ff 27 e8 0f f9 1f 20 82 c3 94
    00000030: c4 16 08 f4 c6 cf 20 90 c6 01 20 92 bc 01 20 90
  UrbLink                 = 00000000
  RequestTypeReservedBits = 00000000
  Request                 = 00000001
  Value                   = 00000005
  Index                   = 00000000
[365791 ms] UsbSnoop - MyInternalIOCTLCompletion(0dd57ddc) : fido=00000000, Irp=0d8d3010, Context=0abca400, IRQL=2
[365791 ms]  <<<  URB 30 coming back  <<< 
-- URB_FUNCTION_CONTROL_TRANSFER:
  PipeHandle           = 0d937120
  TransferFlags        = 0000000a (USBD_TRANSFER_DIRECTION_OUT, USBD_SHORT_TRANSFER_OK)
  TransferBufferLength = 00000040
  TransferBuffer       = 03771400
  TransferBufferMDL    = 0994a540
  UrbLink              = 00000000
  SetupPacket          =
    00000000: 40 01 05 00 00 00 40 00
[365791 ms] UsbSnoop - FilterDispatchAny(0dd57b90) : IRP_MJ_INTERNAL_DEVICE_CONTROL
[365791 ms] UsbSnoop - FdoHookDispatchInternalIoctl(0dd57f8c) : fdo=09b44040, Irp=0d8d3010, IRQL=0
[365791 ms]  >>>  URB 31 going down  >>> 
-- URB_FUNCTION_VENDOR_DEVICE:
  TransferFlags          = 00000002 (USBD_TRANSFER_DIRECTION_OUT, USBD_SHORT_TRANSFER_OK)
  TransferBufferLength = 00000040
  TransferBuffer       = 03771400
  TransferBufferMDL    = 00000000
    00000000: 05 ff c7 01 20 92 bd 01 20 90 c8 01 20 92 be 01
    00000010: 20 90 c9 01 20 92 bf 01 31 c0 20 90 ca 01 2e 82
    00000020: 20 90 cb 01 2d 82 22 20 89 f4 8e 81 86 31 71 f4
    00000030: 8a ec 91 e0 ee 2d ff 27 e8 0f f9 1f 80 81 81 38
  UrbLink                 = 00000000
  RequestTypeReservedBits = 00000000
  Request                 = 00000001
  Value                   = 00000005
  Index                   = 00000000
[365791 ms] UsbSnoop - MyInternalIOCTLCompletion(0dd57ddc) : fido=00000000, Irp=0d8d3010, Context=0abca400, IRQL=2
[365791 ms]  <<<  URB 31 coming back  <<< 
-- URB_FUNCTION_CONTROL_TRANSFER:
  PipeHandle           = 0d937120
  TransferFlags        = 0000000a (USBD_TRANSFER_DIRECTION_OUT, USBD_SHORT_TRANSFER_OK)
  TransferBufferLength = 00000040
  TransferBuffer       = 03771400
  TransferBufferMDL    = 0d8f4740
  UrbLink              = 00000000
  SetupPacket          =
    00000000: 40 01 05 00 00 00 40 00
[365791 ms] UsbSnoop - FilterDispatchAny(0dd57b90) : IRP_MJ_INTERNAL_DEVICE_CONTROL
[365791 ms] UsbSnoop - FdoHookDispatchInternalIoctl(0dd57f8c) : fdo=09b44040, Irp=0d8d3010, IRQL=0
[365791 ms]  >>>  URB 32 going down  >>> 
-- URB_FUNCTION_VENDOR_DEVICE:
  TransferFlags          = 00000002 (USBD_TRANSFER_DIRECTION_OUT, USBD_SHORT_TRANSFER_OK)
  TransferBufferLength = 00000040
  TransferBuffer       = 03771400
  TransferBufferMDL    = 00000000
    00000000: 05 ff 29 f4 81 e0 80 93 00 16 0e 94 64 06 cc 24
    00000010: 14 c0 2c 2c 33 24 ee 2d ff 27 35 96 e2 0d f3 1d
    00000020: 85 ec 91 e0 e8 0f f9 1f 20 80 3c 2c 44 24 ed 81
    00000030: fe 81 e3 0d f4 1d 20 82 c3 94 c4 16 50 f3 20 90
  UrbLink                 = 00000000
  RequestTypeReservedBits = 00000000
  Request                 = 00000001
  Value                   = 00000005
  Index                   = 00000000
[365792 ms] UsbSnoop - MyInternalIOCTLCompletion(0dd57ddc) : fido=00000000, Irp=0d8d3010, Context=0abca400, IRQL=2
[365792 ms]  <<<  URB 32 coming back  <<< 
-- URB_FUNCTION_CONTROL_TRANSFER:
  PipeHandle           = 0d937120
  TransferFlags        = 0000000a (USBD_TRANSFER_DIRECTION_OUT, USBD_SHORT_TRANSFER_OK)
  TransferBufferLength = 00000040
  TransferBuffer       = 03771400
  TransferBufferMDL    = 0d8f4740
  UrbLink              = 00000000
  SetupPacket          =
    00000000: 40 01 05 00 00 00 40 00
[365792 ms] UsbSnoop - FilterDispatchAny(0dd57b90) : IRP_MJ_INTERNAL_DEVICE_CONTROL
[365792 ms] UsbSnoop - FdoHookDispatchInternalIoctl(0dd57f8c) : fdo=09b44040, Irp=0d8d3010, IRQL=0
[365792 ms]  >>>  URB 33 going down  >>> 
-- URB_FUNCTION_VENDOR_DEVICE:
  TransferFlags          = 00000002 (USBD_TRANSFER_DIRECTION_OUT, USBD_SHORT_TRANSFER_OK)
  TransferBufferLength = 00000040
  TransferBuffer       = 03771400
  TransferBufferMDL    = 00000000
    00000000: 05 ff 1c 15 27 fc fc cf 22 24 20 92 1b 15 80 91
    00000010: 1c 15 80 68 80 93 1c 15 de c0 20 90 c8 01 24 fe
    00000020: 29 c0 cc 24 0f c0 80 e6 90 e0 ec 2d ff 27 e8 0f
    00000030: f9 1f 20 80 8c e9 91 e0 ec 2d ff 27 e8 0f f9 1f
  UrbLink                 = 00000000
  RequestTypeReservedBits = 00000000
  Request                 = 00000001
  Value                   = 00000005
  Index                   = 00000000
[365792 ms] UsbSnoop - MyInternalIOCTLCompletion(0dd57ddc) : fido=00000000, Irp=0d8d3010, Context=0abca400, IRQL=2
[365792 ms]  <<<  URB 33 coming back  <<< 
-- URB_FUNCTION_CONTROL_TRANSFER:
  PipeHandle           = 0d937120
  TransferFlags        = 0000000a (USBD_TRANSFER_DIRECTION_OUT, USBD_SHORT_TRANSFER_OK)
  TransferBufferLength = 00000040
  TransferBuffer       = 03771400
  TransferBufferMDL    = 0d8f4740
  UrbLink              = 00000000
  SetupPacket          =
    00000000: 40 01 05 00 00 00 40 00
[365792 ms] UsbSnoop - FilterDispatchAny(0dd57b90) : IRP_MJ_INTERNAL_DEVICE_CONTROL
[365792 ms] UsbSnoop - FdoHookDispatchInternalIoctl(0dd57f8c) : fdo=09b44040, Irp=0d8d3010, IRQL=0
[365792 ms]  >>>  URB 34 going down  >>> 
-- URB_FUNCTION_VENDOR_DEVICE:
  TransferFlags          = 00000002 (USBD_TRANSFER_DIRECTION_OUT, USBD_SHORT_TRANSFER_OK)
  TransferBufferLength = 00000040
  TransferBuffer       = 03771400
  TransferBufferMDL    = 00000000
    00000000: 05 ff 20 82 c3 94 8c 2d 80 31 70 f3 20 90 c8 01
    00000010: 20 92 be 01 20 90 c9 01 20 92 bf 01 20 90 1c 15
    00000020: 27 fc fc cf 22 24 20 92 1b 15 80 91 1c 15 80 68
    00000030: 80 93 1c 15 b1 c0 81 e0 80 93 e9 02 80 91 c8 01
  UrbLink                 = 00000000
  RequestTypeReservedBits = 00000000
  Request                 = 00000001
  Value                   = 00000005
  Index                   = 00000000
[365792 ms] UsbSnoop - MyInternalIOCTLCompletion(0dd57ddc) : fido=00000000, Irp=0d8d3010, Context=0abca400, IRQL=2
[365792 ms]  <<<  URB 34 coming back  <<< 
-- URB_FUNCTION_CONTROL_TRANSFER:
  PipeHandle           = 0d937120
  TransferFlags        = 0000000a (USBD_TRANSFER_DIRECTION_OUT, USBD_SHORT_TRANSFER_OK)
  TransferBufferLength = 00000040
  TransferBuffer       = 03771400
  TransferBufferMDL    = 0d8f4740
  UrbLink              = 00000000
  SetupPacket          =
    00000000: 40 01 05 00 00 00 40 00
[365792 ms] UsbSnoop - FilterDispatchAny(0dd57b90) : IRP_MJ_INTERNAL_DEVICE_CONTROL
[365792 ms] UsbSnoop - FdoHookDispatchInternalIoctl(0dd57f8c) : fdo=09b44040, Irp=0d8d3010, IRQL=0
[365792 ms]  >>>  URB 35 going down  >>> 
-- URB_FUNCTION_VENDOR_DEVICE:
  TransferFlags          = 00000002 (USBD_TRANSFER_DIRECTION_OUT, USBD_SHORT_TRANSFER_OK)
  TransferBufferLength = 00000040
  TransferBuffer       = 03771400
  TransferBufferMDL    = 00000000
    00000000: 05 ff 80 74 a8 2e a6 94 a6 94 a6 94 a6 94 a6 94
    00000010: a6 94 aa 20 19 f0 65 e8 71 e3 02 c0 65 e8 77 e1
    00000020: 20 90 c7 01 25 fe 5b c0 13 c0 ac 82 20 90 ca 01
    00000030: 2a 82 20 90 c9 01 28 82 20 91 c7 01 00 91 c6 01
  UrbLink                 = 00000000
  RequestTypeReservedBits = 00000000
  Request                 = 00000001
  Value                   = 00000005
  Index                   = 00000000
[365792 ms] UsbSnoop - MyInternalIOCTLCompletion(0dd57ddc) : fido=00000000, Irp=0d8d3010, Context=0abca400, IRQL=2
[365792 ms]  <<<  URB 35 coming back  <<< 
-- URB_FUNCTION_CONTROL_TRANSFER:
  PipeHandle           = 0d937120
  TransferFlags        = 0000000a (USBD_TRANSFER_DIRECTION_OUT, USBD_SHORT_TRANSFER_OK)
  TransferBufferLength = 00000040
  TransferBuffer       = 03771400
  TransferBufferMDL    = 0d8f4740
  UrbLink              = 00000000
  SetupPacket          =
    00000000: 40 01 05 00 00 00 40 00
[365792 ms] UsbSnoop - FilterDispatchAny(0dd57b90) : IRP_MJ_INTERNAL_DEVICE_CONTROL
[365792 ms] UsbSnoop - FdoHookDispatchInternalIoctl(0dd57f8c) : fdo=09b44040, Irp=0d8d3010, IRQL=0
[365792 ms]  >>>  URB 36 going down  >>> 
-- URB_FUNCTION_VENDOR_DEVICE:
  TransferFlags          = 00000002 (USBD_TRANSFER_DIRECTION_OUT, USBD_SHORT_TRANSFER_OK)
  TransferBufferLength = 00000040
  TransferBuffer       = 03771400
  TransferBufferMDL    = 00000000
    00000000: 05 ff 0e 94 38 05 00 23 09 f0 07 c0 0f 80 0a 94
    00000010: 0f 82 22 24 0f 80 20 14 48 f3 cc 24 0f c0 8a ec
    00000020: 91 e0 ec 2d ff 27 e8 0f f9 1f 20 80 8c e9 91 e0
    00000030: ec 2d ff 27 e8 0f f9 1f 20 82 c3 94 ce 14 78 f3
  UrbLink                 = 00000000
  RequestTypeReservedBits = 00000000
  Request                 = 00000001
  Value                   = 00000005
  Index                   = 00000000
[365793 ms] UsbSnoop - MyInternalIOCTLCompletion(0dd57ddc) : fido=00000000, Irp=0d8d3010, Context=0abca400, IRQL=2
[365793 ms]  <<<  URB 36 coming back  <<< 
-- URB_FUNCTION_CONTROL_TRANSFER:
  PipeHandle           = 0d937120
  TransferFlags        = 0000000a (USBD_TRANSFER_DIRECTION_OUT, USBD_SHORT_TRANSFER_OK)
  TransferBufferLength = 00000040
  TransferBuffer       = 03771400
  TransferBufferMDL    = 0d8f4740
  UrbLink              = 00000000
  SetupPacket          =
    00000000: 40 01 05 00 00 00 40 00
[365793 ms] UsbSnoop - FilterDispatchAny(0dd57b90) : IRP_MJ_INTERNAL_DEVICE_CONTROL
[365793 ms] UsbSnoop - FdoHookDispatchInternalIoctl(0dd57f8c) : fdo=09b44040, Irp=0d8d3010, IRQL=0
[365793 ms]  >>>  URB 37 going down  >>> 
-- URB_FUNCTION_VENDOR_DEVICE:
  TransferFlags          = 00000002 (USBD_TRANSFER_DIRECTION_OUT, USBD_SHORT_TRANSFER_OK)
  TransferBufferLength = 00000040
  TransferBuffer       = 03771400
  TransferBufferMDL    = 00000000
    00000000: 05 ff cc 24 12 c0 2c 2c 33 24 ee 2d ff 27 e2 0d
    00000010: f3 1d 8c e9 91 e0 e8 0f f9 1f 33 24 a6 2f b7 2f
    00000020: a2 0d b3 1d 2c 90 20 82 c3 94 c4 16 60 f3 20 90
    00000030: c6 01 20 92 bc 01 0f 80 00 20 31 f4 80 91 c7 01
  UrbLink                 = 00000000
  RequestTypeReservedBits = 00000000
  Request                 = 00000001
  Value                   = 00000005
  Index                   = 00000000
[365793 ms] UsbSnoop - MyInternalIOCTLCompletion(0dd57ddc) : fido=00000000, Irp=0d8d3010, Context=0abca400, IRQL=2
[365793 ms]  <<<  URB 37 coming back  <<< 
-- URB_FUNCTION_CONTROL_TRANSFER:
  PipeHandle           = 0d937120
  TransferFlags        = 0000000a (USBD_TRANSFER_DIRECTION_OUT, USBD_SHORT_TRANSFER_OK)
  TransferBufferLength = 00000040
  TransferBuffer       = 03771400
  TransferBufferMDL    = 0d8f4740
  UrbLink              = 00000000
  SetupPacket          =
    00000000: 40 01 05 00 00 00 40 00
[365793 ms] UsbSnoop - FilterDispatchAny(0dd57b90) : IRP_MJ_INTERNAL_DEVICE_CONTROL
[365793 ms] UsbSnoop - FdoHookDispatchInternalIoctl(0dd57f8c) : fdo=09b44040, Irp=0d8d3010, IRQL=0
[365793 ms]  >>>  URB 38 going down  >>> 
-- URB_FUNCTION_VENDOR_DEVICE:
  TransferFlags          = 00000002 (USBD_TRANSFER_DIRECTION_OUT, USBD_SHORT_TRANSFER_OK)
  TransferBufferLength = 00000040
  TransferBuffer       = 03771400
  TransferBufferMDL    = 00000000
    00000000: 05 ff 81 60 80 93 bd 01 04 c0 20 90 c7 01 20 92
    00000010: bd 01 20 90 c8 01 20 92 be 01 20 90 c9 01 20 92
    00000020: bf 01 32 c0 cc 24 14 c0 2c 2c 33 24 ee 2d ff 27
    00000030: 35 96 e2 0d f3 1d 85 ec 91 e0 e8 0f f9 1f 20 80
  UrbLink                 = 00000000
  RequestTypeReservedBits = 00000000
  Request                 = 00000001
  Value                   = 00000005
  Index                   = 00000000
[365793 ms] UsbSnoop - MyInternalIOCTLCompletion(0dd57ddc) : fido=00000000, Irp=0d8d3010, Context=0abca400, IRQL=2
[365793 ms]  <<<  URB 38 coming back  <<< 
-- URB_FUNCTION_CONTROL_TRANSFER:
  PipeHandle           = 0d937120
  TransferFlags        = 0000000a (USBD_TRANSFER_DIRECTION_OUT, USBD_SHORT_TRANSFER_OK)
  TransferBufferLength = 00000040
  TransferBuffer       = 03771400
  TransferBufferMDL    = 0dbf8960
  UrbLink              = 00000000
  SetupPacket          =
    00000000: 40 01 05 00 00 00 40 00
[365793 ms] UsbSnoop - FilterDispatchAny(0dd57b90) : IRP_MJ_INTERNAL_DEVICE_CONTROL
[365793 ms] UsbSnoop - FdoHookDispatchInternalIoctl(0dd57f8c) : fdo=09b44040, Irp=0d8d3010, IRQL=0
[365793 ms]  >>>  URB 39 going down  >>> 
-- URB_FUNCTION_VENDOR_DEVICE:
  TransferFlags          = 00000002 (USBD_TRANSFER_DIRECTION_OUT, USBD_SHORT_TRANSFER_OK)
  TransferBufferLength = 00000040
  TransferBuffer       = 03771400
  TransferBufferMDL    = 00000000
    00000000: 05 ff 3c 2c 44 24 e6 2f f7 2f e3 0d f4 1d 20 82
    00000010: c3 94 c4 16 50 f3 80 e1 8f 83 13 c0 ac 82 20 90
    00000020: ca 01 2a 82 20 90 c9 01 28 82 20 91 c7 01 00 91
    00000030: c6 01 0e 94 38 05 00 23 09 f0 07 c0 0f 80 0a 94
  UrbLink                 = 00000000
  RequestTypeReservedBits = 00000000
  Request                 = 00000001
  Value                   = 00000005
  Index                   = 00000000
[365794 ms] UsbSnoop - MyInternalIOCTLCompletion(0dd57ddc) : fido=00000000, Irp=0d8d3010, Context=0abca400, IRQL=2
[365794 ms]  <<<  URB 39 coming back  <<< 
-- URB_FUNCTION_CONTROL_TRANSFER:
  PipeHandle           = 0d937120
  TransferFlags        = 0000000a (USBD_TRANSFER_DIRECTION_OUT, USBD_SHORT_TRANSFER_OK)
  TransferBufferLength = 00000040
  TransferBuffer       = 03771400
  TransferBufferMDL    = 0dbf8960
  UrbLink              = 00000000
  SetupPacket          =
    00000000: 40 01 05 00 00 00 40 00
[365794 ms] UsbSnoop - FilterDispatchAny(0dd57b90) : IRP_MJ_INTERNAL_DEVICE_CONTROL
[365794 ms] UsbSnoop - FdoHookDispatchInternalIoctl(0dd57f8c) : fdo=09b44040, Irp=0d8d3010, IRQL=0
[365794 ms]  >>>  URB 40 going down  >>> 
-- URB_FUNCTION_VENDOR_DEVICE:
  TransferFlags          = 00000002 (USBD_TRANSFER_DIRECTION_OUT, USBD_SHORT_TRANSFER_OK)
  TransferBufferLength = 00000040
  TransferBuffer       = 03771400
  TransferBufferMDL    = 00000000
    00000000: 05 ff 0f 82 22 24 0f 80 20 14 48 f3 20 90 1c 15
    00000010: 27 fc fc cf 22 24 20 92 1b 15 80 91 1c 15 80 68
    00000020: 80 93 1c 15 28 96 0e 94 71 0e 08 95 ee 97 48 ef
    00000030: 44 27 8f ef 8a bb 83 e0 80 93 e7 02 22 24 20 92
  UrbLink                 = 00000000
  RequestTypeReservedBits = 00000000
  Request                 = 00000001
  Value                   = 00000005
  Index                   = 00000000
[365794 ms] UsbSnoop - MyInternalIOCTLCompletion(0dd57ddc) : fido=00000000, Irp=0d8d3010, Context=0abca400, IRQL=2
[365794 ms]  <<<  URB 40 coming back  <<< 
-- URB_FUNCTION_CONTROL_TRANSFER:
  PipeHandle           = 0d937120
  TransferFlags        = 0000000a (USBD_TRANSFER_DIRECTION_OUT, USBD_SHORT_TRANSFER_OK)
  TransferBufferLength = 00000040
  TransferBuffer       = 03771400
  TransferBufferMDL    = 0d8f4740
  UrbLink              = 00000000
  SetupPacket          =
    00000000: 40 01 05 00 00 00 40 00
[365794 ms] UsbSnoop - FilterDispatchAny(0dd57b90) : IRP_MJ_INTERNAL_DEVICE_CONTROL
[365794 ms] UsbSnoop - FdoHookDispatchInternalIoctl(0dd57f8c) : fdo=09b44040, Irp=0d8d3010, IRQL=0
[365794 ms]  >>>  URB 41 going down  >>> 
-- URB_FUNCTION_VENDOR_DEVICE:
  TransferFlags          = 00000002 (USBD_TRANSFER_DIRECTION_OUT, USBD_SHORT_TRANSFER_OK)
  TransferBufferLength = 00000040
  TransferBuffer       = 03771400
  TransferBufferMDL    = 00000000
    00000000: 05 ff 82 17 20 92 82 31 82 30 09 f4 b1 d0 80 91
    00000010: e7 02 83 30 09 f4 b9 d0 80 91 e7 02 85 30 09 f4
    00000020: bf d0 80 91 e7 02 84 30 09 f4 a8 d0 3e d0 78 94
    00000030: 39 c0 0e 94 72 06 80 91 00 16 83 70 81 30 11 f4
  UrbLink                 = 00000000
  RequestTypeReservedBits = 00000000
  Request                 = 00000001
  Value                   = 00000005
  Index                   = 00000000
[365794 ms] UsbSnoop - MyInternalIOCTLCompletion(0dd57ddc) : fido=00000000, Irp=0d8d3010, Context=0abca400, IRQL=2
[365794 ms]  <<<  URB 41 coming back  <<< 
-- URB_FUNCTION_CONTROL_TRANSFER:
  PipeHandle           = 0d937120
  TransferFlags        = 0000000a (USBD_TRANSFER_DIRECTION_OUT, USBD_SHORT_TRANSFER_OK)
  TransferBufferLength = 00000040
  TransferBuffer       = 03771400
  TransferBufferMDL    = 0d8f4740
  UrbLink              = 00000000
  SetupPacket          =
    00000000: 40 01 05 00 00 00 40 00
[365794 ms] UsbSnoop - FilterDispatchAny(0dd57b90) : IRP_MJ_INTERNAL_DEVICE_CONTROL
[365794 ms] UsbSnoop - FdoHookDispatchInternalIoctl(0dd57f8c) : fdo=09b44040, Irp=0d8d3010, IRQL=0
[365794 ms]  >>>  URB 42 going down  >>> 
-- URB_FUNCTION_VENDOR_DEVICE:
  TransferFlags          = 00000002 (USBD_TRANSFER_DIRECTION_OUT, USBD_SHORT_TRANSFER_OK)
  TransferBufferLength = 00000040
  TransferBuffer       = 03771400
  TransferBufferMDL    = 00000000
    00000000: 05 ff 0e 94 b5 05 80 91 e0 02 81 30 29 f4 22 24
    00000010: 20 92 e0 02 0e 94 ef 06 80 91 e1 02 81 30 29 f4
    00000020: 22 24 20 92 e1 02 0e 94 ac 06 80 91 e5 02 81 30
    00000030: 29 f4 22 24 20 92 e5 02 0e 94 c0 06 80 91 e3 02
  UrbLink                 = 00000000
  RequestTypeReservedBits = 00000000
  Request                 = 00000001
  Value                   = 00000005
  Index                   = 00000000
[365794 ms] UsbSnoop - MyInternalIOCTLCompletion(0dd57ddc) : fido=00000000, Irp=0d8d3010, Context=0abca400, IRQL=2
[365794 ms]  <<<  URB 42 coming back  <<< 
-- URB_FUNCTION_CONTROL_TRANSFER:
  PipeHandle           = 0d937120
  TransferFlags        = 0000000a (USBD_TRANSFER_DIRECTION_OUT, USBD_SHORT_TRANSFER_OK)
  TransferBufferLength = 00000040
  TransferBuffer       = 03771400
  TransferBufferMDL    = 0d8f4740
  UrbLink              = 00000000
  SetupPacket          =
    00000000: 40 01 05 00 00 00 40 00
[365794 ms] UsbSnoop - FilterDispatchAny(0dd57b90) : IRP_MJ_INTERNAL_DEVICE_CONTROL
[365794 ms] UsbSnoop - FdoHookDispatchInternalIoctl(0dd57f8c) : fdo=09b44040, Irp=0d8d3010, IRQL=0
[365794 ms]  >>>  URB 43 going down  >>> 
-- URB_FUNCTION_VENDOR_DEVICE:
  TransferFlags          = 00000002 (USBD_TRANSFER_DIRECTION_OUT, USBD_SHORT_TRANSFER_OK)
  TransferBufferLength = 00000040
  TransferBuffer       = 03771400
  TransferBufferMDL    = 00000000
    00000000: 05 ff 81 30 41 f4 22 24 20 92 e3 02 80 91 80 30
    00000010: 8f 77 80 93 80 30 80 91 e8 02 81 30 29 f4 22 24
    00000020: 20 92 e8 02 0e 94 e0 06 c6 cf ee 96 08 95 22 24
    00000030: 20 92 e0 02 20 92 e1 02 20 92 e3 02 20 92 e6 02
  UrbLink                 = 00000000
  RequestTypeReservedBits = 00000000
  Request                 = 00000001
  Value                   = 00000005
  Index                   = 00000000
[365794 ms] UsbSnoop - MyInternalIOCTLCompletion(0dd57ddc) : fido=00000000, Irp=0d8d3010, Context=0abca400, IRQL=2
[365794 ms]  <<<  URB 43 coming back  <<< 
-- URB_FUNCTION_CONTROL_TRANSFER:
  PipeHandle           = 0d937120
  TransferFlags        = 0000000a (USBD_TRANSFER_DIRECTION_OUT, USBD_SHORT_TRANSFER_OK)
  TransferBufferLength = 00000040
  TransferBuffer       = 03771400
  TransferBufferMDL    = 0d8f4740
  UrbLink              = 00000000
  SetupPacket          =
    00000000: 40 01 05 00 00 00 40 00
[365795 ms] UsbSnoop - FilterDispatchAny(0dd57b90) : IRP_MJ_INTERNAL_DEVICE_CONTROL
[365795 ms] UsbSnoop - FdoHookDispatchInternalIoctl(0dd57f8c) : fdo=09b44040, Irp=0d8d3010, IRQL=0
[365795 ms]  >>>  URB 44 going down  >>> 
-- URB_FUNCTION_VENDOR_DEVICE:
  TransferFlags          = 00000002 (USBD_TRANSFER_DIRECTION_OUT, USBD_SHORT_TRANSFER_OK)
  TransferBufferLength = 00000040
  TransferBuffer       = 03771400
  TransferBufferMDL    = 00000000
    00000000: 05 ff 20 92 e4 02 20 92 e5 02 20 92 e8 02 20 92
    00000010: e9 02 84 ec 80 93 07 15 83 e0 80 93 11 15 80 91
    00000020: 10 15 89 7f 80 93 10 15 28 2e 20 92 10 15 80 e4
    00000030: 80 93 13 15 80 e0 90 e2 90 93 1a 15 80 93 19 15
  UrbLink                 = 00000000
  RequestTypeReservedBits = 00000000
  Request                 = 00000001
  Value                   = 00000005
  Index                   = 00000000
[365795 ms] UsbSnoop - MyInternalIOCTLCompletion(0dd57ddc) : fido=00000000, Irp=0d8d3010, Context=0abca400, IRQL=2
[365795 ms]  <<<  URB 44 coming back  <<< 
-- URB_FUNCTION_CONTROL_TRANSFER:
  PipeHandle           = 0d937120
  TransferFlags        = 0000000a (USBD_TRANSFER_DIRECTION_OUT, USBD_SHORT_TRANSFER_OK)
  TransferBufferLength = 00000040
  TransferBuffer       = 03771400
  TransferBufferMDL    = 0d8f4740
  UrbLink              = 00000000
  SetupPacket          =
    00000000: 40 01 05 00 00 00 40 00
[365795 ms] UsbSnoop - FilterDispatchAny(0dd57b90) : IRP_MJ_INTERNAL_DEVICE_CONTROL
[365795 ms] UsbSnoop - FdoHookDispatchInternalIoctl(0dd57f8c) : fdo=09b44040, Irp=0d8d3010, IRQL=0
[365795 ms]  >>>  URB 45 going down  >>> 
-- URB_FUNCTION_VENDOR_DEVICE:
  TransferFlags          = 00000002 (USBD_TRANSFER_DIRECTION_OUT, USBD_SHORT_TRANSFER_OK)
  TransferBufferLength = 00000040
  TransferBuffer       = 03771400
  TransferBufferMDL    = 00000000
    00000000: 05 ff 80 e4 90 93 1e 15 80 93 1d 15 80 93 15 15
    00000010: 85 e1 80 93 21 15 80 91 20 15 89 7f 80 93 20 15
    00000020: 28 2e 20 92 20 15 8f ef 93 e0 90 93 24 15 80 93
    00000030: 23 15 85 e2 80 93 31 15 80 91 30 15 89 7f 80 93
  UrbLink                 = 00000000
  RequestTypeReservedBits = 00000000
  Request                 = 00000001
  Value                   = 00000005
  Index                   = 00000000
[365795 ms] UsbSnoop - MyInternalIOCTLCompletion(0dd57ddc) : fido=00000000, Irp=0d8d3010, Context=0abca400, IRQL=2
[365795 ms]  <<<  URB 45 coming back  <<< 
-- URB_FUNCTION_CONTROL_TRANSFER:
  PipeHandle           = 0d937120
  TransferFlags        = 0000000a (USBD_TRANSFER_DIRECTION_OUT, USBD_SHORT_TRANSFER_OK)
  TransferBufferLength = 00000040
  TransferBuffer       = 03771400
  TransferBufferMDL    = 0d8f4740
  UrbLink              = 00000000
  SetupPacket          =
    00000000: 40 01 05 00 00 00 40 00
[365795 ms] UsbSnoop - FilterDispatchAny(0dd57b90) : IRP_MJ_INTERNAL_DEVICE_CONTROL
[365795 ms] UsbSnoop - FdoHookDispatchInternalIoctl(0dd57f8c) : fdo=09b44040, Irp=0d8d3010, IRQL=0
[365795 ms]  >>>  URB 46 going down  >>> 
-- URB_FUNCTION_VENDOR_DEVICE:
  TransferFlags          = 00000002 (USBD_TRANSFER_DIRECTION_OUT, USBD_SHORT_TRANSFER_OK)
  TransferBufferLength = 00000040
  TransferBuffer       = 03771400
  TransferBufferMDL    = 00000000
    00000000: 05 ff 30 15 28 2e 20 92 30 15 8f ef 90 93 34 15
    00000010: 80 93 33 15 0e 94 ec 06 08 ec 10 e0 2f d0 80 91
    00000020: 00 15 88 60 80 93 00 15 00 ed 17 e0 27 d0 80 91
    00000030: 00 15 87 7f 80 93 00 15 08 95 22 24 20 92 40 17
  UrbLink                 = 00000000
  RequestTypeReservedBits = 00000000
  Request                 = 00000001
  Value                   = 00000005
  Index                   = 00000000
[365795 ms] UsbSnoop - MyInternalIOCTLCompletion(0dd57ddc) : fido=00000000, Irp=0d8d3010, Context=0abca400, IRQL=2
[365795 ms]  <<<  URB 46 coming back  <<< 
-- URB_FUNCTION_CONTROL_TRANSFER:
  PipeHandle           = 0d937120
  TransferFlags        = 0000000a (USBD_TRANSFER_DIRECTION_OUT, USBD_SHORT_TRANSFER_OK)
  TransferBufferLength = 00000040
  TransferBuffer       = 03771400
  TransferBufferMDL    = 0d8f4740
  UrbLink              = 00000000
  SetupPacket          =
    00000000: 40 01 05 00 00 00 40 00
[365795 ms] UsbSnoop - FilterDispatchAny(0dd57b90) : IRP_MJ_INTERNAL_DEVICE_CONTROL
[365795 ms] UsbSnoop - FdoHookDispatchInternalIoctl(0dd57f8c) : fdo=09b44040, Irp=0d8d3010, IRQL=0
[365795 ms]  >>>  URB 47 going down  >>> 
-- URB_FUNCTION_VENDOR_DEVICE:
  TransferFlags          = 00000002 (USBD_TRANSFER_DIRECTION_OUT, USBD_SHORT_TRANSFER_OK)
  TransferBufferLength = 00000040
  TransferBuffer       = 03771400
  TransferBufferMDL    = 00000000
    00000000: 05 ff 20 92 80 18 08 95 22 24 20 92 00 31 82 e0
    00000010: 80 93 80 18 08 95 83 e0 80 93 80 15 80 91 e7 02
    00000020: 83 30 19 f4 22 24 20 92 80 18 08 95 22 24 20 92
    00000030: 00 18 20 92 40 17 81 e0 80 93 80 18 08 95 0e 94
  UrbLink                 = 00000000
  RequestTypeReservedBits = 00000000
  Request                 = 00000001
  Value                   = 00000005
  Index                   = 00000000
[365795 ms] UsbSnoop - MyInternalIOCTLCompletion(0dd57ddc) : fido=00000000, Irp=0d8d3010, Context=0abca400, IRQL=2
[365795 ms]  <<<  URB 47 coming back  <<< 
-- URB_FUNCTION_CONTROL_TRANSFER:
  PipeHandle           = 0d937120
  TransferFlags        = 0000000a (USBD_TRANSFER_DIRECTION_OUT, USBD_SHORT_TRANSFER_OK)
  TransferBufferLength = 00000040
  TransferBuffer       = 03771400
  TransferBufferMDL    = 0d8f4740
  UrbLink              = 00000000
  SetupPacket          =
    00000000: 40 01 05 00 00 00 40 00
[365796 ms] UsbSnoop - FilterDispatchAny(0dd57b90) : IRP_MJ_INTERNAL_DEVICE_CONTROL
[365796 ms] UsbSnoop - FdoHookDispatchInternalIoctl(0dd57f8c) : fdo=09b44040, Irp=0d8d3010, IRQL=0
[365796 ms]  >>>  URB 48 going down  >>> 
-- URB_FUNCTION_VENDOR_DEVICE:
  TransferFlags          = 00000002 (USBD_TRANSFER_DIRECTION_OUT, USBD_SHORT_TRANSFER_OK)
  TransferBufferLength = 00000040
  TransferBuffer       = 03771400
  TransferBufferMDL    = 00000000
    00000000: 05 ff 7a 0e 4e e1 66 27 02 c0 00 00 63 95 64 17
    00000010: e0 f3 01 50 10 40 81 e0 90 e0 80 17 91 07 98 f3
    00000020: 0e 94 6b 0e 08 95 0e 94 7c 0e 40 2f 51 2f 05 c0
    00000030: 08 ee 13 e0 e5 df 41 50 50 40 40 30 45 07 c1 f7
  UrbLink                 = 00000000
  RequestTypeReservedBits = 00000000
  Request                 = 00000001
  Value                   = 00000005
  Index                   = 00000000
[365796 ms] UsbSnoop - MyInternalIOCTLCompletion(0dd57ddc) : fido=00000000, Irp=0d8d3010, Context=0abca400, IRQL=2
[365796 ms]  <<<  URB 48 coming back  <<< 
-- URB_FUNCTION_CONTROL_TRANSFER:
  PipeHandle           = 0d937120
  TransferFlags        = 0000000a (USBD_TRANSFER_DIRECTION_OUT, USBD_SHORT_TRANSFER_OK)
  TransferBufferLength = 00000040
  TransferBuffer       = 03771400
  TransferBufferMDL    = 0d8f4740
  UrbLink              = 00000000
  SetupPacket          =
    00000000: 40 01 05 00 00 00 40 00
[365796 ms] UsbSnoop - FilterDispatchAny(0dd57b90) : IRP_MJ_INTERNAL_DEVICE_CONTROL
[365796 ms] UsbSnoop - FdoHookDispatchInternalIoctl(0dd57f8c) : fdo=09b44040, Irp=0d8d3010, IRQL=0
[365796 ms]  >>>  URB 49 going down  >>> 
-- URB_FUNCTION_VENDOR_DEVICE:
  TransferFlags          = 00000002 (USBD_TRANSFER_DIRECTION_OUT, USBD_SHORT_TRANSFER_OK)
  TransferBufferLength = 00000040
  TransferBuffer       = 03771400
  TransferBufferMDL    = 00000000
    00000000: 05 ff 0e 94 7f 0e 08 95 0e 94 7c 0e 0e 80 00 20
    00000010: 19 f0 40 e8 51 e3 02 c0 40 e8 57 e1 e4 2f f5 2f
    00000020: 22 80 24 fe 0c c0 e4 2f f5 2f 22 80 33 24 27 fc
    00000030: 02 c0 26 fe f8 cf 22 24 e4 2f f5 2f 22 82 e4 2f
  UrbLink                 = 00000000
  RequestTypeReservedBits = 00000000
  Request                 = 00000001
  Value                   = 00000005
  Index                   = 00000000
[365796 ms] UsbSnoop - MyInternalIOCTLCompletion(0dd57ddc) : fido=00000000, Irp=0d8d3010, Context=0abca400, IRQL=2
[365796 ms]  <<<  URB 49 coming back  <<< 
-- URB_FUNCTION_CONTROL_TRANSFER:
  PipeHandle           = 0d937120
  TransferFlags        = 0000000a (USBD_TRANSFER_DIRECTION_OUT, USBD_SHORT_TRANSFER_OK)
  TransferBufferLength = 00000040
  TransferBuffer       = 03771400
  TransferBufferMDL    = 0d8f4740
  UrbLink              = 00000000
  SetupPacket          =
    00000000: 40 01 05 00 00 00 40 00
[365796 ms] UsbSnoop - FilterDispatchAny(0dd57b90) : IRP_MJ_INTERNAL_DEVICE_CONTROL
[365796 ms] UsbSnoop - FdoHookDispatchInternalIoctl(0dd57f8c) : fdo=09b44040, Irp=0d8d3010, IRQL=0
[365796 ms]  >>>  URB 50 going down  >>> 
-- URB_FUNCTION_VENDOR_DEVICE:
  TransferFlags          = 00000002 (USBD_TRANSFER_DIRECTION_OUT, USBD_SHORT_TRANSFER_OK)
  TransferBufferLength = 00000040
  TransferBuffer       = 03771400
  TransferBufferMDL    = 00000000
    00000000: 05 ff f5 2f 04 83 e4 2f f5 2f 0c 80 03 82 e4 2f
    00000010: f5 2f 0a 80 01 82 e4 2f f5 2f 20 83 e4 2f f5 2f
    00000020: 22 80 33 24 24 fe 04 c0 27 fc 02 c0 26 fe f6 cf
    00000030: e4 2f f5 2f 22 80 25 fe 06 c0 22 24 e4 2f f5 2f
  UrbLink                 = 00000000
  RequestTypeReservedBits = 00000000
  Request                 = 00000001
  Value                   = 00000005
  Index                   = 00000000
[365796 ms] UsbSnoop - MyInternalIOCTLCompletion(0dd57ddc) : fido=00000000, Irp=0d8d3010, Context=0abca400, IRQL=2
[365796 ms]  <<<  URB 50 coming back  <<< 
-- URB_FUNCTION_CONTROL_TRANSFER:
  PipeHandle           = 0d937120
  TransferFlags        = 0000000a (USBD_TRANSFER_DIRECTION_OUT, USBD_SHORT_TRANSFER_OK)
  TransferBufferLength = 00000040
  TransferBuffer       = 03771400
  TransferBufferMDL    = 0d8f4740
  UrbLink              = 00000000
  SetupPacket          =
    00000000: 40 01 05 00 00 00 40 00
[365796 ms] UsbSnoop - FilterDispatchAny(0dd57b90) : IRP_MJ_INTERNAL_DEVICE_CONTROL
[365796 ms] UsbSnoop - FdoHookDispatchInternalIoctl(0dd57f8c) : fdo=09b44040, Irp=0d8d3010, IRQL=0
[365796 ms]  >>>  URB 51 going down  >>> 
-- URB_FUNCTION_VENDOR_DEVICE:
  TransferFlags          = 00000002 (USBD_TRANSFER_DIRECTION_OUT, USBD_SHORT_TRANSFER_OK)
  TransferBufferLength = 00000040
  TransferBuffer       = 03771400
  TransferBufferMDL    = 00000000
    00000000: 05 ff 22 82 00 27 05 c0 22 24 e4 2f f5 2f 22 82
    00000010: 01 e0 0e 94 7f 0e 08 95 22 24 22 be 85 e0 83 bf
    00000020: 82 b7 8b 30 e8 f3 22 24 23 be 08 95 22 24 22 be
    00000030: 87 e0 83 bf 82 b7 84 34 e8 f3 22 24 23 be 08 95
  UrbLink                 = 00000000
  RequestTypeReservedBits = 00000000
  Request                 = 00000001
  Value                   = 00000005
  Index                   = 00000000
[365796 ms] UsbSnoop - MyInternalIOCTLCompletion(0dd57ddc) : fido=00000000, Irp=0d8d3010, Context=0abca400, IRQL=2
[365796 ms]  <<<  URB 51 coming back  <<< 
-- URB_FUNCTION_CONTROL_TRANSFER:
  PipeHandle           = 0d937120
  TransferFlags        = 0000000a (USBD_TRANSFER_DIRECTION_OUT, USBD_SHORT_TRANSFER_OK)
  TransferBufferLength = 00000040
  TransferBuffer       = 03771400
  TransferBufferMDL    = 0d8f4740
  UrbLink              = 00000000
  SetupPacket          =
    00000000: 40 01 05 00 00 00 40 00
[365796 ms] UsbSnoop - FilterDispatchAny(0dd57b90) : IRP_MJ_INTERNAL_DEVICE_CONTROL
[365797 ms] UsbSnoop - FdoHookDispatchInternalIoctl(0dd57f8c) : fdo=09b44040, Irp=07ed8930, IRQL=0
[365797 ms]  >>>  URB 52 going down  >>> 
-- URB_FUNCTION_VENDOR_DEVICE:
  TransferFlags          = 00000002 (USBD_TRANSFER_DIRECTION_OUT, USBD_SHORT_TRANSFER_OK)
  TransferBufferLength = 00000040
  TransferBuffer       = 03771400
  TransferBufferMDL    = 00000000
    00000000: 05 ff 05 c0 01 50 10 40 11 f4 00 27 03 c0 9d 9b
    00000010: f9 cf 01 e0 08 95 05 c0 01 50 10 40 11 f4 00 27
    00000020: 03 c0 9d 99 f9 cf 01 e0 08 95 22 24 20 92 70 00
    00000030: 06 c0 dd df 80 91 70 00 8f 5f 80 93 70 00 80 91
  UrbLink                 = 00000000
  RequestTypeReservedBits = 00000000
  Request                 = 00000001
  Value                   = 00000005
  Index                   = 00000000
[365797 ms] UsbSnoop - MyInternalIOCTLCompletion(0dd57ddc) : fido=00000000, Irp=07ed8930, Context=0abca400, IRQL=2
[365797 ms]  <<<  URB 52 coming back  <<< 
-- URB_FUNCTION_CONTROL_TRANSFER:
  PipeHandle           = 0d937120
  TransferFlags        = 0000000a (USBD_TRANSFER_DIRECTION_OUT, USBD_SHORT_TRANSFER_OK)
  TransferBufferLength = 00000040
  TransferBuffer       = 03771400
  TransferBufferMDL    = 0dbf8960
  UrbLink              = 00000000
  SetupPacket          =
    00000000: 40 01 05 00 00 00 40 00
[365797 ms] UsbSnoop - FilterDispatchAny(0dd57b90) : IRP_MJ_INTERNAL_DEVICE_CONTROL
[365797 ms] UsbSnoop - FdoHookDispatchInternalIoctl(0dd57f8c) : fdo=09b44040, Irp=07ed8930, IRQL=0
[365797 ms]  >>>  URB 53 going down  >>> 
-- URB_FUNCTION_VENDOR_DEVICE:
  TransferFlags          = 00000002 (USBD_TRANSFER_DIRECTION_OUT, USBD_SHORT_TRANSFER_OK)
  TransferBufferLength = 00000040
  TransferBuffer       = 03771400
  TransferBufferMDL    = 00000000
    00000000: 05 ff 70 00 8e 31 b0 f3 08 95 0e 94 7a 0e 44 27
    00000010: 9d 99 a7 c0 22 24 20 92 70 00 0a c0 bf df 9d 9b
    00000020: 02 c0 e4 df 9e c0 80 91 70 00 8f 5f 80 93 70 00
    00000030: 80 91 70 00 86 39 90 f3 00 e5 13 ec c3 df 00 23
  UrbLink                 = 00000000
  RequestTypeReservedBits = 00000000
  Request                 = 00000001
  Value                   = 00000005
  Index                   = 00000000
[365797 ms] UsbSnoop - MyInternalIOCTLCompletion(0dd57ddc) : fido=00000000, Irp=07ed8930, Context=0abca400, IRQL=2
[365797 ms]  <<<  URB 53 coming back  <<< 
-- URB_FUNCTION_CONTROL_TRANSFER:
  PipeHandle           = 0d937120
  TransferFlags        = 0000000a (USBD_TRANSFER_DIRECTION_OUT, USBD_SHORT_TRANSFER_OK)
  TransferBufferLength = 00000040
  TransferBuffer       = 03771400
  TransferBufferMDL    = 0d8f4740
  UrbLink              = 00000000
  SetupPacket          =
    00000000: 40 01 05 00 00 00 40 00
[365797 ms] UsbSnoop - FilterDispatchAny(0dd57b90) : IRP_MJ_INTERNAL_DEVICE_CONTROL
[365797 ms] UsbSnoop - FdoHookDispatchInternalIoctl(0dd57f8c) : fdo=09b44040, Irp=07ed8930, IRQL=0
[365797 ms]  >>>  URB 54 going down  >>> 
-- URB_FUNCTION_VENDOR_DEVICE:
  TransferFlags          = 00000002 (USBD_TRANSFER_DIRECTION_OUT, USBD_SHORT_TRANSFER_OK)
  TransferBufferLength = 00000040
  TransferBuffer       = 03771400
  TransferBufferMDL    = 00000000
    00000000: 05 ff 09 f4 8f c0 22 24 20 92 70 00 12 c0 a7 df
    00000010: 9d 99 0a c0 cc df 20 90 71 00 22 20 09 f0 82 c0
    00000020: 85 e0 80 93 c7 02 7e c0 80 91 70 00 8f 5f 80 93
    00000030: 70 00 80 91 70 00 8c 33 50 f3 81 e0 80 93 71 00
  UrbLink                 = 00000000
  RequestTypeReservedBits = 00000000
  Request                 = 00000001
  Value                   = 00000005
  Index                   = 00000000
[365797 ms] UsbSnoop - MyInternalIOCTLCompletion(0dd57ddc) : fido=00000000, Irp=07ed8930, Context=0abca400, IRQL=2
[365797 ms]  <<<  URB 54 coming back  <<< 
-- URB_FUNCTION_CONTROL_TRANSFER:
  PipeHandle           = 0d937120
  TransferFlags        = 0000000a (USBD_TRANSFER_DIRECTION_OUT, USBD_SHORT_TRANSFER_OK)
  TransferBufferLength = 00000040
  TransferBuffer       = 03771400
  TransferBufferMDL    = 0d8f4740
  UrbLink              = 00000000
  SetupPacket          =
    00000000: 40 01 05 00 00 00 40 00
[365797 ms] UsbSnoop - FilterDispatchAny(0dd57b90) : IRP_MJ_INTERNAL_DEVICE_CONTROL
[365797 ms] UsbSnoop - FdoHookDispatchInternalIoctl(0dd57f8c) : fdo=09b44040, Irp=07ed8930, IRQL=0
[365797 ms]  >>>  URB 55 going down  >>> 
-- URB_FUNCTION_VENDOR_DEVICE:
  TransferFlags          = 00000002 (USBD_TRANSFER_DIRECTION_OUT, USBD_SHORT_TRANSFER_OK)
  TransferBufferLength = 00000040
  TransferBuffer       = 03771400
  TransferBufferMDL    = 00000000
    00000000: 05 ff 00 e5 13 ec aa df 00 23 09 f4 6c c0 22 24
    00000010: 20 92 70 00 5c c0 44 23 11 f0 41 30 31 f4 00 e5
    00000020: 13 ec 92 df 00 23 09 f4 5e c0 44 27 66 27 0b c0
    00000030: 77 df 9d 99 04 c0 44 23 29 f4 41 e0 03 c0 41 30
  UrbLink                 = 00000000
  RequestTypeReservedBits = 00000000
  Request                 = 00000001
  Value                   = 00000005
  Index                   = 00000000
[365797 ms] UsbSnoop - MyInternalIOCTLCompletion(0dd57ddc) : fido=00000000, Irp=07ed8930, Context=0abca400, IRQL=2
[365797 ms]  <<<  URB 55 coming back  <<< 
-- URB_FUNCTION_CONTROL_TRANSFER:
  PipeHandle           = 0d937120
  TransferFlags        = 0000000a (USBD_TRANSFER_DIRECTION_OUT, USBD_SHORT_TRANSFER_OK)
  TransferBufferLength = 00000040
  TransferBuffer       = 03771400
  TransferBufferMDL    = 0d8f4740
  UrbLink              = 00000000
  SetupPacket          =
    00000000: 40 01 05 00 00 00 40 00
[365797 ms] UsbSnoop - FilterDispatchAny(0dd57b90) : IRP_MJ_INTERNAL_DEVICE_CONTROL
[365797 ms] UsbSnoop - FdoHookDispatchInternalIoctl(0dd57f8c) : fdo=09b44040, Irp=07ed8930, IRQL=0
[365798 ms]  >>>  URB 56 going down  >>> 
-- URB_FUNCTION_VENDOR_DEVICE:
  TransferFlags          = 00000002 (USBD_TRANSFER_DIRECTION_OUT, USBD_SHORT_TRANSFER_OK)
  TransferBufferLength = 00000040
  TransferBuffer       = 03771400
  TransferBufferMDL    = 00000000
    00000000: 05 ff 09 f4 42 e0 63 95 62 31 98 f3 44 23 e1 f0
    00000010: 81 e0 84 17 10 f4 8d df 47 c0 28 e0 30 e0 00 91
    00000020: 70 00 11 27 08 5f 1f 4f 0e 94 35 0e 85 e0 90 e0
    00000030: 80 1b 91 0b e7 ec f2 e0 8e 0f 9f 1f e8 2f f9 2f
  UrbLink                 = 00000000
  RequestTypeReservedBits = 00000000
  Request                 = 00000001
  Value                   = 00000005
  Index                   = 00000000
[365798 ms] UsbSnoop - MyInternalIOCTLCompletion(0dd57ddc) : fido=00000000, Irp=07ed8930, Context=0abca400, IRQL=2
[365798 ms]  <<<  URB 56 coming back  <<< 
-- URB_FUNCTION_CONTROL_TRANSFER:
  PipeHandle           = 0d937120
  TransferFlags        = 0000000a (USBD_TRANSFER_DIRECTION_OUT, USBD_SHORT_TRANSFER_OK)
  TransferBufferLength = 00000040
  TransferBuffer       = 03771400
  TransferBufferMDL    = 0d8f4740
  UrbLink              = 00000000
  SetupPacket          =
    00000000: 40 01 05 00 00 00 40 00
[365798 ms] UsbSnoop - FilterDispatchAny(0dd57b90) : IRP_MJ_INTERNAL_DEVICE_CONTROL
[365798 ms] UsbSnoop - FdoHookDispatchInternalIoctl(0dd57f8c) : fdo=09b44040, Irp=07ed8930, IRQL=0
[365798 ms]  >>>  URB 57 going down  >>> 
-- URB_FUNCTION_VENDOR_DEVICE:
  TransferFlags          = 00000002 (USBD_TRANSFER_DIRECTION_OUT, USBD_SHORT_TRANSFER_OK)
  TransferBufferLength = 00000040
  TransferBuffer       = 03771400
  TransferBufferMDL    = 00000000
    00000000: 05 ff 40 80 46 94 40 82 17 c0 28 e0 30 e0 00 91
    00000010: 70 00 11 27 08 5f 1f 4f 0e 94 35 0e 85 e0 90 e0
    00000020: 80 1b 91 0b e7 ec f2 e0 8e 0f 9f 1f e8 2f f9 2f
    00000030: 80 81 86 95 80 68 80 83 44 23 31 f4 00 e5 13 ec
  UrbLink                 = 00000000
  RequestTypeReservedBits = 00000000
  Request                 = 00000001
  Value                   = 00000005
  Index                   = 00000000
[365798 ms] UsbSnoop - MyInternalIOCTLCompletion(0dd57ddc) : fido=00000000, Irp=07ed8930, Context=0abca400, IRQL=2
[365798 ms]  <<<  URB 57 coming back  <<< 
-- URB_FUNCTION_CONTROL_TRANSFER:
  PipeHandle           = 0d937120
  TransferFlags        = 0000000a (USBD_TRANSFER_DIRECTION_OUT, USBD_SHORT_TRANSFER_OK)
  TransferBufferLength = 00000040
  TransferBuffer       = 03771400
  TransferBufferMDL    = 0d8f4740
  UrbLink              = 00000000
  SetupPacket          =
    00000000: 40 01 05 00 00 00 40 00
[365798 ms] UsbSnoop - FilterDispatchAny(0dd57b90) : IRP_MJ_INTERNAL_DEVICE_CONTROL
[365798 ms] UsbSnoop - FdoHookDispatchInternalIoctl(0dd57f8c) : fdo=09b44040, Irp=07ed8930, IRQL=0
[365798 ms]  >>>  URB 58 going down  >>> 
-- URB_FUNCTION_VENDOR_DEVICE:
  TransferFlags          = 00000002 (USBD_TRANSFER_DIRECTION_OUT, USBD_SHORT_TRANSFER_OK)
  TransferBufferLength = 00000040
  TransferBuffer       = 03771400
  TransferBufferMDL    = 00000000
    00000000: 05 ff 4f df 00 23 09 f4 11 c0 80 91 70 00 8f 5f
    00000010: 80 93 70 00 80 91 70 00 80 32 08 f4 9f cf 22 24
    00000020: 20 92 71 00 85 e0 80 93 c7 02 45 df 0e 94 6b 0e
    00000030: 08 95 a5 98 08 95 09 b9 88 e1 8a b9 08 95 5f 9b
  UrbLink                 = 00000000
  RequestTypeReservedBits = 00000000
  Request                 = 00000001
  Value                   = 00000005
  Index                   = 00000000
[365798 ms] UsbSnoop - MyInternalIOCTLCompletion(0dd57ddc) : fido=00000000, Irp=07ed8930, Context=0abca400, IRQL=2
[365798 ms]  <<<  URB 58 coming back  <<< 
-- URB_FUNCTION_CONTROL_TRANSFER:
  PipeHandle           = 0d937120
  TransferFlags        = 0000000a (USBD_TRANSFER_DIRECTION_OUT, USBD_SHORT_TRANSFER_OK)
  TransferBufferLength = 00000040
  TransferBuffer       = 03771400
  TransferBufferMDL    = 0d8f4740
  UrbLink              = 00000000
  SetupPacket          =
    00000000: 40 01 05 00 00 00 40 00
[365798 ms] UsbSnoop - FilterDispatchAny(0dd57b90) : IRP_MJ_INTERNAL_DEVICE_CONTROL
[365798 ms] UsbSnoop - FdoHookDispatchInternalIoctl(0dd57f8c) : fdo=09b44040, Irp=07ed8930, IRQL=0
[365798 ms]  >>>  URB 59 going down  >>> 
-- URB_FUNCTION_VENDOR_DEVICE:
  TransferFlags          = 00000002 (USBD_TRANSFER_DIRECTION_OUT, USBD_SHORT_TRANSFER_OK)
  TransferBufferLength = 00000040
  TransferBuffer       = 03771400
  TransferBufferMDL    = 00000000
    00000000: 05 ff fe cf 0c b1 08 95 5d 9b fe cf 0c b9 08 95
    00000010: 2a 92 8a 93 2f b6 2a 92 80 91 03 15 81 30 b1 f4
    00000020: 20 90 02 15 24 fe 29 c0 20 90 e9 02 22 20 29 f4
    00000030: 80 91 1c 15 8f 77 80 93 1c 15 81 e0 80 93 e0 02
  UrbLink                 = 00000000
  RequestTypeReservedBits = 00000000
  Request                 = 00000001
  Value                   = 00000005
  Index                   = 00000000
[365798 ms] UsbSnoop - MyInternalIOCTLCompletion(0dd57ddc) : fido=00000000, Irp=07ed8930, Context=0abca400, IRQL=2
[365798 ms]  <<<  URB 59 coming back  <<< 
-- URB_FUNCTION_CONTROL_TRANSFER:
  PipeHandle           = 0d937120
  TransferFlags        = 0000000a (USBD_TRANSFER_DIRECTION_OUT, USBD_SHORT_TRANSFER_OK)
  TransferBufferLength = 00000040
  TransferBuffer       = 03771400
  TransferBufferMDL    = 0d8f4740
  UrbLink              = 00000000
  SetupPacket          =
    00000000: 40 01 05 00 00 00 40 00
[365798 ms] UsbSnoop - FilterDispatchAny(0dd57b90) : IRP_MJ_INTERNAL_DEVICE_CONTROL
[365799 ms] UsbSnoop - FdoHookDispatchInternalIoctl(0dd57f8c) : fdo=09b44040, Irp=07ed8930, IRQL=0
[365799 ms]  >>>  URB 60 going down  >>> 
-- URB_FUNCTION_VENDOR_DEVICE:
  TransferFlags          = 00000002 (USBD_TRANSFER_DIRECTION_OUT, USBD_SHORT_TRANSFER_OK)
  TransferBufferLength = 00000040
  TransferBuffer       = 03771400
  TransferBufferMDL    = 00000000
    00000000: 05 ff 80 91 02 15 8f 7e 80 93 02 15 17 c0 80 91
    00000010: 03 15 81 38 21 f4 81 e0 80 93 e1 02 0f c0 80 91
    00000020: 03 15 80 38 21 f4 81 e0 80 93 e5 02 07 c0 80 91
    00000030: 03 15 85 38 19 f4 81 e0 80 93 e8 02 29 90 2f be
  UrbLink                 = 00000000
  RequestTypeReservedBits = 00000000
  Request                 = 00000001
  Value                   = 00000005
  Index                   = 00000000
[365799 ms] UsbSnoop - MyInternalIOCTLCompletion(0dd57ddc) : fido=00000000, Irp=07ed8930, Context=0abca400, IRQL=2
[365799 ms]  <<<  URB 60 coming back  <<< 
-- URB_FUNCTION_CONTROL_TRANSFER:
  PipeHandle           = 0d937120
  TransferFlags        = 0000000a (USBD_TRANSFER_DIRECTION_OUT, USBD_SHORT_TRANSFER_OK)
  TransferBufferLength = 00000040
  TransferBuffer       = 03771400
  TransferBufferMDL    = 0d8f4740
  UrbLink              = 00000000
  SetupPacket          =
    00000000: 40 01 05 00 00 00 40 00
[365799 ms] UsbSnoop - FilterDispatchAny(0dd57b90) : IRP_MJ_INTERNAL_DEVICE_CONTROL
[365799 ms] UsbSnoop - FdoHookDispatchInternalIoctl(0dd57f8c) : fdo=09b44040, Irp=07ed8930, IRQL=0
[365799 ms]  >>>  URB 61 going down  >>> 
-- URB_FUNCTION_VENDOR_DEVICE:
  TransferFlags          = 00000002 (USBD_TRANSFER_DIRECTION_OUT, USBD_SHORT_TRANSFER_OK)
  TransferBufferLength = 00000040
  TransferBuffer       = 03771400
  TransferBufferMDL    = 00000000
    00000000: 05 ff 89 91 29 90 18 95 82 e0 80 93 f2 02 22 24
    00000010: 20 92 73 00 83 e0 80 93 74 00 80 93 75 00 80 93
    00000020: 76 00 80 93 77 00 80 93 78 00 20 92 e9 02 08 95
    00000030: 20 90 01 15 21 fe 0e c0 81 e0 80 93 e4 02 80 e0
  UrbLink                 = 00000000
  RequestTypeReservedBits = 00000000
  Request                 = 00000001
  Value                   = 00000005
  Index                   = 00000000
[365799 ms] UsbSnoop - MyInternalIOCTLCompletion(0dd57ddc) : fido=00000000, Irp=07ed8930, Context=0abca400, IRQL=2
[365799 ms]  <<<  URB 61 coming back  <<< 
-- URB_FUNCTION_CONTROL_TRANSFER:
  PipeHandle           = 0d937120
  TransferFlags        = 0000000a (USBD_TRANSFER_DIRECTION_OUT, USBD_SHORT_TRANSFER_OK)
  TransferBufferLength = 00000040
  TransferBuffer       = 03771400
  TransferBufferMDL    = 0d8f4740
  UrbLink              = 00000000
  SetupPacket          =
    00000000: 40 01 05 00 00 00 40 00
[365799 ms] UsbSnoop - FilterDispatchAny(0dd57b90) : IRP_MJ_INTERNAL_DEVICE_CONTROL
[365799 ms] UsbSnoop - FdoHookDispatchInternalIoctl(0dd57f8c) : fdo=09b44040, Irp=07ed8930, IRQL=0
[365799 ms]  >>>  URB 62 going down  >>> 
-- URB_FUNCTION_VENDOR_DEVICE:
  TransferFlags          = 00000002 (USBD_TRANSFER_DIRECTION_OUT, USBD_SHORT_TRANSFER_OK)
  TransferBufferLength = 00000040
  TransferBuffer       = 03771400
  TransferBufferMDL    = 00000000
    00000000: 05 ff 94 e0 90 93 24 15 80 93 23 15 90 93 34 15
    00000010: 80 93 33 15 0d c0 22 24 20 92 e4 02 8f ef 93 e0
    00000020: 90 93 24 15 80 93 23 15 90 93 34 15 80 93 33 15
    00000030: 08 95 0b d0 80 91 80 30 80 61 80 93 80 30 80 91
  UrbLink                 = 00000000
  RequestTypeReservedBits = 00000000
  Request                 = 00000001
  Value                   = 00000005
  Index                   = 00000000
[365799 ms] UsbSnoop - MyInternalIOCTLCompletion(0dd57ddc) : fido=00000000, Irp=07ed8930, Context=0abca400, IRQL=2
[365799 ms]  <<<  URB 62 coming back  <<< 
-- URB_FUNCTION_CONTROL_TRANSFER:
  PipeHandle           = 0d937120
  TransferFlags        = 0000000a (USBD_TRANSFER_DIRECTION_OUT, USBD_SHORT_TRANSFER_OK)
  TransferBufferLength = 00000040
  TransferBuffer       = 03771400
  TransferBufferMDL    = 0d8f4740
  UrbLink              = 00000000
  SetupPacket          =
    00000000: 40 01 05 00 00 00 40 00
[365799 ms] UsbSnoop - FilterDispatchAny(0dd57b90) : IRP_MJ_INTERNAL_DEVICE_CONTROL
[365799 ms] UsbSnoop - FdoHookDispatchInternalIoctl(0dd57f8c) : fdo=09b44040, Irp=07ed8930, IRQL=0
[365799 ms]  >>>  URB 63 going down  >>> 
-- URB_FUNCTION_VENDOR_DEVICE:
  TransferFlags          = 00000002 (USBD_TRANSFER_DIRECTION_OUT, USBD_SHORT_TRANSFER_OK)
  TransferBufferLength = 00000040
  TransferBuffer       = 03771400
  TransferBufferMDL    = 00000000
    00000000: 05 ff 00 15 84 60 80 93 00 15 08 95 a0 9a a8 98
    00000010: 08 95 0e 94 78 0e 66 27 77 27 80 e4 90 e2 90 93
    00000020: 1e 15 80 93 1d 15 20 90 73 00 22 20 09 f0 69 c0
    00000030: 20 90 18 15 27 fe 65 c0 28 ed 32 e0 08 e0 10 e0
  UrbLink                 = 00000000
  RequestTypeReservedBits = 00000000
  Request                 = 00000001
  Value                   = 00000005
  Index                   = 00000000
[365799 ms] UsbSnoop - MyInternalIOCTLCompletion(0dd57ddc) : fido=00000000, Irp=07ed8930, Context=0abca400, IRQL=2
[365799 ms]  <<<  URB 63 coming back  <<< 
-- URB_FUNCTION_CONTROL_TRANSFER:
  PipeHandle           = 0d937120
  TransferFlags        = 0000000a (USBD_TRANSFER_DIRECTION_OUT, USBD_SHORT_TRANSFER_OK)
  TransferBufferLength = 00000040
  TransferBuffer       = 03771400
  TransferBufferMDL    = 0d8f4740
  UrbLink              = 00000000
  SetupPacket          =
    00000000: 40 01 05 00 00 00 40 00
[365799 ms] UsbSnoop - FilterDispatchAny(0dd57b90) : IRP_MJ_INTERNAL_DEVICE_CONTROL
[365800 ms] UsbSnoop - FdoHookDispatchInternalIoctl(0dd57f8c) : fdo=09b44040, Irp=07ed8930, IRQL=0
[365800 ms]  >>>  URB 64 going down  >>> 
-- URB_FUNCTION_VENDOR_DEVICE:
  TransferFlags          = 00000002 (USBD_TRANSFER_DIRECTION_OUT, USBD_SHORT_TRANSFER_OK)
  TransferBufferLength = 00000040
  TransferBuffer       = 03771400
  TransferBufferMDL    = 00000000
    00000000: 05 ff 84 d1 80 91 18 15 8f 77 80 93 18 15 80 91
    00000010: e9 02 81 30 29 f4 80 91 1c 15 8f 77 80 93 1c 15
    00000020: 80 91 d8 02 80 76 80 34 51 f4 20 90 d8 02 27 fe
    00000030: 03 c0 0e 94 ef 00 46 c0 0e 94 e1 01 43 c0 40 91
  UrbLink                 = 00000000
  RequestTypeReservedBits = 00000000
  Request                 = 00000001
  Value                   = 00000005
  Index                   = 00000000
[365800 ms] UsbSnoop - MyInternalIOCTLCompletion(0dd57ddc) : fido=00000000, Irp=07ed8930, Context=0abca400, IRQL=2
[365800 ms]  <<<  URB 64 coming back  <<< 
-- URB_FUNCTION_CONTROL_TRANSFER:
  PipeHandle           = 0d937120
  TransferFlags        = 0000000a (USBD_TRANSFER_DIRECTION_OUT, USBD_SHORT_TRANSFER_OK)
  TransferBufferLength = 00000040
  TransferBuffer       = 03771400
  TransferBufferMDL    = 0d8f4740
  UrbLink              = 00000000
  SetupPacket          =
    00000000: 40 01 05 00 00 00 40 00
[365800 ms] UsbSnoop - FilterDispatchAny(0dd57b90) : IRP_MJ_INTERNAL_DEVICE_CONTROL
[365800 ms] UsbSnoop - FdoHookDispatchInternalIoctl(0dd57f8c) : fdo=09b44040, Irp=07ed8930, IRQL=0
[365800 ms]  >>>  URB 65 going down  >>> 
-- URB_FUNCTION_VENDOR_DEVICE:
  TransferFlags          = 00000002 (USBD_TRANSFER_DIRECTION_OUT, USBD_SHORT_TRANSFER_OK)
  TransferBufferLength = 00000040
  TransferBuffer       = 03771400
  TransferBufferMDL    = 00000000
    00000000: 05 ff d9 02 55 27 40 30 45 07 09 f1 41 30 e0 e0
    00000010: 5e 07 01 f1 43 30 e0 e0 5e 07 f9 f0 45 30 e0 e0
    00000020: 5e 07 f1 f0 46 30 e0 e0 5e 07 e9 f0 48 30 e0 e0
    00000030: 5e 07 e1 f0 49 30 e0 e0 5e 07 d9 f0 4a 30 e0 e0
  UrbLink                 = 00000000
  RequestTypeReservedBits = 00000000
  Request                 = 00000001
  Value                   = 00000005
  Index                   = 00000000
[365800 ms] UsbSnoop - MyInternalIOCTLCompletion(0dd57ddc) : fido=00000000, Irp=07ed8930, Context=0abca400, IRQL=2
[365800 ms]  <<<  URB 65 coming back  <<< 
-- URB_FUNCTION_CONTROL_TRANSFER:
  PipeHandle           = 0d937120
  TransferFlags        = 0000000a (USBD_TRANSFER_DIRECTION_OUT, USBD_SHORT_TRANSFER_OK)
  TransferBufferLength = 00000040
  TransferBuffer       = 03771400
  TransferBufferMDL    = 0dbf8960
  UrbLink              = 00000000
  SetupPacket          =
    00000000: 40 01 05 00 00 00 40 00
[365800 ms] UsbSnoop - FilterDispatchAny(0dd57b90) : IRP_MJ_INTERNAL_DEVICE_CONTROL
[365800 ms] UsbSnoop - FdoHookDispatchInternalIoctl(0dd57f8c) : fdo=09b44040, Irp=07ed8930, IRQL=0
[365800 ms]  >>>  URB 66 going down  >>> 
-- URB_FUNCTION_VENDOR_DEVICE:
  TransferFlags          = 00000002 (USBD_TRANSFER_DIRECTION_OUT, USBD_SHORT_TRANSFER_OK)
  TransferBufferLength = 00000040
  TransferBuffer       = 03771400
  TransferBufferMDL    = 00000000
    00000000: 05 ff 5e 07 d1 f0 4b 30 e0 e0 5e 07 c9 f0 1b c0
    00000010: 0e 94 7f 09 19 c0 0e 94 62 0a 16 c0 0e 94 d1 0a
    00000020: 13 c0 0e 94 4d 0b 10 c0 0e 94 8b 0b 0d c0 0e 94
    00000030: e7 0c 0a c0 0e 94 31 0d 07 c0 0e 94 9e 0d 04 c0
  UrbLink                 = 00000000
  RequestTypeReservedBits = 00000000
  Request                 = 00000001
  Value                   = 00000005
  Index                   = 00000000
[365800 ms] UsbSnoop - MyInternalIOCTLCompletion(0dd57ddc) : fido=00000000, Irp=07ed8930, Context=0abca400, IRQL=2
[365800 ms]  <<<  URB 66 coming back  <<< 
-- URB_FUNCTION_CONTROL_TRANSFER:
  PipeHandle           = 0d937120
  TransferFlags        = 0000000a (USBD_TRANSFER_DIRECTION_OUT, USBD_SHORT_TRANSFER_OK)
  TransferBufferLength = 00000040
  TransferBuffer       = 03771400
  TransferBufferMDL    = 0d8f4740
  UrbLink              = 00000000
  SetupPacket          =
    00000000: 40 01 05 00 00 00 40 00
[365800 ms] UsbSnoop - FilterDispatchAny(0dd57b90) : IRP_MJ_INTERNAL_DEVICE_CONTROL
[365800 ms] UsbSnoop - FdoHookDispatchInternalIoctl(0dd57f8c) : fdo=09b44040, Irp=07ed8930, IRQL=0
[365800 ms]  >>>  URB 67 going down  >>> 
-- URB_FUNCTION_VENDOR_DEVICE:
  TransferFlags          = 00000002 (USBD_TRANSFER_DIRECTION_OUT, USBD_SHORT_TRANSFER_OK)
  TransferBufferLength = 00000040
  TransferBuffer       = 03771400
  TransferBufferMDL    = 00000000
    00000000: 05 ff 0e 94 ef 0d 01 c0 a4 d1 80 91 73 00 85 30
    00000010: 59 f4 20 90 1c 15 27 fc fc cf 20 90 da 02 20 92
    00000020: 04 15 22 24 20 92 73 00 80 91 73 00 84 30 19 f4
    00000030: 22 24 20 92 73 00 80 91 73 00 81 30 09 f0 87 c0
  UrbLink                 = 00000000
  RequestTypeReservedBits = 00000000
  Request                 = 00000001
  Value                   = 00000005
  Index                   = 00000000
[365800 ms] UsbSnoop - MyInternalIOCTLCompletion(0dd57ddc) : fido=00000000, Irp=07ed8930, Context=0abca400, IRQL=2
[365800 ms]  <<<  URB 67 coming back  <<< 
-- URB_FUNCTION_CONTROL_TRANSFER:
  PipeHandle           = 0d937120
  TransferFlags        = 0000000a (USBD_TRANSFER_DIRECTION_OUT, USBD_SHORT_TRANSFER_OK)
  TransferBufferLength = 00000040
  TransferBuffer       = 03771400
  TransferBufferMDL    = 0d8f4740
  UrbLink              = 00000000
  SetupPacket          =
    00000000: 40 01 05 00 00 00 40 00
[365801 ms] UsbSnoop - FilterDispatchAny(0dd57b90) : IRP_MJ_INTERNAL_DEVICE_CONTROL
[365801 ms] UsbSnoop - FdoHookDispatchInternalIoctl(0dd57f8c) : fdo=09b44040, Irp=07ed8930, IRQL=0
[365801 ms]  >>>  URB 68 going down  >>> 
-- URB_FUNCTION_VENDOR_DEVICE:
  TransferFlags          = 00000002 (USBD_TRANSFER_DIRECTION_OUT, USBD_SHORT_TRANSFER_OK)
  TransferBufferLength = 00000040
  TransferBuffer       = 03771400
  TransferBufferMDL    = 00000000
    00000000: 05 ff 20 90 de 02 30 90 df 02 40 90 f0 02 50 90
    00000010: f1 02 42 14 53 04 18 f4 a4 2c b5 2c 04 c0 a0 90
    00000020: de 02 b0 90 df 02 4a 2d 5b 2d 20 90 1c 15 27 fc
    00000030: fc cf 80 91 f0 02 90 91 f1 02 80 34 e0 e0 9e 07
  UrbLink                 = 00000000
  RequestTypeReservedBits = 00000000
  Request                 = 00000001
  Value                   = 00000005
  Index                   = 00000000
[365801 ms] UsbSnoop - MyInternalIOCTLCompletion(0dd57ddc) : fido=00000000, Irp=07ed8930, Context=0abca400, IRQL=2
[365801 ms]  <<<  URB 68 coming back  <<< 
-- URB_FUNCTION_CONTROL_TRANSFER:
  PipeHandle           = 0d937120
  TransferFlags        = 0000000a (USBD_TRANSFER_DIRECTION_OUT, USBD_SHORT_TRANSFER_OK)
  TransferBufferLength = 00000040
  TransferBuffer       = 03771400
  TransferBufferMDL    = 0d8f4740
  UrbLink              = 00000000
  SetupPacket          =
    00000000: 40 01 05 00 00 00 40 00
[365801 ms] UsbSnoop - FilterDispatchAny(0dd57b90) : IRP_MJ_INTERNAL_DEVICE_CONTROL
[365801 ms] UsbSnoop - FdoHookDispatchInternalIoctl(0dd57f8c) : fdo=09b44040, Irp=07ed8930, IRQL=0
[365801 ms]  >>>  URB 69 going down  >>> 
-- URB_FUNCTION_VENDOR_DEVICE:
  TransferFlags          = 00000002 (USBD_TRANSFER_DIRECTION_OUT, USBD_SHORT_TRANSFER_OK)
  TransferBufferLength = 00000040
  TransferBuffer       = 03771400
  TransferBufferMDL    = 00000000
    00000000: 05 ff 78 f1 80 91 e6 02 81 30 61 f4 86 2f 97 2f
    00000010: 80 5c 9f 4d 90 93 1e 15 80 93 1d 15 80 e4 80 93
    00000020: 1b 15 03 c0 00 e4 10 e0 f0 d0 80 91 f0 02 90 91
    00000030: f1 02 80 54 90 40 90 93 f1 02 80 93 f0 02 80 91
  UrbLink                 = 00000000
  RequestTypeReservedBits = 00000000
  Request                 = 00000001
  Value                   = 00000005
  Index                   = 00000000
[365801 ms] UsbSnoop - MyInternalIOCTLCompletion(0dd57ddc) : fido=00000000, Irp=07ed8930, Context=0abca400, IRQL=2
[365801 ms]  <<<  URB 69 coming back  <<< 
-- URB_FUNCTION_CONTROL_TRANSFER:
  PipeHandle           = 0d937120
  TransferFlags        = 0000000a (USBD_TRANSFER_DIRECTION_OUT, USBD_SHORT_TRANSFER_OK)
  TransferBufferLength = 00000040
  TransferBuffer       = 03771400
  TransferBufferMDL    = 0d8f4740
  UrbLink              = 00000000
  SetupPacket          =
    00000000: 40 01 05 00 00 00 40 00
[365801 ms] UsbSnoop - FilterDispatchAny(0dd57b90) : IRP_MJ_INTERNAL_DEVICE_CONTROL
[365801 ms] UsbSnoop - FdoHookDispatchInternalIoctl(0dd57f8c) : fdo=09b44040, Irp=07ed8930, IRQL=0
[365801 ms]  >>>  URB 70 going down  >>> 
-- URB_FUNCTION_VENDOR_DEVICE:
  TransferFlags          = 00000002 (USBD_TRANSFER_DIRECTION_OUT, USBD_SHORT_TRANSFER_OK)
  TransferBufferLength = 00000040
  TransferBuffer       = 03771400
  TransferBufferMDL    = 00000000
    00000000: 05 ff ee 02 90 91 ef 02 80 5c 9f 4f 90 93 ef 02
    00000010: 80 93 ee 02 60 5c 7f 4f 80 91 1c 15 80 68 80 93
    00000020: 1c 15 2b c0 80 91 e6 02 81 30 79 f4 86 2f 97 2f
    00000030: 80 5c 9f 4d 90 93 1e 15 80 93 1d 15 20 90 f0 02
  UrbLink                 = 00000000
  RequestTypeReservedBits = 00000000
  Request                 = 00000001
  Value                   = 00000005
  Index                   = 00000000
[365801 ms] UsbSnoop - MyInternalIOCTLCompletion(0dd57ddc) : fido=00000000, Irp=07ed8930, Context=0abca400, IRQL=2
[365801 ms]  <<<  URB 70 coming back  <<< 
-- URB_FUNCTION_CONTROL_TRANSFER:
  PipeHandle           = 0d937120
  TransferFlags        = 0000000a (USBD_TRANSFER_DIRECTION_OUT, USBD_SHORT_TRANSFER_OK)
  TransferBufferLength = 00000040
  TransferBuffer       = 03771400
  TransferBufferMDL    = 0d8f4740
  UrbLink              = 00000000
  SetupPacket          =
    00000000: 40 01 05 00 00 00 40 00
[365801 ms] UsbSnoop - FilterDispatchAny(0dd57b90) : IRP_MJ_INTERNAL_DEVICE_CONTROL
[365801 ms] UsbSnoop - FdoHookDispatchInternalIoctl(0dd57f8c) : fdo=09b44040, Irp=07ed8930, IRQL=0
[365801 ms]  >>>  URB 71 going down  >>> 
-- URB_FUNCTION_VENDOR_DEVICE:
  TransferFlags          = 00000002 (USBD_TRANSFER_DIRECTION_OUT, USBD_SHORT_TRANSFER_OK)
  TransferBufferLength = 00000040
  TransferBuffer       = 03771400
  TransferBufferMDL    = 00000000
    00000000: 05 ff 30 90 f1 02 20 92 1b 15 05 c0 00 91 f0 02
    00000010: 10 91 f1 02 bc d0 20 90 f0 02 30 90 f1 02 40 90
    00000020: ee 02 50 90 ef 02 42 0c 53 1c 50 92 ef 02 40 92
    00000030: ee 02 80 91 1c 15 80 68 80 93 1c 15 20 90 ee 02
  UrbLink                 = 00000000
  RequestTypeReservedBits = 00000000
  Request                 = 00000001
  Value                   = 00000005
  Index                   = 00000000
[365801 ms] UsbSnoop - MyInternalIOCTLCompletion(0dd57ddc) : fido=00000000, Irp=07ed8930, Context=0abca400, IRQL=2
[365801 ms]  <<<  URB 71 coming back  <<< 
-- URB_FUNCTION_CONTROL_TRANSFER:
  PipeHandle           = 0d937120
  TransferFlags        = 0000000a (USBD_TRANSFER_DIRECTION_OUT, USBD_SHORT_TRANSFER_OK)
  TransferBufferLength = 00000040
  TransferBuffer       = 03771400
  TransferBufferMDL    = 0d8f4740
  UrbLink              = 00000000
  SetupPacket          =
    00000000: 40 01 05 00 00 00 40 00
[365801 ms] UsbSnoop - FilterDispatchAny(0dd57b90) : IRP_MJ_INTERNAL_DEVICE_CONTROL
[365802 ms] UsbSnoop - FdoHookDispatchInternalIoctl(0dd57f8c) : fdo=09b44040, Irp=07ed8930, IRQL=0
[365802 ms]  >>>  URB 72 going down  >>> 
-- URB_FUNCTION_VENDOR_DEVICE:
  TransferFlags          = 00000002 (USBD_TRANSFER_DIRECTION_OUT, USBD_SHORT_TRANSFER_OK)
  TransferBufferLength = 00000040
  TransferBuffer       = 03771400
  TransferBufferMDL    = 00000000
    00000000: 05 ff 30 90 ef 02 24 16 35 06 08 f4 92 cf 22 24
    00000010: 20 92 73 00 20 92 e6 02 80 91 73 00 82 30 09 f0
    00000020: 7a c0 20 90 de 02 30 90 df 02 40 90 f0 02 50 90
    00000030: f1 02 42 14 53 04 18 f4 64 2d 75 2d 04 c0 60 91
  UrbLink                 = 00000000
  RequestTypeReservedBits = 00000000
  Request                 = 00000001
  Value                   = 00000005
  Index                   = 00000000
[365802 ms] UsbSnoop - MyInternalIOCTLCompletion(0dd57ddc) : fido=00000000, Irp=07ed8930, Context=0abca400, IRQL=2
[365802 ms]  <<<  URB 72 coming back  <<< 
-- URB_FUNCTION_CONTROL_TRANSFER:
  PipeHandle           = 0d937120
  TransferFlags        = 0000000a (USBD_TRANSFER_DIRECTION_OUT, USBD_SHORT_TRANSFER_OK)
  TransferBufferLength = 00000040
  TransferBuffer       = 03771400
  TransferBufferMDL    = 0d8f4740
  UrbLink              = 00000000
  SetupPacket          =
    00000000: 40 01 05 00 00 00 40 00
[365802 ms] UsbSnoop - FilterDispatchAny(0dd57b90) : IRP_MJ_INTERNAL_DEVICE_CONTROL
[365802 ms] UsbSnoop - FdoHookDispatchInternalIoctl(0dd57f8c) : fdo=09b44040, Irp=07ed8930, IRQL=0
[365802 ms]  >>>  URB 73 going down  >>> 
-- URB_FUNCTION_VENDOR_DEVICE:
  TransferFlags          = 00000002 (USBD_TRANSFER_DIRECTION_OUT, USBD_SHORT_TRANSFER_OK)
  TransferBufferLength = 00000040
  TransferBuffer       = 03771400
  TransferBufferMDL    = 00000000
    00000000: 05 ff de 02 70 91 df 02 46 2f 57 2f 20 90 18 15
    00000010: 27 fe fc cf 80 91 f0 02 90 91 f1 02 80 34 e0 e0
    00000020: 9e 07 58 f1 20 91 ec 02 30 91 ed 02 00 e4 10 e0
    00000030: 56 d0 80 91 18 15 8f 77 80 93 18 15 80 91 ec 02
  UrbLink                 = 00000000
  RequestTypeReservedBits = 00000000
  Request                 = 00000001
  Value                   = 00000005
  Index                   = 00000000
[365802 ms] UsbSnoop - MyInternalIOCTLCompletion(0dd57ddc) : fido=00000000, Irp=07ed8930, Context=0abca400, IRQL=2
[365802 ms]  <<<  URB 73 coming back  <<< 
-- URB_FUNCTION_CONTROL_TRANSFER:
  PipeHandle           = 0d937120
  TransferFlags        = 0000000a (USBD_TRANSFER_DIRECTION_OUT, USBD_SHORT_TRANSFER_OK)
  TransferBufferLength = 00000040
  TransferBuffer       = 03771400
  TransferBufferMDL    = 0d8f4740
  UrbLink              = 00000000
  SetupPacket          =
    00000000: 40 01 05 00 00 00 40 00
[365802 ms] UsbSnoop - FilterDispatchAny(0dd57b90) : IRP_MJ_INTERNAL_DEVICE_CONTROL
[365802 ms] UsbSnoop - FdoHookDispatchInternalIoctl(0dd57f8c) : fdo=09b44040, Irp=07ed8930, IRQL=0
[365802 ms]  >>>  URB 74 going down  >>> 
-- URB_FUNCTION_VENDOR_DEVICE:
  TransferFlags          = 00000002 (USBD_TRANSFER_DIRECTION_OUT, USBD_SHORT_TRANSFER_OK)
  TransferBufferLength = 00000040
  TransferBuffer       = 03771400
  TransferBufferMDL    = 00000000
    00000000: 05 ff 90 91 ed 02 80 5c 9f 4f 90 93 ed 02 80 93
    00000010: ec 02 80 91 f0 02 90 91 f1 02 80 54 90 40 90 93
    00000020: f1 02 80 93 f0 02 80 91 ee 02 90 91 ef 02 80 5c
    00000030: 9f 4f 90 93 ef 02 80 93 ee 02 1c c0 20 91 ec 02
  UrbLink                 = 00000000
  RequestTypeReservedBits = 00000000
  Request                 = 00000001
  Value                   = 00000005
  Index                   = 00000000
[365802 ms] UsbSnoop - MyInternalIOCTLCompletion(0dd57ddc) : fido=00000000, Irp=07ed8930, Context=0abca400, IRQL=2
[365802 ms]  <<<  URB 74 coming back  <<< 
-- URB_FUNCTION_CONTROL_TRANSFER:
  PipeHandle           = 0d937120
  TransferFlags        = 0000000a (USBD_TRANSFER_DIRECTION_OUT, USBD_SHORT_TRANSFER_OK)
  TransferBufferLength = 00000040
  TransferBuffer       = 03771400
  TransferBufferMDL    = 0d8f4740
  UrbLink              = 00000000
  SetupPacket          =
    00000000: 40 01 05 00 00 00 40 00
[365802 ms] UsbSnoop - FilterDispatchAny(0dd57b90) : IRP_MJ_INTERNAL_DEVICE_CONTROL
[365802 ms] UsbSnoop - FdoHookDispatchInternalIoctl(0dd57f8c) : fdo=09b44040, Irp=07ed8930, IRQL=0
[365802 ms]  >>>  URB 75 going down  >>> 
-- URB_FUNCTION_VENDOR_DEVICE:
  TransferFlags          = 00000002 (USBD_TRANSFER_DIRECTION_OUT, USBD_SHORT_TRANSFER_OK)
  TransferBufferLength = 00000040
  TransferBuffer       = 03771400
  TransferBufferMDL    = 00000000
    00000000: 05 ff 30 91 ed 02 00 91 f0 02 10 91 f1 02 29 d0
    00000010: 20 90 f0 02 30 90 f1 02 40 90 ee 02 50 90 ef 02
    00000020: 42 0c 53 1c 50 92 ef 02 40 92 ee 02 80 91 18 15
    00000030: 8f 77 80 93 18 15 20 90 ee 02 30 90 ef 02 24 16
  UrbLink                 = 00000000
  RequestTypeReservedBits = 00000000
  Request                 = 00000001
  Value                   = 00000005
  Index                   = 00000000
[365802 ms] UsbSnoop - MyInternalIOCTLCompletion(0dd57ddc) : fido=00000000, Irp=07ed8930, Context=0abca400, IRQL=2
[365802 ms]  <<<  URB 75 coming back  <<< 
-- URB_FUNCTION_CONTROL_TRANSFER:
  PipeHandle           = 0d937120
  TransferFlags        = 0000000a (USBD_TRANSFER_DIRECTION_OUT, USBD_SHORT_TRANSFER_OK)
  TransferBufferLength = 00000040
  TransferBuffer       = 03771400
  TransferBufferMDL    = 0d8f4740
  UrbLink              = 00000000
  SetupPacket          =
    00000000: 40 01 05 00 00 00 40 00
[365802 ms] UsbSnoop - FilterDispatchAny(0dd57b90) : IRP_MJ_INTERNAL_DEVICE_CONTROL
[365802 ms] UsbSnoop - FdoHookDispatchInternalIoctl(0dd57f8c) : fdo=09b44040, Irp=07ed8930, IRQL=0
[365803 ms]  >>>  URB 76 going down  >>> 
-- URB_FUNCTION_VENDOR_DEVICE:
  TransferFlags          = 00000002 (USBD_TRANSFER_DIRECTION_OUT, USBD_SHORT_TRANSFER_OK)
  TransferBufferLength = 00000040
  TransferBuffer       = 03771400
  TransferBufferMDL    = 00000000
    00000000: 05 ff 35 06 08 f4 a5 cf 22 24 20 92 73 00 22 20
    00000010: 31 f4 20 90 d8 02 27 fc 02 c0 0e 94 00 02 0e 94
    00000020: 6e 0e 08 95 0e 94 7c 0e 00 30 01 07 91 f0 44 27
    00000030: 55 27 0c c0 e4 2f f5 2f e2 0f f3 1f a4 2f b5 2f
  UrbLink                 = 00000000
  RequestTypeReservedBits = 00000000
  Request                 = 00000001
  Value                   = 00000005
  Index                   = 00000000
[365803 ms] UsbSnoop - MyInternalIOCTLCompletion(0dd57ddc) : fido=00000000, Irp=07ed8930, Context=0abca400, IRQL=2
[365803 ms]  <<<  URB 76 coming back  <<< 
-- URB_FUNCTION_CONTROL_TRANSFER:
  PipeHandle           = 0d937120
  TransferFlags        = 0000000a (USBD_TRANSFER_DIRECTION_OUT, USBD_SHORT_TRANSFER_OK)
  TransferBufferLength = 00000040
  TransferBuffer       = 03771400
  TransferBufferMDL    = 0d8f4740
  UrbLink              = 00000000
  SetupPacket          =
    00000000: 40 01 05 00 00 00 40 00
[365803 ms] UsbSnoop - FilterDispatchAny(0dd57b90) : IRP_MJ_INTERNAL_DEVICE_CONTROL
[365803 ms] UsbSnoop - FdoHookDispatchInternalIoctl(0dd57f8c) : fdo=09b44040, Irp=07ed8930, IRQL=0
[365803 ms]  >>>  URB 77 going down  >>> 
-- URB_FUNCTION_VENDOR_DEVICE:
  TransferFlags          = 00000002 (USBD_TRANSFER_DIRECTION_OUT, USBD_SHORT_TRANSFER_OK)
  TransferBufferLength = 00000040
  TransferBuffer       = 03771400
  TransferBufferMDL    = 00000000
    00000000: 05 ff a0 50 b0 4e 2c 90 20 82 4f 5f 5f 4f 40 17
    00000010: 51 07 88 f3 0e 94 7f 0e 08 95 0e 94 7c 0e 00 30
    00000020: 01 07 09 f4 37 c0 20 90 1c 15 27 fc fc cf 00 93
    00000030: 1b 15 80 91 72 00 81 30 b9 f4 44 27 55 27 10 c0
  UrbLink                 = 00000000
  RequestTypeReservedBits = 00000000
  Request                 = 00000001
  Value                   = 00000005
  Index                   = 00000000
[365803 ms] UsbSnoop - MyInternalIOCTLCompletion(0dd57ddc) : fido=00000000, Irp=07ed8930, Context=0abca400, IRQL=2
[365803 ms]  <<<  URB 77 coming back  <<< 
-- URB_FUNCTION_CONTROL_TRANSFER:
  PipeHandle           = 0d937120
  TransferFlags        = 0000000a (USBD_TRANSFER_DIRECTION_OUT, USBD_SHORT_TRANSFER_OK)
  TransferBufferLength = 00000040
  TransferBuffer       = 03771400
  TransferBufferMDL    = 0d8f4740
  UrbLink              = 00000000
  SetupPacket          =
    00000000: 40 01 05 00 00 00 40 00
[365803 ms] UsbSnoop - FilterDispatchAny(0dd57b90) : IRP_MJ_INTERNAL_DEVICE_CONTROL
[365803 ms] UsbSnoop - FdoHookDispatchInternalIoctl(0dd57f8c) : fdo=09b44040, Irp=07ed8930, IRQL=0
[365803 ms]  >>>  URB 78 going down  >>> 
-- URB_FUNCTION_VENDOR_DEVICE:
  TransferFlags          = 00000002 (USBD_TRANSFER_DIRECTION_OUT, USBD_SHORT_TRANSFER_OK)
  TransferBufferLength = 00000040
  TransferBuffer       = 03771400
  TransferBufferMDL    = 00000000
    00000000: 05 ff e0 91 ea 02 f0 91 eb 02 21 90 f0 93 eb 02
    00000010: e0 93 ea 02 e4 2f f5 2f e0 5c ff 4d 20 82 4f 5f
    00000020: 5f 4f 40 17 51 07 68 f3 16 c0 44 27 55 27 10 c0
    00000030: e0 91 ec 02 f0 91 ed 02 21 90 f0 93 ed 02 e0 93
  UrbLink                 = 00000000
  RequestTypeReservedBits = 00000000
  Request                 = 00000001
  Value                   = 00000005
  Index                   = 00000000
[365803 ms] UsbSnoop - MyInternalIOCTLCompletion(0dd57ddc) : fido=00000000, Irp=07ed8930, Context=0abca400, IRQL=2
[365803 ms]  <<<  URB 78 coming back  <<< 
-- URB_FUNCTION_CONTROL_TRANSFER:
  PipeHandle           = 0d937120
  TransferFlags        = 0000000a (USBD_TRANSFER_DIRECTION_OUT, USBD_SHORT_TRANSFER_OK)
  TransferBufferLength = 00000040
  TransferBuffer       = 03771400
  TransferBufferMDL    = 0d8f4740
  UrbLink              = 00000000
  SetupPacket          =
    00000000: 40 01 05 00 00 00 40 00
[365803 ms] UsbSnoop - FilterDispatchAny(0dd57b90) : IRP_MJ_INTERNAL_DEVICE_CONTROL
[365803 ms] UsbSnoop - FdoHookDispatchInternalIoctl(0dd57f8c) : fdo=09b44040, Irp=07ed8930, IRQL=0
[365803 ms]  >>>  URB 79 going down  >>> 
-- URB_FUNCTION_VENDOR_DEVICE:
  TransferFlags          = 00000002 (USBD_TRANSFER_DIRECTION_OUT, USBD_SHORT_TRANSFER_OK)
  TransferBufferLength = 00000040
  TransferBuffer       = 03771400
  TransferBufferMDL    = 00000000
    00000000: 05 ff ec 02 e4 2f f5 2f e0 5c ff 4d 20 82 4f 5f
    00000010: 5f 4f 40 17 51 07 68 f3 0e 94 7f 0e 08 95 0e 94
    00000020: 7a 0e 6c 81 7d 81 42 2f 53 2f 40 5c 5f 4d 05 c0
    00000030: 80 91 e1 02 81 30 09 f4 13 c0 20 90 1c 15 27 fc
  UrbLink                 = 00000000
  RequestTypeReservedBits = 00000000
  Request                 = 00000001
  Value                   = 00000005
  Index                   = 00000000
[365803 ms] UsbSnoop - MyInternalIOCTLCompletion(0dd57ddc) : fido=00000000, Irp=07ed8930, Context=0abca400, IRQL=2
[365803 ms]  <<<  URB 79 coming back  <<< 
-- URB_FUNCTION_CONTROL_TRANSFER:
  PipeHandle           = 0d937120
  TransferFlags        = 0000000a (USBD_TRANSFER_DIRECTION_OUT, USBD_SHORT_TRANSFER_OK)
  TransferBufferLength = 00000040
  TransferBuffer       = 03771400
  TransferBufferMDL    = 0d8f4740
  UrbLink              = 00000000
  SetupPacket          =
    00000000: 40 01 05 00 00 00 40 00
[365803 ms] UsbSnoop - FilterDispatchAny(0dd57b90) : IRP_MJ_INTERNAL_DEVICE_CONTROL
[365804 ms] UsbSnoop - FdoHookDispatchInternalIoctl(0dd57f8c) : fdo=09b44040, Irp=07ed8930, IRQL=0
[365804 ms]  >>>  URB 80 going down  >>> 
-- URB_FUNCTION_VENDOR_DEVICE:
  TransferFlags          = 00000002 (USBD_TRANSFER_DIRECTION_OUT, USBD_SHORT_TRANSFER_OK)
  TransferBufferLength = 00000040
  TransferBuffer       = 03771400
  TransferBufferMDL    = 00000000
    00000000: 05 ff f7 cf e0 2f f1 2f a4 2f b5 2f 01 90 0e 2f
    00000010: 1f 2f 0d 92 4a 2f 5b 2f 61 50 70 40 60 30 67 07
    00000020: 89 f7 0e 94 6b 0e 08 95 0f 77 08 95 80 91 10 15
    00000030: 89 7f 80 93 10 15 84 60 80 93 10 15 84 e0 80 93
  UrbLink                 = 00000000
  RequestTypeReservedBits = 00000000
  Request                 = 00000001
  Value                   = 00000005
  Index                   = 00000000
[365804 ms] UsbSnoop - MyInternalIOCTLCompletion(0dd57ddc) : fido=00000000, Irp=07ed8930, Context=0abca400, IRQL=2
[365804 ms]  <<<  URB 80 coming back  <<< 
-- URB_FUNCTION_CONTROL_TRANSFER:
  PipeHandle           = 0d937120
  TransferFlags        = 0000000a (USBD_TRANSFER_DIRECTION_OUT, USBD_SHORT_TRANSFER_OK)
  TransferBufferLength = 00000040
  TransferBuffer       = 03771400
  TransferBufferMDL    = 0d8f4740
  UrbLink              = 00000000
  SetupPacket          =
    00000000: 40 01 05 00 00 00 40 00
[365804 ms] UsbSnoop - FilterDispatchAny(0dd57b90) : IRP_MJ_INTERNAL_DEVICE_CONTROL
[365804 ms] UsbSnoop - FdoHookDispatchInternalIoctl(0dd57f8c) : fdo=09b44040, Irp=07ed8930, IRQL=0
[365804 ms]  >>>  URB 81 going down  >>> 
-- URB_FUNCTION_VENDOR_DEVICE:
  TransferFlags          = 00000002 (USBD_TRANSFER_DIRECTION_OUT, USBD_SHORT_TRANSFER_OK)
  TransferBufferLength = 00000040
  TransferBuffer       = 03771400
  TransferBufferMDL    = 00000000
    00000000: 05 ff 73 00 08 95 80 91 e7 02 82 30 31 f4 80 91
    00000010: 40 17 8a 7f 80 93 40 17 16 c0 80 91 e7 02 83 30
    00000020: 21 f0 85 30 11 f0 84 30 71 f4 80 91 80 30 84 60
    00000030: 80 93 80 30 04 e1 10 e0 0e 94 15 05 80 91 80 30
  UrbLink                 = 00000000
  RequestTypeReservedBits = 00000000
  Request                 = 00000001
  Value                   = 00000005
  Index                   = 00000000
[365804 ms] UsbSnoop - MyInternalIOCTLCompletion(0dd57ddc) : fido=00000000, Irp=07ed8930, Context=0abca400, IRQL=2
[365804 ms]  <<<  URB 81 coming back  <<< 
-- URB_FUNCTION_CONTROL_TRANSFER:
  PipeHandle           = 0d937120
  TransferFlags        = 0000000a (USBD_TRANSFER_DIRECTION_OUT, USBD_SHORT_TRANSFER_OK)
  TransferBufferLength = 00000040
  TransferBuffer       = 03771400
  TransferBufferMDL    = 0e126e00
  UrbLink              = 00000000
  SetupPacket          =
    00000000: 40 01 05 00 00 00 40 00
[365804 ms] UsbSnoop - FilterDispatchAny(0dd57b90) : IRP_MJ_INTERNAL_DEVICE_CONTROL
[365804 ms] UsbSnoop - FdoHookDispatchInternalIoctl(0dd57f8c) : fdo=09b44040, Irp=07ed8930, IRQL=0
[365804 ms]  >>>  URB 82 going down  >>> 
-- URB_FUNCTION_VENDOR_DEVICE:
  TransferFlags          = 00000002 (USBD_TRANSFER_DIRECTION_OUT, USBD_SHORT_TRANSFER_OK)
  TransferBufferLength = 00000040
  TransferBuffer       = 03771400
  TransferBufferMDL    = 00000000
    00000000: 05 ff 8b 7f 80 93 80 30 80 91 00 16 8f 77 80 93
    00000010: 00 16 08 95 80 91 e7 02 82 30 31 f4 80 91 40 17
    00000020: 85 60 80 93 40 17 20 c0 80 91 e7 02 83 30 31 f4
    00000030: 80 91 80 15 80 68 80 93 80 15 16 c0 80 91 e7 02
  UrbLink                 = 00000000
  RequestTypeReservedBits = 00000000
  Request                 = 00000001
  Value                   = 00000005
  Index                   = 00000000
[365804 ms] UsbSnoop - MyInternalIOCTLCompletion(0dd57ddc) : fido=00000000, Irp=07ed8930, Context=0abca400, IRQL=2
[365804 ms]  <<<  URB 82 coming back  <<< 
-- URB_FUNCTION_CONTROL_TRANSFER:
  PipeHandle           = 0d937120
  TransferFlags        = 0000000a (USBD_TRANSFER_DIRECTION_OUT, USBD_SHORT_TRANSFER_OK)
  TransferBufferLength = 00000040
  TransferBuffer       = 03771400
  TransferBufferMDL    = 0dbf8960
  UrbLink              = 00000000
  SetupPacket          =
    00000000: 40 01 05 00 00 00 40 00
[365804 ms] UsbSnoop - FilterDispatchAny(0dd57b90) : IRP_MJ_INTERNAL_DEVICE_CONTROL
[365804 ms] UsbSnoop - FdoHookDispatchInternalIoctl(0dd57f8c) : fdo=09b44040, Irp=07ed8930, IRQL=0
[365804 ms]  >>>  URB 83 going down  >>> 
-- URB_FUNCTION_VENDOR_DEVICE:
  TransferFlags          = 00000002 (USBD_TRANSFER_DIRECTION_OUT, USBD_SHORT_TRANSFER_OK)
  TransferBufferLength = 00000040
  TransferBuffer       = 03771400
  TransferBufferMDL    = 00000000
    00000000: 05 ff 85 30 59 f4 80 91 00 18 8d 60 80 93 00 18
    00000010: 80 91 40 17 85 60 80 93 40 17 07 c0 80 91 e7 02
    00000020: 84 30 19 f4 81 e0 80 93 00 31 80 91 00 16 80 68
    00000030: 80 93 00 16 08 95 22 97 22 24 33 24 39 82 28 82
  UrbLink                 = 00000000
  RequestTypeReservedBits = 00000000
  Request                 = 00000001
  Value                   = 00000005
  Index                   = 00000000
[365804 ms] UsbSnoop - MyInternalIOCTLCompletion(0dd57ddc) : fido=00000000, Irp=07ed8930, Context=0abca400, IRQL=2
[365804 ms]  <<<  URB 83 coming back  <<< 
-- URB_FUNCTION_CONTROL_TRANSFER:
  PipeHandle           = 0d937120
  TransferFlags        = 0000000a (USBD_TRANSFER_DIRECTION_OUT, USBD_SHORT_TRANSFER_OK)
  TransferBufferLength = 00000040
  TransferBuffer       = 03771400
  TransferBufferMDL    = 0dbf8960
  UrbLink              = 00000000
  SetupPacket          =
    00000000: 40 01 05 00 00 00 40 00
[365804 ms] UsbSnoop - FilterDispatchAny(0dd57b90) : IRP_MJ_INTERNAL_DEVICE_CONTROL
[365804 ms] UsbSnoop - FdoHookDispatchInternalIoctl(0dd57f8c) : fdo=09b44040, Irp=07ed8930, IRQL=0
[365804 ms]  >>>  URB 84 going down  >>> 
-- URB_FUNCTION_VENDOR_DEVICE:
  TransferFlags          = 00000002 (USBD_TRANSFER_DIRECTION_OUT, USBD_SHORT_TRANSFER_OK)
  TransferBufferLength = 00000040
  TransferBuffer       = 03771400
  TransferBufferMDL    = 00000000
    00000000: 05 ff 88 81 99 81 01 96 99 83 88 83 88 81 99 81
    00000010: 84 3f e1 e0 9e 07 ac f3 22 96 08 95 0e 94 7c 0e
    00000020: 20 90 da 02 30 90 db 02 22 20 51 f4 33 20 41 f4
    00000030: 80 91 de 02 90 91 df 02 82 30 e0 e0 9e 07 11 f0
  UrbLink                 = 00000000
  RequestTypeReservedBits = 00000000
  Request                 = 00000001
  Value                   = 00000005
  Index                   = 00000000
[365805 ms] UsbSnoop - MyInternalIOCTLCompletion(0dd57ddc) : fido=00000000, Irp=07ed8930, Context=0abca400, IRQL=2
[365805 ms]  <<<  URB 84 coming back  <<< 
-- URB_FUNCTION_CONTROL_TRANSFER:
  PipeHandle           = 0d937120
  TransferFlags        = 0000000a (USBD_TRANSFER_DIRECTION_OUT, USBD_SHORT_TRANSFER_OK)
  TransferBufferLength = 00000040
  TransferBuffer       = 03771400
  TransferBufferMDL    = 0e126e00
  UrbLink              = 00000000
  SetupPacket          =
    00000000: 40 01 05 00 00 00 40 00
[365805 ms] UsbSnoop - FilterDispatchAny(0dd57b90) : IRP_MJ_INTERNAL_DEVICE_CONTROL
[365805 ms] UsbSnoop - FdoHookDispatchInternalIoctl(0dd57f8c) : fdo=09b44040, Irp=07ed8930, IRQL=0
[365805 ms]  >>>  URB 85 going down  >>> 
-- URB_FUNCTION_VENDOR_DEVICE:
  TransferFlags          = 00000002 (USBD_TRANSFER_DIRECTION_OUT, USBD_SHORT_TRANSFER_OK)
  TransferBufferLength = 00000040
  TransferBuffer       = 03771400
  TransferBufferMDL    = 00000000
    00000000: 05 ff 0e 94 0b 09 40 91 d8 02 55 27 40 38 e0 e0
    00000010: 5e 07 49 f0 41 38 e0 e0 5e 07 d1 f0 42 38 e0 e0
    00000020: 5e 07 79 f1 a7 c0 20 90 dc 02 30 90 dd 02 22 20
    00000030: 11 f4 33 20 19 f0 0e 94 0b 09 9e c0 80 e6 91 e0
  UrbLink                 = 00000000
  RequestTypeReservedBits = 00000000
  Request                 = 00000001
  Value                   = 00000005
  Index                   = 00000000
[365805 ms] UsbSnoop - MyInternalIOCTLCompletion(0dd57ddc) : fido=00000000, Irp=07ed8930, Context=0abca400, IRQL=2
[365805 ms]  <<<  URB 85 coming back  <<< 
-- URB_FUNCTION_CONTROL_TRANSFER:
  PipeHandle           = 0d937120
  TransferFlags        = 0000000a (USBD_TRANSFER_DIRECTION_OUT, USBD_SHORT_TRANSFER_OK)
  TransferBufferLength = 00000040
  TransferBuffer       = 03771400
  TransferBufferMDL    = 0e126e00
  UrbLink              = 00000000
  SetupPacket          =
    00000000: 40 01 05 00 00 00 40 00
[365805 ms] UsbSnoop - FilterDispatchAny(0dd57b90) : IRP_MJ_INTERNAL_DEVICE_CONTROL
[365805 ms] UsbSnoop - FdoHookDispatchInternalIoctl(0dd57f8c) : fdo=09b44040, Irp=07ed8930, IRQL=0
[365805 ms]  >>>  URB 86 going down  >>> 
-- URB_FUNCTION_VENDOR_DEVICE:
  TransferFlags          = 00000002 (USBD_TRANSFER_DIRECTION_OUT, USBD_SHORT_TRANSFER_OK)
  TransferBufferLength = 00000040
  TransferBuffer       = 03771400
  TransferBufferMDL    = 00000000
    00000000: 05 ff 90 93 eb 02 80 93 ea 02 81 e0 80 93 72 00
    00000010: 94 c0 80 91 f2 02 84 30 41 f4 20 90 dc 02 30 90
    00000020: dd 02 22 20 11 f4 33 20 19 f0 0e 94 0b 09 85 c0
    00000030: 80 e6 91 e0 90 93 eb 02 80 93 ea 02 81 e0 80 93
  UrbLink                 = 00000000
  RequestTypeReservedBits = 00000000
  Request                 = 00000001
  Value                   = 00000005
  Index                   = 00000000
[365805 ms] UsbSnoop - MyInternalIOCTLCompletion(0dd57ddc) : fido=00000000, Irp=07ed8930, Context=0abca400, IRQL=2
[365805 ms]  <<<  URB 86 coming back  <<< 
-- URB_FUNCTION_CONTROL_TRANSFER:
  PipeHandle           = 0d937120
  TransferFlags        = 0000000a (USBD_TRANSFER_DIRECTION_OUT, USBD_SHORT_TRANSFER_OK)
  TransferBufferLength = 00000040
  TransferBuffer       = 03771400
  TransferBufferMDL    = 0e126e00
  UrbLink              = 00000000
  SetupPacket          =
    00000000: 40 01 05 00 00 00 40 00
[365805 ms] UsbSnoop - FilterDispatchAny(0dd57b90) : IRP_MJ_INTERNAL_DEVICE_CONTROL
[365805 ms] UsbSnoop - FdoHookDispatchInternalIoctl(0dd57f8c) : fdo=09b44040, Irp=07ed8930, IRQL=0
[365805 ms]  >>>  URB 87 going down  >>> 
-- URB_FUNCTION_VENDOR_DEVICE:
  TransferFlags          = 00000002 (USBD_TRANSFER_DIRECTION_OUT, USBD_SHORT_TRANSFER_OK)
  TransferBufferLength = 00000040
  TransferBuffer       = 03771400
  TransferBufferMDL    = 00000000
    00000000: 05 ff 72 00 7b c0 80 91 f2 02 84 30 21 f4 20 90
    00000010: dd 02 22 20 19 f0 0e 94 0b 09 70 c0 40 91 dc 02
    00000020: 55 27 41 38 e0 e0 5e 07 51 f0 42 38 e0 e0 5e 07
    00000030: 21 f1 43 38 e0 e0 5e 07 09 f4 3d c0 5a c0 80 91
  UrbLink                 = 00000000
  RequestTypeReservedBits = 00000000
  Request                 = 00000001
  Value                   = 00000005
  Index                   = 00000000
[365805 ms] UsbSnoop - MyInternalIOCTLCompletion(0dd57ddc) : fido=00000000, Irp=07ed8930, Context=0abca400, IRQL=2
[365805 ms]  <<<  URB 87 coming back  <<< 
-- URB_FUNCTION_CONTROL_TRANSFER:
  PipeHandle           = 0d937120
  TransferFlags        = 0000000a (USBD_TRANSFER_DIRECTION_OUT, USBD_SHORT_TRANSFER_OK)
  TransferBufferLength = 00000040
  TransferBuffer       = 03771400
  TransferBufferMDL    = 0e126e00
  UrbLink              = 00000000
  SetupPacket          =
    00000000: 40 01 05 00 00 00 40 00
[365805 ms] UsbSnoop - FilterDispatchAny(0dd57b90) : IRP_MJ_INTERNAL_DEVICE_CONTROL
[365805 ms] UsbSnoop - FdoHookDispatchInternalIoctl(0dd57f8c) : fdo=09b44040, Irp=07ed8930, IRQL=0
[365805 ms]  >>>  URB 88 going down  >>> 
-- URB_FUNCTION_VENDOR_DEVICE:
  TransferFlags          = 00000002 (USBD_TRANSFER_DIRECTION_OUT, USBD_SHORT_TRANSFER_OK)
  TransferBufferLength = 00000040
  TransferBuffer       = 03771400
  TransferBufferMDL    = 00000000
    00000000: 05 ff 74 00 83 30 51 f4 8e e5 91 e0 90 93 eb 02
    00000010: 80 93 ea 02 81 e0 80 93 72 00 09 c0 80 e6 91 e0
    00000020: 90 93 eb 02 80 93 ea 02 81 e0 80 93 72 00 82 e0
    00000030: 90 e0 90 93 f1 02 80 93 f0 02 41 c0 80 91 75 00
  UrbLink                 = 00000000
  RequestTypeReservedBits = 00000000
  Request                 = 00000001
  Value                   = 00000005
  Index                   = 00000000
[365805 ms] UsbSnoop - MyInternalIOCTLCompletion(0dd57ddc) : fido=00000000, Irp=07ed8930, Context=0abca400, IRQL=2
[365805 ms]  <<<  URB 88 coming back  <<< 
-- URB_FUNCTION_CONTROL_TRANSFER:
  PipeHandle           = 0d937120
  TransferFlags        = 0000000a (USBD_TRANSFER_DIRECTION_OUT, USBD_SHORT_TRANSFER_OK)
  TransferBufferLength = 00000040
  TransferBuffer       = 03771400
  TransferBufferMDL    = 0e126e00
  UrbLink              = 00000000
  SetupPacket          =
    00000000: 40 01 05 00 00 00 40 00
[365805 ms] UsbSnoop - FilterDispatchAny(0dd57b90) : IRP_MJ_INTERNAL_DEVICE_CONTROL
[365806 ms] UsbSnoop - FdoHookDispatchInternalIoctl(0dd57f8c) : fdo=09b44040, Irp=07ed8930, IRQL=0
[365806 ms]  >>>  URB 89 going down  >>> 
-- URB_FUNCTION_VENDOR_DEVICE:
  TransferFlags          = 00000002 (USBD_TRANSFER_DIRECTION_OUT, USBD_SHORT_TRANSFER_OK)
  TransferBufferLength = 00000040
  TransferBuffer       = 03771400
  TransferBufferMDL    = 00000000
    00000000: 05 ff 83 30 51 f4 8e e5 91 e0 90 93 eb 02 80 93
    00000010: ea 02 81 e0 80 93 72 00 09 c0 80 e6 91 e0 90 93
    00000020: eb 02 80 93 ea 02 81 e0 80 93 72 00 82 e0 90 e0
    00000030: 90 93 f1 02 80 93 f0 02 23 c0 80 91 76 00 83 30
  UrbLink                 = 00000000
  RequestTypeReservedBits = 00000000
  Request                 = 00000001
  Value                   = 00000005
  Index                   = 00000000
[365806 ms] UsbSnoop - MyInternalIOCTLCompletion(0dd57ddc) : fido=00000000, Irp=07ed8930, Context=0abca400, IRQL=2
[365806 ms]  <<<  URB 89 coming back  <<< 
-- URB_FUNCTION_CONTROL_TRANSFER:
  PipeHandle           = 0d937120
  TransferFlags        = 0000000a (USBD_TRANSFER_DIRECTION_OUT, USBD_SHORT_TRANSFER_OK)
  TransferBufferLength = 00000040
  TransferBuffer       = 03771400
  TransferBufferMDL    = 0e126e00
  UrbLink              = 00000000
  SetupPacket          =
    00000000: 40 01 05 00 00 00 40 00
[365806 ms] UsbSnoop - FilterDispatchAny(0dd57b90) : IRP_MJ_INTERNAL_DEVICE_CONTROL
[365806 ms] UsbSnoop - FdoHookDispatchInternalIoctl(0dd57f8c) : fdo=09b44040, Irp=07ed8930, IRQL=0
[365806 ms]  >>>  URB 90 going down  >>> 
-- URB_FUNCTION_VENDOR_DEVICE:
  TransferFlags          = 00000002 (USBD_TRANSFER_DIRECTION_OUT, USBD_SHORT_TRANSFER_OK)
  TransferBufferLength = 00000040
  TransferBuffer       = 03771400
  TransferBufferMDL    = 00000000
    00000000: 05 ff 51 f4 8e e5 91 e0 90 93 eb 02 80 93 ea 02
    00000010: 81 e0 80 93 72 00 09 c0 80 e6 91 e0 90 93 eb 02
    00000020: 80 93 ea 02 81 e0 80 93 72 00 82 e0 90 e0 90 93
    00000030: f1 02 80 93 f0 02 05 c0 0e 94 0b 09 02 c0 0e 94
  UrbLink                 = 00000000
  RequestTypeReservedBits = 00000000
  Request                 = 00000001
  Value                   = 00000005
  Index                   = 00000000
[365806 ms] UsbSnoop - MyInternalIOCTLCompletion(0dd57ddc) : fido=00000000, Irp=07ed8930, Context=0abca400, IRQL=2
[365806 ms]  <<<  URB 90 coming back  <<< 
-- URB_FUNCTION_CONTROL_TRANSFER:
  PipeHandle           = 0d937120
  TransferFlags        = 0000000a (USBD_TRANSFER_DIRECTION_OUT, USBD_SHORT_TRANSFER_OK)
  TransferBufferLength = 00000040
  TransferBuffer       = 03771400
  TransferBufferMDL    = 0e126e00
  UrbLink              = 00000000
  SetupPacket          =
    00000000: 40 01 05 00 00 00 40 00
[365806 ms] UsbSnoop - FilterDispatchAny(0dd57b90) : IRP_MJ_INTERNAL_DEVICE_CONTROL
[365806 ms] UsbSnoop - FdoHookDispatchInternalIoctl(0dd57f8c) : fdo=09b44040, Irp=07ed8930, IRQL=0
[365806 ms]  >>>  URB 91 going down  >>> 
-- URB_FUNCTION_VENDOR_DEVICE:
  TransferFlags          = 00000002 (USBD_TRANSFER_DIRECTION_OUT, USBD_SHORT_TRANSFER_OK)
  TransferBufferLength = 00000040
  TransferBuffer       = 03771400
  TransferBufferMDL    = 00000000
    00000000: 05 ff 0b 09 80 91 73 00 84 30 79 f0 81 e0 80 93
    00000010: 73 00 22 24 33 24 30 92 ef 02 20 92 ee 02 82 e0
    00000020: 90 e0 90 93 f1 02 80 93 f0 02 0e 94 7f 0e 08 95
    00000030: 0e 94 7c 0e 80 91 f2 02 84 30 a1 f4 80 91 d8 02
  UrbLink                 = 00000000
  RequestTypeReservedBits = 00000000
  Request                 = 00000001
  Value                   = 00000005
  Index                   = 00000000
[365806 ms] UsbSnoop - MyInternalIOCTLCompletion(0dd57ddc) : fido=00000000, Irp=07ed8930, Context=0abca400, IRQL=2
[365806 ms]  <<<  URB 91 coming back  <<< 
-- URB_FUNCTION_CONTROL_TRANSFER:
  PipeHandle           = 0d937120
  TransferFlags        = 0000000a (USBD_TRANSFER_DIRECTION_OUT, USBD_SHORT_TRANSFER_OK)
  TransferBufferLength = 00000040
  TransferBuffer       = 03771400
  TransferBufferMDL    = 0e126e00
  UrbLink              = 00000000
  SetupPacket          =
    00000000: 40 01 05 00 00 00 40 00
[365806 ms] UsbSnoop - FilterDispatchAny(0dd57b90) : IRP_MJ_INTERNAL_DEVICE_CONTROL
[365806 ms] UsbSnoop - FdoHookDispatchInternalIoctl(0dd57f8c) : fdo=09b44040, Irp=07ed8930, IRQL=0
[365806 ms]  >>>  URB 92 going down  >>> 
-- URB_FUNCTION_VENDOR_DEVICE:
  TransferFlags          = 00000002 (USBD_TRANSFER_DIRECTION_OUT, USBD_SHORT_TRANSFER_OK)
  TransferBufferLength = 00000040
  TransferBuffer       = 03771400
  TransferBufferMDL    = 00000000
    00000000: 05 ff 82 30 81 f4 20 90 da 02 30 90 db 02 22 20
    00000010: 51 f4 33 20 41 f4 20 90 de 02 30 90 df 02 22 20
    00000020: 11 f4 33 20 19 f0 0e 94 0b 09 3f c0 40 91 dc 02
    00000030: 55 27 41 38 e0 e0 5e 07 49 f0 42 38 e0 e0 5e 07
  UrbLink                 = 00000000
  RequestTypeReservedBits = 00000000
  Request                 = 00000001
  Value                   = 00000005
  Index                   = 00000000
[365806 ms] UsbSnoop - MyInternalIOCTLCompletion(0dd57ddc) : fido=00000000, Irp=07ed8930, Context=0abca400, IRQL=2
[365806 ms]  <<<  URB 92 coming back  <<< 
-- URB_FUNCTION_CONTROL_TRANSFER:
  PipeHandle           = 0d937120
  TransferFlags        = 0000000a (USBD_TRANSFER_DIRECTION_OUT, USBD_SHORT_TRANSFER_OK)
  TransferBufferLength = 00000040
  TransferBuffer       = 03771400
  TransferBufferMDL    = 0e126e00
  UrbLink              = 00000000
  SetupPacket          =
    00000000: 40 01 05 00 00 00 40 00
[365807 ms] UsbSnoop - FilterDispatchAny(0dd57b90) : IRP_MJ_INTERNAL_DEVICE_CONTROL
[365807 ms] UsbSnoop - FdoHookDispatchInternalIoctl(0dd57f8c) : fdo=09b44040, Irp=07ed8930, IRQL=0
[365807 ms]  >>>  URB 93 going down  >>> 
-- URB_FUNCTION_VENDOR_DEVICE:
  TransferFlags          = 00000002 (USBD_TRANSFER_DIRECTION_OUT, USBD_SHORT_TRANSFER_OK)
  TransferBufferLength = 00000040
  TransferBuffer       = 03771400
  TransferBufferMDL    = 00000000
    00000000: 05 ff a1 f0 43 38 e0 e0 5e 07 f9 f0 2d c0 80 91
    00000010: 20 15 89 7f 80 93 20 15 28 2e 20 92 20 15 8e 7f
    00000020: 80 93 20 15 22 24 20 92 74 00 20 c0 80 91 30 15
    00000030: 89 7f 80 93 30 15 28 2e 20 92 30 15 8e 7f 80 93
  UrbLink                 = 00000000
  RequestTypeReservedBits = 00000000
  Request                 = 00000001
  Value                   = 00000005
  Index                   = 00000000
[365807 ms] UsbSnoop - MyInternalIOCTLCompletion(0dd57ddc) : fido=00000000, Irp=07ed8930, Context=0abca400, IRQL=2
[365807 ms]  <<<  URB 93 coming back  <<< 
-- URB_FUNCTION_CONTROL_TRANSFER:
  PipeHandle           = 0d937120
  TransferFlags        = 0000000a (USBD_TRANSFER_DIRECTION_OUT, USBD_SHORT_TRANSFER_OK)
  TransferBufferLength = 00000040
  TransferBuffer       = 03771400
  TransferBufferMDL    = 0e126e00
  UrbLink              = 00000000
  SetupPacket          =
    00000000: 40 01 05 00 00 00 40 00
[365807 ms] UsbSnoop - FilterDispatchAny(0dd57b90) : IRP_MJ_INTERNAL_DEVICE_CONTROL
[365807 ms] UsbSnoop - FdoHookDispatchInternalIoctl(0dd57f8c) : fdo=09b44040, Irp=07ed8930, IRQL=0
[365807 ms]  >>>  URB 94 going down  >>> 
-- URB_FUNCTION_VENDOR_DEVICE:
  TransferFlags          = 00000002 (USBD_TRANSFER_DIRECTION_OUT, USBD_SHORT_TRANSFER_OK)
  TransferBufferLength = 00000040
  TransferBuffer       = 03771400
  TransferBufferMDL    = 00000000
    00000000: 05 ff 30 15 22 24 20 92 75 00 11 c0 80 91 40 15
    00000010: 89 7f 80 93 40 15 28 2e 20 92 40 15 8e 7f 80 93
    00000020: 40 15 22 24 20 92 76 00 02 c0 0e 94 0b 09 80 91
    00000030: 73 00 84 30 61 f0 20 90 1c 15 27 fc fc cf 22 24
  UrbLink                 = 00000000
  RequestTypeReservedBits = 00000000
  Request                 = 00000001
  Value                   = 00000005
  Index                   = 00000000
[365807 ms] UsbSnoop - MyInternalIOCTLCompletion(0dd57ddc) : fido=00000000, Irp=07ed8930, Context=0abca400, IRQL=2
[365807 ms]  <<<  URB 94 coming back  <<< 
-- URB_FUNCTION_CONTROL_TRANSFER:
  PipeHandle           = 0d937120
  TransferFlags        = 0000000a (USBD_TRANSFER_DIRECTION_OUT, USBD_SHORT_TRANSFER_OK)
  TransferBufferLength = 00000040
  TransferBuffer       = 03771400
  TransferBufferMDL    = 0e126e00
  UrbLink              = 00000000
  SetupPacket          =
    00000000: 40 01 05 00 00 00 40 00
[365807 ms] UsbSnoop - FilterDispatchAny(0dd57b90) : IRP_MJ_INTERNAL_DEVICE_CONTROL
[365807 ms] UsbSnoop - FdoHookDispatchInternalIoctl(0dd57f8c) : fdo=09b44040, Irp=07ed8930, IRQL=0
[365807 ms]  >>>  URB 95 going down  >>> 
-- URB_FUNCTION_VENDOR_DEVICE:
  TransferFlags          = 00000002 (USBD_TRANSFER_DIRECTION_OUT, USBD_SHORT_TRANSFER_OK)
  TransferBufferLength = 00000040
  TransferBuffer       = 03771400
  TransferBufferMDL    = 00000000
    00000000: 05 ff 20 92 1b 15 80 91 1c 15 80 68 80 93 1c 15
    00000010: 0e 94 7f 0e 08 95 0e 94 7a 0e 44 27 20 90 da 02
    00000020: 30 90 db 02 22 20 09 f0 55 c0 33 20 09 f0 52 c0
    00000030: 80 91 f2 02 84 30 a1 f4 80 91 d8 02 82 30 81 f4
  UrbLink                 = 00000000
  RequestTypeReservedBits = 00000000
  Request                 = 00000001
  Value                   = 00000005
  Index                   = 00000000
[365807 ms] UsbSnoop - MyInternalIOCTLCompletion(0dd57ddc) : fido=00000000, Irp=07ed8930, Context=0abca400, IRQL=2
[365807 ms]  <<<  URB 95 coming back  <<< 
-- URB_FUNCTION_CONTROL_TRANSFER:
  PipeHandle           = 0d937120
  TransferFlags        = 0000000a (USBD_TRANSFER_DIRECTION_OUT, USBD_SHORT_TRANSFER_OK)
  TransferBufferLength = 00000040
  TransferBuffer       = 03771400
  TransferBufferMDL    = 0e126e00
  UrbLink              = 00000000
  SetupPacket          =
    00000000: 40 01 05 00 00 00 40 00
[365807 ms] UsbSnoop - FilterDispatchAny(0dd57b90) : IRP_MJ_INTERNAL_DEVICE_CONTROL
[365807 ms] UsbSnoop - FdoHookDispatchInternalIoctl(0dd57f8c) : fdo=09b44040, Irp=07ed8930, IRQL=0
[365807 ms]  >>>  URB 96 going down  >>> 
-- URB_FUNCTION_VENDOR_DEVICE:
  TransferFlags          = 00000002 (USBD_TRANSFER_DIRECTION_OUT, USBD_SHORT_TRANSFER_OK)
  TransferBufferLength = 00000040
  TransferBuffer       = 03771400
  TransferBufferMDL    = 00000000
    00000000: 05 ff 20 90 da 02 30 90 db 02 22 20 51 f4 33 20
    00000010: 41 f4 20 90 de 02 30 90 df 02 22 20 11 f4 33 20
    00000020: 19 f0 0e 94 0b 09 39 c0 60 91 dc 02 77 27 61 38
    00000030: e0 e0 7e 07 49 f0 62 38 e0 e0 7e 07 89 f0 63 38
  UrbLink                 = 00000000
  RequestTypeReservedBits = 00000000
  Request                 = 00000001
  Value                   = 00000005
  Index                   = 00000000
[365807 ms] UsbSnoop - MyInternalIOCTLCompletion(0dd57ddc) : fido=00000000, Irp=07ed8930, Context=0abca400, IRQL=2
[365807 ms]  <<<  URB 96 coming back  <<< 
-- URB_FUNCTION_CONTROL_TRANSFER:
  PipeHandle           = 0d937120
  TransferFlags        = 0000000a (USBD_TRANSFER_DIRECTION_OUT, USBD_SHORT_TRANSFER_OK)
  TransferBufferLength = 00000040
  TransferBuffer       = 03771400
  TransferBufferMDL    = 0dbf8960
  UrbLink              = 00000000
  SetupPacket          =
    00000000: 40 01 05 00 00 00 40 00
[365807 ms] UsbSnoop - FilterDispatchAny(0dd57b90) : IRP_MJ_INTERNAL_DEVICE_CONTROL
[365807 ms] UsbSnoop - FdoHookDispatchInternalIoctl(0dd57f8c) : fdo=09b44040, Irp=07ed8930, IRQL=0
[365808 ms]  >>>  URB 97 going down  >>> 
-- URB_FUNCTION_VENDOR_DEVICE:
  TransferFlags          = 00000002 (USBD_TRANSFER_DIRECTION_OUT, USBD_SHORT_TRANSFER_OK)
  TransferBufferLength = 00000040
  TransferBuffer       = 03771400
  TransferBufferMDL    = 00000000
    00000000: 05 ff e0 e0 7e 07 c9 f0 24 c0 80 91 20 15 89 7f
    00000010: 80 93 20 15 84 60 80 93 20 15 83 e0 80 93 74 00
    00000020: 1d c0 80 91 30 15 89 7f 80 93 30 15 84 60 80 93
    00000030: 30 15 83 e0 80 93 75 00 11 c0 80 91 40 15 89 7f
  UrbLink                 = 00000000
  RequestTypeReservedBits = 00000000
  Request                 = 00000001
  Value                   = 00000005
  Index                   = 00000000
[365808 ms] UsbSnoop - MyInternalIOCTLCompletion(0dd57ddc) : fido=00000000, Irp=07ed8930, Context=0abca400, IRQL=2
[365808 ms]  <<<  URB 97 coming back  <<< 
-- URB_FUNCTION_CONTROL_TRANSFER:
  PipeHandle           = 0d937120
  TransferFlags        = 0000000a (USBD_TRANSFER_DIRECTION_OUT, USBD_SHORT_TRANSFER_OK)
  TransferBufferLength = 00000040
  TransferBuffer       = 03771400
  TransferBufferMDL    = 0dbf8960
  UrbLink              = 00000000
  SetupPacket          =
    00000000: 40 01 05 00 00 00 40 00
[365808 ms] UsbSnoop - FilterDispatchAny(0dd57b90) : IRP_MJ_INTERNAL_DEVICE_CONTROL
[365808 ms] UsbSnoop - FdoHookDispatchInternalIoctl(0dd57f8c) : fdo=09b44040, Irp=07ed8930, IRQL=0
[365808 ms]  >>>  URB 98 going down  >>> 
-- URB_FUNCTION_VENDOR_DEVICE:
  TransferFlags          = 00000002 (USBD_TRANSFER_DIRECTION_OUT, USBD_SHORT_TRANSFER_OK)
  TransferBufferLength = 00000040
  TransferBuffer       = 03771400
  TransferBufferMDL    = 00000000
    00000000: 05 ff 80 93 40 15 84 60 80 93 40 15 83 e0 80 93
    00000010: 76 00 05 c0 0e 94 0b 09 02 c0 0e 94 0b 09 80 91
    00000020: 73 00 84 30 a1 f0 20 90 1c 15 27 fc fc cf 22 24
    00000030: 20 92 1b 15 80 91 1c 15 80 68 80 93 1c 15 44 23
  UrbLink                 = 00000000
  RequestTypeReservedBits = 00000000
  Request                 = 00000001
  Value                   = 00000005
  Index                   = 00000000
[365808 ms] UsbSnoop - MyInternalIOCTLCompletion(0dd57ddc) : fido=00000000, Irp=07ed8930, Context=0abca400, IRQL=2
[365808 ms]  <<<  URB 98 coming back  <<< 
-- URB_FUNCTION_CONTROL_TRANSFER:
  PipeHandle           = 0d937120
  TransferFlags        = 0000000a (USBD_TRANSFER_DIRECTION_OUT, USBD_SHORT_TRANSFER_OK)
  TransferBufferLength = 00000040
  TransferBuffer       = 03771400
  TransferBufferMDL    = 0e126e00
  UrbLink              = 00000000
  SetupPacket          =
    00000000: 40 01 05 00 00 00 40 00
[365808 ms] UsbSnoop - FilterDispatchAny(0dd57b90) : IRP_MJ_INTERNAL_DEVICE_CONTROL
[365808 ms] UsbSnoop - FdoHookDispatchInternalIoctl(0dd57f8c) : fdo=09b44040, Irp=07ed8930, IRQL=0
[365808 ms]  >>>  URB 99 going down  >>> 
-- URB_FUNCTION_VENDOR_DEVICE:
  TransferFlags          = 00000002 (USBD_TRANSFER_DIRECTION_OUT, USBD_SHORT_TRANSFER_OK)
  TransferBufferLength = 00000040
  TransferBuffer       = 03771400
  TransferBufferMDL    = 00000000
    00000000: 05 ff 31 f0 20 90 1c 15 27 fc fc cf 40 93 09 15
    00000010: 0e 94 6b 0e 08 95 20 90 d8 02 22 20 c9 f4 20 90
    00000020: dc 02 30 90 dd 02 22 20 99 f4 33 20 89 f4 20 90
    00000030: de 02 30 90 df 02 22 20 59 f4 33 20 49 f4 8f e7
  UrbLink                 = 00000000
  RequestTypeReservedBits = 00000000
  Request                 = 00000001
  Value                   = 00000005
  Index                   = 00000000
[365808 ms] UsbSnoop - MyInternalIOCTLCompletion(0dd57ddc) : fido=00000000, Irp=07ed8930, Context=0abca400, IRQL=2
[365808 ms]  <<<  URB 99 coming back  <<< 
-- URB_FUNCTION_CONTROL_TRANSFER:
  PipeHandle           = 0d937120
  TransferFlags        = 0000000a (USBD_TRANSFER_DIRECTION_OUT, USBD_SHORT_TRANSFER_OK)
  TransferBufferLength = 00000040
  TransferBuffer       = 03771400
  TransferBufferMDL    = 0e126e00
  UrbLink              = 00000000
  SetupPacket          =
    00000000: 40 01 05 00 00 00 40 00
[365808 ms] UsbSnoop - FilterDispatchAny(0dd57b90) : IRP_MJ_INTERNAL_DEVICE_CONTROL
[365808 ms] UsbSnoop - FdoHookDispatchInternalIoctl(0dd57f8c) : fdo=09b44040, Irp=07ed8930, IRQL=0
[365808 ms]  >>>  URB 100 going down  >>> 
-- URB_FUNCTION_VENDOR_DEVICE:
  TransferFlags          = 00000002 (USBD_TRANSFER_DIRECTION_OUT, USBD_SHORT_TRANSFER_OK)
  TransferBufferLength = 00000040
  TransferBuffer       = 03771400
  TransferBufferMDL    = 00000000
    00000000: 05 ff 90 e0 20 90 da 02 30 90 db 02 82 15 93 05
    00000010: 10 f4 0e 94 0b 09 85 e0 80 93 73 00 20 90 da 02
    00000020: 22 20 21 f0 83 e0 80 93 f2 02 03 c0 82 e0 80 93
    00000030: f2 02 80 91 73 00 84 30 61 f0 20 90 1c 15 27 fc
  UrbLink                 = 00000000
  RequestTypeReservedBits = 00000000
  Request                 = 00000001
  Value                   = 00000005
  Index                   = 00000000
[365808 ms] UsbSnoop - MyInternalIOCTLCompletion(0dd57ddc) : fido=00000000, Irp=07ed8930, Context=0abca400, IRQL=2
[365808 ms]  <<<  URB 100 coming back  <<< 
-- URB_FUNCTION_CONTROL_TRANSFER:
  PipeHandle           = 0d937120
  TransferFlags        = 0000000a (USBD_TRANSFER_DIRECTION_OUT, USBD_SHORT_TRANSFER_OK)
  TransferBufferLength = 00000040
  TransferBuffer       = 03771400
  TransferBufferMDL    = 0e126e00
  UrbLink              = 00000000
  SetupPacket          =
    00000000: 40 01 05 00 00 00 40 00
[365808 ms] UsbSnoop - FilterDispatchAny(0dd57b90) : IRP_MJ_INTERNAL_DEVICE_CONTROL
[365808 ms] UsbSnoop - FdoHookDispatchInternalIoctl(0dd57f8c) : fdo=09b44040, Irp=07ed8930, IRQL=0
[365809 ms]  >>>  URB 101 going down  >>> 
-- URB_FUNCTION_VENDOR_DEVICE:
  TransferFlags          = 00000002 (USBD_TRANSFER_DIRECTION_OUT, USBD_SHORT_TRANSFER_OK)
  TransferBufferLength = 00000040
  TransferBuffer       = 03771400
  TransferBufferMDL    = 00000000
    00000000: 05 ff fc cf 22 24 20 92 1b 15 80 91 1c 15 80 68
    00000010: 80 93 1c 15 08 95 0e 94 7c 0e 22 97 80 91 db 02
    00000020: 82 30 09 f0 6b c0 81 e0 80 93 e6 02 20 90 1c 15
    00000030: 27 fc fc cf 20 90 01 15 21 fe 1f c0 89 e0 90 e0
  UrbLink                 = 00000000
  RequestTypeReservedBits = 00000000
  Request                 = 00000001
  Value                   = 00000005
  Index                   = 00000000
[365809 ms] UsbSnoop - MyInternalIOCTLCompletion(0dd57ddc) : fido=00000000, Irp=07ed8930, Context=0abca400, IRQL=2
[365809 ms]  <<<  URB 101 coming back  <<< 
-- URB_FUNCTION_CONTROL_TRANSFER:
  PipeHandle           = 0d937120
  TransferFlags        = 0000000a (USBD_TRANSFER_DIRECTION_OUT, USBD_SHORT_TRANSFER_OK)
  TransferBufferLength = 00000040
  TransferBuffer       = 03771400
  TransferBufferMDL    = 0e126e00
  UrbLink              = 00000000
  SetupPacket          =
    00000000: 40 01 05 00 00 00 40 00
[365809 ms] UsbSnoop - FilterDispatchAny(0dd57b90) : IRP_MJ_INTERNAL_DEVICE_CONTROL
[365809 ms] UsbSnoop - FdoHookDispatchInternalIoctl(0dd57f8c) : fdo=09b44040, Irp=07ed8930, IRQL=0
[365809 ms]  >>>  URB 102 going down  >>> 
-- URB_FUNCTION_VENDOR_DEVICE:
  TransferFlags          = 00000002 (USBD_TRANSFER_DIRECTION_OUT, USBD_SHORT_TRANSFER_OK)
  TransferBufferLength = 00000040
  TransferBuffer       = 03771400
  TransferBufferMDL    = 00000000
    00000000: 05 ff 99 83 88 83 22 27 33 27 00 ea 10 e0 0e 94
    00000010: e5 08 82 e2 90 e0 99 83 88 83 29 e0 30 e0 02 eb
    00000020: 10 e0 0e 94 e5 08 87 e0 90 e0 99 83 88 83 2b e2
    00000030: 30 e0 04 ed 10 e0 0e 94 e5 08 1e c0 89 e0 90 e0
  UrbLink                 = 00000000
  RequestTypeReservedBits = 00000000
  Request                 = 00000001
  Value                   = 00000005
  Index                   = 00000000
[365809 ms] UsbSnoop - MyInternalIOCTLCompletion(0dd57ddc) : fido=00000000, Irp=07ed8930, Context=0abca400, IRQL=2
[365809 ms]  <<<  URB 102 coming back  <<< 
-- URB_FUNCTION_CONTROL_TRANSFER:
  PipeHandle           = 0d937120
  TransferFlags        = 0000000a (USBD_TRANSFER_DIRECTION_OUT, USBD_SHORT_TRANSFER_OK)
  TransferBufferLength = 00000040
  TransferBuffer       = 03771400
  TransferBufferMDL    = 0e126e00
  UrbLink              = 00000000
  SetupPacket          =
    00000000: 40 01 05 00 00 00 40 00
[365809 ms] UsbSnoop - FilterDispatchAny(0dd57b90) : IRP_MJ_INTERNAL_DEVICE_CONTROL
[365809 ms] UsbSnoop - FdoHookDispatchInternalIoctl(0dd57f8c) : fdo=09b44040, Irp=07ed8930, IRQL=0
[365809 ms]  >>>  URB 103 going down  >>> 
-- URB_FUNCTION_VENDOR_DEVICE:
  TransferFlags          = 00000002 (USBD_TRANSFER_DIRECTION_OUT, USBD_SHORT_TRANSFER_OK)
  TransferBufferLength = 00000040
  TransferBuffer       = 03771400
  TransferBufferMDL    = 00000000
    00000000: 05 ff 99 83 88 83 22 27 33 27 00 ea 10 e0 0e 94
    00000010: e5 08 82 e2 90 e0 99 83 88 83 29 e0 30 e0 02 eb
    00000020: 10 e0 0e 94 e5 08 87 e0 90 e0 99 83 88 83 2b e2
    00000030: 30 e0 0b ed 10 e0 0e 94 e5 08 20 90 a2 00 30 90
  UrbLink                 = 00000000
  RequestTypeReservedBits = 00000000
  Request                 = 00000001
  Value                   = 00000005
  Index                   = 00000000
[365809 ms] UsbSnoop - MyInternalIOCTLCompletion(0dd57ddc) : fido=00000000, Irp=07ed8930, Context=0abca400, IRQL=2
[365809 ms]  <<<  URB 103 coming back  <<< 
-- URB_FUNCTION_CONTROL_TRANSFER:
  PipeHandle           = 0d937120
  TransferFlags        = 0000000a (USBD_TRANSFER_DIRECTION_OUT, USBD_SHORT_TRANSFER_OK)
  TransferBufferLength = 00000040
  TransferBuffer       = 03771400
  TransferBufferMDL    = 0e126e00
  UrbLink              = 00000000
  SetupPacket          =
    00000000: 40 01 05 00 00 00 40 00
[365809 ms] UsbSnoop - FilterDispatchAny(0dd57b90) : IRP_MJ_INTERNAL_DEVICE_CONTROL
[365809 ms] UsbSnoop - FdoHookDispatchInternalIoctl(0dd57f8c) : fdo=09b44040, Irp=07ed8930, IRQL=0
[365809 ms]  >>>  URB 104 going down  >>> 
-- URB_FUNCTION_VENDOR_DEVICE:
  TransferFlags          = 00000002 (USBD_TRANSFER_DIRECTION_OUT, USBD_SHORT_TRANSFER_OK)
  TransferBufferLength = 00000040
  TransferBuffer       = 03771400
  TransferBufferMDL    = 00000000
    00000000: 05 ff a3 00 30 92 f1 02 20 92 f0 02 20 90 f0 02
    00000010: 30 90 f1 02 40 90 de 02 50 90 df 02 42 14 53 04
    00000020: 30 f4 24 2c 35 2c 30 92 f1 02 20 92 f0 02 81 e0
    00000030: 80 93 73 00 22 24 33 24 30 92 ef 02 20 92 ee 02
  UrbLink                 = 00000000
  RequestTypeReservedBits = 00000000
  Request                 = 00000001
  Value                   = 00000005
  Index                   = 00000000
[365809 ms] UsbSnoop - MyInternalIOCTLCompletion(0dd57ddc) : fido=00000000, Irp=07ed8930, Context=0abca400, IRQL=2
[365809 ms]  <<<  URB 104 coming back  <<< 
-- URB_FUNCTION_CONTROL_TRANSFER:
  PipeHandle           = 0d937120
  TransferFlags        = 0000000a (USBD_TRANSFER_DIRECTION_OUT, USBD_SHORT_TRANSFER_OK)
  TransferBufferLength = 00000040
  TransferBuffer       = 03771400
  TransferBufferMDL    = 0e126e00
  UrbLink              = 00000000
  SetupPacket          =
    00000000: 40 01 05 00 00 00 40 00
[365809 ms] UsbSnoop - FilterDispatchAny(0dd57b90) : IRP_MJ_INTERNAL_DEVICE_CONTROL
[365809 ms] UsbSnoop - FdoHookDispatchInternalIoctl(0dd57f8c) : fdo=09b44040, Irp=07ed8930, IRQL=0
[365809 ms]  >>>  URB 105 going down  >>> 
-- URB_FUNCTION_VENDOR_DEVICE:
  TransferFlags          = 00000002 (USBD_TRANSFER_DIRECTION_OUT, USBD_SHORT_TRANSFER_OK)
  TransferBufferLength = 00000040
  TransferBuffer       = 03771400
  TransferBufferMDL    = 00000000
    00000000: 05 ff e5 c0 80 91 db 02 87 30 09 f0 6b c0 81 e0
    00000010: 80 93 e6 02 20 90 1c 15 27 fc fc cf 20 90 01 15
    00000020: 21 fe 1f c0 89 e0 90 e0 99 83 88 83 22 27 33 27
    00000030: 09 ea 10 e0 0e 94 e5 08 82 e2 90 e0 99 83 88 83
  UrbLink                 = 00000000
  RequestTypeReservedBits = 00000000
  Request                 = 00000001
  Value                   = 00000005
  Index                   = 00000000
[365809 ms] UsbSnoop - MyInternalIOCTLCompletion(0dd57ddc) : fido=00000000, Irp=07ed8930, Context=0abca400, IRQL=2
[365809 ms]  <<<  URB 105 coming back  <<< 
-- URB_FUNCTION_CONTROL_TRANSFER:
  PipeHandle           = 0d937120
  TransferFlags        = 0000000a (USBD_TRANSFER_DIRECTION_OUT, USBD_SHORT_TRANSFER_OK)
  TransferBufferLength = 00000040
  TransferBuffer       = 03771400
  TransferBufferMDL    = 0e126e00
  UrbLink              = 00000000
  SetupPacket          =
    00000000: 40 01 05 00 00 00 40 00
[365809 ms] UsbSnoop - FilterDispatchAny(0dd57b90) : IRP_MJ_INTERNAL_DEVICE_CONTROL
[365810 ms] UsbSnoop - FdoHookDispatchInternalIoctl(0dd57f8c) : fdo=09b44040, Irp=07ed8930, IRQL=0
[365810 ms]  >>>  URB 106 going down  >>> 
-- URB_FUNCTION_VENDOR_DEVICE:
  TransferFlags          = 00000002 (USBD_TRANSFER_DIRECTION_OUT, USBD_SHORT_TRANSFER_OK)
  TransferBufferLength = 00000040
  TransferBuffer       = 03771400
  TransferBufferMDL    = 00000000
    00000000: 05 ff 29 e0 30 e0 02 eb 10 e0 0e 94 e5 08 87 e0
    00000010: 90 e0 99 83 88 83 2b e2 30 e0 0b ed 10 e0 0e 94
    00000020: e5 08 1e c0 89 e0 90 e0 99 83 88 83 22 27 33 27
    00000030: 09 ea 10 e0 0e 94 e5 08 82 e2 90 e0 99 83 88 83
  UrbLink                 = 00000000
  RequestTypeReservedBits = 00000000
  Request                 = 00000001
  Value                   = 00000005
  Index                   = 00000000
[365810 ms] UsbSnoop - MyInternalIOCTLCompletion(0dd57ddc) : fido=00000000, Irp=07ed8930, Context=0abca400, IRQL=2
[365810 ms]  <<<  URB 106 coming back  <<< 
-- URB_FUNCTION_CONTROL_TRANSFER:
  PipeHandle           = 0d937120
  TransferFlags        = 0000000a (USBD_TRANSFER_DIRECTION_OUT, USBD_SHORT_TRANSFER_OK)
  TransferBufferLength = 00000040
  TransferBuffer       = 03771400
  TransferBufferMDL    = 0e126e00
  UrbLink              = 00000000
  SetupPacket          =
    00000000: 40 01 05 00 00 00 40 00
[365810 ms] UsbSnoop - FilterDispatchAny(0dd57b90) : IRP_MJ_INTERNAL_DEVICE_CONTROL
[365810 ms] UsbSnoop - FdoHookDispatchInternalIoctl(0dd57f8c) : fdo=09b44040, Irp=07ed8930, IRQL=0
[365810 ms]  >>>  URB 107 going down  >>> 
-- URB_FUNCTION_VENDOR_DEVICE:
  TransferFlags          = 00000002 (USBD_TRANSFER_DIRECTION_OUT, USBD_SHORT_TRANSFER_OK)
  TransferBufferLength = 00000040
  TransferBuffer       = 03771400
  TransferBufferMDL    = 00000000
    00000000: 05 ff 29 e0 30 e0 02 eb 10 e0 0e 94 e5 08 87 e0
    00000010: 90 e0 99 83 88 83 2b e2 30 e0 04 ed 10 e0 0e 94
    00000020: e5 08 20 90 ab 00 30 90 ac 00 30 92 f1 02 20 92
    00000030: f0 02 20 90 f0 02 30 90 f1 02 40 90 de 02 50 90
  UrbLink                 = 00000000
  RequestTypeReservedBits = 00000000
  Request                 = 00000001
  Value                   = 00000005
  Index                   = 00000000
[365810 ms] UsbSnoop - MyInternalIOCTLCompletion(0dd57ddc) : fido=00000000, Irp=07ed8930, Context=0abca400, IRQL=2
[365810 ms]  <<<  URB 107 coming back  <<< 
-- URB_FUNCTION_CONTROL_TRANSFER:
  PipeHandle           = 0d937120
  TransferFlags        = 0000000a (USBD_TRANSFER_DIRECTION_OUT, USBD_SHORT_TRANSFER_OK)
  TransferBufferLength = 00000040
  TransferBuffer       = 03771400
  TransferBufferMDL    = 0e126e00
  UrbLink              = 00000000
  SetupPacket          =
    00000000: 40 01 05 00 00 00 40 00
[365810 ms] UsbSnoop - FilterDispatchAny(0dd57b90) : IRP_MJ_INTERNAL_DEVICE_CONTROL
[365810 ms] UsbSnoop - FdoHookDispatchInternalIoctl(0dd57f8c) : fdo=09b44040, Irp=07ed8930, IRQL=0
[365810 ms]  >>>  URB 108 going down  >>> 
-- URB_FUNCTION_VENDOR_DEVICE:
  TransferFlags          = 00000002 (USBD_TRANSFER_DIRECTION_OUT, USBD_SHORT_TRANSFER_OK)
  TransferBufferLength = 00000040
  TransferBuffer       = 03771400
  TransferBufferMDL    = 00000000
    00000000: 05 ff df 02 42 14 53 04 30 f4 24 2c 35 2c 30 92
    00000010: f1 02 20 92 f0 02 81 e0 80 93 73 00 22 24 33 24
    00000020: 30 92 ef 02 20 92 ee 02 75 c0 40 91 db 02 55 27
    00000030: 41 30 e0 e0 5e 07 49 f0 43 30 e0 e0 5e 07 39 f1
  UrbLink                 = 00000000
  RequestTypeReservedBits = 00000000
  Request                 = 00000001
  Value                   = 00000005
  Index                   = 00000000
[365810 ms] UsbSnoop - MyInternalIOCTLCompletion(0dd57ddc) : fido=00000000, Irp=07ed8930, Context=0abca400, IRQL=2
[365810 ms]  <<<  URB 108 coming back  <<< 
-- URB_FUNCTION_CONTROL_TRANSFER:
  PipeHandle           = 0d937120
  TransferFlags        = 0000000a (USBD_TRANSFER_DIRECTION_OUT, USBD_SHORT_TRANSFER_OK)
  TransferBufferLength = 00000040
  TransferBuffer       = 03771400
  TransferBufferMDL    = 0e126e00
  UrbLink              = 00000000
  SetupPacket          =
    00000000: 40 01 05 00 00 00 40 00
[365810 ms] UsbSnoop - FilterDispatchAny(0dd57b90) : IRP_MJ_INTERNAL_DEVICE_CONTROL
[365810 ms] UsbSnoop - FdoHookDispatchInternalIoctl(0dd57f8c) : fdo=09b44040, Irp=07ed8930, IRQL=0
[365810 ms]  >>>  URB 109 going down  >>> 
-- URB_FUNCTION_VENDOR_DEVICE:
  TransferFlags          = 00000002 (USBD_TRANSFER_DIRECTION_OUT, USBD_SHORT_TRANSFER_OK)
  TransferBufferLength = 00000040
  TransferBuffer       = 03771400
  TransferBufferMDL    = 00000000
    00000000: 05 ff 46 30 e0 e0 5e 07 91 f0 45 c0 84 e8 90 e0
    00000010: 90 93 eb 02 80 93 ea 02 81 e0 80 93 72 00 20 90
    00000020: 84 00 33 24 30 92 f1 02 20 92 f0 02 36 c0 86 e9
    00000030: 90 e0 90 93 eb 02 80 93 ea 02 81 e0 80 93 72 00
  UrbLink                 = 00000000
  RequestTypeReservedBits = 00000000
  Request                 = 00000001
  Value                   = 00000005
  Index                   = 00000000
[365810 ms] UsbSnoop - MyInternalIOCTLCompletion(0dd57ddc) : fido=00000000, Irp=07ed8930, Context=0abca400, IRQL=2
[365810 ms]  <<<  URB 109 coming back  <<< 
-- URB_FUNCTION_CONTROL_TRANSFER:
  PipeHandle           = 0d937120
  TransferFlags        = 0000000a (USBD_TRANSFER_DIRECTION_OUT, USBD_SHORT_TRANSFER_OK)
  TransferBufferLength = 00000040
  TransferBuffer       = 03771400
  TransferBufferMDL    = 0e126e00
  UrbLink              = 00000000
  SetupPacket          =
    00000000: 40 01 05 00 00 00 40 00
[365810 ms] UsbSnoop - FilterDispatchAny(0dd57b90) : IRP_MJ_INTERNAL_DEVICE_CONTROL
[365811 ms] UsbSnoop - FdoHookDispatchInternalIoctl(0dd57f8c) : fdo=09b44040, Irp=07ed8930, IRQL=0
[365811 ms]  >>>  URB 110 going down  >>> 
-- URB_FUNCTION_VENDOR_DEVICE:
  TransferFlags          = 00000002 (USBD_TRANSFER_DIRECTION_OUT, USBD_SHORT_TRANSFER_OK)
  TransferBufferLength = 00000040
  TransferBuffer       = 03771400
  TransferBufferMDL    = 00000000
    00000000: 05 ff 20 90 96 00 33 24 30 92 f1 02 20 92 f0 02
    00000010: 25 c0 83 e0 20 90 da 02 82 15 18 f4 0e 94 0b 09
    00000020: 1d c0 86 e5 91 e0 e0 91 da 02 ff 27 ee 0f ff 1f
    00000030: e8 0f f9 1f 20 80 31 80 30 92 eb 02 20 92 ea 02
  UrbLink                 = 00000000
  RequestTypeReservedBits = 00000000
  Request                 = 00000001
  Value                   = 00000005
  Index                   = 00000000
[365811 ms] UsbSnoop - MyInternalIOCTLCompletion(0dd57ddc) : fido=00000000, Irp=07ed8930, Context=0abca400, IRQL=2
[365811 ms]  <<<  URB 110 coming back  <<< 
-- URB_FUNCTION_CONTROL_TRANSFER:
  PipeHandle           = 0d937120
  TransferFlags        = 0000000a (USBD_TRANSFER_DIRECTION_OUT, USBD_SHORT_TRANSFER_OK)
  TransferBufferLength = 00000040
  TransferBuffer       = 03771400
  TransferBufferMDL    = 0e126e00
  UrbLink              = 00000000
  SetupPacket          =
    00000000: 40 01 05 00 00 00 40 00
[365811 ms] UsbSnoop - FilterDispatchAny(0dd57b90) : IRP_MJ_INTERNAL_DEVICE_CONTROL
[365811 ms] UsbSnoop - FdoHookDispatchInternalIoctl(0dd57f8c) : fdo=09b44040, Irp=07ed8930, IRQL=0
[365811 ms]  >>>  URB 111 going down  >>> 
-- URB_FUNCTION_VENDOR_DEVICE:
  TransferFlags          = 00000002 (USBD_TRANSFER_DIRECTION_OUT, USBD_SHORT_TRANSFER_OK)
  TransferBufferLength = 00000040
  TransferBuffer       = 03771400
  TransferBufferMDL    = 00000000
    00000000: 05 ff 81 e0 80 93 72 00 e2 2d f3 2d 20 80 33 24
    00000010: 30 92 f1 02 20 92 f0 02 02 c0 0e 94 0b 09 20 90
    00000020: f0 02 30 90 f1 02 40 90 de 02 50 90 df 02 42 14
    00000030: 53 04 30 f4 24 2c 35 2c 30 92 f1 02 20 92 f0 02
  UrbLink                 = 00000000
  RequestTypeReservedBits = 00000000
  Request                 = 00000001
  Value                   = 00000005
  Index                   = 00000000
[365811 ms] UsbSnoop - MyInternalIOCTLCompletion(0dd57ddc) : fido=00000000, Irp=07ed8930, Context=0abca400, IRQL=2
[365811 ms]  <<<  URB 111 coming back  <<< 
-- URB_FUNCTION_CONTROL_TRANSFER:
  PipeHandle           = 0d937120
  TransferFlags        = 0000000a (USBD_TRANSFER_DIRECTION_OUT, USBD_SHORT_TRANSFER_OK)
  TransferBufferLength = 00000040
  TransferBuffer       = 03771400
  TransferBufferMDL    = 0e126e00
  UrbLink              = 00000000
  SetupPacket          =
    00000000: 40 01 05 00 00 00 40 00
[365811 ms] UsbSnoop - FilterDispatchAny(0dd57b90) : IRP_MJ_INTERNAL_DEVICE_CONTROL
[365811 ms] UsbSnoop - FdoHookDispatchInternalIoctl(0dd57f8c) : fdo=09b44040, Irp=07ed8930, IRQL=0
[365811 ms]  >>>  URB 112 going down  >>> 
-- URB_FUNCTION_VENDOR_DEVICE:
  TransferFlags          = 00000002 (USBD_TRANSFER_DIRECTION_OUT, USBD_SHORT_TRANSFER_OK)
  TransferBufferLength = 00000040
  TransferBuffer       = 03771400
  TransferBufferMDL    = 00000000
    00000000: 05 ff 80 91 73 00 84 30 49 f0 81 e0 80 93 73 00
    00000010: 22 24 33 24 30 92 ef 02 20 92 ee 02 22 96 0e 94
    00000020: 7f 0e 08 95 80 91 d8 02 80 38 c1 f4 20 90 da 02
    00000030: 30 90 db 02 22 20 91 f4 33 20 81 f4 20 90 dc 02
  UrbLink                 = 00000000
  RequestTypeReservedBits = 00000000
  Request                 = 00000001
  Value                   = 00000005
  Index                   = 00000000
[365811 ms] UsbSnoop - MyInternalIOCTLCompletion(0dd57ddc) : fido=00000000, Irp=07ed8930, Context=0abca400, IRQL=2
[365811 ms]  <<<  URB 112 coming back  <<< 
-- URB_FUNCTION_CONTROL_TRANSFER:
  PipeHandle           = 0d937120
  TransferFlags        = 0000000a (USBD_TRANSFER_DIRECTION_OUT, USBD_SHORT_TRANSFER_OK)
  TransferBufferLength = 00000040
  TransferBuffer       = 03771400
  TransferBufferMDL    = 0e126e00
  UrbLink              = 00000000
  SetupPacket          =
    00000000: 40 01 05 00 00 00 40 00
[365811 ms] UsbSnoop - FilterDispatchAny(0dd57b90) : IRP_MJ_INTERNAL_DEVICE_CONTROL
[365811 ms] UsbSnoop - FdoHookDispatchInternalIoctl(0dd57f8c) : fdo=09b44040, Irp=07ed8930, IRQL=0
[365811 ms]  >>>  URB 113 going down  >>> 
-- URB_FUNCTION_VENDOR_DEVICE:
  TransferFlags          = 00000002 (USBD_TRANSFER_DIRECTION_OUT, USBD_SHORT_TRANSFER_OK)
  TransferBufferLength = 00000040
  TransferBuffer       = 03771400
  TransferBufferMDL    = 00000000
    00000000: 05 ff 30 90 dd 02 22 20 51 f4 33 20 41 f4 80 91
    00000010: de 02 90 91 df 02 81 30 e0 e0 9e 07 19 f0 0e 94
    00000020: 0b 09 1d c0 81 e0 90 e0 90 93 f1 02 80 93 f0 02
    00000030: 80 91 f2 02 84 30 51 f4 8e e5 91 e0 90 93 eb 02
  UrbLink                 = 00000000
  RequestTypeReservedBits = 00000000
  Request                 = 00000001
  Value                   = 00000005
  Index                   = 00000000
[365811 ms] UsbSnoop - MyInternalIOCTLCompletion(0dd57ddc) : fido=00000000, Irp=07ed8930, Context=0abca400, IRQL=2
[365811 ms]  <<<  URB 113 coming back  <<< 
-- URB_FUNCTION_CONTROL_TRANSFER:
  PipeHandle           = 0d937120
  TransferFlags        = 0000000a (USBD_TRANSFER_DIRECTION_OUT, USBD_SHORT_TRANSFER_OK)
  TransferBufferLength = 00000040
  TransferBuffer       = 03771400
  TransferBufferMDL    = 0e126e00
  UrbLink              = 00000000
  SetupPacket          =
    00000000: 40 01 05 00 00 00 40 00
[365812 ms] UsbSnoop - FilterDispatchAny(0dd57b90) : IRP_MJ_INTERNAL_DEVICE_CONTROL
[365812 ms] UsbSnoop - FdoHookDispatchInternalIoctl(0dd57f8c) : fdo=09b44040, Irp=07ed8930, IRQL=0
[365812 ms]  >>>  URB 114 going down  >>> 
-- URB_FUNCTION_VENDOR_DEVICE:
  TransferFlags          = 00000002 (USBD_TRANSFER_DIRECTION_OUT, USBD_SHORT_TRANSFER_OK)
  TransferBufferLength = 00000040
  TransferBuffer       = 03771400
  TransferBufferMDL    = 00000000
    00000000: 05 ff 80 93 ea 02 81 e0 80 93 72 00 09 c0 80 e6
    00000010: 91 e0 90 93 eb 02 80 93 ea 02 81 e0 80 93 72 00
    00000020: 80 91 73 00 84 30 49 f0 81 e0 80 93 73 00 22 24
    00000030: 33 24 30 92 ef 02 20 92 ee 02 08 95 80 91 f2 02
  UrbLink                 = 00000000
  RequestTypeReservedBits = 00000000
  Request                 = 00000001
  Value                   = 00000005
  Index                   = 00000000
[365812 ms] UsbSnoop - MyInternalIOCTLCompletion(0dd57ddc) : fido=00000000, Irp=07ed8930, Context=0abca400, IRQL=2
[365812 ms]  <<<  URB 114 coming back  <<< 
-- URB_FUNCTION_CONTROL_TRANSFER:
  PipeHandle           = 0d937120
  TransferFlags        = 0000000a (USBD_TRANSFER_DIRECTION_OUT, USBD_SHORT_TRANSFER_OK)
  TransferBufferLength = 00000040
  TransferBuffer       = 03771400
  TransferBufferMDL    = 0e126e00
  UrbLink              = 00000000
  SetupPacket          =
    00000000: 40 01 05 00 00 00 40 00
[365812 ms] UsbSnoop - FilterDispatchAny(0dd57b90) : IRP_MJ_INTERNAL_DEVICE_CONTROL
[365812 ms] UsbSnoop - FdoHookDispatchInternalIoctl(0dd57f8c) : fdo=09b44040, Irp=07ed8930, IRQL=0
[365812 ms]  >>>  URB 115 going down  >>> 
-- URB_FUNCTION_VENDOR_DEVICE:
  TransferFlags          = 00000002 (USBD_TRANSFER_DIRECTION_OUT, USBD_SHORT_TRANSFER_OK)
  TransferBufferLength = 00000040
  TransferBuffer       = 03771400
  TransferBufferMDL    = 00000000
    00000000: 05 ff 82 30 e9 f0 20 90 d8 02 22 20 c9 f4 20 90
    00000010: dc 02 30 90 dd 02 22 20 99 f4 33 20 89 f4 20 90
    00000020: de 02 30 90 df 02 22 20 59 f4 33 20 49 f4 81 e0
    00000030: 90 e0 20 90 da 02 30 90 db 02 82 15 93 05 18 f4
  UrbLink                 = 00000000
  RequestTypeReservedBits = 00000000
  Request                 = 00000001
  Value                   = 00000005
  Index                   = 00000000
[365812 ms] UsbSnoop - MyInternalIOCTLCompletion(0dd57ddc) : fido=00000000, Irp=07ed8930, Context=0abca400, IRQL=2
[365812 ms]  <<<  URB 115 coming back  <<< 
-- URB_FUNCTION_CONTROL_TRANSFER:
  PipeHandle           = 0d937120
  TransferFlags        = 0000000a (USBD_TRANSFER_DIRECTION_OUT, USBD_SHORT_TRANSFER_OK)
  TransferBufferLength = 00000040
  TransferBuffer       = 03771400
  TransferBufferMDL    = 0e126e00
  UrbLink              = 00000000
  SetupPacket          =
    00000000: 40 01 05 00 00 00 40 00
[365812 ms] UsbSnoop - FilterDispatchAny(0dd57b90) : IRP_MJ_INTERNAL_DEVICE_CONTROL
[365812 ms] UsbSnoop - FdoHookDispatchInternalIoctl(0dd57f8c) : fdo=09b44040, Irp=07ed8930, IRQL=0
[365812 ms]  >>>  URB 116 going down  >>> 
-- URB_FUNCTION_VENDOR_DEVICE:
  TransferFlags          = 00000002 (USBD_TRANSFER_DIRECTION_OUT, USBD_SHORT_TRANSFER_OK)
  TransferBufferLength = 00000040
  TransferBuffer       = 03771400
  TransferBufferMDL    = 00000000
    00000000: 05 ff 0e 94 0b 09 38 c0 22 24 30 90 da 02 23 14
    00000010: 30 f5 84 e0 80 93 f2 02 20 92 74 00 20 92 75 00
    00000020: 20 92 76 00 20 92 77 00 20 92 78 00 80 91 20 15
    00000030: 89 7f 80 93 20 15 28 2e 20 92 20 15 80 91 30 15
  UrbLink                 = 00000000
  RequestTypeReservedBits = 00000000
  Request                 = 00000001
  Value                   = 00000005
  Index                   = 00000000
[365812 ms] UsbSnoop - MyInternalIOCTLCompletion(0dd57ddc) : fido=00000000, Irp=07ed8930, Context=0abca400, IRQL=2
[365812 ms]  <<<  URB 116 coming back  <<< 
-- URB_FUNCTION_CONTROL_TRANSFER:
  PipeHandle           = 0d937120
  TransferFlags        = 0000000a (USBD_TRANSFER_DIRECTION_OUT, USBD_SHORT_TRANSFER_OK)
  TransferBufferLength = 00000040
  TransferBuffer       = 03771400
  TransferBufferMDL    = 0e126e00
  UrbLink              = 00000000
  SetupPacket          =
    00000000: 40 01 05 00 00 00 40 00
[365812 ms] UsbSnoop - FilterDispatchAny(0dd57b90) : IRP_MJ_INTERNAL_DEVICE_CONTROL
[365812 ms] UsbSnoop - FdoHookDispatchInternalIoctl(0dd57f8c) : fdo=09b44040, Irp=07ed8930, IRQL=0
[365812 ms]  >>>  URB 117 going down  >>> 
-- URB_FUNCTION_VENDOR_DEVICE:
  TransferFlags          = 00000002 (USBD_TRANSFER_DIRECTION_OUT, USBD_SHORT_TRANSFER_OK)
  TransferBufferLength = 00000040
  TransferBuffer       = 03771400
  TransferBufferMDL    = 00000000
    00000000: 05 ff 89 7f 80 93 30 15 28 2e 20 92 30 15 80 91
    00000010: 40 15 89 7f 80 93 40 15 28 2e 20 92 40 15 0d c0
    00000020: 83 e0 80 93 f2 02 80 93 74 00 80 93 75 00 80 93
    00000030: 76 00 80 93 77 00 80 93 78 00 80 91 73 00 84 30
  UrbLink                 = 00000000
  RequestTypeReservedBits = 00000000
  Request                 = 00000001
  Value                   = 00000005
  Index                   = 00000000
[365812 ms] UsbSnoop - MyInternalIOCTLCompletion(0dd57ddc) : fido=00000000, Irp=07ed8930, Context=0abca400, IRQL=2
[365812 ms]  <<<  URB 117 coming back  <<< 
-- URB_FUNCTION_CONTROL_TRANSFER:
  PipeHandle           = 0d937120
  TransferFlags        = 0000000a (USBD_TRANSFER_DIRECTION_OUT, USBD_SHORT_TRANSFER_OK)
  TransferBufferLength = 00000040
  TransferBuffer       = 03771400
  TransferBufferMDL    = 0e126e00
  UrbLink              = 00000000
  SetupPacket          =
    00000000: 40 01 05 00 00 00 40 00
[365813 ms] UsbSnoop - FilterDispatchAny(0dd57b90) : IRP_MJ_INTERNAL_DEVICE_CONTROL
[365813 ms] UsbSnoop - FdoHookDispatchInternalIoctl(0dd57f8c) : fdo=09b44040, Irp=07ed8930, IRQL=0
[365813 ms]  >>>  URB 118 going down  >>> 
-- URB_FUNCTION_VENDOR_DEVICE:
  TransferFlags          = 00000002 (USBD_TRANSFER_DIRECTION_OUT, USBD_SHORT_TRANSFER_OK)
  TransferBufferLength = 00000040
  TransferBuffer       = 03771400
  TransferBufferMDL    = 00000000
    00000000: 05 ff 61 f0 20 90 1c 15 27 fc fc cf 22 24 20 92
    00000010: 1b 15 80 91 1c 15 80 68 80 93 1c 15 08 95 80 91
    00000020: f2 02 84 30 a1 f4 20 90 da 02 30 90 db 02 22 20
    00000030: 71 f4 33 20 61 f4 80 91 d8 02 81 38 41 f4 80 91
  UrbLink                 = 00000000
  RequestTypeReservedBits = 00000000
  Request                 = 00000001
  Value                   = 00000005
  Index                   = 00000000
[365813 ms] UsbSnoop - MyInternalIOCTLCompletion(0dd57ddc) : fido=00000000, Irp=07ed8930, Context=0abca400, IRQL=2
[365813 ms]  <<<  URB 118 coming back  <<< 
-- URB_FUNCTION_CONTROL_TRANSFER:
  PipeHandle           = 0d937120
  TransferFlags        = 0000000a (USBD_TRANSFER_DIRECTION_OUT, USBD_SHORT_TRANSFER_OK)
  TransferBufferLength = 00000040
  TransferBuffer       = 03771400
  TransferBufferMDL    = 0e126e00
  UrbLink              = 00000000
  SetupPacket          =
    00000000: 40 01 05 00 00 00 40 00
[365813 ms] UsbSnoop - FilterDispatchAny(0dd57b90) : IRP_MJ_INTERNAL_DEVICE_CONTROL
[365813 ms] UsbSnoop - FdoHookDispatchInternalIoctl(0dd57f8c) : fdo=09b44040, Irp=07ed8930, IRQL=0
[365813 ms]  >>>  URB 119 going down  >>> 
-- URB_FUNCTION_VENDOR_DEVICE:
  TransferFlags          = 00000002 (USBD_TRANSFER_DIRECTION_OUT, USBD_SHORT_TRANSFER_OK)
  TransferBufferLength = 00000040
  TransferBuffer       = 03771400
  TransferBufferMDL    = 00000000
    00000000: 05 ff de 02 90 91 df 02 81 30 e0 e0 9e 07 19 f0
    00000010: 0e 94 0b 09 28 c0 81 e0 90 e0 90 93 f1 02 80 93
    00000020: f0 02 20 90 dc 02 30 90 dd 02 22 20 11 f4 33 20
    00000030: 41 f0 80 91 dc 02 90 91 dd 02 81 30 e0 e0 9e 07
  UrbLink                 = 00000000
  RequestTypeReservedBits = 00000000
  Request                 = 00000001
  Value                   = 00000005
  Index                   = 00000000
[365813 ms] UsbSnoop - MyInternalIOCTLCompletion(0dd57ddc) : fido=00000000, Irp=07ed8930, Context=0abca400, IRQL=2
[365813 ms]  <<<  URB 119 coming back  <<< 
-- URB_FUNCTION_CONTROL_TRANSFER:
  PipeHandle           = 0d937120
  TransferFlags        = 0000000a (USBD_TRANSFER_DIRECTION_OUT, USBD_SHORT_TRANSFER_OK)
  TransferBufferLength = 00000040
  TransferBuffer       = 03771400
  TransferBufferMDL    = 0e126e00
  UrbLink              = 00000000
  SetupPacket          =
    00000000: 40 01 05 00 00 00 40 00
[365813 ms] UsbSnoop - FilterDispatchAny(0dd57b90) : IRP_MJ_INTERNAL_DEVICE_CONTROL
[365813 ms] UsbSnoop - FdoHookDispatchInternalIoctl(0dd57f8c) : fdo=09b44040, Irp=07ed8930, IRQL=0
[365813 ms]  >>>  URB 120 going down  >>> 
-- URB_FUNCTION_VENDOR_DEVICE:
  TransferFlags          = 00000002 (USBD_TRANSFER_DIRECTION_OUT, USBD_SHORT_TRANSFER_OK)
  TransferBufferLength = 00000040
  TransferBuffer       = 03771400
  TransferBufferMDL    = 00000000
    00000000: 05 ff 81 f4 8a e9 91 e0 20 90 dc 02 30 90 dd 02
    00000010: 28 0e 39 1e 30 92 ed 02 20 92 ec 02 22 24 20 92
    00000020: 72 00 02 c0 0e 94 0b 09 80 91 73 00 84 30 49 f0
    00000030: 81 e0 80 93 73 00 22 24 33 24 30 92 ef 02 20 92
  UrbLink                 = 00000000
  RequestTypeReservedBits = 00000000
  Request                 = 00000001
  Value                   = 00000005
  Index                   = 00000000
[365813 ms] UsbSnoop - MyInternalIOCTLCompletion(0dd57ddc) : fido=00000000, Irp=07ed8930, Context=0abca400, IRQL=2
[365813 ms]  <<<  URB 120 coming back  <<< 
-- URB_FUNCTION_CONTROL_TRANSFER:
  PipeHandle           = 0d937120
  TransferFlags        = 0000000a (USBD_TRANSFER_DIRECTION_OUT, USBD_SHORT_TRANSFER_OK)
  TransferBufferLength = 00000040
  TransferBuffer       = 03771400
  TransferBufferMDL    = 0e126e00
  UrbLink              = 00000000
  SetupPacket          =
    00000000: 40 01 05 00 00 00 40 00
[365813 ms] UsbSnoop - FilterDispatchAny(0dd57b90) : IRP_MJ_INTERNAL_DEVICE_CONTROL
[365813 ms] UsbSnoop - FdoHookDispatchInternalIoctl(0dd57f8c) : fdo=09b44040, Irp=07ed8930, IRQL=0
[365813 ms]  >>>  URB 121 going down  >>> 
-- URB_FUNCTION_VENDOR_DEVICE:
  TransferFlags          = 00000002 (USBD_TRANSFER_DIRECTION_OUT, USBD_SHORT_TRANSFER_OK)
  TransferBufferLength = 00000040
  TransferBuffer       = 03771400
  TransferBufferMDL    = 00000000
    00000000: 05 ff ee 02 08 95 80 91 d8 02 81 30 41 f4 20 90
    00000010: de 02 30 90 df 02 22 20 11 f4 33 20 19 f0 0e 94
    00000020: 0b 09 22 c0 80 91 dc 02 90 91 dd 02 82 30 e0 e0
    00000030: 9e 07 d0 f4 8a e9 91 e0 e0 91 dc 02 f0 91 dd 02
  UrbLink                 = 00000000
  RequestTypeReservedBits = 00000000
  Request                 = 00000001
  Value                   = 00000005
  Index                   = 00000000
[365813 ms] UsbSnoop - MyInternalIOCTLCompletion(0dd57ddc) : fido=00000000, Irp=07ed8930, Context=0abca400, IRQL=2
[365813 ms]  <<<  URB 121 coming back  <<< 
-- URB_FUNCTION_CONTROL_TRANSFER:
  PipeHandle           = 0d937120
  TransferFlags        = 0000000a (USBD_TRANSFER_DIRECTION_OUT, USBD_SHORT_TRANSFER_OK)
  TransferBufferLength = 00000040
  TransferBuffer       = 03771400
  TransferBufferMDL    = 0e126e00
  UrbLink              = 00000000
  SetupPacket          =
    00000000: 40 01 05 00 00 00 40 00
[365814 ms] UsbSnoop - FilterDispatchAny(0dd57b90) : IRP_MJ_INTERNAL_DEVICE_CONTROL
[365814 ms] UsbSnoop - FdoHookDispatchInternalIoctl(0dd57f8c) : fdo=09b44040, Irp=07ed8930, IRQL=0
[365814 ms]  >>>  URB 122 going down  >>> 
-- URB_FUNCTION_VENDOR_DEVICE:
  TransferFlags          = 00000002 (USBD_TRANSFER_DIRECTION_OUT, USBD_SHORT_TRANSFER_OK)
  TransferBufferLength = 00000040
  TransferBuffer       = 03771400
  TransferBufferMDL    = 00000000
    00000000: 05 ff e8 0f f9 1f 20 90 da 02 30 90 db 02 20 82
    00000010: e0 91 dc 02 f0 91 dd 02 e8 0f f9 1f 20 80 22 20
    00000020: 19 f0 0e 94 3d 09 01 c0 00 00 80 91 73 00 84 30
    00000030: 61 f0 20 90 1c 15 27 fc fc cf 22 24 20 92 1b 15
  UrbLink                 = 00000000
  RequestTypeReservedBits = 00000000
  Request                 = 00000001
  Value                   = 00000005
  Index                   = 00000000
[365814 ms] UsbSnoop - MyInternalIOCTLCompletion(0dd57ddc) : fido=00000000, Irp=07ed8930, Context=0abca400, IRQL=2
[365814 ms]  <<<  URB 122 coming back  <<< 
-- URB_FUNCTION_CONTROL_TRANSFER:
  PipeHandle           = 0d937120
  TransferFlags        = 0000000a (USBD_TRANSFER_DIRECTION_OUT, USBD_SHORT_TRANSFER_OK)
  TransferBufferLength = 00000040
  TransferBuffer       = 03771400
  TransferBufferMDL    = 0e126e00
  UrbLink              = 00000000
  SetupPacket          =
    00000000: 40 01 05 00 00 00 40 00
[365814 ms] UsbSnoop - FilterDispatchAny(0dd57b90) : IRP_MJ_INTERNAL_DEVICE_CONTROL
[365814 ms] UsbSnoop - FdoHookDispatchInternalIoctl(0dd57f8c) : fdo=09b44040, Irp=09d6f690, IRQL=0
[365814 ms]  >>>  URB 123 going down  >>> 
-- URB_FUNCTION_VENDOR_DEVICE:
  TransferFlags          = 00000002 (USBD_TRANSFER_DIRECTION_OUT, USBD_SHORT_TRANSFER_OK)
  TransferBufferLength = 00000040
  TransferBuffer       = 03771400
  TransferBufferMDL    = 00000000
    00000000: 05 ff 80 91 1c 15 80 68 80 93 1c 15 08 95 68 94
    00000010: da 92 d1 2e 04 c0 e8 94 da 92 d1 2e d3 26 17 ff
    00000020: 04 c0 10 95 00 95 0f 5f 1f 4f 37 ff 04 c0 30 95
    00000030: 20 95 2f 5f 3f 4f 0e 94 52 0e d7 fe 04 c0 10 95
  UrbLink                 = 00000000
  RequestTypeReservedBits = 00000000
  Request                 = 00000001
  Value                   = 00000005
  Index                   = 00000000
[365814 ms] UsbSnoop - MyInternalIOCTLCompletion(0dd57ddc) : fido=00000000, Irp=09d6f690, Context=0abca400, IRQL=2
[365814 ms]  <<<  URB 123 coming back  <<< 
-- URB_FUNCTION_CONTROL_TRANSFER:
  PipeHandle           = 0d937120
  TransferFlags        = 0000000a (USBD_TRANSFER_DIRECTION_OUT, USBD_SHORT_TRANSFER_OK)
  TransferBufferLength = 00000040
  TransferBuffer       = 03771400
  TransferBufferMDL    = 0dc7a170
  UrbLink              = 00000000
  SetupPacket          =
    00000000: 40 01 05 00 00 00 40 00
[365814 ms] UsbSnoop - FilterDispatchAny(0dd57b90) : IRP_MJ_INTERNAL_DEVICE_CONTROL
[365814 ms] UsbSnoop - FdoHookDispatchInternalIoctl(0dd57f8c) : fdo=09b44040, Irp=09d6f690, IRQL=0
[365814 ms]  >>>  URB 124 going down  >>> 
-- URB_FUNCTION_VENDOR_DEVICE:
  TransferFlags          = 00000002 (USBD_TRANSFER_DIRECTION_OUT, USBD_SHORT_TRANSFER_OK)
  TransferBufferLength = 00000040
  TransferBuffer       = 03771400
  TransferBufferMDL    = 00000000
    00000000: 05 ff 00 95 0f 5f 1f 4f d9 90 08 95 68 94 01 c0
    00000010: e8 94 ea 92 fa 92 8a 93 ee 24 ff 24 80 e1 00 0f
    00000020: 11 1f ee 1c ff 1c e2 16 f3 06 18 f0 e2 1a f3 0a
    00000030: 03 95 8a 95 a1 f7 16 f4 0e 2d 1f 2d 89 91 f9 90
  UrbLink                 = 00000000
  RequestTypeReservedBits = 00000000
  Request                 = 00000001
  Value                   = 00000005
  Index                   = 00000000
[365814 ms] UsbSnoop - MyInternalIOCTLCompletion(0dd57ddc) : fido=00000000, Irp=09d6f690, Context=0abca400, IRQL=2
[365814 ms]  <<<  URB 124 coming back  <<< 
-- URB_FUNCTION_CONTROL_TRANSFER:
  PipeHandle           = 0d937120
  TransferFlags        = 0000000a (USBD_TRANSFER_DIRECTION_OUT, USBD_SHORT_TRANSFER_OK)
  TransferBufferLength = 00000040
  TransferBuffer       = 03771400
  TransferBufferMDL    = 0e126e00
  UrbLink              = 00000000
  SetupPacket          =
    00000000: 40 01 05 00 00 00 40 00
[365814 ms] UsbSnoop - FilterDispatchAny(0dd57b90) : IRP_MJ_INTERNAL_DEVICE_CONTROL
[365814 ms] UsbSnoop - FdoHookDispatchInternalIoctl(0dd57f8c) : fdo=09b44040, Irp=09d6f690, IRQL=0
[365814 ms]  >>>  URB 125 going down  >>> 
-- URB_FUNCTION_VENDOR_DEVICE:
  TransferFlags          = 00000002 (USBD_TRANSFER_DIRECTION_OUT, USBD_SHORT_TRANSFER_OK)
  TransferBufferLength = 00000040
  TransferBuffer       = 03771400
  TransferBufferMDL    = 00000000
    00000000: 05 ff e9 90 08 95 e2 e0 0c 94 80 0e e4 e0 0c 94
    00000010: 80 0e ee 27 0c 94 80 0e fa 92 ea 92 da 92 ca 92
    00000020: ba 92 aa 92 7a 93 6a 93 5a 93 4a 93 08 95 e1 e0
    00000030: 49 91 59 91 e0 fd 08 95 69 91 79 91 e1 fd 08 95
  UrbLink                 = 00000000
  RequestTypeReservedBits = 00000000
  Request                 = 00000001
  Value                   = 00000005
  Index                   = 00000000
[365814 ms] UsbSnoop - MyInternalIOCTLCompletion(0dd57ddc) : fido=00000000, Irp=09d6f690, Context=0abca400, IRQL=2
[365814 ms]  <<<  URB 125 coming back  <<< 
-- URB_FUNCTION_CONTROL_TRANSFER:
  PipeHandle           = 0d937120
  TransferFlags        = 0000000a (USBD_TRANSFER_DIRECTION_OUT, USBD_SHORT_TRANSFER_OK)
  TransferBufferLength = 00000040
  TransferBuffer       = 03771400
  TransferBufferMDL    = 0e126e00
  UrbLink              = 00000000
  SetupPacket          =
    00000000: 40 01 05 00 00 00 40 00
[365815 ms] UsbSnoop - FilterDispatchAny(0dd57b90) : IRP_MJ_INTERNAL_DEVICE_CONTROL
[365815 ms] UsbSnoop - FdoHookDispatchInternalIoctl(0dd57f8c) : fdo=09b44040, Irp=09d6f690, IRQL=0
[365815 ms]  >>>  URB 126 going down  >>> 
-- URB_FUNCTION_VENDOR_DEVICE:
  TransferFlags          = 00000002 (USBD_TRANSFER_DIRECTION_OUT, USBD_SHORT_TRANSFER_OK)
  TransferBufferLength = 00000040
  TransferBuffer       = 03771400
  TransferBufferMDL    = 00000000
    00000000: 05 ff a9 90 b9 90 e2 fd 08 95 c9 90 d9 90 e3 fd
    00000010: 08 95 e9 90 f9 90 08 95 22 23 21 f0 00 0f 11 1f
    00000020: 2a 95 fa cf 08 95 ff ff ff ff ff ff ff ff ff ff
    00000030: ff ff ff ff ff ff ff ff ff ff ff ff ff ff ff ff
  UrbLink                 = 00000000
  RequestTypeReservedBits = 00000000
  Request                 = 00000001
  Value                   = 00000005
  Index                   = 00000000
[365815 ms] UsbSnoop - MyInternalIOCTLCompletion(0dd57ddc) : fido=00000000, Irp=09d6f690, Context=0abca400, IRQL=2
[365815 ms]  <<<  URB 126 coming back  <<< 
-- URB_FUNCTION_CONTROL_TRANSFER:
  PipeHandle           = 0d937120
  TransferFlags        = 0000000a (USBD_TRANSFER_DIRECTION_OUT, USBD_SHORT_TRANSFER_OK)
  TransferBufferLength = 00000040
  TransferBuffer       = 03771400
  TransferBufferMDL    = 0e126e00
  UrbLink              = 00000000
  SetupPacket          =
    00000000: 40 01 05 00 00 00 40 00
[365815 ms] UsbSnoop - FilterDispatchAny(0dd57b90) : IRP_MJ_INTERNAL_DEVICE_CONTROL
[365815 ms] UsbSnoop - FdoHookDispatchInternalIoctl(0dd57f8c) : fdo=09b44040, Irp=09d6f690, IRQL=0
[365815 ms]  >>>  URB 127 going down  >>> 
-- URB_FUNCTION_VENDOR_DEVICE:
  TransferFlags          = 00000002 (USBD_TRANSFER_DIRECTION_OUT, USBD_SHORT_TRANSFER_OK)
  TransferBufferLength = 00000002
  TransferBuffer       = 037713f0
  TransferBufferMDL    = 00000000
    00000000: 07 00
  UrbLink                 = 00000000
  RequestTypeReservedBits = 00000000
  Request                 = 00000001
  Value                   = 00000007
  Index                   = 00000000
[365815 ms] UsbSnoop - MyInternalIOCTLCompletion(0dd57ddc) : fido=00000000, Irp=09d6f690, Context=0abca400, IRQL=2
[365815 ms]  <<<  URB 127 coming back  <<< 
-- URB_FUNCTION_CONTROL_TRANSFER:
  PipeHandle           = 0d937120
  TransferFlags        = 0000000a (USBD_TRANSFER_DIRECTION_OUT, USBD_SHORT_TRANSFER_OK)
  TransferBufferLength = 00000002
  TransferBuffer       = 037713f0
  TransferBufferMDL    = 0e126e00
  UrbLink              = 00000000
  SetupPacket          =
    00000000: 40 01 07 00 00 00 02 00
[365815 ms] UsbSnoop - FilterDispatchPnp(0dd6020c) : IRP_MJ_PNP (IRP_MN_REMOVE_DEVICE)
[366062 ms] UsbSnoop - FilterAddDevice(0dd60008) : DriverObject 09d16c60, pdo 0c4c5060
[366062 ms] UsbSnoop - FilterDispatchPnp(0dd6020c) : IRP_MJ_PNP (IRP_MN_QUERY_DEVICE_RELATIONS)
[366062 ms] UsbSnoop - FdoHookDispatchPnp(0dd6020c) : IRP_MJ_PNP (IRP_MN_QUERY_DEVICE_RELATIONS)
[366062 ms] UsbSnoop - FilterDispatchPnp(0dd6020c) : IRP_MJ_PNP (IRP_MN_QUERY_INTERFACE)
[366062 ms] UsbSnoop - FdoHookDispatchPnp(0dd6020c) : IRP_MJ_PNP (IRP_MN_QUERY_INTERFACE)
[366062 ms] UsbSnoop - FilterDispatchPnp(0dd6020c) : IRP_MJ_PNP (IRP_MN_QUERY_LEGACY_BUS_INFORMATION)
[366062 ms] UsbSnoop - FdoHookDispatchPnp(0dd6020c) : IRP_MJ_PNP (IRP_MN_QUERY_LEGACY_BUS_INFORMATION)
[366062 ms] UsbSnoop - FilterDispatchPnp(0dd6020c) : IRP_MJ_PNP (IRP_MN_QUERY_RESOURCE_REQUIREMENTS)
[366062 ms] UsbSnoop - FdoHookDispatchPnp(0dd6020c) : IRP_MJ_PNP (IRP_MN_QUERY_RESOURCE_REQUIREMENTS)
[366062 ms] UsbSnoop - FilterDispatchPnp(0dd6020c) : IRP_MJ_PNP (IRP_MN_FILTER_RESOURCE_REQUIREMENTS)
[366062 ms] UsbSnoop - FdoHookDispatchPnp(0dd6020c) : IRP_MJ_PNP (IRP_MN_FILTER_RESOURCE_REQUIREMENTS)
[366062 ms] UsbSnoop - FilterDispatchPnp(0dd6020c) : IRP_MJ_PNP (IRP_MN_START_DEVICE)
[366062 ms] UsbSnoop - FdoHookDispatchPnp(0dd6020c) : IRP_MJ_PNP (IRP_MN_START_DEVICE)
[366063 ms] UsbSnoop - FilterDispatchPnp(0dd6020c) : IRP_MJ_PNP (IRP_MN_START_DEVICE)
[366063 ms] UsbSnoop - FdoHookDispatchPnp(0dd6020c) : IRP_MJ_PNP (IRP_MN_START_DEVICE)
[366063 ms] UsbSnoop - FilterDispatchAny(0dd57b90) : IRP_MJ_INTERNAL_DEVICE_CONTROL
[366063 ms] UsbSnoop - FdoHookDispatchInternalIoctl(0dd57f8c) : fdo=09d39410, Irp=0d8ccb40, IRQL=0
[366063 ms]  >>>  URB 1 going down  >>> 
-- URB_FUNCTION_GET_DESCRIPTOR_FROM_DEVICE:
  TransferBufferLength = 00000012
  TransferBuffer       = 0e0f2740
  TransferBufferMDL    = 00000000
  Index                = 00000000
  DescriptorType       = 00000001 (USB_DEVICE_DESCRIPTOR_TYPE)
  LanguageId           = 00000000
[366064 ms] UsbSnoop - MyInternalIOCTLCompletion(0dd57ddc) : fido=00000000, Irp=0d8ccb40, Context=0abca400, IRQL=2
[366064 ms]  <<<  URB 1 coming back  <<< 
-- URB_FUNCTION_CONTROL_TRANSFER:
  PipeHandle           = 0d937120
  TransferFlags        = 000037ff (USBD_TRANSFER_DIRECTION_IN, USBD_SHORT_TRANSFER_OK)
  TransferBufferLength = 00000012
  TransferBuffer       = 0e0f2740
  TransferBufferMDL    = 0d8f4740
    00000000: 12 01 00 02 00 00 00 40 88 1c 3c 00 00 01 01 02
    00000010: 03 01
  UrbLink              = 00000000
  SetupPacket          =
    00000000: 80 06 00 01 00 00 12 00
[366064 ms] UsbSnoop - FilterDispatchAny(0dd57b90) : IRP_MJ_INTERNAL_DEVICE_CONTROL
[366064 ms] UsbSnoop - FdoHookDispatchInternalIoctl(0dd57f8c) : fdo=09d39410, Irp=098f3b40, IRQL=0
[366064 ms]  >>>  URB 2 going down  >>> 
-- URB_FUNCTION_GET_DESCRIPTOR_FROM_DEVICE:
  TransferBufferLength = 00000009
  TransferBuffer       = 0de72160
  TransferBufferMDL    = 00000000
  Index                = 00000000
  DescriptorType       = 00000002 (USB_CONFIGURATION_DESCRIPTOR_TYPE)
  LanguageId           = 00000000
[366064 ms] UsbSnoop - MyInternalIOCTLCompletion(0dd57ddc) : fido=00000000, Irp=098f3b40, Context=0abca400, IRQL=2
[366064 ms]  <<<  URB 2 coming back  <<< 
-- URB_FUNCTION_CONTROL_TRANSFER:
  PipeHandle           = 0d937120
  TransferFlags        = 000037ff (USBD_TRANSFER_DIRECTION_IN, USBD_SHORT_TRANSFER_OK)
  TransferBufferLength = 00000009
  TransferBuffer       = 0de72160
  TransferBufferMDL    = 0da71dc0
    00000000: 09 02 32 00 01 01 00 80 fa
  UrbLink              = 00000000
  SetupPacket          =
    00000000: 80 06 00 02 00 00 09 00
[366064 ms] UsbSnoop - FilterDispatchAny(0dd57b90) : IRP_MJ_INTERNAL_DEVICE_CONTROL
[366064 ms] UsbSnoop - FdoHookDispatchInternalIoctl(0dd57f8c) : fdo=09d39410, Irp=098f3b40, IRQL=0
[366064 ms]  >>>  URB 3 going down  >>> 
-- URB_FUNCTION_GET_DESCRIPTOR_FROM_DEVICE:
  TransferBufferLength = 00000042
  TransferBuffer       = 09cfce20
  TransferBufferMDL    = 00000000
  Index                = 00000000
  DescriptorType       = 00000002 (USB_CONFIGURATION_DESCRIPTOR_TYPE)
  LanguageId           = 00000000
[366064 ms] UsbSnoop - MyInternalIOCTLCompletion(0dd57ddc) : fido=00000000, Irp=098f3b40, Context=0abca400, IRQL=2
[366064 ms]  <<<  URB 3 coming back  <<< 
-- URB_FUNCTION_CONTROL_TRANSFER:
  PipeHandle           = 0d937120
  TransferFlags        = 000037ff (USBD_TRANSFER_DIRECTION_IN, USBD_SHORT_TRANSFER_OK)
  TransferBufferLength = 00000032
  TransferBuffer       = 09cfce20
  TransferBufferMDL    = 0da71dc0
    00000000: 09 02 32 00 01 01 00 80 fa 09 04 00 00 00 ff ff
    00000010: ff 00 09 04 00 01 01 ff ff ff 00 07 05 82 05 ff
    00000020: 03 01 09 04 00 02 01 ff ff ff 00 07 05 82 05 00
    00000030: 14 01
  UrbLink              = 00000000
  SetupPacket          =
    00000000: 80 06 00 02 00 00 42 00
[366064 ms] UsbSnoop - FilterDispatchAny(0dd57b90) : IRP_MJ_INTERNAL_DEVICE_CONTROL
[366064 ms] UsbSnoop - FdoHookDispatchInternalIoctl(0dd57f8c) : fdo=09d39410, Irp=098f3b40, IRQL=0
[366064 ms]  >>>  URB 4 going down  >>> 
-- URB_FUNCTION_SELECT_CONFIGURATION:
  ConfigurationDescriptor = 0x09cfce20 (configure)
  ConfigurationDescriptor : bLength             = 9
  ConfigurationDescriptor : bDescriptorType     = 0x00000002
  ConfigurationDescriptor : wTotalLength        = 0x00000032
  ConfigurationDescriptor : bNumInterfaces      = 0x00000001
  ConfigurationDescriptor : bConfigurationValue = 0x00000001
  ConfigurationDescriptor : iConfiguration      = 0x00000000
  ConfigurationDescriptor : bmAttributes        = 0x00000080
  ConfigurationDescriptor : MaxPower            = 0x000000fa
  ConfigurationHandle     = 0x00000000
  Interface[0]: Length            = 24
  Interface[0]: InterfaceNumber   = 0
  Interface[0]: AlternateSetting  = 0
[366064 ms] UsbSnoop - MyInternalIOCTLCompletion(0dd57ddc) : fido=00000000, Irp=098f3b40, Context=0abca400, IRQL=0
[366064 ms]  <<<  URB 4 coming back  <<< 
-- URB_FUNCTION_SELECT_CONFIGURATION:
  ConfigurationDescriptor = 0x09cfce20 (configure)
  ConfigurationDescriptor : bLength             = 9
  ConfigurationDescriptor : bDescriptorType     = 0x00000002
  ConfigurationDescriptor : wTotalLength        = 0x00000032
  ConfigurationDescriptor : bNumInterfaces      = 0x00000001
  ConfigurationDescriptor : bConfigurationValue = 0x00000001
  ConfigurationDescriptor : iConfiguration      = 0x00000000
  ConfigurationDescriptor : bmAttributes        = 0x00000080
  ConfigurationDescriptor : MaxPower            = 0x000000fa
  ConfigurationHandle     = 0x098ed8b0
  Interface[0]: Length            = 24
  Interface[0]: InterfaceNumber   = 0
  Interface[0]: AlternateSetting  = 0
  Interface[0]: Class             = 0x000000ff
  Interface[0]: SubClass          = 0x000000ff
  Interface[0]: Protocol          = 0x000000ff
  Interface[0]: InterfaceHandle   = 0x0dbf31c0
  Interface[0]: NumberOfPipes     = 0
[366064 ms] UsbSnoop - FilterDispatchAny(0dd57b90) : IRP_MJ_INTERNAL_DEVICE_CONTROL
[366064 ms] UsbSnoop - FdoHookDispatchInternalIoctl(0dd57f8c) : fdo=09d39410, Irp=098f3b40, IRQL=0
[366064 ms]  >>>  URB 5 going down  >>> 
-- URB_FUNCTION_VENDOR_DEVICE:
  TransferFlags          = 00000003 (USBD_TRANSFER_DIRECTION_IN, USBD_SHORT_TRANSFER_OK)
  TransferBufferLength = 00000002
  TransferBuffer       = 037944b0
  TransferBufferMDL    = 00000000
  UrbLink                 = 00000000
  RequestTypeReservedBits = 00000000
  Request                 = 00000001
  Value                   = 00000001
  Index                   = 00000000
[366065 ms] UsbSnoop - MyInternalIOCTLCompletion(0dd57ddc) : fido=00000000, Irp=098f3b40, Context=0abca400, IRQL=2
[366065 ms]  <<<  URB 5 coming back  <<< 
-- URB_FUNCTION_CONTROL_TRANSFER:
  PipeHandle           = 0d937120
  TransferFlags        = 0000000b (USBD_TRANSFER_DIRECTION_IN, USBD_SHORT_TRANSFER_OK)
  TransferBufferLength = 00000002
  TransferBuffer       = 037944b0
  TransferBufferMDL    = 0da71dc0
    00000000: 01 03
  UrbLink              = 00000000
  SetupPacket          =
    00000000: c0 01 01 00 00 00 02 00
[366065 ms] UsbSnoop - FilterDispatchAny(0dd57b90) : IRP_MJ_INTERNAL_DEVICE_CONTROL
[366065 ms] UsbSnoop - FdoHookDispatchInternalIoctl(0dd57f8c) : fdo=09d39410, Irp=098f3b40, IRQL=0
[366065 ms]  >>>  URB 6 going down  >>> 
-- URB_FUNCTION_VENDOR_DEVICE:
  TransferFlags          = 00000002 (USBD_TRANSFER_DIRECTION_OUT, USBD_SHORT_TRANSFER_OK)
  TransferBufferLength = 0000000d
  TransferBuffer       = 037943c0
  TransferBufferMDL    = 00000000
    00000000: 0b 00 00 82 01 00 3a 80 f0 43 79 03 80
  UrbLink                 = 00000000
  RequestTypeReservedBits = 00000000
  Request                 = 00000001
  Value                   = 0000000b
  Index                   = 00000000
[366065 ms] UsbSnoop - MyInternalIOCTLCompletion(0dd57ddc) : fido=00000000, Irp=098f3b40, Context=0abca400, IRQL=2
[366065 ms]  <<<  URB 6 coming back  <<< 
-- URB_FUNCTION_CONTROL_TRANSFER:
  PipeHandle           = 0d937120
  TransferFlags        = 0000000a (USBD_TRANSFER_DIRECTION_OUT, USBD_SHORT_TRANSFER_OK)
  TransferBufferLength = 0000000d
  TransferBuffer       = 037943c0
  TransferBufferMDL    = 0da71dc0
  UrbLink              = 00000000
  SetupPacket          =
    00000000: 40 01 0b 00 00 00 0d 00
[366065 ms] UsbSnoop - FilterDispatchAny(0dd57b90) : IRP_MJ_INTERNAL_DEVICE_CONTROL
[366065 ms] UsbSnoop - FdoHookDispatchInternalIoctl(0dd57f8c) : fdo=09d39410, Irp=098f3b40, IRQL=0
[366065 ms]  >>>  URB 7 going down  >>> 
-- URB_FUNCTION_VENDOR_DEVICE:
  TransferFlags          = 00000002 (USBD_TRANSFER_DIRECTION_OUT, USBD_SHORT_TRANSFER_OK)
  TransferBufferLength = 0000000d
  TransferBuffer       = 037943c0
  TransferBufferMDL    = 00000000
    00000000: 0b 00 00 82 01 00 3b 00 f0 43 79 03 80
  UrbLink                 = 00000000
  RequestTypeReservedBits = 00000000
  Request                 = 00000001
  Value                   = 0000000b
  Index                   = 00000000
[366065 ms] UsbSnoop - MyInternalIOCTLCompletion(0dd57ddc) : fido=00000000, Irp=098f3b40, Context=0abca400, IRQL=2
[366065 ms]  <<<  URB 7 coming back  <<< 
-- URB_FUNCTION_CONTROL_TRANSFER:
  PipeHandle           = 0d937120
  TransferFlags        = 0000000a (USBD_TRANSFER_DIRECTION_OUT, USBD_SHORT_TRANSFER_OK)
  TransferBufferLength = 0000000d
  TransferBuffer       = 037943c0
  TransferBufferMDL    = 0da71dc0
  UrbLink              = 00000000
  SetupPacket          =
    00000000: 40 01 0b 00 00 00 0d 00
[366065 ms] UsbSnoop - FilterDispatchAny(0dd57b90) : IRP_MJ_INTERNAL_DEVICE_CONTROL
[366065 ms] UsbSnoop - FdoHookDispatchInternalIoctl(0dd57f8c) : fdo=09d39410, Irp=098f3b40, IRQL=0
[366065 ms]  >>>  URB 8 going down  >>> 
-- URB_FUNCTION_VENDOR_DEVICE:
  TransferFlags          = 00000002 (USBD_TRANSFER_DIRECTION_OUT, USBD_SHORT_TRANSFER_OK)
  TransferBufferLength = 0000000d
  TransferBuffer       = 037943c0
  TransferBufferMDL    = 00000000
    00000000: 0b 00 00 82 01 00 34 01 f0 43 79 03 80
  UrbLink                 = 00000000
  RequestTypeReservedBits = 00000000
  Request                 = 00000001
  Value                   = 0000000b
  Index                   = 00000000
[366065 ms] UsbSnoop - MyInternalIOCTLCompletion(0dd57ddc) : fido=00000000, Irp=098f3b40, Context=0abca400, IRQL=2
[366065 ms]  <<<  URB 8 coming back  <<< 
-- URB_FUNCTION_CONTROL_TRANSFER:
  PipeHandle           = 0d937120
  TransferFlags        = 0000000a (USBD_TRANSFER_DIRECTION_OUT, USBD_SHORT_TRANSFER_OK)
  TransferBufferLength = 0000000d
  TransferBuffer       = 037943c0
  TransferBufferMDL    = 0da71dc0
  UrbLink              = 00000000
  SetupPacket          =
    00000000: 40 01 0b 00 00 00 0d 00
[366065 ms] UsbSnoop - FilterDispatchAny(0dd57b90) : IRP_MJ_INTERNAL_DEVICE_CONTROL
[366065 ms] UsbSnoop - FdoHookDispatchInternalIoctl(0dd57f8c) : fdo=09d39410, Irp=098f3b40, IRQL=0
[366065 ms]  >>>  URB 9 going down  >>> 
-- URB_FUNCTION_VENDOR_DEVICE:
  TransferFlags          = 00000002 (USBD_TRANSFER_DIRECTION_OUT, USBD_SHORT_TRANSFER_OK)
  TransferBufferLength = 0000000d
  TransferBuffer       = 037943c0
  TransferBufferMDL    = 00000000
    00000000: 0b 00 00 82 01 00 35 00 f0 43 79 03 80
  UrbLink                 = 00000000
  RequestTypeReservedBits = 00000000
  Request                 = 00000001
  Value                   = 0000000b
  Index                   = 00000000
[366066 ms] UsbSnoop - MyInternalIOCTLCompletion(0dd57ddc) : fido=00000000, Irp=098f3b40, Context=0abca400, IRQL=2
[366066 ms]  <<<  URB 9 coming back  <<< 
-- URB_FUNCTION_CONTROL_TRANSFER:
  PipeHandle           = 0d937120
  TransferFlags        = 0000000a (USBD_TRANSFER_DIRECTION_OUT, USBD_SHORT_TRANSFER_OK)
  TransferBufferLength = 0000000d
  TransferBuffer       = 037943c0
  TransferBufferMDL    = 0da71dc0
  UrbLink              = 00000000
  SetupPacket          =
    00000000: 40 01 0b 00 00 00 0d 00
[366066 ms] UsbSnoop - FilterDispatchPnp(0dd6020c) : IRP_MJ_PNP (IRP_MN_QUERY_INTERFACE)
[366066 ms] UsbSnoop - FdoHookDispatchPnp(0dd6020c) : IRP_MJ_PNP (IRP_MN_QUERY_INTERFACE)
[366068 ms] UsbSnoop - FilterDispatchPnp(0dd6020c) : IRP_MJ_PNP (IRP_MN_QUERY_CAPABILITIES)
[366068 ms] UsbSnoop - FdoHookDispatchPnp(0dd6020c) : IRP_MJ_PNP (IRP_MN_QUERY_CAPABILITIES)
[366068 ms] UsbSnoop - FilterDispatchPnp(0dd6020c) : IRP_MJ_PNP (IRP_MN_QUERY_PNP_DEVICE_STATE)
[366068 ms] UsbSnoop - FdoHookDispatchPnp(0dd6020c) : IRP_MJ_PNP (IRP_MN_QUERY_PNP_DEVICE_STATE)
[366068 ms] UsbSnoop - FilterDispatchPnp(0dd6020c) : IRP_MJ_PNP (IRP_MN_QUERY_DEVICE_RELATIONS)
[366068 ms] UsbSnoop - FdoHookDispatchPnp(0dd6020c) : IRP_MJ_PNP (IRP_MN_QUERY_DEVICE_RELATIONS)
[366068 ms] UsbSnoop - FilterDispatchAny(0dd57b90) : IRP_MJ_SYSTEM_CONTROL
[380158 ms] UsbSnoop - FilterDispatchPnp(0dd6020c) : IRP_MJ_PNP (IRP_MN_QUERY_DEVICE_RELATIONS)
[380158 ms] UsbSnoop - FdoHookDispatchPnp(0dd6020c) : IRP_MJ_PNP (IRP_MN_QUERY_DEVICE_RELATIONS)
[380158 ms] UsbSnoop - FilterDispatchPnp(0dd6020c) : IRP_MJ_PNP (IRP_MN_QUERY_DEVICE_RELATIONS)
[380158 ms] UsbSnoop - FdoHookDispatchPnp(0dd6020c) : IRP_MJ_PNP (IRP_MN_QUERY_DEVICE_RELATIONS)
[380158 ms] UsbSnoop - FilterDispatchPnp(0dd6020c) : IRP_MJ_PNP (IRP_MN_SURPRISE_REMOVAL)
[380158 ms] UsbSnoop - FdoHookDispatchPnp(0dd6020c) : IRP_MJ_PNP (IRP_MN_SURPRISE_REMOVAL)
[380162 ms] UsbSnoop - FilterDispatchPnp(0dd6020c) : IRP_MJ_PNP (IRP_MN_REMOVE_DEVICE)
[444691 ms] UsbSnoop - FilterDispatchAny(0dd57b90) : IRP_MJ_INTERNAL_DEVICE_CONTROL
[444691 ms] UsbSnoop - FdoHookDispatchInternalIoctl(0dd57f8c) : fdo=0e2e29a0, Irp=09d70870, IRQL=0
[444691 ms]  >>>  URB 10350 going down  >>> 
-- URB_FUNCTION_VENDOR_DEVICE:
  TransferFlags          = 00000002 (USBD_TRANSFER_DIRECTION_OUT, USBD_SHORT_TRANSFER_OK)
  TransferBufferLength = 0000000d
  TransferBuffer       = 0ee927f0
  TransferBufferMDL    = 00000000
    00000000: 0b 00 00 82 01 17 40 00 95 2e 43 01 80
  UrbLink                 = 00000000
  RequestTypeReservedBits = 00000000
  Request                 = 00000001
  Value                   = 0000000b
  Index                   = 00000000
[444691 ms] UsbSnoop - MyInternalIOCTLCompletion(0dd57ddc) : fido=00000000, Irp=09d70870, Context=0abca400, IRQL=0
[444691 ms]  <<<  URB 10350 coming back  <<< 
-- URB_FUNCTION_VENDOR_DEVICE:
  TransferFlags          = 00000002 (USBD_TRANSFER_DIRECTION_OUT, USBD_SHORT_TRANSFER_OK)
  TransferBufferLength = 0000000d
  TransferBuffer       = 0ee927f0
  TransferBufferMDL    = 00000000
  UrbLink                 = 00000000
  RequestTypeReservedBits = 00000000
  Request                 = 00000001
  Value                   = 0000000b
  Index                   = 00000000
[444691 ms] UsbSnoop - FilterDispatchAny(0dd57b90) : IRP_MJ_INTERNAL_DEVICE_CONTROL
[444691 ms] UsbSnoop - FdoHookDispatchInternalIoctl(0dd57f8c) : fdo=0e2e29a0, Irp=09d70870, IRQL=0
[444691 ms]  >>>  URB 10351 going down  >>> 
-- URB_FUNCTION_ABORT_PIPE:
  PipeHandle = 077023c8 [endpoint 0x00000082]
[444691 ms] UsbSnoop - MyInternalIOCTLCompletion(0dd57ddc) : fido=00000000, Irp=09d70870, Context=0abca400, IRQL=0
[444691 ms]  <<<  URB 10351 coming back  <<< 
-- URB_FUNCTION_ABORT_PIPE:
[444707 ms] UsbSnoop - FilterDispatchPnp(0dd6020c) : IRP_MJ_PNP (IRP_MN_REMOVE_DEVICE)
