[8014345 ms] UsbSnoop - FilterAddDevice(0dd60008) : DriverObject 09d16c60, pdo 098f2060
[8014345 ms] UsbSnoop - FilterDispatchPnp(0dd6020c) : IRP_MJ_PNP (IRP_MN_QUERY_DEVICE_RELATIONS)
[8014345 ms] UsbSnoop - FdoHookDispatchPnp(0dd6020c) : IRP_MJ_PNP (IRP_MN_QUERY_DEVICE_RELATIONS)
[8014345 ms] UsbSnoop - FilterDispatchPnp(0dd6020c) : IRP_MJ_PNP (IRP_MN_QUERY_INTERFACE)
[8014345 ms] UsbSnoop - FdoHookDispatchPnp(0dd6020c) : IRP_MJ_PNP (IRP_MN_QUERY_INTERFACE)
[8014345 ms] UsbSnoop - FilterDispatchPnp(0dd6020c) : IRP_MJ_PNP (IRP_MN_QUERY_LEGACY_BUS_INFORMATION)
[8014345 ms] UsbSnoop - FdoHookDispatchPnp(0dd6020c) : IRP_MJ_PNP (IRP_MN_QUERY_LEGACY_BUS_INFORMATION)
[8014345 ms] UsbSnoop - FilterDispatchPnp(0dd6020c) : IRP_MJ_PNP (IRP_MN_QUERY_RESOURCE_REQUIREMENTS)
[8014345 ms] UsbSnoop - FdoHookDispatchPnp(0dd6020c) : IRP_MJ_PNP (IRP_MN_QUERY_RESOURCE_REQUIREMENTS)
[8014345 ms] UsbSnoop - FilterDispatchPnp(0dd6020c) : IRP_MJ_PNP (IRP_MN_FILTER_RESOURCE_REQUIREMENTS)
[8014345 ms] UsbSnoop - FdoHookDispatchPnp(0dd6020c) : IRP_MJ_PNP (IRP_MN_FILTER_RESOURCE_REQUIREMENTS)
[8014345 ms] UsbSnoop - FilterDispatchPnp(0dd6020c) : IRP_MJ_PNP (IRP_MN_START_DEVICE)
[8014345 ms] UsbSnoop - FdoHookDispatchPnp(0dd6020c) : IRP_MJ_PNP (IRP_MN_START_DEVICE)
[8014347 ms] UsbSnoop - FilterDispatchPnp(0dd6020c) : IRP_MJ_PNP (IRP_MN_START_DEVICE)
[8014347 ms] UsbSnoop - FdoHookDispatchPnp(0dd6020c) : IRP_MJ_PNP (IRP_MN_START_DEVICE)
[8014347 ms] UsbSnoop - FilterDispatchAny(0dd57b90) : IRP_MJ_INTERNAL_DEVICE_CONTROL
[8014347 ms] UsbSnoop - FdoHookDispatchInternalIoctl(0dd57f8c) : fdo=0e0d7ab0, Irp=0e5e9b40, IRQL=0
[8014347 ms]  >>>  URB 1 going down  >>> 
-- URB_FUNCTION_GET_DESCRIPTOR_FROM_DEVICE:
  TransferBufferLength = 00000012
  TransferBuffer       = 0e0872b0
  TransferBufferMDL    = 00000000
  Index                = 00000000
  DescriptorType       = 00000001 (USB_DEVICE_DESCRIPTOR_TYPE)
  LanguageId           = 00000000
[8014347 ms] UsbSnoop - MyInternalIOCTLCompletion(0dd57ddc) : fido=00000000, Irp=0e5e9b40, Context=0c522240, IRQL=2
[8014347 ms]  <<<  URB 1 coming back  <<< 
-- URB_FUNCTION_CONTROL_TRANSFER:
  PipeHandle           = 0d567060
  TransferFlags        = 0000000b (USBD_TRANSFER_DIRECTION_IN, USBD_SHORT_TRANSFER_OK)
  TransferBufferLength = 00000012
  TransferBuffer       = 0e0872b0
  TransferBufferMDL    = 071a2450
    00000000: 12 01 00 02 00 00 00 40 88 1c 3c 00 00 01 01 02
    00000010: 03 01
  UrbLink              = 00000000
  SetupPacket          =
    00000000: 80 06 00 01 00 00 12 00
[8014347 ms] UsbSnoop - FilterDispatchAny(0dd57b90) : IRP_MJ_INTERNAL_DEVICE_CONTROL
[8014347 ms] UsbSnoop - FdoHookDispatchInternalIoctl(0dd57f8c) : fdo=0e0d7ab0, Irp=0e5e9b40, IRQL=0
[8014347 ms]  >>>  URB 2 going down  >>> 
-- URB_FUNCTION_GET_DESCRIPTOR_FROM_DEVICE:
  TransferBufferLength = 00000009
  TransferBuffer       = 09d61c00
  TransferBufferMDL    = 00000000
  Index                = 00000000
  DescriptorType       = 00000002 (USB_CONFIGURATION_DESCRIPTOR_TYPE)
  LanguageId           = 00000000
[8014347 ms] UsbSnoop - MyInternalIOCTLCompletion(0dd57ddc) : fido=00000000, Irp=0e5e9b40, Context=0e020650, IRQL=2
[8014347 ms]  <<<  URB 2 coming back  <<< 
-- URB_FUNCTION_CONTROL_TRANSFER:
  PipeHandle           = 0d567060
  TransferFlags        = 0000000b (USBD_TRANSFER_DIRECTION_IN, USBD_SHORT_TRANSFER_OK)
  TransferBufferLength = 00000009
  TransferBuffer       = 09d61c00
  TransferBufferMDL    = 0db7da40
    00000000: 09 02 32 00 01 01 00 80 fa
  UrbLink              = 00000000
  SetupPacket          =
    00000000: 80 06 00 02 00 00 09 00
[8014347 ms] UsbSnoop - FilterDispatchAny(0dd57b90) : IRP_MJ_INTERNAL_DEVICE_CONTROL
[8014347 ms] UsbSnoop - FdoHookDispatchInternalIoctl(0dd57f8c) : fdo=0e0d7ab0, Irp=0e5e9b40, IRQL=0
[8014347 ms]  >>>  URB 3 going down  >>> 
-- URB_FUNCTION_GET_DESCRIPTOR_FROM_DEVICE:
  TransferBufferLength = 00000042
  TransferBuffer       = 078552d0
  TransferBufferMDL    = 00000000
  Index                = 00000000
  DescriptorType       = 00000002 (USB_CONFIGURATION_DESCRIPTOR_TYPE)
  LanguageId           = 00000000
[8014347 ms] UsbSnoop - MyInternalIOCTLCompletion(0dd57ddc) : fido=00000000, Irp=0e5e9b40, Context=09d1e8b0, IRQL=2
[8014347 ms]  <<<  URB 3 coming back  <<< 
-- URB_FUNCTION_CONTROL_TRANSFER:
  PipeHandle           = 0d567060
  TransferFlags        = 0000000b (USBD_TRANSFER_DIRECTION_IN, USBD_SHORT_TRANSFER_OK)
  TransferBufferLength = 00000032
  TransferBuffer       = 078552d0
  TransferBufferMDL    = 098a7cd0
    00000000: 09 02 32 00 01 01 00 80 fa 09 04 00 00 00 ff ff
    00000010: ff 00 09 04 00 01 01 ff ff ff 00 07 05 82 05 ff
    00000020: 03 01 09 04 00 02 01 ff ff ff 00 07 05 82 05 00
    00000030: 14 01
  UrbLink              = 00000000
  SetupPacket          =
    00000000: 80 06 00 02 00 00 42 00
[8014347 ms] UsbSnoop - FilterDispatchAny(0dd57b90) : IRP_MJ_INTERNAL_DEVICE_CONTROL
[8014347 ms] UsbSnoop - FdoHookDispatchInternalIoctl(0dd57f8c) : fdo=0e0d7ab0, Irp=0e5e9b40, IRQL=0
[8014347 ms]  >>>  URB 4 going down  >>> 
-- URB_FUNCTION_SELECT_CONFIGURATION:
  ConfigurationDescriptor = 0x078552d0 (configure)
  ConfigurationDescriptor : bLength             = 9
  ConfigurationDescriptor : bDescriptorType     = 0x00000002
  ConfigurationDescriptor : wTotalLength        = 0x00000032
  ConfigurationDescriptor : bNumInterfaces      = 0x00000001
  ConfigurationDescriptor : bConfigurationValue = 0x00000001
  ConfigurationDescriptor : iConfiguration      = 0x00000000
  ConfigurationDescriptor : bmAttributes        = 0x00000080
  ConfigurationDescriptor : MaxPower            = 0x000000fa
  ConfigurationHandle     = 0x00000000
  Interface[0]: Length            = 24
  Interface[0]: InterfaceNumber   = 0
  Interface[0]: AlternateSetting  = 0
[8014348 ms] UsbSnoop - MyInternalIOCTLCompletion(0dd57ddc) : fido=00000000, Irp=0e5e9b40, Context=0abca400, IRQL=0
[8014348 ms]  <<<  URB 4 coming back  <<< 
-- URB_FUNCTION_SELECT_CONFIGURATION:
  ConfigurationDescriptor = 0x078552d0 (configure)
  ConfigurationDescriptor : bLength             = 9
  ConfigurationDescriptor : bDescriptorType     = 0x00000002
  ConfigurationDescriptor : wTotalLength        = 0x00000032
  ConfigurationDescriptor : bNumInterfaces      = 0x00000001
  ConfigurationDescriptor : bConfigurationValue = 0x00000001
  ConfigurationDescriptor : iConfiguration      = 0x00000000
  ConfigurationDescriptor : bmAttributes        = 0x00000080
  ConfigurationDescriptor : MaxPower            = 0x000000fa
  ConfigurationHandle     = 0x0df2a4e0
  Interface[0]: Length            = 24
  Interface[0]: InterfaceNumber   = 0
  Interface[0]: AlternateSetting  = 0
  Interface[0]: Class             = 0x000000ff
  Interface[0]: SubClass          = 0x000000ff
  Interface[0]: Protocol          = 0x000000ff
  Interface[0]: InterfaceHandle   = 0x073264a0
  Interface[0]: NumberOfPipes     = 0
[8014348 ms] UsbSnoop - FilterDispatchAny(0dd57b90) : IRP_MJ_INTERNAL_DEVICE_CONTROL
[8014348 ms] UsbSnoop - FdoHookDispatchInternalIoctl(0dd57f8c) : fdo=0e0d7ab0, Irp=0e5e9b40, IRQL=0
[8014348 ms]  >>>  URB 5 going down  >>> 
-- URB_FUNCTION_VENDOR_DEVICE:
  TransferFlags          = 00000003 (USBD_TRANSFER_DIRECTION_IN, USBD_SHORT_TRANSFER_OK)
  TransferBufferLength = 00000002
  TransferBuffer       = 0379b4b0
  TransferBufferMDL    = 00000000
  UrbLink                 = 00000000
  RequestTypeReservedBits = 00000000
  Request                 = 00000001
  Value                   = 00000001
  Index                   = 00000000
[8014348 ms] UsbSnoop - MyInternalIOCTLCompletion(0dd57ddc) : fido=00000000, Irp=0e5e9b40, Context=0e1574f0, IRQL=2
[8014348 ms]  <<<  URB 5 coming back  <<< 
-- URB_FUNCTION_CONTROL_TRANSFER:
  PipeHandle           = 0d567060
  TransferFlags        = 0000000b (USBD_TRANSFER_DIRECTION_IN, USBD_SHORT_TRANSFER_OK)
  TransferBufferLength = 00000002
  TransferBuffer       = 0379b4b0
  TransferBufferMDL    = 098a7cd0
    00000000: 01 03
  UrbLink              = 00000000
  SetupPacket          =
    00000000: c0 01 01 00 00 00 02 00
[8014348 ms] UsbSnoop - FilterDispatchAny(0dd57b90) : IRP_MJ_INTERNAL_DEVICE_CONTROL
[8014348 ms] UsbSnoop - FdoHookDispatchInternalIoctl(0dd57f8c) : fdo=0e0d7ab0, Irp=0e5e9b40, IRQL=0
[8014348 ms]  >>>  URB 6 going down  >>> 
-- URB_FUNCTION_VENDOR_DEVICE:
  TransferFlags          = 00000002 (USBD_TRANSFER_DIRECTION_OUT, USBD_SHORT_TRANSFER_OK)
  TransferBufferLength = 0000000d
  TransferBuffer       = 0379b3c0
  TransferBufferMDL    = 00000000
    00000000: 0b 00 00 82 01 00 3a 80 f0 b3 79 03 80
  UrbLink                 = 00000000
  RequestTypeReservedBits = 00000000
  Request                 = 00000001
  Value                   = 0000000b
  Index                   = 00000000
[8014348 ms] UsbSnoop - MyInternalIOCTLCompletion(0dd57ddc) : fido=00000000, Irp=0e5e9b40, Context=09bd0440, IRQL=2
[8014348 ms]  <<<  URB 6 coming back  <<< 
-- URB_FUNCTION_CONTROL_TRANSFER:
  PipeHandle           = 0d567060
  TransferFlags        = 0000000a (USBD_TRANSFER_DIRECTION_OUT, USBD_SHORT_TRANSFER_OK)
  TransferBufferLength = 0000000d
  TransferBuffer       = 0379b3c0
  TransferBufferMDL    = 098a7cd0
  UrbLink              = 00000000
  SetupPacket          =
    00000000: 40 01 0b 00 00 00 0d 00
[8014348 ms] UsbSnoop - FilterDispatchAny(0dd57b90) : IRP_MJ_INTERNAL_DEVICE_CONTROL
[8014348 ms] UsbSnoop - FdoHookDispatchInternalIoctl(0dd57f8c) : fdo=0e0d7ab0, Irp=0e5e9b40, IRQL=0
[8014348 ms]  >>>  URB 7 going down  >>> 
-- URB_FUNCTION_VENDOR_DEVICE:
  TransferFlags          = 00000002 (USBD_TRANSFER_DIRECTION_OUT, USBD_SHORT_TRANSFER_OK)
  TransferBufferLength = 0000000d
  TransferBuffer       = 0379b3c0
  TransferBufferMDL    = 00000000
    00000000: 0b 00 00 82 01 00 3b 00 f0 b3 79 03 80
  UrbLink                 = 00000000
  RequestTypeReservedBits = 00000000
  Request                 = 00000001
  Value                   = 0000000b
  Index                   = 00000000
[8014348 ms] UsbSnoop - MyInternalIOCTLCompletion(0dd57ddc) : fido=00000000, Irp=0e5e9b40, Context=09bd0440, IRQL=2
[8014348 ms]  <<<  URB 7 coming back  <<< 
-- URB_FUNCTION_CONTROL_TRANSFER:
  PipeHandle           = 0d567060
  TransferFlags        = 0000000a (USBD_TRANSFER_DIRECTION_OUT, USBD_SHORT_TRANSFER_OK)
  TransferBufferLength = 0000000d
  TransferBuffer       = 0379b3c0
  TransferBufferMDL    = 098a7cd0
  UrbLink              = 00000000
  SetupPacket          =
    00000000: 40 01 0b 00 00 00 0d 00
[8014348 ms] UsbSnoop - FilterDispatchAny(0dd57b90) : IRP_MJ_INTERNAL_DEVICE_CONTROL
[8014348 ms] UsbSnoop - FdoHookDispatchInternalIoctl(0dd57f8c) : fdo=0e0d7ab0, Irp=0e5e9b40, IRQL=0
[8014348 ms]  >>>  URB 8 going down  >>> 
-- URB_FUNCTION_VENDOR_DEVICE:
  TransferFlags          = 00000002 (USBD_TRANSFER_DIRECTION_OUT, USBD_SHORT_TRANSFER_OK)
  TransferBufferLength = 0000000d
  TransferBuffer       = 0379b3c0
  TransferBufferMDL    = 00000000
    00000000: 0b 00 00 82 01 00 34 01 f0 b3 79 03 80
  UrbLink                 = 00000000
  RequestTypeReservedBits = 00000000
  Request                 = 00000001
  Value                   = 0000000b
  Index                   = 00000000
[8014349 ms] UsbSnoop - MyInternalIOCTLCompletion(0dd57ddc) : fido=00000000, Irp=0e5e9b40, Context=09bd0440, IRQL=2
[8014349 ms]  <<<  URB 8 coming back  <<< 
-- URB_FUNCTION_CONTROL_TRANSFER:
  PipeHandle           = 0d567060
  TransferFlags        = 0000000a (USBD_TRANSFER_DIRECTION_OUT, USBD_SHORT_TRANSFER_OK)
  TransferBufferLength = 0000000d
  TransferBuffer       = 0379b3c0
  TransferBufferMDL    = 098a7cd0
  UrbLink              = 00000000
  SetupPacket          =
    00000000: 40 01 0b 00 00 00 0d 00
[8014349 ms] UsbSnoop - FilterDispatchAny(0dd57b90) : IRP_MJ_INTERNAL_DEVICE_CONTROL
[8014349 ms] UsbSnoop - FdoHookDispatchInternalIoctl(0dd57f8c) : fdo=0e0d7ab0, Irp=0e5e9b40, IRQL=0
[8014349 ms]  >>>  URB 9 going down  >>> 
-- URB_FUNCTION_VENDOR_DEVICE:
  TransferFlags          = 00000002 (USBD_TRANSFER_DIRECTION_OUT, USBD_SHORT_TRANSFER_OK)
  TransferBufferLength = 0000000d
  TransferBuffer       = 0379b3c0
  TransferBufferMDL    = 00000000
    00000000: 0b 00 00 82 01 00 35 00 f0 b3 79 03 80
  UrbLink                 = 00000000
  RequestTypeReservedBits = 00000000
  Request                 = 00000001
  Value                   = 0000000b
  Index                   = 00000000
[8014349 ms] UsbSnoop - MyInternalIOCTLCompletion(0dd57ddc) : fido=00000000, Irp=0e5e9b40, Context=09bd0440, IRQL=2
[8014349 ms]  <<<  URB 9 coming back  <<< 
-- URB_FUNCTION_CONTROL_TRANSFER:
  PipeHandle           = 0d567060
  TransferFlags        = 0000000a (USBD_TRANSFER_DIRECTION_OUT, USBD_SHORT_TRANSFER_OK)
  TransferBufferLength = 0000000d
  TransferBuffer       = 0379b3c0
  TransferBufferMDL    = 098a7cd0
  UrbLink              = 00000000
  SetupPacket          =
    00000000: 40 01 0b 00 00 00 0d 00
[8014349 ms] UsbSnoop - FilterDispatchPnp(0dd6020c) : IRP_MJ_PNP (IRP_MN_QUERY_INTERFACE)
[8014349 ms] UsbSnoop - FdoHookDispatchPnp(0dd6020c) : IRP_MJ_PNP (IRP_MN_QUERY_INTERFACE)
[8014351 ms] UsbSnoop - FilterDispatchPnp(0dd6020c) : IRP_MJ_PNP (IRP_MN_QUERY_CAPABILITIES)
[8014351 ms] UsbSnoop - FdoHookDispatchPnp(0dd6020c) : IRP_MJ_PNP (IRP_MN_QUERY_CAPABILITIES)
[8014351 ms] UsbSnoop - FilterDispatchPnp(0dd6020c) : IRP_MJ_PNP (IRP_MN_QUERY_PNP_DEVICE_STATE)
[8014351 ms] UsbSnoop - FdoHookDispatchPnp(0dd6020c) : IRP_MJ_PNP (IRP_MN_QUERY_PNP_DEVICE_STATE)
[8014351 ms] UsbSnoop - FilterDispatchPnp(0dd6020c) : IRP_MJ_PNP (IRP_MN_QUERY_DEVICE_RELATIONS)
[8014351 ms] UsbSnoop - FdoHookDispatchPnp(0dd6020c) : IRP_MJ_PNP (IRP_MN_QUERY_DEVICE_RELATIONS)
[8014351 ms] UsbSnoop - FilterDispatchAny(0dd57b90) : IRP_MJ_SYSTEM_CONTROL
[8030111 ms] UsbSnoop - FilterDispatchAny(0dd57b90) : IRP_MJ_INTERNAL_DEVICE_CONTROL
[8030111 ms] UsbSnoop - FdoHookDispatchInternalIoctl(0dd57f8c) : fdo=0e0d7ab0, Irp=0d862b40, IRQL=0
[8030111 ms]  >>>  URB 10 going down  >>> 
-- URB_FUNCTION_VENDOR_DEVICE:
  TransferFlags          = 00000002 (USBD_TRANSFER_DIRECTION_OUT, USBD_SHORT_TRANSFER_OK)
  TransferBufferLength = 0000000d
  TransferBuffer       = 0e0b4248
  TransferBufferMDL    = 00000000
    00000000: 0b 00 20 82 01 30 80 1b e1 03 00 00 00
  UrbLink                 = 00000000
  RequestTypeReservedBits = 00000000
  Request                 = 00000001
  Value                   = 0000000b
  Index                   = 00000000
[8030111 ms] UsbSnoop - MyInternalIOCTLCompletion(0dd57ddc) : fido=00000000, Irp=0d862b40, Context=09bd0440, IRQL=2
[8030111 ms]  <<<  URB 10 coming back  <<< 
-- URB_FUNCTION_CONTROL_TRANSFER:
  PipeHandle           = 0d567060
  TransferFlags        = 0000000a (USBD_TRANSFER_DIRECTION_OUT, USBD_SHORT_TRANSFER_OK)
  TransferBufferLength = 0000000d
  TransferBuffer       = 0e0b4248
  TransferBufferMDL    = 07c938f0
  UrbLink              = 00000000
  SetupPacket          =
    00000000: 40 01 0b 00 00 00 0d 00
[8030111 ms] UsbSnoop - FilterDispatchAny(0dd57b90) : IRP_MJ_INTERNAL_DEVICE_CONTROL
[8030111 ms] UsbSnoop - FdoHookDispatchInternalIoctl(0dd57f8c) : fdo=0e0d7ab0, Irp=0d862b40, IRQL=0
[8030111 ms]  >>>  URB 11 going down  >>> 
-- URB_FUNCTION_VENDOR_DEVICE:
  TransferFlags          = 00000003 (USBD_TRANSFER_DIRECTION_IN, USBD_SHORT_TRANSFER_OK)
  TransferBufferLength = 0000000d
  TransferBuffer       = 0e0b4248
  TransferBufferMDL    = 00000000
  UrbLink                 = 00000000
  RequestTypeReservedBits = 00000000
  Request                 = 00000001
  Value                   = 0000000b
  Index                   = 00000000
[8030111 ms] UsbSnoop - MyInternalIOCTLCompletion(0dd57ddc) : fido=00000000, Irp=0d862b40, Context=09bd0440, IRQL=2
[8030111 ms]  <<<  URB 11 coming back  <<< 
-- URB_FUNCTION_CONTROL_TRANSFER:
  PipeHandle           = 0d567060
  TransferFlags        = 0000000b (USBD_TRANSFER_DIRECTION_IN, USBD_SHORT_TRANSFER_OK)
  TransferBufferLength = 0000000d
  TransferBuffer       = 0e0b4248
  TransferBufferMDL    = 0d3bb060
    00000000: 0b 00 20 82 01 30 80 80 e1 03 00 00 00
  UrbLink              = 00000000
  SetupPacket          =
    00000000: c0 01 0b 00 00 00 0d 00
[8030111 ms] UsbSnoop - FilterDispatchAny(0dd57b90) : IRP_MJ_INTERNAL_DEVICE_CONTROL
[8030111 ms] UsbSnoop - FdoHookDispatchInternalIoctl(0dd57f8c) : fdo=0e0d7ab0, Irp=0d862b40, IRQL=0
[8030111 ms]  >>>  URB 12 going down  >>> 
-- URB_FUNCTION_VENDOR_DEVICE:
  TransferFlags          = 00000002 (USBD_TRANSFER_DIRECTION_OUT, USBD_SHORT_TRANSFER_OK)
  TransferBufferLength = 0000000d
  TransferBuffer       = 0e0b4260
  TransferBufferMDL    = 00000000
    00000000: 0b 00 00 82 01 00 34 11 50 b3 df 02 00
  UrbLink                 = 00000000
  RequestTypeReservedBits = 00000000
  Request                 = 00000001
  Value                   = 0000000b
  Index                   = 00000000
[8030111 ms] UsbSnoop - MyInternalIOCTLCompletion(0dd57ddc) : fido=00000000, Irp=0d862b40, Context=09bd0440, IRQL=2
[8030111 ms]  <<<  URB 12 coming back  <<< 
-- URB_FUNCTION_CONTROL_TRANSFER:
  PipeHandle           = 0d567060
  TransferFlags        = 0000000a (USBD_TRANSFER_DIRECTION_OUT, USBD_SHORT_TRANSFER_OK)
  TransferBufferLength = 0000000d
  TransferBuffer       = 0e0b4260
  TransferBufferMDL    = 0dc04850
  UrbLink              = 00000000
  SetupPacket          =
    00000000: 40 01 0b 00 00 00 0d 00
[8030111 ms] UsbSnoop - FilterDispatchAny(0dd57b90) : IRP_MJ_INTERNAL_DEVICE_CONTROL
[8030111 ms] UsbSnoop - FdoHookDispatchInternalIoctl(0dd57f8c) : fdo=0e0d7ab0, Irp=0d862b40, IRQL=0
[8030111 ms]  >>>  URB 13 going down  >>> 
-- URB_FUNCTION_VENDOR_DEVICE:
  TransferFlags          = 00000002 (USBD_TRANSFER_DIRECTION_OUT, USBD_SHORT_TRANSFER_OK)
  TransferBufferLength = 0000000d
  TransferBuffer       = 0e0b4260
  TransferBufferMDL    = 00000000
    00000000: 0b 00 00 82 01 00 35 11 50 b3 df 02 00
  UrbLink                 = 00000000
  RequestTypeReservedBits = 00000000
  Request                 = 00000001
  Value                   = 0000000b
  Index                   = 00000000
[8030112 ms] UsbSnoop - MyInternalIOCTLCompletion(0dd57ddc) : fido=00000000, Irp=0d862b40, Context=09bd0440, IRQL=2
[8030112 ms]  <<<  URB 13 coming back  <<< 
-- URB_FUNCTION_CONTROL_TRANSFER:
  PipeHandle           = 0d567060
  TransferFlags        = 0000000a (USBD_TRANSFER_DIRECTION_OUT, USBD_SHORT_TRANSFER_OK)
  TransferBufferLength = 0000000d
  TransferBuffer       = 0e0b4260
  TransferBufferMDL    = 098deaf0
  UrbLink              = 00000000
  SetupPacket          =
    00000000: 40 01 0b 00 00 00 0d 00
[8030122 ms] UsbSnoop - FilterDispatchAny(0dd57b90) : IRP_MJ_INTERNAL_DEVICE_CONTROL
[8030122 ms] UsbSnoop - FdoHookDispatchInternalIoctl(0dd57f8c) : fdo=0e0d7ab0, Irp=0d862b40, IRQL=0
[8030122 ms]  >>>  URB 14 going down  >>> 
-- URB_FUNCTION_VENDOR_DEVICE:
  TransferFlags          = 00000002 (USBD_TRANSFER_DIRECTION_OUT, USBD_SHORT_TRANSFER_OK)
  TransferBufferLength = 0000000d
  TransferBuffer       = 0e0b4260
  TransferBufferMDL    = 00000000
    00000000: 0b 00 00 82 01 00 3a 80 88 ca d7 0d 80
  UrbLink                 = 00000000
  RequestTypeReservedBits = 00000000
  Request                 = 00000001
  Value                   = 0000000b
  Index                   = 00000000
[8030122 ms] UsbSnoop - MyInternalIOCTLCompletion(0dd57ddc) : fido=00000000, Irp=0d862b40, Context=09bd0440, IRQL=2
[8030122 ms]  <<<  URB 14 coming back  <<< 
-- URB_FUNCTION_CONTROL_TRANSFER:
  PipeHandle           = 0d567060
  TransferFlags        = 0000000a (USBD_TRANSFER_DIRECTION_OUT, USBD_SHORT_TRANSFER_OK)
  TransferBufferLength = 0000000d
  TransferBuffer       = 0e0b4260
  TransferBufferMDL    = 0d5e91c0
  UrbLink              = 00000000
  SetupPacket          =
    00000000: 40 01 0b 00 00 00 0d 00
[8030122 ms] UsbSnoop - FilterDispatchAny(0dd57b90) : IRP_MJ_INTERNAL_DEVICE_CONTROL
[8030122 ms] UsbSnoop - FdoHookDispatchInternalIoctl(0dd57f8c) : fdo=0e0d7ab0, Irp=0d862b40, IRQL=0
[8030122 ms]  >>>  URB 15 going down  >>> 
-- URB_FUNCTION_VENDOR_DEVICE:
  TransferFlags          = 00000002 (USBD_TRANSFER_DIRECTION_OUT, USBD_SHORT_TRANSFER_OK)
  TransferBufferLength = 0000000d
  TransferBuffer       = 0e0b4260
  TransferBufferMDL    = 00000000
    00000000: 0b 00 00 82 01 00 3b 80 88 ca d7 0d 80
  UrbLink                 = 00000000
  RequestTypeReservedBits = 00000000
  Request                 = 00000001
  Value                   = 0000000b
  Index                   = 00000000
[8030122 ms] UsbSnoop - MyInternalIOCTLCompletion(0dd57ddc) : fido=00000000, Irp=0d862b40, Context=09bd0440, IRQL=2
[8030122 ms]  <<<  URB 15 coming back  <<< 
-- URB_FUNCTION_CONTROL_TRANSFER:
  PipeHandle           = 0d567060
  TransferFlags        = 0000000a (USBD_TRANSFER_DIRECTION_OUT, USBD_SHORT_TRANSFER_OK)
  TransferBufferLength = 0000000d
  TransferBuffer       = 0e0b4260
  TransferBufferMDL    = 0d5e91c0
  UrbLink              = 00000000
  SetupPacket          =
    00000000: 40 01 0b 00 00 00 0d 00
[8030222 ms] UsbSnoop - FilterDispatchAny(0dd57b90) : IRP_MJ_INTERNAL_DEVICE_CONTROL
[8030222 ms] UsbSnoop - FdoHookDispatchInternalIoctl(0dd57f8c) : fdo=0e0d7ab0, Irp=0d862b40, IRQL=0
[8030222 ms]  >>>  URB 16 going down  >>> 
-- URB_FUNCTION_VENDOR_DEVICE:
  TransferFlags          = 00000002 (USBD_TRANSFER_DIRECTION_OUT, USBD_SHORT_TRANSFER_OK)
  TransferBufferLength = 0000000d
  TransferBuffer       = 0e0b4260
  TransferBufferMDL    = 00000000
    00000000: 0b 00 00 82 01 00 3a 80 88 ca d7 0d 80
  UrbLink                 = 00000000
  RequestTypeReservedBits = 00000000
  Request                 = 00000001
  Value                   = 0000000b
  Index                   = 00000000
[8030222 ms] UsbSnoop - MyInternalIOCTLCompletion(0dd57ddc) : fido=00000000, Irp=0d862b40, Context=09bd0440, IRQL=2
[8030222 ms]  <<<  URB 16 coming back  <<< 
-- URB_FUNCTION_CONTROL_TRANSFER:
  PipeHandle           = 0d567060
  TransferFlags        = 0000000a (USBD_TRANSFER_DIRECTION_OUT, USBD_SHORT_TRANSFER_OK)
  TransferBufferLength = 0000000d
  TransferBuffer       = 0e0b4260
  TransferBufferMDL    = 0d5e91c0
  UrbLink              = 00000000
  SetupPacket          =
    00000000: 40 01 0b 00 00 00 0d 00
[8030222 ms] UsbSnoop - FilterDispatchAny(0dd57b90) : IRP_MJ_INTERNAL_DEVICE_CONTROL
[8030222 ms] UsbSnoop - FdoHookDispatchInternalIoctl(0dd57f8c) : fdo=0e0d7ab0, Irp=0d862b40, IRQL=0
[8030222 ms]  >>>  URB 17 going down  >>> 
-- URB_FUNCTION_VENDOR_DEVICE:
  TransferFlags          = 00000002 (USBD_TRANSFER_DIRECTION_OUT, USBD_SHORT_TRANSFER_OK)
  TransferBufferLength = 0000000d
  TransferBuffer       = 0e0b4260
  TransferBufferMDL    = 00000000
    00000000: 0b 00 00 82 01 00 3b 00 88 ca d7 0d 80
  UrbLink                 = 00000000
  RequestTypeReservedBits = 00000000
  Request                 = 00000001
  Value                   = 0000000b
  Index                   = 00000000
[8030222 ms] UsbSnoop - MyInternalIOCTLCompletion(0dd57ddc) : fido=00000000, Irp=0d862b40, Context=09bd0440, IRQL=2
[8030222 ms]  <<<  URB 17 coming back  <<< 
-- URB_FUNCTION_CONTROL_TRANSFER:
  PipeHandle           = 0d567060
  TransferFlags        = 0000000a (USBD_TRANSFER_DIRECTION_OUT, USBD_SHORT_TRANSFER_OK)
  TransferBufferLength = 0000000d
  TransferBuffer       = 0e0b4260
  TransferBufferMDL    = 0b3a0ab0
  UrbLink              = 00000000
  SetupPacket          =
    00000000: 40 01 0b 00 00 00 0d 00
[8030234 ms] UsbSnoop - FilterDispatchAny(0dd57b90) : IRP_MJ_INTERNAL_DEVICE_CONTROL
[8030234 ms] UsbSnoop - FdoHookDispatchInternalIoctl(0dd57f8c) : fdo=0e0d7ab0, Irp=0e16e1a0, IRQL=0
[8030234 ms]  >>>  URB 18 going down  >>> 
-- URB_FUNCTION_VENDOR_DEVICE:
  TransferFlags          = 00000002 (USBD_TRANSFER_DIRECTION_OUT, USBD_SHORT_TRANSFER_OK)
  TransferBufferLength = 0000000d
  TransferBuffer       = 0e0b46b0
  TransferBufferMDL    = 00000000
    00000000: 0b 00 00 82 01 17 40 00 bd bf df 02 00
  UrbLink                 = 00000000
  RequestTypeReservedBits = 00000000
  Request                 = 00000001
  Value                   = 0000000b
  Index                   = 00000000
[8030235 ms] UsbSnoop - MyInternalIOCTLCompletion(0dd57ddc) : fido=00000000, Irp=0e16e1a0, Context=09bd0440, IRQL=2
[8030235 ms]  <<<  URB 18 coming back  <<< 
-- URB_FUNCTION_CONTROL_TRANSFER:
  PipeHandle           = 0d567060
  TransferFlags        = 0000000a (USBD_TRANSFER_DIRECTION_OUT, USBD_SHORT_TRANSFER_OK)
  TransferBufferLength = 0000000d
  TransferBuffer       = 0e0b46b0
  TransferBufferMDL    = 098a8b90
  UrbLink              = 00000000
  SetupPacket          =
    00000000: 40 01 0b 00 00 00 0d 00
[8030235 ms] UsbSnoop - FilterDispatchAny(0dd57b90) : IRP_MJ_INTERNAL_DEVICE_CONTROL
[8030235 ms] UsbSnoop - FdoHookDispatchInternalIoctl(0dd57f8c) : fdo=0e0d7ab0, Irp=0e16e1a0, IRQL=0
[8030235 ms]  >>>  URB 19 going down  >>> 
-- URB_FUNCTION_VENDOR_DEVICE:
  TransferFlags          = 00000002 (USBD_TRANSFER_DIRECTION_OUT, USBD_SHORT_TRANSFER_OK)
  TransferBufferLength = 0000000d
  TransferBuffer       = 0e0b46d0
  TransferBufferMDL    = 00000000
    00000000: 0b 00 00 82 01 00 3a 80 89 75 32 2f 00
  UrbLink                 = 00000000
  RequestTypeReservedBits = 00000000
  Request                 = 00000001
  Value                   = 0000000b
  Index                   = 00000000
[8030235 ms] UsbSnoop - MyInternalIOCTLCompletion(0dd57ddc) : fido=00000000, Irp=0e16e1a0, Context=09bd0440, IRQL=2
[8030235 ms]  <<<  URB 19 coming back  <<< 
-- URB_FUNCTION_CONTROL_TRANSFER:
  PipeHandle           = 0d567060
  TransferFlags        = 0000000a (USBD_TRANSFER_DIRECTION_OUT, USBD_SHORT_TRANSFER_OK)
  TransferBufferLength = 0000000d
  TransferBuffer       = 0e0b46d0
  TransferBufferMDL    = 098a8b90
  UrbLink              = 00000000
  SetupPacket          =
    00000000: 40 01 0b 00 00 00 0d 00
[8030235 ms] UsbSnoop - FilterDispatchAny(0dd57b90) : IRP_MJ_INTERNAL_DEVICE_CONTROL
[8030235 ms] UsbSnoop - FdoHookDispatchInternalIoctl(0dd57f8c) : fdo=0e0d7ab0, Irp=0e16e1a0, IRQL=0
[8030235 ms]  >>>  URB 20 going down  >>> 
-- URB_FUNCTION_VENDOR_DEVICE:
  TransferFlags          = 00000002 (USBD_TRANSFER_DIRECTION_OUT, USBD_SHORT_TRANSFER_OK)
  TransferBufferLength = 0000000d
  TransferBuffer       = 0e0b46d0
  TransferBufferMDL    = 00000000
    00000000: 0b 00 00 82 01 00 3b 00 89 75 32 2f 00
  UrbLink                 = 00000000
  RequestTypeReservedBits = 00000000
  Request                 = 00000001
  Value                   = 0000000b
  Index                   = 00000000
[8030235 ms] UsbSnoop - MyInternalIOCTLCompletion(0dd57ddc) : fido=00000000, Irp=0e16e1a0, Context=09bd0440, IRQL=2
[8030235 ms]  <<<  URB 20 coming back  <<< 
-- URB_FUNCTION_CONTROL_TRANSFER:
  PipeHandle           = 0d567060
  TransferFlags        = 0000000a (USBD_TRANSFER_DIRECTION_OUT, USBD_SHORT_TRANSFER_OK)
  TransferBufferLength = 0000000d
  TransferBuffer       = 0e0b46d0
  TransferBufferMDL    = 098a8b90
  UrbLink              = 00000000
  SetupPacket          =
    00000000: 40 01 0b 00 00 00 0d 00
[8030235 ms] UsbSnoop - FilterDispatchAny(0dd57b90) : IRP_MJ_INTERNAL_DEVICE_CONTROL
[8030235 ms] UsbSnoop - FdoHookDispatchInternalIoctl(0dd57f8c) : fdo=0e0d7ab0, Irp=0e16e1a0, IRQL=0
[8030235 ms]  >>>  URB 21 going down  >>> 
-- URB_FUNCTION_VENDOR_DEVICE:
  TransferFlags          = 00000002 (USBD_TRANSFER_DIRECTION_OUT, USBD_SHORT_TRANSFER_OK)
  TransferBufferLength = 0000000d
  TransferBuffer       = 0e0b46d0
  TransferBufferMDL    = 00000000
    00000000: 0b 00 00 82 01 00 34 01 89 75 32 2f 00
  UrbLink                 = 00000000
  RequestTypeReservedBits = 00000000
  Request                 = 00000001
  Value                   = 0000000b
  Index                   = 00000000
[8030235 ms] UsbSnoop - MyInternalIOCTLCompletion(0dd57ddc) : fido=00000000, Irp=0e16e1a0, Context=09bd0440, IRQL=2
[8030235 ms]  <<<  URB 21 coming back  <<< 
-- URB_FUNCTION_CONTROL_TRANSFER:
  PipeHandle           = 0d567060
  TransferFlags        = 0000000a (USBD_TRANSFER_DIRECTION_OUT, USBD_SHORT_TRANSFER_OK)
  TransferBufferLength = 0000000d
  TransferBuffer       = 0e0b46d0
  TransferBufferMDL    = 098a8b90
  UrbLink              = 00000000
  SetupPacket          =
    00000000: 40 01 0b 00 00 00 0d 00
[8030235 ms] UsbSnoop - FilterDispatchAny(0dd57b90) : IRP_MJ_INTERNAL_DEVICE_CONTROL
[8030235 ms] UsbSnoop - FdoHookDispatchInternalIoctl(0dd57f8c) : fdo=0e0d7ab0, Irp=0e16e1a0, IRQL=0
[8030236 ms]  >>>  URB 22 going down  >>> 
-- URB_FUNCTION_VENDOR_DEVICE:
  TransferFlags          = 00000002 (USBD_TRANSFER_DIRECTION_OUT, USBD_SHORT_TRANSFER_OK)
  TransferBufferLength = 0000000d
  TransferBuffer       = 0e0b46d0
  TransferBufferMDL    = 00000000
    00000000: 0b 00 00 82 01 00 35 00 89 75 32 2f 00
  UrbLink                 = 00000000
  RequestTypeReservedBits = 00000000
  Request                 = 00000001
  Value                   = 0000000b
  Index                   = 00000000
[8030236 ms] UsbSnoop - MyInternalIOCTLCompletion(0dd57ddc) : fido=00000000, Irp=0e16e1a0, Context=09bd0440, IRQL=2
[8030236 ms]  <<<  URB 22 coming back  <<< 
-- URB_FUNCTION_CONTROL_TRANSFER:
  PipeHandle           = 0d567060
  TransferFlags        = 0000000a (USBD_TRANSFER_DIRECTION_OUT, USBD_SHORT_TRANSFER_OK)
  TransferBufferLength = 0000000d
  TransferBuffer       = 0e0b46d0
  TransferBufferMDL    = 098a8b90
  UrbLink              = 00000000
  SetupPacket          =
    00000000: 40 01 0b 00 00 00 0d 00
[8030291 ms] UsbSnoop - FilterDispatchAny(0dd57b90) : IRP_MJ_INTERNAL_DEVICE_CONTROL
[8030291 ms] UsbSnoop - FdoHookDispatchInternalIoctl(0dd57f8c) : fdo=0e0d7ab0, Irp=098a5870, IRQL=0
[8030291 ms]  >>>  URB 23 going down  >>> 
-- URB_FUNCTION_VENDOR_DEVICE:
  TransferFlags          = 00000002 (USBD_TRANSFER_DIRECTION_OUT, USBD_SHORT_TRANSFER_OK)
  TransferBufferLength = 0000000d
  TransferBuffer       = 0e0b4248
  TransferBufferMDL    = 00000000
    00000000: 0b 00 20 82 01 30 80 1b 00 00 00 00 00
  UrbLink                 = 00000000
  RequestTypeReservedBits = 00000000
  Request                 = 00000001
  Value                   = 0000000b
  Index                   = 00000000
[8030292 ms] UsbSnoop - MyInternalIOCTLCompletion(0dd57ddc) : fido=00000000, Irp=098a5870, Context=09bd0440, IRQL=2
[8030292 ms]  <<<  URB 23 coming back  <<< 
-- URB_FUNCTION_CONTROL_TRANSFER:
  PipeHandle           = 0d567060
  TransferFlags        = 0000000a (USBD_TRANSFER_DIRECTION_OUT, USBD_SHORT_TRANSFER_OK)
  TransferBufferLength = 0000000d
  TransferBuffer       = 0e0b4248
  TransferBufferMDL    = 0b3a0ab0
  UrbLink              = 00000000
  SetupPacket          =
    00000000: 40 01 0b 00 00 00 0d 00
[8030292 ms] UsbSnoop - FilterDispatchAny(0dd57b90) : IRP_MJ_INTERNAL_DEVICE_CONTROL
[8030292 ms] UsbSnoop - FdoHookDispatchInternalIoctl(0dd57f8c) : fdo=0e0d7ab0, Irp=098a5870, IRQL=0
[8030292 ms]  >>>  URB 24 going down  >>> 
-- URB_FUNCTION_VENDOR_DEVICE:
  TransferFlags          = 00000003 (USBD_TRANSFER_DIRECTION_IN, USBD_SHORT_TRANSFER_OK)
  TransferBufferLength = 0000000d
  TransferBuffer       = 0e0b4248
  TransferBufferMDL    = 00000000
  UrbLink                 = 00000000
  RequestTypeReservedBits = 00000000
  Request                 = 00000001
  Value                   = 0000000b
  Index                   = 00000000
[8030292 ms] UsbSnoop - MyInternalIOCTLCompletion(0dd57ddc) : fido=00000000, Irp=098a5870, Context=09bd0440, IRQL=2
[8030292 ms]  <<<  URB 24 coming back  <<< 
-- URB_FUNCTION_CONTROL_TRANSFER:
  PipeHandle           = 0d567060
  TransferFlags        = 0000000b (USBD_TRANSFER_DIRECTION_IN, USBD_SHORT_TRANSFER_OK)
  TransferBufferLength = 0000000d
  TransferBuffer       = 0e0b4248
  TransferBufferMDL    = 0b3a0ab0
    00000000: 0b 00 20 82 01 30 80 80 00 00 00 00 00
  UrbLink              = 00000000
  SetupPacket          =
    00000000: c0 01 0b 00 00 00 0d 00
[8030292 ms] UsbSnoop - FilterDispatchAny(0dd57b90) : IRP_MJ_INTERNAL_DEVICE_CONTROL
[8030292 ms] UsbSnoop - FdoHookDispatchInternalIoctl(0dd57f8c) : fdo=0e0d7ab0, Irp=098a5870, IRQL=0
[8030292 ms]  >>>  URB 25 going down  >>> 
-- URB_FUNCTION_VENDOR_DEVICE:
  TransferFlags          = 00000002 (USBD_TRANSFER_DIRECTION_OUT, USBD_SHORT_TRANSFER_OK)
  TransferBufferLength = 0000000d
  TransferBuffer       = 0e0b4260
  TransferBufferMDL    = 00000000
    00000000: 0b 00 00 82 01 00 34 11 50 b3 df 02 00
  UrbLink                 = 00000000
  RequestTypeReservedBits = 00000000
  Request                 = 00000001
  Value                   = 0000000b
  Index                   = 00000000
[8030292 ms] UsbSnoop - MyInternalIOCTLCompletion(0dd57ddc) : fido=00000000, Irp=098a5870, Context=09bd0440, IRQL=2
[8030292 ms]  <<<  URB 25 coming back  <<< 
-- URB_FUNCTION_CONTROL_TRANSFER:
  PipeHandle           = 0d567060
  TransferFlags        = 0000000a (USBD_TRANSFER_DIRECTION_OUT, USBD_SHORT_TRANSFER_OK)
  TransferBufferLength = 0000000d
  TransferBuffer       = 0e0b4260
  TransferBufferMDL    = 0b3a0ab0
  UrbLink              = 00000000
  SetupPacket          =
    00000000: 40 01 0b 00 00 00 0d 00
[8030292 ms] UsbSnoop - FilterDispatchAny(0dd57b90) : IRP_MJ_INTERNAL_DEVICE_CONTROL
[8030292 ms] UsbSnoop - FdoHookDispatchInternalIoctl(0dd57f8c) : fdo=0e0d7ab0, Irp=098a5870, IRQL=0
[8030292 ms]  >>>  URB 26 going down  >>> 
-- URB_FUNCTION_VENDOR_DEVICE:
  TransferFlags          = 00000002 (USBD_TRANSFER_DIRECTION_OUT, USBD_SHORT_TRANSFER_OK)
  TransferBufferLength = 0000000d
  TransferBuffer       = 0e0b4260
  TransferBufferMDL    = 00000000
    00000000: 0b 00 00 82 01 00 35 11 50 b3 df 02 00
  UrbLink                 = 00000000
  RequestTypeReservedBits = 00000000
  Request                 = 00000001
  Value                   = 0000000b
  Index                   = 00000000
[8030293 ms] UsbSnoop - MyInternalIOCTLCompletion(0dd57ddc) : fido=00000000, Irp=098a5870, Context=09bd0440, IRQL=2
[8030293 ms]  <<<  URB 26 coming back  <<< 
-- URB_FUNCTION_CONTROL_TRANSFER:
  PipeHandle           = 0d567060
  TransferFlags        = 0000000a (USBD_TRANSFER_DIRECTION_OUT, USBD_SHORT_TRANSFER_OK)
  TransferBufferLength = 0000000d
  TransferBuffer       = 0e0b4260
  TransferBufferMDL    = 0b3a0ab0
  UrbLink              = 00000000
  SetupPacket          =
    00000000: 40 01 0b 00 00 00 0d 00
[8030302 ms] UsbSnoop - FilterDispatchAny(0dd57b90) : IRP_MJ_INTERNAL_DEVICE_CONTROL
[8030302 ms] UsbSnoop - FdoHookDispatchInternalIoctl(0dd57f8c) : fdo=0e0d7ab0, Irp=0a3cab40, IRQL=0
[8030302 ms]  >>>  URB 27 going down  >>> 
-- URB_FUNCTION_VENDOR_DEVICE:
  TransferFlags          = 00000002 (USBD_TRANSFER_DIRECTION_OUT, USBD_SHORT_TRANSFER_OK)
  TransferBufferLength = 0000000d
  TransferBuffer       = 0e0b4260
  TransferBufferMDL    = 00000000
    00000000: 0b 00 00 82 01 00 3a 80 98 fe 1f 0e 80
  UrbLink                 = 00000000
  RequestTypeReservedBits = 00000000
  Request                 = 00000001
  Value                   = 0000000b
  Index                   = 00000000
[8030302 ms] UsbSnoop - MyInternalIOCTLCompletion(0dd57ddc) : fido=00000000, Irp=0a3cab40, Context=09bd0440, IRQL=2
[8030302 ms]  <<<  URB 27 coming back  <<< 
-- URB_FUNCTION_CONTROL_TRANSFER:
  PipeHandle           = 0d567060
  TransferFlags        = 0000000a (USBD_TRANSFER_DIRECTION_OUT, USBD_SHORT_TRANSFER_OK)
  TransferBufferLength = 0000000d
  TransferBuffer       = 0e0b4260
  TransferBufferMDL    = 0b3a0ab0
  UrbLink              = 00000000
  SetupPacket          =
    00000000: 40 01 0b 00 00 00 0d 00
[8030302 ms] UsbSnoop - FilterDispatchAny(0dd57b90) : IRP_MJ_INTERNAL_DEVICE_CONTROL
[8030302 ms] UsbSnoop - FdoHookDispatchInternalIoctl(0dd57f8c) : fdo=0e0d7ab0, Irp=0a3cab40, IRQL=0
[8030302 ms]  >>>  URB 28 going down  >>> 
-- URB_FUNCTION_VENDOR_DEVICE:
  TransferFlags          = 00000002 (USBD_TRANSFER_DIRECTION_OUT, USBD_SHORT_TRANSFER_OK)
  TransferBufferLength = 0000000d
  TransferBuffer       = 0e0b4260
  TransferBufferMDL    = 00000000
    00000000: 0b 00 00 82 01 00 3b 80 98 fe 1f 0e 80
  UrbLink                 = 00000000
  RequestTypeReservedBits = 00000000
  Request                 = 00000001
  Value                   = 0000000b
  Index                   = 00000000
[8030302 ms] UsbSnoop - MyInternalIOCTLCompletion(0dd57ddc) : fido=00000000, Irp=0a3cab40, Context=09bd0440, IRQL=2
[8030302 ms]  <<<  URB 28 coming back  <<< 
-- URB_FUNCTION_CONTROL_TRANSFER:
  PipeHandle           = 0d567060
  TransferFlags        = 0000000a (USBD_TRANSFER_DIRECTION_OUT, USBD_SHORT_TRANSFER_OK)
  TransferBufferLength = 0000000d
  TransferBuffer       = 0e0b4260
  TransferBufferMDL    = 0b3a0ab0
  UrbLink              = 00000000
  SetupPacket          =
    00000000: 40 01 0b 00 00 00 0d 00
[8030402 ms] UsbSnoop - FilterDispatchAny(0dd57b90) : IRP_MJ_INTERNAL_DEVICE_CONTROL
[8030402 ms] UsbSnoop - FdoHookDispatchInternalIoctl(0dd57f8c) : fdo=0e0d7ab0, Irp=098a5870, IRQL=0
[8030402 ms]  >>>  URB 29 going down  >>> 
-- URB_FUNCTION_VENDOR_DEVICE:
  TransferFlags          = 00000002 (USBD_TRANSFER_DIRECTION_OUT, USBD_SHORT_TRANSFER_OK)
  TransferBufferLength = 0000000d
  TransferBuffer       = 0e0b4260
  TransferBufferMDL    = 00000000
    00000000: 0b 00 00 82 01 00 3a 80 98 fe 1f 0e 80
  UrbLink                 = 00000000
  RequestTypeReservedBits = 00000000
  Request                 = 00000001
  Value                   = 0000000b
  Index                   = 00000000
[8030402 ms] UsbSnoop - MyInternalIOCTLCompletion(0dd57ddc) : fido=00000000, Irp=098a5870, Context=09bd0440, IRQL=2
[8030402 ms]  <<<  URB 29 coming back  <<< 
-- URB_FUNCTION_CONTROL_TRANSFER:
  PipeHandle           = 0d567060
  TransferFlags        = 0000000a (USBD_TRANSFER_DIRECTION_OUT, USBD_SHORT_TRANSFER_OK)
  TransferBufferLength = 0000000d
  TransferBuffer       = 0e0b4260
  TransferBufferMDL    = 098d4a40
  UrbLink              = 00000000
  SetupPacket          =
    00000000: 40 01 0b 00 00 00 0d 00
[8030402 ms] UsbSnoop - FilterDispatchAny(0dd57b90) : IRP_MJ_INTERNAL_DEVICE_CONTROL
[8030402 ms] UsbSnoop - FdoHookDispatchInternalIoctl(0dd57f8c) : fdo=0e0d7ab0, Irp=098a5870, IRQL=0
[8030402 ms]  >>>  URB 30 going down  >>> 
-- URB_FUNCTION_VENDOR_DEVICE:
  TransferFlags          = 00000002 (USBD_TRANSFER_DIRECTION_OUT, USBD_SHORT_TRANSFER_OK)
  TransferBufferLength = 0000000d
  TransferBuffer       = 0e0b4260
  TransferBufferMDL    = 00000000
    00000000: 0b 00 00 82 01 00 3b 00 98 fe 1f 0e 80
  UrbLink                 = 00000000
  RequestTypeReservedBits = 00000000
  Request                 = 00000001
  Value                   = 0000000b
  Index                   = 00000000
[8030402 ms] UsbSnoop - MyInternalIOCTLCompletion(0dd57ddc) : fido=00000000, Irp=098a5870, Context=09bd0440, IRQL=2
[8030402 ms]  <<<  URB 30 coming back  <<< 
-- URB_FUNCTION_CONTROL_TRANSFER:
  PipeHandle           = 0d567060
  TransferFlags        = 0000000a (USBD_TRANSFER_DIRECTION_OUT, USBD_SHORT_TRANSFER_OK)
  TransferBufferLength = 0000000d
  TransferBuffer       = 0e0b4260
  TransferBufferMDL    = 0b3a0ab0
  UrbLink              = 00000000
  SetupPacket          =
    00000000: 40 01 0b 00 00 00 0d 00
[8030413 ms] UsbSnoop - FilterDispatchAny(0dd57b90) : IRP_MJ_INTERNAL_DEVICE_CONTROL
[8030413 ms] UsbSnoop - FdoHookDispatchInternalIoctl(0dd57f8c) : fdo=0e0d7ab0, Irp=0d862b40, IRQL=0
[8030413 ms]  >>>  URB 31 going down  >>> 
-- URB_FUNCTION_VENDOR_DEVICE:
  TransferFlags          = 00000002 (USBD_TRANSFER_DIRECTION_OUT, USBD_SHORT_TRANSFER_OK)
  TransferBufferLength = 0000000d
  TransferBuffer       = 0e0b46b0
  TransferBufferMDL    = 00000000
    00000000: 0b 00 00 82 01 17 40 00 bd bf df 02 00
  UrbLink                 = 00000000
  RequestTypeReservedBits = 00000000
  Request                 = 00000001
  Value                   = 0000000b
  Index                   = 00000000
[8030413 ms] UsbSnoop - MyInternalIOCTLCompletion(0dd57ddc) : fido=00000000, Irp=0d862b40, Context=09bd0440, IRQL=2
[8030413 ms]  <<<  URB 31 coming back  <<< 
-- URB_FUNCTION_CONTROL_TRANSFER:
  PipeHandle           = 0d567060
  TransferFlags        = 0000000a (USBD_TRANSFER_DIRECTION_OUT, USBD_SHORT_TRANSFER_OK)
  TransferBufferLength = 0000000d
  TransferBuffer       = 0e0b46b0
  TransferBufferMDL    = 0b3a0ab0
  UrbLink              = 00000000
  SetupPacket          =
    00000000: 40 01 0b 00 00 00 0d 00
[8030413 ms] UsbSnoop - FilterDispatchAny(0dd57b90) : IRP_MJ_INTERNAL_DEVICE_CONTROL
[8030413 ms] UsbSnoop - FdoHookDispatchInternalIoctl(0dd57f8c) : fdo=0e0d7ab0, Irp=0d862b40, IRQL=0
[8030413 ms]  >>>  URB 32 going down  >>> 
-- URB_FUNCTION_VENDOR_DEVICE:
  TransferFlags          = 00000002 (USBD_TRANSFER_DIRECTION_OUT, USBD_SHORT_TRANSFER_OK)
  TransferBufferLength = 0000000d
  TransferBuffer       = 0e0b46d0
  TransferBufferMDL    = 00000000
    00000000: 0b 00 00 82 01 00 3a 80 89 75 32 2f 00
  UrbLink                 = 00000000
  RequestTypeReservedBits = 00000000
  Request                 = 00000001
  Value                   = 0000000b
  Index                   = 00000000
[8030413 ms] UsbSnoop - MyInternalIOCTLCompletion(0dd57ddc) : fido=00000000, Irp=0d862b40, Context=09bd0440, IRQL=2
[8030413 ms]  <<<  URB 32 coming back  <<< 
-- URB_FUNCTION_CONTROL_TRANSFER:
  PipeHandle           = 0d567060
  TransferFlags        = 0000000a (USBD_TRANSFER_DIRECTION_OUT, USBD_SHORT_TRANSFER_OK)
  TransferBufferLength = 0000000d
  TransferBuffer       = 0e0b46d0
  TransferBufferMDL    = 0b3a0ab0
  UrbLink              = 00000000
  SetupPacket          =
    00000000: 40 01 0b 00 00 00 0d 00
[8030413 ms] UsbSnoop - FilterDispatchAny(0dd57b90) : IRP_MJ_INTERNAL_DEVICE_CONTROL
[8030413 ms] UsbSnoop - FdoHookDispatchInternalIoctl(0dd57f8c) : fdo=0e0d7ab0, Irp=0d862b40, IRQL=0
[8030413 ms]  >>>  URB 33 going down  >>> 
-- URB_FUNCTION_VENDOR_DEVICE:
  TransferFlags          = 00000002 (USBD_TRANSFER_DIRECTION_OUT, USBD_SHORT_TRANSFER_OK)
  TransferBufferLength = 0000000d
  TransferBuffer       = 0e0b46d0
  TransferBufferMDL    = 00000000
    00000000: 0b 00 00 82 01 00 3b 00 89 75 32 2f 00
  UrbLink                 = 00000000
  RequestTypeReservedBits = 00000000
  Request                 = 00000001
  Value                   = 0000000b
  Index                   = 00000000
[8030414 ms] UsbSnoop - MyInternalIOCTLCompletion(0dd57ddc) : fido=00000000, Irp=0d862b40, Context=09bd0440, IRQL=2
[8030414 ms]  <<<  URB 33 coming back  <<< 
-- URB_FUNCTION_CONTROL_TRANSFER:
  PipeHandle           = 0d567060
  TransferFlags        = 0000000a (USBD_TRANSFER_DIRECTION_OUT, USBD_SHORT_TRANSFER_OK)
  TransferBufferLength = 0000000d
  TransferBuffer       = 0e0b46d0
  TransferBufferMDL    = 0b3a0ab0
  UrbLink              = 00000000
  SetupPacket          =
    00000000: 40 01 0b 00 00 00 0d 00
[8030414 ms] UsbSnoop - FilterDispatchAny(0dd57b90) : IRP_MJ_INTERNAL_DEVICE_CONTROL
[8030414 ms] UsbSnoop - FdoHookDispatchInternalIoctl(0dd57f8c) : fdo=0e0d7ab0, Irp=0d862b40, IRQL=0
[8030414 ms]  >>>  URB 34 going down  >>> 
-- URB_FUNCTION_VENDOR_DEVICE:
  TransferFlags          = 00000002 (USBD_TRANSFER_DIRECTION_OUT, USBD_SHORT_TRANSFER_OK)
  TransferBufferLength = 0000000d
  TransferBuffer       = 0e0b46d0
  TransferBufferMDL    = 00000000
    00000000: 0b 00 00 82 01 00 34 01 89 75 32 2f 00
  UrbLink                 = 00000000
  RequestTypeReservedBits = 00000000
  Request                 = 00000001
  Value                   = 0000000b
  Index                   = 00000000
[8030414 ms] UsbSnoop - MyInternalIOCTLCompletion(0dd57ddc) : fido=00000000, Irp=0d862b40, Context=09bd0440, IRQL=2
[8030414 ms]  <<<  URB 34 coming back  <<< 
-- URB_FUNCTION_CONTROL_TRANSFER:
  PipeHandle           = 0d567060
  TransferFlags        = 0000000a (USBD_TRANSFER_DIRECTION_OUT, USBD_SHORT_TRANSFER_OK)
  TransferBufferLength = 0000000d
  TransferBuffer       = 0e0b46d0
  TransferBufferMDL    = 0b3a0ab0
  UrbLink              = 00000000
  SetupPacket          =
    00000000: 40 01 0b 00 00 00 0d 00
[8030414 ms] UsbSnoop - FilterDispatchAny(0dd57b90) : IRP_MJ_INTERNAL_DEVICE_CONTROL
[8030414 ms] UsbSnoop - FdoHookDispatchInternalIoctl(0dd57f8c) : fdo=0e0d7ab0, Irp=0d862b40, IRQL=0
[8030414 ms]  >>>  URB 35 going down  >>> 
-- URB_FUNCTION_VENDOR_DEVICE:
  TransferFlags          = 00000002 (USBD_TRANSFER_DIRECTION_OUT, USBD_SHORT_TRANSFER_OK)
  TransferBufferLength = 0000000d
  TransferBuffer       = 0e0b46d0
  TransferBufferMDL    = 00000000
    00000000: 0b 00 00 82 01 00 35 00 89 75 32 2f 00
  UrbLink                 = 00000000
  RequestTypeReservedBits = 00000000
  Request                 = 00000001
  Value                   = 0000000b
  Index                   = 00000000
[8030414 ms] UsbSnoop - MyInternalIOCTLCompletion(0dd57ddc) : fido=00000000, Irp=0d862b40, Context=09bd0440, IRQL=2
[8030414 ms]  <<<  URB 35 coming back  <<< 
-- URB_FUNCTION_CONTROL_TRANSFER:
  PipeHandle           = 0d567060
  TransferFlags        = 0000000a (USBD_TRANSFER_DIRECTION_OUT, USBD_SHORT_TRANSFER_OK)
  TransferBufferLength = 0000000d
  TransferBuffer       = 0e0b46d0
  TransferBufferMDL    = 0b3a0ab0
  UrbLink              = 00000000
  SetupPacket          =
    00000000: 40 01 0b 00 00 00 0d 00
[8090052 ms] UsbSnoop - FilterDispatchAny(0dd57b90) : IRP_MJ_INTERNAL_DEVICE_CONTROL
[8090052 ms] UsbSnoop - FdoHookDispatchInternalIoctl(0dd57f8c) : fdo=0e0d7ab0, Irp=0d85d830, IRQL=0
[8090052 ms]  >>>  URB 36 going down  >>> 
-- URB_FUNCTION_VENDOR_DEVICE:
  TransferFlags          = 00000002 (USBD_TRANSFER_DIRECTION_OUT, USBD_SHORT_TRANSFER_OK)
  TransferBufferLength = 0000000d
  TransferBuffer       = 0e0b4248
  TransferBufferMDL    = 00000000
    00000000: 0b 00 20 82 01 30 80 1b 00 00 00 00 00
  UrbLink                 = 00000000
  RequestTypeReservedBits = 00000000
  Request                 = 00000001
  Value                   = 0000000b
  Index                   = 00000000
[8090053 ms] UsbSnoop - MyInternalIOCTLCompletion(0dd57ddc) : fido=00000000, Irp=0d85d830, Context=09bd0440, IRQL=2
[8090053 ms]  <<<  URB 36 coming back  <<< 
-- URB_FUNCTION_CONTROL_TRANSFER:
  PipeHandle           = 0d567060
  TransferFlags        = 0000000a (USBD_TRANSFER_DIRECTION_OUT, USBD_SHORT_TRANSFER_OK)
  TransferBufferLength = 0000000d
  TransferBuffer       = 0e0b4248
  TransferBufferMDL    = 0e16f630
  UrbLink              = 00000000
  SetupPacket          =
    00000000: 40 01 0b 00 00 00 0d 00
[8090053 ms] UsbSnoop - FilterDispatchAny(0dd57b90) : IRP_MJ_INTERNAL_DEVICE_CONTROL
[8090053 ms] UsbSnoop - FdoHookDispatchInternalIoctl(0dd57f8c) : fdo=0e0d7ab0, Irp=0d85d830, IRQL=0
[8090053 ms]  >>>  URB 37 going down  >>> 
-- URB_FUNCTION_VENDOR_DEVICE:
  TransferFlags          = 00000003 (USBD_TRANSFER_DIRECTION_IN, USBD_SHORT_TRANSFER_OK)
  TransferBufferLength = 0000000d
  TransferBuffer       = 0e0b4248
  TransferBufferMDL    = 00000000
  UrbLink                 = 00000000
  RequestTypeReservedBits = 00000000
  Request                 = 00000001
  Value                   = 0000000b
  Index                   = 00000000
[8090053 ms] UsbSnoop - MyInternalIOCTLCompletion(0dd57ddc) : fido=00000000, Irp=0d85d830, Context=09bd0440, IRQL=2
[8090053 ms]  <<<  URB 37 coming back  <<< 
-- URB_FUNCTION_CONTROL_TRANSFER:
  PipeHandle           = 0d567060
  TransferFlags        = 0000000b (USBD_TRANSFER_DIRECTION_IN, USBD_SHORT_TRANSFER_OK)
  TransferBufferLength = 0000000d
  TransferBuffer       = 0e0b4248
  TransferBufferMDL    = 0e16f630
    00000000: 0b 00 20 82 01 30 80 80 00 00 00 00 00
  UrbLink              = 00000000
  SetupPacket          =
    00000000: c0 01 0b 00 00 00 0d 00
[8090053 ms] UsbSnoop - FilterDispatchAny(0dd57b90) : IRP_MJ_INTERNAL_DEVICE_CONTROL
[8090053 ms] UsbSnoop - FdoHookDispatchInternalIoctl(0dd57f8c) : fdo=0e0d7ab0, Irp=0d85d830, IRQL=0
[8090053 ms]  >>>  URB 38 going down  >>> 
-- URB_FUNCTION_VENDOR_DEVICE:
  TransferFlags          = 00000002 (USBD_TRANSFER_DIRECTION_OUT, USBD_SHORT_TRANSFER_OK)
  TransferBufferLength = 0000000d
  TransferBuffer       = 0e0b4260
  TransferBufferMDL    = 00000000
    00000000: 0b 00 00 82 01 00 34 11 50 b3 df 02 00
  UrbLink                 = 00000000
  RequestTypeReservedBits = 00000000
  Request                 = 00000001
  Value                   = 0000000b
  Index                   = 00000000
[8090053 ms] UsbSnoop - MyInternalIOCTLCompletion(0dd57ddc) : fido=00000000, Irp=0d85d830, Context=09bd0440, IRQL=2
[8090053 ms]  <<<  URB 38 coming back  <<< 
-- URB_FUNCTION_CONTROL_TRANSFER:
  PipeHandle           = 0d567060
  TransferFlags        = 0000000a (USBD_TRANSFER_DIRECTION_OUT, USBD_SHORT_TRANSFER_OK)
  TransferBufferLength = 0000000d
  TransferBuffer       = 0e0b4260
  TransferBufferMDL    = 0e16f630
  UrbLink              = 00000000
  SetupPacket          =
    00000000: 40 01 0b 00 00 00 0d 00
[8090053 ms] UsbSnoop - FilterDispatchAny(0dd57b90) : IRP_MJ_INTERNAL_DEVICE_CONTROL
[8090053 ms] UsbSnoop - FdoHookDispatchInternalIoctl(0dd57f8c) : fdo=0e0d7ab0, Irp=0d85d830, IRQL=0
[8090053 ms]  >>>  URB 39 going down  >>> 
-- URB_FUNCTION_VENDOR_DEVICE:
  TransferFlags          = 00000002 (USBD_TRANSFER_DIRECTION_OUT, USBD_SHORT_TRANSFER_OK)
  TransferBufferLength = 0000000d
  TransferBuffer       = 0e0b4260
  TransferBufferMDL    = 00000000
    00000000: 0b 00 00 82 01 00 35 11 50 b3 df 02 00
  UrbLink                 = 00000000
  RequestTypeReservedBits = 00000000
  Request                 = 00000001
  Value                   = 0000000b
  Index                   = 00000000
[8090054 ms] UsbSnoop - MyInternalIOCTLCompletion(0dd57ddc) : fido=00000000, Irp=0d85d830, Context=09bd0440, IRQL=2
[8090054 ms]  <<<  URB 39 coming back  <<< 
-- URB_FUNCTION_CONTROL_TRANSFER:
  PipeHandle           = 0d567060
  TransferFlags        = 0000000a (USBD_TRANSFER_DIRECTION_OUT, USBD_SHORT_TRANSFER_OK)
  TransferBufferLength = 0000000d
  TransferBuffer       = 0e0b4260
  TransferBufferMDL    = 0e16f630
  UrbLink              = 00000000
  SetupPacket          =
    00000000: 40 01 0b 00 00 00 0d 00
[8090063 ms] UsbSnoop - FilterDispatchAny(0dd57b90) : IRP_MJ_INTERNAL_DEVICE_CONTROL
[8090063 ms] UsbSnoop - FdoHookDispatchInternalIoctl(0dd57f8c) : fdo=0e0d7ab0, Irp=0ed1db40, IRQL=0
[8090063 ms]  >>>  URB 40 going down  >>> 
-- URB_FUNCTION_VENDOR_DEVICE:
  TransferFlags          = 00000002 (USBD_TRANSFER_DIRECTION_OUT, USBD_SHORT_TRANSFER_OK)
  TransferBufferLength = 0000000d
  TransferBuffer       = 0e0b4260
  TransferBufferMDL    = 00000000
    00000000: 0b 00 00 82 01 00 3a 80 98 6e 80 0d 80
  UrbLink                 = 00000000
  RequestTypeReservedBits = 00000000
  Request                 = 00000001
  Value                   = 0000000b
  Index                   = 00000000
[8090063 ms] UsbSnoop - MyInternalIOCTLCompletion(0dd57ddc) : fido=00000000, Irp=0ed1db40, Context=09bd0440, IRQL=2
[8090063 ms]  <<<  URB 40 coming back  <<< 
-- URB_FUNCTION_CONTROL_TRANSFER:
  PipeHandle           = 0d567060
  TransferFlags        = 0000000a (USBD_TRANSFER_DIRECTION_OUT, USBD_SHORT_TRANSFER_OK)
  TransferBufferLength = 0000000d
  TransferBuffer       = 0e0b4260
  TransferBufferMDL    = 0a365720
  UrbLink              = 00000000
  SetupPacket          =
    00000000: 40 01 0b 00 00 00 0d 00
[8090063 ms] UsbSnoop - FilterDispatchAny(0dd57b90) : IRP_MJ_INTERNAL_DEVICE_CONTROL
[8090063 ms] UsbSnoop - FdoHookDispatchInternalIoctl(0dd57f8c) : fdo=0e0d7ab0, Irp=0ed1db40, IRQL=0
[8090064 ms]  >>>  URB 41 going down  >>> 
-- URB_FUNCTION_VENDOR_DEVICE:
  TransferFlags          = 00000002 (USBD_TRANSFER_DIRECTION_OUT, USBD_SHORT_TRANSFER_OK)
  TransferBufferLength = 0000000d
  TransferBuffer       = 0e0b4260
  TransferBufferMDL    = 00000000
    00000000: 0b 00 00 82 01 00 3b 80 98 6e 80 0d 80
  UrbLink                 = 00000000
  RequestTypeReservedBits = 00000000
  Request                 = 00000001
  Value                   = 0000000b
  Index                   = 00000000
[8090064 ms] UsbSnoop - MyInternalIOCTLCompletion(0dd57ddc) : fido=00000000, Irp=0ed1db40, Context=09bd0440, IRQL=2
[8090064 ms]  <<<  URB 41 coming back  <<< 
-- URB_FUNCTION_CONTROL_TRANSFER:
  PipeHandle           = 0d567060
  TransferFlags        = 0000000a (USBD_TRANSFER_DIRECTION_OUT, USBD_SHORT_TRANSFER_OK)
  TransferBufferLength = 0000000d
  TransferBuffer       = 0e0b4260
  TransferBufferMDL    = 0de17110
  UrbLink              = 00000000
  SetupPacket          =
    00000000: 40 01 0b 00 00 00 0d 00
[8090163 ms] UsbSnoop - FilterDispatchAny(0dd57b90) : IRP_MJ_INTERNAL_DEVICE_CONTROL
[8090163 ms] UsbSnoop - FdoHookDispatchInternalIoctl(0dd57f8c) : fdo=0e0d7ab0, Irp=0d85d830, IRQL=0
[8090164 ms]  >>>  URB 42 going down  >>> 
-- URB_FUNCTION_VENDOR_DEVICE:
  TransferFlags          = 00000002 (USBD_TRANSFER_DIRECTION_OUT, USBD_SHORT_TRANSFER_OK)
  TransferBufferLength = 0000000d
  TransferBuffer       = 0e0b4260
  TransferBufferMDL    = 00000000
    00000000: 0b 00 00 82 01 00 3a 80 98 6e 80 0d 80
  UrbLink                 = 00000000
  RequestTypeReservedBits = 00000000
  Request                 = 00000001
  Value                   = 0000000b
  Index                   = 00000000
[8090164 ms] UsbSnoop - MyInternalIOCTLCompletion(0dd57ddc) : fido=00000000, Irp=0d85d830, Context=09bd0440, IRQL=2
[8090164 ms]  <<<  URB 42 coming back  <<< 
-- URB_FUNCTION_CONTROL_TRANSFER:
  PipeHandle           = 0d567060
  TransferFlags        = 0000000a (USBD_TRANSFER_DIRECTION_OUT, USBD_SHORT_TRANSFER_OK)
  TransferBufferLength = 0000000d
  TransferBuffer       = 0e0b4260
  TransferBufferMDL    = 075c1790
  UrbLink              = 00000000
  SetupPacket          =
    00000000: 40 01 0b 00 00 00 0d 00
[8090164 ms] UsbSnoop - FilterDispatchAny(0dd57b90) : IRP_MJ_INTERNAL_DEVICE_CONTROL
[8090164 ms] UsbSnoop - FdoHookDispatchInternalIoctl(0dd57f8c) : fdo=0e0d7ab0, Irp=0d85d830, IRQL=0
[8090164 ms]  >>>  URB 43 going down  >>> 
-- URB_FUNCTION_VENDOR_DEVICE:
  TransferFlags          = 00000002 (USBD_TRANSFER_DIRECTION_OUT, USBD_SHORT_TRANSFER_OK)
  TransferBufferLength = 0000000d
  TransferBuffer       = 0e0b4260
  TransferBufferMDL    = 00000000
    00000000: 0b 00 00 82 01 00 3b 00 98 6e 80 0d 80
  UrbLink                 = 00000000
  RequestTypeReservedBits = 00000000
  Request                 = 00000001
  Value                   = 0000000b
  Index                   = 00000000
[8090164 ms] UsbSnoop - MyInternalIOCTLCompletion(0dd57ddc) : fido=00000000, Irp=0d85d830, Context=09bd0440, IRQL=2
[8090164 ms]  <<<  URB 43 coming back  <<< 
-- URB_FUNCTION_CONTROL_TRANSFER:
  PipeHandle           = 0d567060
  TransferFlags        = 0000000a (USBD_TRANSFER_DIRECTION_OUT, USBD_SHORT_TRANSFER_OK)
  TransferBufferLength = 0000000d
  TransferBuffer       = 0e0b4260
  TransferBufferMDL    = 075c1790
  UrbLink              = 00000000
  SetupPacket          =
    00000000: 40 01 0b 00 00 00 0d 00
[8090174 ms] UsbSnoop - FilterDispatchAny(0dd57b90) : IRP_MJ_INTERNAL_DEVICE_CONTROL
[8090174 ms] UsbSnoop - FdoHookDispatchInternalIoctl(0dd57f8c) : fdo=0e0d7ab0, Irp=0d85d830, IRQL=0
[8090174 ms]  >>>  URB 44 going down  >>> 
-- URB_FUNCTION_VENDOR_DEVICE:
  TransferFlags          = 00000002 (USBD_TRANSFER_DIRECTION_OUT, USBD_SHORT_TRANSFER_OK)
  TransferBufferLength = 0000000d
  TransferBuffer       = 0e0b46b0
  TransferBufferMDL    = 00000000
    00000000: 0b 00 00 82 01 17 40 00 bd bf df 02 00
  UrbLink                 = 00000000
  RequestTypeReservedBits = 00000000
  Request                 = 00000001
  Value                   = 0000000b
  Index                   = 00000000
[8090174 ms] UsbSnoop - MyInternalIOCTLCompletion(0dd57ddc) : fido=00000000, Irp=0d85d830, Context=09bd0440, IRQL=2
[8090174 ms]  <<<  URB 44 coming back  <<< 
-- URB_FUNCTION_CONTROL_TRANSFER:
  PipeHandle           = 0d567060
  TransferFlags        = 0000000a (USBD_TRANSFER_DIRECTION_OUT, USBD_SHORT_TRANSFER_OK)
  TransferBufferLength = 0000000d
  TransferBuffer       = 0e0b46b0
  TransferBufferMDL    = 075c1790
  UrbLink              = 00000000
  SetupPacket          =
    00000000: 40 01 0b 00 00 00 0d 00
[8090175 ms] UsbSnoop - FilterDispatchAny(0dd57b90) : IRP_MJ_INTERNAL_DEVICE_CONTROL
[8090175 ms] UsbSnoop - FdoHookDispatchInternalIoctl(0dd57f8c) : fdo=0e0d7ab0, Irp=0d85d830, IRQL=0
[8090175 ms]  >>>  URB 45 going down  >>> 
-- URB_FUNCTION_VENDOR_DEVICE:
  TransferFlags          = 00000002 (USBD_TRANSFER_DIRECTION_OUT, USBD_SHORT_TRANSFER_OK)
  TransferBufferLength = 0000000d
  TransferBuffer       = 0e0b46d0
  TransferBufferMDL    = 00000000
    00000000: 0b 00 00 82 01 00 3a 80 89 75 32 2f 00
  UrbLink                 = 00000000
  RequestTypeReservedBits = 00000000
  Request                 = 00000001
  Value                   = 0000000b
  Index                   = 00000000
[8090175 ms] UsbSnoop - MyInternalIOCTLCompletion(0dd57ddc) : fido=00000000, Irp=0d85d830, Context=09bd0440, IRQL=2
[8090175 ms]  <<<  URB 45 coming back  <<< 
-- URB_FUNCTION_CONTROL_TRANSFER:
  PipeHandle           = 0d567060
  TransferFlags        = 0000000a (USBD_TRANSFER_DIRECTION_OUT, USBD_SHORT_TRANSFER_OK)
  TransferBufferLength = 0000000d
  TransferBuffer       = 0e0b46d0
  TransferBufferMDL    = 075c1790
  UrbLink              = 00000000
  SetupPacket          =
    00000000: 40 01 0b 00 00 00 0d 00
[8090175 ms] UsbSnoop - FilterDispatchAny(0dd57b90) : IRP_MJ_INTERNAL_DEVICE_CONTROL
[8090175 ms] UsbSnoop - FdoHookDispatchInternalIoctl(0dd57f8c) : fdo=0e0d7ab0, Irp=0d85d830, IRQL=0
[8090175 ms]  >>>  URB 46 going down  >>> 
-- URB_FUNCTION_VENDOR_DEVICE:
  TransferFlags          = 00000002 (USBD_TRANSFER_DIRECTION_OUT, USBD_SHORT_TRANSFER_OK)
  TransferBufferLength = 0000000d
  TransferBuffer       = 0e0b46d0
  TransferBufferMDL    = 00000000
    00000000: 0b 00 00 82 01 00 3b 00 89 75 32 2f 00
  UrbLink                 = 00000000
  RequestTypeReservedBits = 00000000
  Request                 = 00000001
  Value                   = 0000000b
  Index                   = 00000000
[8090175 ms] UsbSnoop - MyInternalIOCTLCompletion(0dd57ddc) : fido=00000000, Irp=0d85d830, Context=09bd0440, IRQL=2
[8090175 ms]  <<<  URB 46 coming back  <<< 
-- URB_FUNCTION_CONTROL_TRANSFER:
  PipeHandle           = 0d567060
  TransferFlags        = 0000000a (USBD_TRANSFER_DIRECTION_OUT, USBD_SHORT_TRANSFER_OK)
  TransferBufferLength = 0000000d
  TransferBuffer       = 0e0b46d0
  TransferBufferMDL    = 075c1790
  UrbLink              = 00000000
  SetupPacket          =
    00000000: 40 01 0b 00 00 00 0d 00
[8090175 ms] UsbSnoop - FilterDispatchAny(0dd57b90) : IRP_MJ_INTERNAL_DEVICE_CONTROL
[8090175 ms] UsbSnoop - FdoHookDispatchInternalIoctl(0dd57f8c) : fdo=0e0d7ab0, Irp=0d85d830, IRQL=0
[8090175 ms]  >>>  URB 47 going down  >>> 
-- URB_FUNCTION_VENDOR_DEVICE:
  TransferFlags          = 00000002 (USBD_TRANSFER_DIRECTION_OUT, USBD_SHORT_TRANSFER_OK)
  TransferBufferLength = 0000000d
  TransferBuffer       = 0e0b46d0
  TransferBufferMDL    = 00000000
    00000000: 0b 00 00 82 01 00 34 01 89 75 32 2f 00
  UrbLink                 = 00000000
  RequestTypeReservedBits = 00000000
  Request                 = 00000001
  Value                   = 0000000b
  Index                   = 00000000
[8090175 ms] UsbSnoop - MyInternalIOCTLCompletion(0dd57ddc) : fido=00000000, Irp=0d85d830, Context=09bd0440, IRQL=2
[8090175 ms]  <<<  URB 47 coming back  <<< 
-- URB_FUNCTION_CONTROL_TRANSFER:
  PipeHandle           = 0d567060
  TransferFlags        = 0000000a (USBD_TRANSFER_DIRECTION_OUT, USBD_SHORT_TRANSFER_OK)
  TransferBufferLength = 0000000d
  TransferBuffer       = 0e0b46d0
  TransferBufferMDL    = 075c1790
  UrbLink              = 00000000
  SetupPacket          =
    00000000: 40 01 0b 00 00 00 0d 00
[8090176 ms] UsbSnoop - FilterDispatchAny(0dd57b90) : IRP_MJ_INTERNAL_DEVICE_CONTROL
[8090176 ms] UsbSnoop - FdoHookDispatchInternalIoctl(0dd57f8c) : fdo=0e0d7ab0, Irp=0d85d830, IRQL=0
[8090176 ms]  >>>  URB 48 going down  >>> 
-- URB_FUNCTION_VENDOR_DEVICE:
  TransferFlags          = 00000002 (USBD_TRANSFER_DIRECTION_OUT, USBD_SHORT_TRANSFER_OK)
  TransferBufferLength = 0000000d
  TransferBuffer       = 0e0b46d0
  TransferBufferMDL    = 00000000
    00000000: 0b 00 00 82 01 00 35 00 89 75 32 2f 00
  UrbLink                 = 00000000
  RequestTypeReservedBits = 00000000
  Request                 = 00000001
  Value                   = 0000000b
  Index                   = 00000000
[8090176 ms] UsbSnoop - MyInternalIOCTLCompletion(0dd57ddc) : fido=00000000, Irp=0d85d830, Context=09bd0440, IRQL=2
[8090176 ms]  <<<  URB 48 coming back  <<< 
-- URB_FUNCTION_CONTROL_TRANSFER:
  PipeHandle           = 0d567060
  TransferFlags        = 0000000a (USBD_TRANSFER_DIRECTION_OUT, USBD_SHORT_TRANSFER_OK)
  TransferBufferLength = 0000000d
  TransferBuffer       = 0e0b46d0
  TransferBufferMDL    = 075c1790
  UrbLink              = 00000000
  SetupPacket          =
    00000000: 40 01 0b 00 00 00 0d 00
[8090218 ms] UsbSnoop - FilterDispatchAny(0dd57b90) : IRP_MJ_INTERNAL_DEVICE_CONTROL
[8090218 ms] UsbSnoop - FdoHookDispatchInternalIoctl(0dd57f8c) : fdo=0e0d7ab0, Irp=0e2c1010, IRQL=0
[8090218 ms]  >>>  URB 49 going down  >>> 
-- URB_FUNCTION_VENDOR_DEVICE:
  TransferFlags          = 00000002 (USBD_TRANSFER_DIRECTION_OUT, USBD_SHORT_TRANSFER_OK)
  TransferBufferLength = 0000000d
  TransferBuffer       = 0e0b4248
  TransferBufferMDL    = 00000000
    00000000: 0b 00 20 82 01 30 80 1b 00 00 00 00 00
  UrbLink                 = 00000000
  RequestTypeReservedBits = 00000000
  Request                 = 00000001
  Value                   = 0000000b
  Index                   = 00000000
[8090218 ms] UsbSnoop - MyInternalIOCTLCompletion(0dd57ddc) : fido=00000000, Irp=0e2c1010, Context=09bd0440, IRQL=2
[8090218 ms]  <<<  URB 49 coming back  <<< 
-- URB_FUNCTION_CONTROL_TRANSFER:
  PipeHandle           = 0d567060
  TransferFlags        = 0000000a (USBD_TRANSFER_DIRECTION_OUT, USBD_SHORT_TRANSFER_OK)
  TransferBufferLength = 0000000d
  TransferBuffer       = 0e0b4248
  TransferBufferMDL    = 0e2420d0
  UrbLink              = 00000000
  SetupPacket          =
    00000000: 40 01 0b 00 00 00 0d 00
[8090218 ms] UsbSnoop - FilterDispatchAny(0dd57b90) : IRP_MJ_INTERNAL_DEVICE_CONTROL
[8090218 ms] UsbSnoop - FdoHookDispatchInternalIoctl(0dd57f8c) : fdo=0e0d7ab0, Irp=0e2c1010, IRQL=0
[8090218 ms]  >>>  URB 50 going down  >>> 
-- URB_FUNCTION_VENDOR_DEVICE:
  TransferFlags          = 00000003 (USBD_TRANSFER_DIRECTION_IN, USBD_SHORT_TRANSFER_OK)
  TransferBufferLength = 0000000d
  TransferBuffer       = 0e0b4248
  TransferBufferMDL    = 00000000
  UrbLink                 = 00000000
  RequestTypeReservedBits = 00000000
  Request                 = 00000001
  Value                   = 0000000b
  Index                   = 00000000
[8090218 ms] UsbSnoop - MyInternalIOCTLCompletion(0dd57ddc) : fido=00000000, Irp=0e2c1010, Context=09bd0440, IRQL=2
[8090218 ms]  <<<  URB 50 coming back  <<< 
-- URB_FUNCTION_CONTROL_TRANSFER:
  PipeHandle           = 0d567060
  TransferFlags        = 0000000b (USBD_TRANSFER_DIRECTION_IN, USBD_SHORT_TRANSFER_OK)
  TransferBufferLength = 0000000d
  TransferBuffer       = 0e0b4248
  TransferBufferMDL    = 0e0d12f0
    00000000: 0b 00 20 82 01 30 80 80 00 00 00 00 00
  UrbLink              = 00000000
  SetupPacket          =
    00000000: c0 01 0b 00 00 00 0d 00
[8090218 ms] UsbSnoop - FilterDispatchAny(0dd57b90) : IRP_MJ_INTERNAL_DEVICE_CONTROL
[8090218 ms] UsbSnoop - FdoHookDispatchInternalIoctl(0dd57f8c) : fdo=0e0d7ab0, Irp=0e2c1010, IRQL=0
[8090218 ms]  >>>  URB 51 going down  >>> 
-- URB_FUNCTION_VENDOR_DEVICE:
  TransferFlags          = 00000002 (USBD_TRANSFER_DIRECTION_OUT, USBD_SHORT_TRANSFER_OK)
  TransferBufferLength = 0000000d
  TransferBuffer       = 0e0b4260
  TransferBufferMDL    = 00000000
    00000000: 0b 00 00 82 01 00 34 11 50 b3 df 02 00
  UrbLink                 = 00000000
  RequestTypeReservedBits = 00000000
  Request                 = 00000001
  Value                   = 0000000b
  Index                   = 00000000
[8090218 ms] UsbSnoop - MyInternalIOCTLCompletion(0dd57ddc) : fido=00000000, Irp=0e2c1010, Context=09bd0440, IRQL=2
[8090218 ms]  <<<  URB 51 coming back  <<< 
-- URB_FUNCTION_CONTROL_TRANSFER:
  PipeHandle           = 0d567060
  TransferFlags        = 0000000a (USBD_TRANSFER_DIRECTION_OUT, USBD_SHORT_TRANSFER_OK)
  TransferBufferLength = 0000000d
  TransferBuffer       = 0e0b4260
  TransferBufferMDL    = 0de17110
  UrbLink              = 00000000
  SetupPacket          =
    00000000: 40 01 0b 00 00 00 0d 00
[8090219 ms] UsbSnoop - FilterDispatchAny(0dd57b90) : IRP_MJ_INTERNAL_DEVICE_CONTROL
[8090219 ms] UsbSnoop - FdoHookDispatchInternalIoctl(0dd57f8c) : fdo=0e0d7ab0, Irp=0e2c1010, IRQL=0
[8090219 ms]  >>>  URB 52 going down  >>> 
-- URB_FUNCTION_VENDOR_DEVICE:
  TransferFlags          = 00000002 (USBD_TRANSFER_DIRECTION_OUT, USBD_SHORT_TRANSFER_OK)
  TransferBufferLength = 0000000d
  TransferBuffer       = 0e0b4260
  TransferBufferMDL    = 00000000
    00000000: 0b 00 00 82 01 00 35 11 50 b3 df 02 00
  UrbLink                 = 00000000
  RequestTypeReservedBits = 00000000
  Request                 = 00000001
  Value                   = 0000000b
  Index                   = 00000000
[8090219 ms] UsbSnoop - MyInternalIOCTLCompletion(0dd57ddc) : fido=00000000, Irp=0e2c1010, Context=09bd0440, IRQL=2
[8090219 ms]  <<<  URB 52 coming back  <<< 
-- URB_FUNCTION_CONTROL_TRANSFER:
  PipeHandle           = 0d567060
  TransferFlags        = 0000000a (USBD_TRANSFER_DIRECTION_OUT, USBD_SHORT_TRANSFER_OK)
  TransferBufferLength = 0000000d
  TransferBuffer       = 0e0b4260
  TransferBufferMDL    = 0a365720
  UrbLink              = 00000000
  SetupPacket          =
    00000000: 40 01 0b 00 00 00 0d 00
[8090228 ms] UsbSnoop - FilterDispatchAny(0dd57b90) : IRP_MJ_INTERNAL_DEVICE_CONTROL
[8090228 ms] UsbSnoop - FdoHookDispatchInternalIoctl(0dd57f8c) : fdo=0e0d7ab0, Irp=0e2c1010, IRQL=0
[8090228 ms]  >>>  URB 53 going down  >>> 
-- URB_FUNCTION_VENDOR_DEVICE:
  TransferFlags          = 00000002 (USBD_TRANSFER_DIRECTION_OUT, USBD_SHORT_TRANSFER_OK)
  TransferBufferLength = 0000000d
  TransferBuffer       = 0e0b4260
  TransferBufferMDL    = 00000000
    00000000: 0b 00 00 82 01 00 3a 80 68 a3 e5 09 80
  UrbLink                 = 00000000
  RequestTypeReservedBits = 00000000
  Request                 = 00000001
  Value                   = 0000000b
  Index                   = 00000000
[8090229 ms] UsbSnoop - MyInternalIOCTLCompletion(0dd57ddc) : fido=00000000, Irp=0e2c1010, Context=09bd0440, IRQL=2
[8090229 ms]  <<<  URB 53 coming back  <<< 
-- URB_FUNCTION_CONTROL_TRANSFER:
  PipeHandle           = 0d567060
  TransferFlags        = 0000000a (USBD_TRANSFER_DIRECTION_OUT, USBD_SHORT_TRANSFER_OK)
  TransferBufferLength = 0000000d
  TransferBuffer       = 0e0b4260
  TransferBufferMDL    = 0dd7a010
  UrbLink              = 00000000
  SetupPacket          =
    00000000: 40 01 0b 00 00 00 0d 00
[8090229 ms] UsbSnoop - FilterDispatchAny(0dd57b90) : IRP_MJ_INTERNAL_DEVICE_CONTROL
[8090229 ms] UsbSnoop - FdoHookDispatchInternalIoctl(0dd57f8c) : fdo=0e0d7ab0, Irp=0e2c1010, IRQL=0
[8090229 ms]  >>>  URB 54 going down  >>> 
-- URB_FUNCTION_VENDOR_DEVICE:
  TransferFlags          = 00000002 (USBD_TRANSFER_DIRECTION_OUT, USBD_SHORT_TRANSFER_OK)
  TransferBufferLength = 0000000d
  TransferBuffer       = 0e0b4260
  TransferBufferMDL    = 00000000
    00000000: 0b 00 00 82 01 00 3b 80 68 a3 e5 09 80
  UrbLink                 = 00000000
  RequestTypeReservedBits = 00000000
  Request                 = 00000001
  Value                   = 0000000b
  Index                   = 00000000
[8090229 ms] UsbSnoop - MyInternalIOCTLCompletion(0dd57ddc) : fido=00000000, Irp=0e2c1010, Context=09bd0440, IRQL=2
[8090229 ms]  <<<  URB 54 coming back  <<< 
-- URB_FUNCTION_CONTROL_TRANSFER:
  PipeHandle           = 0d567060
  TransferFlags        = 0000000a (USBD_TRANSFER_DIRECTION_OUT, USBD_SHORT_TRANSFER_OK)
  TransferBufferLength = 0000000d
  TransferBuffer       = 0e0b4260
  TransferBufferMDL    = 0dd7a010
  UrbLink              = 00000000
  SetupPacket          =
    00000000: 40 01 0b 00 00 00 0d 00
[8090332 ms] UsbSnoop - FilterDispatchAny(0dd57b90) : IRP_MJ_INTERNAL_DEVICE_CONTROL
[8090332 ms] UsbSnoop - FdoHookDispatchInternalIoctl(0dd57f8c) : fdo=0e0d7ab0, Irp=0de8a830, IRQL=0
[8090332 ms]  >>>  URB 55 going down  >>> 
-- URB_FUNCTION_VENDOR_DEVICE:
  TransferFlags          = 00000002 (USBD_TRANSFER_DIRECTION_OUT, USBD_SHORT_TRANSFER_OK)
  TransferBufferLength = 0000000d
  TransferBuffer       = 0e0b4260
  TransferBufferMDL    = 00000000
    00000000: 0b 00 00 82 01 00 3a 80 68 a3 e5 09 80
  UrbLink                 = 00000000
  RequestTypeReservedBits = 00000000
  Request                 = 00000001
  Value                   = 0000000b
  Index                   = 00000000
[8090332 ms] UsbSnoop - MyInternalIOCTLCompletion(0dd57ddc) : fido=00000000, Irp=0de8a830, Context=09bd0440, IRQL=2
[8090332 ms]  <<<  URB 55 coming back  <<< 
-- URB_FUNCTION_CONTROL_TRANSFER:
  PipeHandle           = 0d567060
  TransferFlags        = 0000000a (USBD_TRANSFER_DIRECTION_OUT, USBD_SHORT_TRANSFER_OK)
  TransferBufferLength = 0000000d
  TransferBuffer       = 0e0b4260
  TransferBufferMDL    = 0e3c07f0
  UrbLink              = 00000000
  SetupPacket          =
    00000000: 40 01 0b 00 00 00 0d 00
[8090332 ms] UsbSnoop - FilterDispatchAny(0dd57b90) : IRP_MJ_INTERNAL_DEVICE_CONTROL
[8090332 ms] UsbSnoop - FdoHookDispatchInternalIoctl(0dd57f8c) : fdo=0e0d7ab0, Irp=0de8a830, IRQL=0
[8090332 ms]  >>>  URB 56 going down  >>> 
-- URB_FUNCTION_VENDOR_DEVICE:
  TransferFlags          = 00000002 (USBD_TRANSFER_DIRECTION_OUT, USBD_SHORT_TRANSFER_OK)
  TransferBufferLength = 0000000d
  TransferBuffer       = 0e0b4260
  TransferBufferMDL    = 00000000
    00000000: 0b 00 00 82 01 00 3b 00 68 a3 e5 09 80
  UrbLink                 = 00000000
  RequestTypeReservedBits = 00000000
  Request                 = 00000001
  Value                   = 0000000b
  Index                   = 00000000
[8090332 ms] UsbSnoop - MyInternalIOCTLCompletion(0dd57ddc) : fido=00000000, Irp=0de8a830, Context=09bd0440, IRQL=2
[8090332 ms]  <<<  URB 56 coming back  <<< 
-- URB_FUNCTION_CONTROL_TRANSFER:
  PipeHandle           = 0d567060
  TransferFlags        = 0000000a (USBD_TRANSFER_DIRECTION_OUT, USBD_SHORT_TRANSFER_OK)
  TransferBufferLength = 0000000d
  TransferBuffer       = 0e0b4260
  TransferBufferMDL    = 0dd7a010
  UrbLink              = 00000000
  SetupPacket          =
    00000000: 40 01 0b 00 00 00 0d 00
[8090342 ms] UsbSnoop - FilterDispatchAny(0dd57b90) : IRP_MJ_INTERNAL_DEVICE_CONTROL
[8090342 ms] UsbSnoop - FdoHookDispatchInternalIoctl(0dd57f8c) : fdo=0e0d7ab0, Irp=0de8a830, IRQL=0
[8090342 ms]  >>>  URB 57 going down  >>> 
-- URB_FUNCTION_VENDOR_DEVICE:
  TransferFlags          = 00000002 (USBD_TRANSFER_DIRECTION_OUT, USBD_SHORT_TRANSFER_OK)
  TransferBufferLength = 0000000d
  TransferBuffer       = 0e0b46b0
  TransferBufferMDL    = 00000000
    00000000: 0b 00 00 82 01 17 40 00 bd bf df 02 00
  UrbLink                 = 00000000
  RequestTypeReservedBits = 00000000
  Request                 = 00000001
  Value                   = 0000000b
  Index                   = 00000000
[8090342 ms] UsbSnoop - MyInternalIOCTLCompletion(0dd57ddc) : fido=00000000, Irp=0de8a830, Context=09bd0440, IRQL=2
[8090342 ms]  <<<  URB 57 coming back  <<< 
-- URB_FUNCTION_CONTROL_TRANSFER:
  PipeHandle           = 0d567060
  TransferFlags        = 0000000a (USBD_TRANSFER_DIRECTION_OUT, USBD_SHORT_TRANSFER_OK)
  TransferBufferLength = 0000000d
  TransferBuffer       = 0e0b46b0
  TransferBufferMDL    = 0dd7a010
  UrbLink              = 00000000
  SetupPacket          =
    00000000: 40 01 0b 00 00 00 0d 00
[8090343 ms] UsbSnoop - FilterDispatchAny(0dd57b90) : IRP_MJ_INTERNAL_DEVICE_CONTROL
[8090343 ms] UsbSnoop - FdoHookDispatchInternalIoctl(0dd57f8c) : fdo=0e0d7ab0, Irp=0de8a830, IRQL=0
[8090343 ms]  >>>  URB 58 going down  >>> 
-- URB_FUNCTION_VENDOR_DEVICE:
  TransferFlags          = 00000002 (USBD_TRANSFER_DIRECTION_OUT, USBD_SHORT_TRANSFER_OK)
  TransferBufferLength = 0000000d
  TransferBuffer       = 0e0b46d0
  TransferBufferMDL    = 00000000
    00000000: 0b 00 00 82 01 00 3a 80 89 75 32 2f 00
  UrbLink                 = 00000000
  RequestTypeReservedBits = 00000000
  Request                 = 00000001
  Value                   = 0000000b
  Index                   = 00000000
[8090343 ms] UsbSnoop - MyInternalIOCTLCompletion(0dd57ddc) : fido=00000000, Irp=0de8a830, Context=09bd0440, IRQL=2
[8090343 ms]  <<<  URB 58 coming back  <<< 
-- URB_FUNCTION_CONTROL_TRANSFER:
  PipeHandle           = 0d567060
  TransferFlags        = 0000000a (USBD_TRANSFER_DIRECTION_OUT, USBD_SHORT_TRANSFER_OK)
  TransferBufferLength = 0000000d
  TransferBuffer       = 0e0b46d0
  TransferBufferMDL    = 0dd7a010
  UrbLink              = 00000000
  SetupPacket          =
    00000000: 40 01 0b 00 00 00 0d 00
[8090343 ms] UsbSnoop - FilterDispatchAny(0dd57b90) : IRP_MJ_INTERNAL_DEVICE_CONTROL
[8090343 ms] UsbSnoop - FdoHookDispatchInternalIoctl(0dd57f8c) : fdo=0e0d7ab0, Irp=0de8a830, IRQL=0
[8090343 ms]  >>>  URB 59 going down  >>> 
-- URB_FUNCTION_VENDOR_DEVICE:
  TransferFlags          = 00000002 (USBD_TRANSFER_DIRECTION_OUT, USBD_SHORT_TRANSFER_OK)
  TransferBufferLength = 0000000d
  TransferBuffer       = 0e0b46d0
  TransferBufferMDL    = 00000000
    00000000: 0b 00 00 82 01 00 3b 00 89 75 32 2f 00
  UrbLink                 = 00000000
  RequestTypeReservedBits = 00000000
  Request                 = 00000001
  Value                   = 0000000b
  Index                   = 00000000
[8090343 ms] UsbSnoop - MyInternalIOCTLCompletion(0dd57ddc) : fido=00000000, Irp=0de8a830, Context=09bd0440, IRQL=2
[8090343 ms]  <<<  URB 59 coming back  <<< 
-- URB_FUNCTION_CONTROL_TRANSFER:
  PipeHandle           = 0d567060
  TransferFlags        = 0000000a (USBD_TRANSFER_DIRECTION_OUT, USBD_SHORT_TRANSFER_OK)
  TransferBufferLength = 0000000d
  TransferBuffer       = 0e0b46d0
  TransferBufferMDL    = 0dd7a010
  UrbLink              = 00000000
  SetupPacket          =
    00000000: 40 01 0b 00 00 00 0d 00
[8090343 ms] UsbSnoop - FilterDispatchAny(0dd57b90) : IRP_MJ_INTERNAL_DEVICE_CONTROL
[8090343 ms] UsbSnoop - FdoHookDispatchInternalIoctl(0dd57f8c) : fdo=0e0d7ab0, Irp=0de8a830, IRQL=0
[8090343 ms]  >>>  URB 60 going down  >>> 
-- URB_FUNCTION_VENDOR_DEVICE:
  TransferFlags          = 00000002 (USBD_TRANSFER_DIRECTION_OUT, USBD_SHORT_TRANSFER_OK)
  TransferBufferLength = 0000000d
  TransferBuffer       = 0e0b46d0
  TransferBufferMDL    = 00000000
    00000000: 0b 00 00 82 01 00 34 01 89 75 32 2f 00
  UrbLink                 = 00000000
  RequestTypeReservedBits = 00000000
  Request                 = 00000001
  Value                   = 0000000b
  Index                   = 00000000
[8090344 ms] UsbSnoop - MyInternalIOCTLCompletion(0dd57ddc) : fido=00000000, Irp=0de8a830, Context=09bd0440, IRQL=2
[8090344 ms]  <<<  URB 60 coming back  <<< 
-- URB_FUNCTION_CONTROL_TRANSFER:
  PipeHandle           = 0d567060
  TransferFlags        = 0000000a (USBD_TRANSFER_DIRECTION_OUT, USBD_SHORT_TRANSFER_OK)
  TransferBufferLength = 0000000d
  TransferBuffer       = 0e0b46d0
  TransferBufferMDL    = 0dd7a010
  UrbLink              = 00000000
  SetupPacket          =
    00000000: 40 01 0b 00 00 00 0d 00
[8090344 ms] UsbSnoop - FilterDispatchAny(0dd57b90) : IRP_MJ_INTERNAL_DEVICE_CONTROL
[8090344 ms] UsbSnoop - FdoHookDispatchInternalIoctl(0dd57f8c) : fdo=0e0d7ab0, Irp=0de8a830, IRQL=0
[8090344 ms]  >>>  URB 61 going down  >>> 
-- URB_FUNCTION_VENDOR_DEVICE:
  TransferFlags          = 00000002 (USBD_TRANSFER_DIRECTION_OUT, USBD_SHORT_TRANSFER_OK)
  TransferBufferLength = 0000000d
  TransferBuffer       = 0e0b46d0
  TransferBufferMDL    = 00000000
    00000000: 0b 00 00 82 01 00 35 00 89 75 32 2f 00
  UrbLink                 = 00000000
  RequestTypeReservedBits = 00000000
  Request                 = 00000001
  Value                   = 0000000b
  Index                   = 00000000
[8090344 ms] UsbSnoop - MyInternalIOCTLCompletion(0dd57ddc) : fido=00000000, Irp=0de8a830, Context=09bd0440, IRQL=2
[8090344 ms]  <<<  URB 61 coming back  <<< 
-- URB_FUNCTION_CONTROL_TRANSFER:
  PipeHandle           = 0d567060
  TransferFlags        = 0000000a (USBD_TRANSFER_DIRECTION_OUT, USBD_SHORT_TRANSFER_OK)
  TransferBufferLength = 0000000d
  TransferBuffer       = 0e0b46d0
  TransferBufferMDL    = 0dd7a010
  UrbLink              = 00000000
  SetupPacket          =
    00000000: 40 01 0b 00 00 00 0d 00
[8090369 ms] UsbSnoop - FilterDispatchAny(0dd57b90) : IRP_MJ_INTERNAL_DEVICE_CONTROL
[8090369 ms] UsbSnoop - FdoHookDispatchInternalIoctl(0dd57f8c) : fdo=0e0d7ab0, Irp=09e5a010, IRQL=0
[8090369 ms]  >>>  URB 62 going down  >>> 
-- URB_FUNCTION_VENDOR_DEVICE:
  TransferFlags          = 00000002 (USBD_TRANSFER_DIRECTION_OUT, USBD_SHORT_TRANSFER_OK)
  TransferBufferLength = 0000000d
  TransferBuffer       = 0e0b4248
  TransferBufferMDL    = 00000000
    00000000: 0b 00 20 82 01 30 80 1b 00 00 00 00 00
  UrbLink                 = 00000000
  RequestTypeReservedBits = 00000000
  Request                 = 00000001
  Value                   = 0000000b
  Index                   = 00000000
[8090369 ms] UsbSnoop - MyInternalIOCTLCompletion(0dd57ddc) : fido=00000000, Irp=09e5a010, Context=09bd0440, IRQL=2
[8090369 ms]  <<<  URB 62 coming back  <<< 
-- URB_FUNCTION_CONTROL_TRANSFER:
  PipeHandle           = 0d567060
  TransferFlags        = 0000000a (USBD_TRANSFER_DIRECTION_OUT, USBD_SHORT_TRANSFER_OK)
  TransferBufferLength = 0000000d
  TransferBuffer       = 0e0b4248
  TransferBufferMDL    = 09d3a640
  UrbLink              = 00000000
  SetupPacket          =
    00000000: 40 01 0b 00 00 00 0d 00
[8090369 ms] UsbSnoop - FilterDispatchAny(0dd57b90) : IRP_MJ_INTERNAL_DEVICE_CONTROL
[8090369 ms] UsbSnoop - FdoHookDispatchInternalIoctl(0dd57f8c) : fdo=0e0d7ab0, Irp=09e5a010, IRQL=0
[8090369 ms]  >>>  URB 63 going down  >>> 
-- URB_FUNCTION_VENDOR_DEVICE:
  TransferFlags          = 00000003 (USBD_TRANSFER_DIRECTION_IN, USBD_SHORT_TRANSFER_OK)
  TransferBufferLength = 0000000d
  TransferBuffer       = 0e0b4248
  TransferBufferMDL    = 00000000
  UrbLink                 = 00000000
  RequestTypeReservedBits = 00000000
  Request                 = 00000001
  Value                   = 0000000b
  Index                   = 00000000
[8090369 ms] UsbSnoop - MyInternalIOCTLCompletion(0dd57ddc) : fido=00000000, Irp=09e5a010, Context=09bd0440, IRQL=2
[8090369 ms]  <<<  URB 63 coming back  <<< 
-- URB_FUNCTION_CONTROL_TRANSFER:
  PipeHandle           = 0d567060
  TransferFlags        = 0000000b (USBD_TRANSFER_DIRECTION_IN, USBD_SHORT_TRANSFER_OK)
  TransferBufferLength = 0000000d
  TransferBuffer       = 0e0b4248
  TransferBufferMDL    = 09d3a640
    00000000: 0b 00 20 82 01 30 80 80 00 00 00 00 00
  UrbLink              = 00000000
  SetupPacket          =
    00000000: c0 01 0b 00 00 00 0d 00
[8090369 ms] UsbSnoop - FilterDispatchAny(0dd57b90) : IRP_MJ_INTERNAL_DEVICE_CONTROL
[8090369 ms] UsbSnoop - FdoHookDispatchInternalIoctl(0dd57f8c) : fdo=0e0d7ab0, Irp=09e5a010, IRQL=0
[8090369 ms]  >>>  URB 64 going down  >>> 
-- URB_FUNCTION_VENDOR_DEVICE:
  TransferFlags          = 00000002 (USBD_TRANSFER_DIRECTION_OUT, USBD_SHORT_TRANSFER_OK)
  TransferBufferLength = 0000000d
  TransferBuffer       = 0e0b4260
  TransferBufferMDL    = 00000000
    00000000: 0b 00 00 82 01 00 34 11 50 b3 df 02 00
  UrbLink                 = 00000000
  RequestTypeReservedBits = 00000000
  Request                 = 00000001
  Value                   = 0000000b
  Index                   = 00000000
[8090370 ms] UsbSnoop - MyInternalIOCTLCompletion(0dd57ddc) : fido=00000000, Irp=09e5a010, Context=09bd0440, IRQL=2
[8090370 ms]  <<<  URB 64 coming back  <<< 
-- URB_FUNCTION_CONTROL_TRANSFER:
  PipeHandle           = 0d567060
  TransferFlags        = 0000000a (USBD_TRANSFER_DIRECTION_OUT, USBD_SHORT_TRANSFER_OK)
  TransferBufferLength = 0000000d
  TransferBuffer       = 0e0b4260
  TransferBufferMDL    = 09d3a640
  UrbLink              = 00000000
  SetupPacket          =
    00000000: 40 01 0b 00 00 00 0d 00
[8090370 ms] UsbSnoop - FilterDispatchAny(0dd57b90) : IRP_MJ_INTERNAL_DEVICE_CONTROL
[8090370 ms] UsbSnoop - FdoHookDispatchInternalIoctl(0dd57f8c) : fdo=0e0d7ab0, Irp=09e5a010, IRQL=0
[8090370 ms]  >>>  URB 65 going down  >>> 
-- URB_FUNCTION_VENDOR_DEVICE:
  TransferFlags          = 00000002 (USBD_TRANSFER_DIRECTION_OUT, USBD_SHORT_TRANSFER_OK)
  TransferBufferLength = 0000000d
  TransferBuffer       = 0e0b4260
  TransferBufferMDL    = 00000000
    00000000: 0b 00 00 82 01 00 35 11 50 b3 df 02 00
  UrbLink                 = 00000000
  RequestTypeReservedBits = 00000000
  Request                 = 00000001
  Value                   = 0000000b
  Index                   = 00000000
[8090370 ms] UsbSnoop - MyInternalIOCTLCompletion(0dd57ddc) : fido=00000000, Irp=09e5a010, Context=09bd0440, IRQL=2
[8090370 ms]  <<<  URB 65 coming back  <<< 
-- URB_FUNCTION_CONTROL_TRANSFER:
  PipeHandle           = 0d567060
  TransferFlags        = 0000000a (USBD_TRANSFER_DIRECTION_OUT, USBD_SHORT_TRANSFER_OK)
  TransferBufferLength = 0000000d
  TransferBuffer       = 0e0b4260
  TransferBufferMDL    = 09d3a640
  UrbLink              = 00000000
  SetupPacket          =
    00000000: 40 01 0b 00 00 00 0d 00
[8090383 ms] UsbSnoop - FilterDispatchAny(0dd57b90) : IRP_MJ_INTERNAL_DEVICE_CONTROL
[8090383 ms] UsbSnoop - FdoHookDispatchInternalIoctl(0dd57f8c) : fdo=0e0d7ab0, Irp=09e5a010, IRQL=0
[8090383 ms]  >>>  URB 66 going down  >>> 
-- URB_FUNCTION_VENDOR_DEVICE:
  TransferFlags          = 00000002 (USBD_TRANSFER_DIRECTION_OUT, USBD_SHORT_TRANSFER_OK)
  TransferBufferLength = 0000000d
  TransferBuffer       = 0e0b4260
  TransferBufferMDL    = 00000000
    00000000: 0b 00 00 82 01 00 3a 80 68 13 2c 0e 80
  UrbLink                 = 00000000
  RequestTypeReservedBits = 00000000
  Request                 = 00000001
  Value                   = 0000000b
  Index                   = 00000000
[8090383 ms] UsbSnoop - MyInternalIOCTLCompletion(0dd57ddc) : fido=00000000, Irp=09e5a010, Context=09bd0440, IRQL=2
[8090383 ms]  <<<  URB 66 coming back  <<< 
-- URB_FUNCTION_CONTROL_TRANSFER:
  PipeHandle           = 0d567060
  TransferFlags        = 0000000a (USBD_TRANSFER_DIRECTION_OUT, USBD_SHORT_TRANSFER_OK)
  TransferBufferLength = 0000000d
  TransferBuffer       = 0e0b4260
  TransferBufferMDL    = 09d3a640
  UrbLink              = 00000000
  SetupPacket          =
    00000000: 40 01 0b 00 00 00 0d 00
[8090383 ms] UsbSnoop - FilterDispatchAny(0dd57b90) : IRP_MJ_INTERNAL_DEVICE_CONTROL
[8090383 ms] UsbSnoop - FdoHookDispatchInternalIoctl(0dd57f8c) : fdo=0e0d7ab0, Irp=09e5a010, IRQL=0
[8090383 ms]  >>>  URB 67 going down  >>> 
-- URB_FUNCTION_VENDOR_DEVICE:
  TransferFlags          = 00000002 (USBD_TRANSFER_DIRECTION_OUT, USBD_SHORT_TRANSFER_OK)
  TransferBufferLength = 0000000d
  TransferBuffer       = 0e0b4260
  TransferBufferMDL    = 00000000
    00000000: 0b 00 00 82 01 00 3b 80 68 13 2c 0e 80
  UrbLink                 = 00000000
  RequestTypeReservedBits = 00000000
  Request                 = 00000001
  Value                   = 0000000b
  Index                   = 00000000
[8090383 ms] UsbSnoop - MyInternalIOCTLCompletion(0dd57ddc) : fido=00000000, Irp=09e5a010, Context=09bd0440, IRQL=2
[8090383 ms]  <<<  URB 67 coming back  <<< 
-- URB_FUNCTION_CONTROL_TRANSFER:
  PipeHandle           = 0d567060
  TransferFlags        = 0000000a (USBD_TRANSFER_DIRECTION_OUT, USBD_SHORT_TRANSFER_OK)
  TransferBufferLength = 0000000d
  TransferBuffer       = 0e0b4260
  TransferBufferMDL    = 09d3a640
  UrbLink              = 00000000
  SetupPacket          =
    00000000: 40 01 0b 00 00 00 0d 00
[8090483 ms] UsbSnoop - FilterDispatchAny(0dd57b90) : IRP_MJ_INTERNAL_DEVICE_CONTROL
[8090483 ms] UsbSnoop - FdoHookDispatchInternalIoctl(0dd57f8c) : fdo=0e0d7ab0, Irp=0ed1db40, IRQL=0
[8090483 ms]  >>>  URB 68 going down  >>> 
-- URB_FUNCTION_VENDOR_DEVICE:
  TransferFlags          = 00000002 (USBD_TRANSFER_DIRECTION_OUT, USBD_SHORT_TRANSFER_OK)
  TransferBufferLength = 0000000d
  TransferBuffer       = 0e0b4260
  TransferBufferMDL    = 00000000
    00000000: 0b 00 00 82 01 00 3a 80 68 13 2c 0e 80
  UrbLink                 = 00000000
  RequestTypeReservedBits = 00000000
  Request                 = 00000001
  Value                   = 0000000b
  Index                   = 00000000
[8090483 ms] UsbSnoop - MyInternalIOCTLCompletion(0dd57ddc) : fido=00000000, Irp=0ed1db40, Context=09bd0440, IRQL=2
[8090483 ms]  <<<  URB 68 coming back  <<< 
-- URB_FUNCTION_CONTROL_TRANSFER:
  PipeHandle           = 0d567060
  TransferFlags        = 0000000a (USBD_TRANSFER_DIRECTION_OUT, USBD_SHORT_TRANSFER_OK)
  TransferBufferLength = 0000000d
  TransferBuffer       = 0e0b4260
  TransferBufferMDL    = 07efd370
  UrbLink              = 00000000
  SetupPacket          =
    00000000: 40 01 0b 00 00 00 0d 00
[8090483 ms] UsbSnoop - FilterDispatchAny(0dd57b90) : IRP_MJ_INTERNAL_DEVICE_CONTROL
[8090483 ms] UsbSnoop - FdoHookDispatchInternalIoctl(0dd57f8c) : fdo=0e0d7ab0, Irp=0ed1db40, IRQL=0
[8090483 ms]  >>>  URB 69 going down  >>> 
-- URB_FUNCTION_VENDOR_DEVICE:
  TransferFlags          = 00000002 (USBD_TRANSFER_DIRECTION_OUT, USBD_SHORT_TRANSFER_OK)
  TransferBufferLength = 0000000d
  TransferBuffer       = 0e0b4260
  TransferBufferMDL    = 00000000
    00000000: 0b 00 00 82 01 00 3b 00 68 13 2c 0e 80
  UrbLink                 = 00000000
  RequestTypeReservedBits = 00000000
  Request                 = 00000001
  Value                   = 0000000b
  Index                   = 00000000
[8090484 ms] UsbSnoop - MyInternalIOCTLCompletion(0dd57ddc) : fido=00000000, Irp=0ed1db40, Context=09bd0440, IRQL=2
[8090484 ms]  <<<  URB 69 coming back  <<< 
-- URB_FUNCTION_CONTROL_TRANSFER:
  PipeHandle           = 0d567060
  TransferFlags        = 0000000a (USBD_TRANSFER_DIRECTION_OUT, USBD_SHORT_TRANSFER_OK)
  TransferBufferLength = 0000000d
  TransferBuffer       = 0e0b4260
  TransferBufferMDL    = 07efd370
  UrbLink              = 00000000
  SetupPacket          =
    00000000: 40 01 0b 00 00 00 0d 00
[8090494 ms] UsbSnoop - FilterDispatchAny(0dd57b90) : IRP_MJ_INTERNAL_DEVICE_CONTROL
[8090494 ms] UsbSnoop - FdoHookDispatchInternalIoctl(0dd57f8c) : fdo=0e0d7ab0, Irp=0d89ab40, IRQL=0
[8090494 ms]  >>>  URB 70 going down  >>> 
-- URB_FUNCTION_VENDOR_DEVICE:
  TransferFlags          = 00000002 (USBD_TRANSFER_DIRECTION_OUT, USBD_SHORT_TRANSFER_OK)
  TransferBufferLength = 0000000d
  TransferBuffer       = 0e0b46b0
  TransferBufferMDL    = 00000000
    00000000: 0b 00 00 82 01 17 40 00 bd bf df 02 00
  UrbLink                 = 00000000
  RequestTypeReservedBits = 00000000
  Request                 = 00000001
  Value                   = 0000000b
  Index                   = 00000000
[8090494 ms] UsbSnoop - MyInternalIOCTLCompletion(0dd57ddc) : fido=00000000, Irp=0d89ab40, Context=09bd0440, IRQL=2
[8090494 ms]  <<<  URB 70 coming back  <<< 
-- URB_FUNCTION_CONTROL_TRANSFER:
  PipeHandle           = 0d567060
  TransferFlags        = 0000000a (USBD_TRANSFER_DIRECTION_OUT, USBD_SHORT_TRANSFER_OK)
  TransferBufferLength = 0000000d
  TransferBuffer       = 0e0b46b0
  TransferBufferMDL    = 07efd370
  UrbLink              = 00000000
  SetupPacket          =
    00000000: 40 01 0b 00 00 00 0d 00
[8090494 ms] UsbSnoop - FilterDispatchAny(0dd57b90) : IRP_MJ_INTERNAL_DEVICE_CONTROL
[8090494 ms] UsbSnoop - FdoHookDispatchInternalIoctl(0dd57f8c) : fdo=0e0d7ab0, Irp=0d89ab40, IRQL=0
[8090494 ms]  >>>  URB 71 going down  >>> 
-- URB_FUNCTION_VENDOR_DEVICE:
  TransferFlags          = 00000002 (USBD_TRANSFER_DIRECTION_OUT, USBD_SHORT_TRANSFER_OK)
  TransferBufferLength = 0000000d
  TransferBuffer       = 0e0b46d0
  TransferBufferMDL    = 00000000
    00000000: 0b 00 00 82 01 00 3a 80 89 75 32 2f 00
  UrbLink                 = 00000000
  RequestTypeReservedBits = 00000000
  Request                 = 00000001
  Value                   = 0000000b
  Index                   = 00000000
[8090495 ms] UsbSnoop - MyInternalIOCTLCompletion(0dd57ddc) : fido=00000000, Irp=0d89ab40, Context=09bd0440, IRQL=2
[8090495 ms]  <<<  URB 71 coming back  <<< 
-- URB_FUNCTION_CONTROL_TRANSFER:
  PipeHandle           = 0d567060
  TransferFlags        = 0000000a (USBD_TRANSFER_DIRECTION_OUT, USBD_SHORT_TRANSFER_OK)
  TransferBufferLength = 0000000d
  TransferBuffer       = 0e0b46d0
  TransferBufferMDL    = 0e3c07f0
  UrbLink              = 00000000
  SetupPacket          =
    00000000: 40 01 0b 00 00 00 0d 00
[8090495 ms] UsbSnoop - FilterDispatchAny(0dd57b90) : IRP_MJ_INTERNAL_DEVICE_CONTROL
[8090495 ms] UsbSnoop - FdoHookDispatchInternalIoctl(0dd57f8c) : fdo=0e0d7ab0, Irp=0d89ab40, IRQL=0
[8090495 ms]  >>>  URB 72 going down  >>> 
-- URB_FUNCTION_VENDOR_DEVICE:
  TransferFlags          = 00000002 (USBD_TRANSFER_DIRECTION_OUT, USBD_SHORT_TRANSFER_OK)
  TransferBufferLength = 0000000d
  TransferBuffer       = 0e0b46d0
  TransferBufferMDL    = 00000000
    00000000: 0b 00 00 82 01 00 3b 00 89 75 32 2f 00
  UrbLink                 = 00000000
  RequestTypeReservedBits = 00000000
  Request                 = 00000001
  Value                   = 0000000b
  Index                   = 00000000
[8090495 ms] UsbSnoop - MyInternalIOCTLCompletion(0dd57ddc) : fido=00000000, Irp=0d89ab40, Context=09bd0440, IRQL=2
[8090495 ms]  <<<  URB 72 coming back  <<< 
-- URB_FUNCTION_CONTROL_TRANSFER:
  PipeHandle           = 0d567060
  TransferFlags        = 0000000a (USBD_TRANSFER_DIRECTION_OUT, USBD_SHORT_TRANSFER_OK)
  TransferBufferLength = 0000000d
  TransferBuffer       = 0e0b46d0
  TransferBufferMDL    = 0e3c07f0
  UrbLink              = 00000000
  SetupPacket          =
    00000000: 40 01 0b 00 00 00 0d 00
[8090495 ms] UsbSnoop - FilterDispatchAny(0dd57b90) : IRP_MJ_INTERNAL_DEVICE_CONTROL
[8090495 ms] UsbSnoop - FdoHookDispatchInternalIoctl(0dd57f8c) : fdo=0e0d7ab0, Irp=0d89ab40, IRQL=0
[8090495 ms]  >>>  URB 73 going down  >>> 
-- URB_FUNCTION_VENDOR_DEVICE:
  TransferFlags          = 00000002 (USBD_TRANSFER_DIRECTION_OUT, USBD_SHORT_TRANSFER_OK)
  TransferBufferLength = 0000000d
  TransferBuffer       = 0e0b46d0
  TransferBufferMDL    = 00000000
    00000000: 0b 00 00 82 01 00 34 01 89 75 32 2f 00
  UrbLink                 = 00000000
  RequestTypeReservedBits = 00000000
  Request                 = 00000001
  Value                   = 0000000b
  Index                   = 00000000
[8090495 ms] UsbSnoop - MyInternalIOCTLCompletion(0dd57ddc) : fido=00000000, Irp=0d89ab40, Context=09bd0440, IRQL=2
[8090495 ms]  <<<  URB 73 coming back  <<< 
-- URB_FUNCTION_CONTROL_TRANSFER:
  PipeHandle           = 0d567060
  TransferFlags        = 0000000a (USBD_TRANSFER_DIRECTION_OUT, USBD_SHORT_TRANSFER_OK)
  TransferBufferLength = 0000000d
  TransferBuffer       = 0e0b46d0
  TransferBufferMDL    = 0e3c07f0
  UrbLink              = 00000000
  SetupPacket          =
    00000000: 40 01 0b 00 00 00 0d 00
[8090495 ms] UsbSnoop - FilterDispatchAny(0dd57b90) : IRP_MJ_INTERNAL_DEVICE_CONTROL
[8090495 ms] UsbSnoop - FdoHookDispatchInternalIoctl(0dd57f8c) : fdo=0e0d7ab0, Irp=0d89ab40, IRQL=0
[8090495 ms]  >>>  URB 74 going down  >>> 
-- URB_FUNCTION_VENDOR_DEVICE:
  TransferFlags          = 00000002 (USBD_TRANSFER_DIRECTION_OUT, USBD_SHORT_TRANSFER_OK)
  TransferBufferLength = 0000000d
  TransferBuffer       = 0e0b46d0
  TransferBufferMDL    = 00000000
    00000000: 0b 00 00 82 01 00 35 00 89 75 32 2f 00
  UrbLink                 = 00000000
  RequestTypeReservedBits = 00000000
  Request                 = 00000001
  Value                   = 0000000b
  Index                   = 00000000
[8090495 ms] UsbSnoop - MyInternalIOCTLCompletion(0dd57ddc) : fido=00000000, Irp=0d89ab40, Context=09bd0440, IRQL=2
[8090495 ms]  <<<  URB 74 coming back  <<< 
-- URB_FUNCTION_CONTROL_TRANSFER:
  PipeHandle           = 0d567060
  TransferFlags        = 0000000a (USBD_TRANSFER_DIRECTION_OUT, USBD_SHORT_TRANSFER_OK)
  TransferBufferLength = 0000000d
  TransferBuffer       = 0e0b46d0
  TransferBufferMDL    = 0e3c07f0
  UrbLink              = 00000000
  SetupPacket          =
    00000000: 40 01 0b 00 00 00 0d 00
[8090577 ms] UsbSnoop - FilterDispatchAny(0dd57b90) : IRP_MJ_INTERNAL_DEVICE_CONTROL
[8090577 ms] UsbSnoop - FdoHookDispatchInternalIoctl(0dd57f8c) : fdo=0e0d7ab0, Irp=0d89ab40, IRQL=0
[8090577 ms]  >>>  URB 75 going down  >>> 
-- URB_FUNCTION_VENDOR_DEVICE:
  TransferFlags          = 00000002 (USBD_TRANSFER_DIRECTION_OUT, USBD_SHORT_TRANSFER_OK)
  TransferBufferLength = 0000000d
  TransferBuffer       = 0e0b4248
  TransferBufferMDL    = 00000000
    00000000: 0b 00 20 82 01 30 80 1b 00 00 00 00 00
  UrbLink                 = 00000000
  RequestTypeReservedBits = 00000000
  Request                 = 00000001
  Value                   = 0000000b
  Index                   = 00000000
[8090577 ms] UsbSnoop - MyInternalIOCTLCompletion(0dd57ddc) : fido=00000000, Irp=0d89ab40, Context=09bd0440, IRQL=2
[8090577 ms]  <<<  URB 75 coming back  <<< 
-- URB_FUNCTION_CONTROL_TRANSFER:
  PipeHandle           = 0d567060
  TransferFlags        = 0000000a (USBD_TRANSFER_DIRECTION_OUT, USBD_SHORT_TRANSFER_OK)
  TransferBufferLength = 0000000d
  TransferBuffer       = 0e0b4248
  TransferBufferMDL    = 0e16f630
  UrbLink              = 00000000
  SetupPacket          =
    00000000: 40 01 0b 00 00 00 0d 00
[8090577 ms] UsbSnoop - FilterDispatchAny(0dd57b90) : IRP_MJ_INTERNAL_DEVICE_CONTROL
[8090577 ms] UsbSnoop - FdoHookDispatchInternalIoctl(0dd57f8c) : fdo=0e0d7ab0, Irp=0d89ab40, IRQL=0
[8090577 ms]  >>>  URB 76 going down  >>> 
-- URB_FUNCTION_VENDOR_DEVICE:
  TransferFlags          = 00000003 (USBD_TRANSFER_DIRECTION_IN, USBD_SHORT_TRANSFER_OK)
  TransferBufferLength = 0000000d
  TransferBuffer       = 0e0b4248
  TransferBufferMDL    = 00000000
  UrbLink                 = 00000000
  RequestTypeReservedBits = 00000000
  Request                 = 00000001
  Value                   = 0000000b
  Index                   = 00000000
[8090577 ms] UsbSnoop - MyInternalIOCTLCompletion(0dd57ddc) : fido=00000000, Irp=0d89ab40, Context=09bd0440, IRQL=2
[8090577 ms]  <<<  URB 76 coming back  <<< 
-- URB_FUNCTION_CONTROL_TRANSFER:
  PipeHandle           = 0d567060
  TransferFlags        = 0000000b (USBD_TRANSFER_DIRECTION_IN, USBD_SHORT_TRANSFER_OK)
  TransferBufferLength = 0000000d
  TransferBuffer       = 0e0b4248
  TransferBufferMDL    = 0da04c00
    00000000: 0b 00 20 82 01 30 80 80 00 00 00 00 00
  UrbLink              = 00000000
  SetupPacket          =
    00000000: c0 01 0b 00 00 00 0d 00
[8090577 ms] UsbSnoop - FilterDispatchAny(0dd57b90) : IRP_MJ_INTERNAL_DEVICE_CONTROL
[8090577 ms] UsbSnoop - FdoHookDispatchInternalIoctl(0dd57f8c) : fdo=0e0d7ab0, Irp=0d89ab40, IRQL=0
[8090577 ms]  >>>  URB 77 going down  >>> 
-- URB_FUNCTION_VENDOR_DEVICE:
  TransferFlags          = 00000002 (USBD_TRANSFER_DIRECTION_OUT, USBD_SHORT_TRANSFER_OK)
  TransferBufferLength = 0000000d
  TransferBuffer       = 0e0b4260
  TransferBufferMDL    = 00000000
    00000000: 0b 00 00 82 01 00 34 11 50 b3 df 02 00
  UrbLink                 = 00000000
  RequestTypeReservedBits = 00000000
  Request                 = 00000001
  Value                   = 0000000b
  Index                   = 00000000
[8090577 ms] UsbSnoop - MyInternalIOCTLCompletion(0dd57ddc) : fido=00000000, Irp=0d89ab40, Context=09bd0440, IRQL=2
[8090577 ms]  <<<  URB 77 coming back  <<< 
-- URB_FUNCTION_CONTROL_TRANSFER:
  PipeHandle           = 0d567060
  TransferFlags        = 0000000a (USBD_TRANSFER_DIRECTION_OUT, USBD_SHORT_TRANSFER_OK)
  TransferBufferLength = 0000000d
  TransferBuffer       = 0e0b4260
  TransferBufferMDL    = 0da04c00
  UrbLink              = 00000000
  SetupPacket          =
    00000000: 40 01 0b 00 00 00 0d 00
[8090577 ms] UsbSnoop - FilterDispatchAny(0dd57b90) : IRP_MJ_INTERNAL_DEVICE_CONTROL
[8090577 ms] UsbSnoop - FdoHookDispatchInternalIoctl(0dd57f8c) : fdo=0e0d7ab0, Irp=0d89ab40, IRQL=0
[8090577 ms]  >>>  URB 78 going down  >>> 
-- URB_FUNCTION_VENDOR_DEVICE:
  TransferFlags          = 00000002 (USBD_TRANSFER_DIRECTION_OUT, USBD_SHORT_TRANSFER_OK)
  TransferBufferLength = 0000000d
  TransferBuffer       = 0e0b4260
  TransferBufferMDL    = 00000000
    00000000: 0b 00 00 82 01 00 35 11 50 b3 df 02 00
  UrbLink                 = 00000000
  RequestTypeReservedBits = 00000000
  Request                 = 00000001
  Value                   = 0000000b
  Index                   = 00000000
[8090578 ms] UsbSnoop - MyInternalIOCTLCompletion(0dd57ddc) : fido=00000000, Irp=0d89ab40, Context=09bd0440, IRQL=2
[8090578 ms]  <<<  URB 78 coming back  <<< 
-- URB_FUNCTION_CONTROL_TRANSFER:
  PipeHandle           = 0d567060
  TransferFlags        = 0000000a (USBD_TRANSFER_DIRECTION_OUT, USBD_SHORT_TRANSFER_OK)
  TransferBufferLength = 0000000d
  TransferBuffer       = 0e0b4260
  TransferBufferMDL    = 0da04c00
  UrbLink              = 00000000
  SetupPacket          =
    00000000: 40 01 0b 00 00 00 0d 00
[8090587 ms] UsbSnoop - FilterDispatchAny(0dd57b90) : IRP_MJ_INTERNAL_DEVICE_CONTROL
[8090587 ms] UsbSnoop - FdoHookDispatchInternalIoctl(0dd57f8c) : fdo=0e0d7ab0, Irp=0e1ffb40, IRQL=0
[8090587 ms]  >>>  URB 79 going down  >>> 
-- URB_FUNCTION_VENDOR_DEVICE:
  TransferFlags          = 00000002 (USBD_TRANSFER_DIRECTION_OUT, USBD_SHORT_TRANSFER_OK)
  TransferBufferLength = 0000000d
  TransferBuffer       = 0e0b4260
  TransferBufferMDL    = 00000000
    00000000: 0b 00 00 82 01 00 3a 80 98 ae 5c 07 80
  UrbLink                 = 00000000
  RequestTypeReservedBits = 00000000
  Request                 = 00000001
  Value                   = 0000000b
  Index                   = 00000000
[8090588 ms] UsbSnoop - MyInternalIOCTLCompletion(0dd57ddc) : fido=00000000, Irp=0e1ffb40, Context=09bd0440, IRQL=2
[8090588 ms]  <<<  URB 79 coming back  <<< 
-- URB_FUNCTION_CONTROL_TRANSFER:
  PipeHandle           = 0d567060
  TransferFlags        = 0000000a (USBD_TRANSFER_DIRECTION_OUT, USBD_SHORT_TRANSFER_OK)
  TransferBufferLength = 0000000d
  TransferBuffer       = 0e0b4260
  TransferBufferMDL    = 09972170
  UrbLink              = 00000000
  SetupPacket          =
    00000000: 40 01 0b 00 00 00 0d 00
[8090588 ms] UsbSnoop - FilterDispatchAny(0dd57b90) : IRP_MJ_INTERNAL_DEVICE_CONTROL
[8090588 ms] UsbSnoop - FdoHookDispatchInternalIoctl(0dd57f8c) : fdo=0e0d7ab0, Irp=0e1ffb40, IRQL=0
[8090588 ms]  >>>  URB 80 going down  >>> 
-- URB_FUNCTION_VENDOR_DEVICE:
  TransferFlags          = 00000002 (USBD_TRANSFER_DIRECTION_OUT, USBD_SHORT_TRANSFER_OK)
  TransferBufferLength = 0000000d
  TransferBuffer       = 0e0b4260
  TransferBufferMDL    = 00000000
    00000000: 0b 00 00 82 01 00 3b 80 98 ae 5c 07 80
  UrbLink                 = 00000000
  RequestTypeReservedBits = 00000000
  Request                 = 00000001
  Value                   = 0000000b
  Index                   = 00000000
[8090588 ms] UsbSnoop - MyInternalIOCTLCompletion(0dd57ddc) : fido=00000000, Irp=0e1ffb40, Context=09bd0440, IRQL=2
[8090588 ms]  <<<  URB 80 coming back  <<< 
-- URB_FUNCTION_CONTROL_TRANSFER:
  PipeHandle           = 0d567060
  TransferFlags        = 0000000a (USBD_TRANSFER_DIRECTION_OUT, USBD_SHORT_TRANSFER_OK)
  TransferBufferLength = 0000000d
  TransferBuffer       = 0e0b4260
  TransferBufferMDL    = 07efd370
  UrbLink              = 00000000
  SetupPacket          =
    00000000: 40 01 0b 00 00 00 0d 00
[8090687 ms] UsbSnoop - FilterDispatchAny(0dd57b90) : IRP_MJ_INTERNAL_DEVICE_CONTROL
[8090687 ms] UsbSnoop - FdoHookDispatchInternalIoctl(0dd57f8c) : fdo=0e0d7ab0, Irp=0e1ffb40, IRQL=0
[8090687 ms]  >>>  URB 81 going down  >>> 
-- URB_FUNCTION_VENDOR_DEVICE:
  TransferFlags          = 00000002 (USBD_TRANSFER_DIRECTION_OUT, USBD_SHORT_TRANSFER_OK)
  TransferBufferLength = 0000000d
  TransferBuffer       = 0e0b4260
  TransferBufferMDL    = 00000000
    00000000: 0b 00 00 82 01 00 3a 80 98 ae 5c 07 80
  UrbLink                 = 00000000
  RequestTypeReservedBits = 00000000
  Request                 = 00000001
  Value                   = 0000000b
  Index                   = 00000000
[8090687 ms] UsbSnoop - MyInternalIOCTLCompletion(0dd57ddc) : fido=00000000, Irp=0e1ffb40, Context=09bd0440, IRQL=2
[8090687 ms]  <<<  URB 81 coming back  <<< 
-- URB_FUNCTION_CONTROL_TRANSFER:
  PipeHandle           = 0d567060
  TransferFlags        = 0000000a (USBD_TRANSFER_DIRECTION_OUT, USBD_SHORT_TRANSFER_OK)
  TransferBufferLength = 0000000d
  TransferBuffer       = 0e0b4260
  TransferBufferMDL    = 0e0bb2e0
  UrbLink              = 00000000
  SetupPacket          =
    00000000: 40 01 0b 00 00 00 0d 00
[8090688 ms] UsbSnoop - FilterDispatchAny(0dd57b90) : IRP_MJ_INTERNAL_DEVICE_CONTROL
[8090688 ms] UsbSnoop - FdoHookDispatchInternalIoctl(0dd57f8c) : fdo=0e0d7ab0, Irp=0e1ffb40, IRQL=0
[8090688 ms]  >>>  URB 82 going down  >>> 
-- URB_FUNCTION_VENDOR_DEVICE:
  TransferFlags          = 00000002 (USBD_TRANSFER_DIRECTION_OUT, USBD_SHORT_TRANSFER_OK)
  TransferBufferLength = 0000000d
  TransferBuffer       = 0e0b4260
  TransferBufferMDL    = 00000000
    00000000: 0b 00 00 82 01 00 3b 00 98 ae 5c 07 80
  UrbLink                 = 00000000
  RequestTypeReservedBits = 00000000
  Request                 = 00000001
  Value                   = 0000000b
  Index                   = 00000000
[8090688 ms] UsbSnoop - MyInternalIOCTLCompletion(0dd57ddc) : fido=00000000, Irp=0e1ffb40, Context=09bd0440, IRQL=2
[8090688 ms]  <<<  URB 82 coming back  <<< 
-- URB_FUNCTION_CONTROL_TRANSFER:
  PipeHandle           = 0d567060
  TransferFlags        = 0000000a (USBD_TRANSFER_DIRECTION_OUT, USBD_SHORT_TRANSFER_OK)
  TransferBufferLength = 0000000d
  TransferBuffer       = 0e0b4260
  TransferBufferMDL    = 0dd84160
  UrbLink              = 00000000
  SetupPacket          =
    00000000: 40 01 0b 00 00 00 0d 00
[8090718 ms] UsbSnoop - FilterDispatchAny(0dd57b90) : IRP_MJ_INTERNAL_DEVICE_CONTROL
[8090718 ms] UsbSnoop - FdoHookDispatchInternalIoctl(0dd57f8c) : fdo=0e0d7ab0, Irp=0de8a830, IRQL=0
[8090718 ms]  >>>  URB 83 going down  >>> 
-- URB_FUNCTION_VENDOR_DEVICE:
  TransferFlags          = 00000002 (USBD_TRANSFER_DIRECTION_OUT, USBD_SHORT_TRANSFER_OK)
  TransferBufferLength = 0000000d
  TransferBuffer       = 0e0b46b0
  TransferBufferMDL    = 00000000
    00000000: 0b 00 00 82 01 17 40 00 bd bf df 02 00
  UrbLink                 = 00000000
  RequestTypeReservedBits = 00000000
  Request                 = 00000001
  Value                   = 0000000b
  Index                   = 00000000
[8090718 ms] UsbSnoop - MyInternalIOCTLCompletion(0dd57ddc) : fido=00000000, Irp=0de8a830, Context=09bd0440, IRQL=2
[8090718 ms]  <<<  URB 83 coming back  <<< 
-- URB_FUNCTION_CONTROL_TRANSFER:
  PipeHandle           = 0d567060
  TransferFlags        = 0000000a (USBD_TRANSFER_DIRECTION_OUT, USBD_SHORT_TRANSFER_OK)
  TransferBufferLength = 0000000d
  TransferBuffer       = 0e0b46b0
  TransferBufferMDL    = 0e2c2420
  UrbLink              = 00000000
  SetupPacket          =
    00000000: 40 01 0b 00 00 00 0d 00
[8090718 ms] UsbSnoop - FilterDispatchAny(0dd57b90) : IRP_MJ_INTERNAL_DEVICE_CONTROL
[8090718 ms] UsbSnoop - FdoHookDispatchInternalIoctl(0dd57f8c) : fdo=0e0d7ab0, Irp=0de8a830, IRQL=0
[8090718 ms]  >>>  URB 84 going down  >>> 
-- URB_FUNCTION_VENDOR_DEVICE:
  TransferFlags          = 00000002 (USBD_TRANSFER_DIRECTION_OUT, USBD_SHORT_TRANSFER_OK)
  TransferBufferLength = 0000000d
  TransferBuffer       = 0e0b46d0
  TransferBufferMDL    = 00000000
    00000000: 0b 00 00 82 01 00 3a 80 89 75 32 2f 00
  UrbLink                 = 00000000
  RequestTypeReservedBits = 00000000
  Request                 = 00000001
  Value                   = 0000000b
  Index                   = 00000000
[8090718 ms] UsbSnoop - MyInternalIOCTLCompletion(0dd57ddc) : fido=00000000, Irp=0de8a830, Context=09bd0440, IRQL=2
[8090718 ms]  <<<  URB 84 coming back  <<< 
-- URB_FUNCTION_CONTROL_TRANSFER:
  PipeHandle           = 0d567060
  TransferFlags        = 0000000a (USBD_TRANSFER_DIRECTION_OUT, USBD_SHORT_TRANSFER_OK)
  TransferBufferLength = 0000000d
  TransferBuffer       = 0e0b46d0
  TransferBufferMDL    = 09d3a640
  UrbLink              = 00000000
  SetupPacket          =
    00000000: 40 01 0b 00 00 00 0d 00
[8090718 ms] UsbSnoop - FilterDispatchAny(0dd57b90) : IRP_MJ_INTERNAL_DEVICE_CONTROL
[8090718 ms] UsbSnoop - FdoHookDispatchInternalIoctl(0dd57f8c) : fdo=0e0d7ab0, Irp=0de8a830, IRQL=0
[8090718 ms]  >>>  URB 85 going down  >>> 
-- URB_FUNCTION_VENDOR_DEVICE:
  TransferFlags          = 00000002 (USBD_TRANSFER_DIRECTION_OUT, USBD_SHORT_TRANSFER_OK)
  TransferBufferLength = 0000000d
  TransferBuffer       = 0e0b46d0
  TransferBufferMDL    = 00000000
    00000000: 0b 00 00 82 01 00 3b 00 89 75 32 2f 00
  UrbLink                 = 00000000
  RequestTypeReservedBits = 00000000
  Request                 = 00000001
  Value                   = 0000000b
  Index                   = 00000000
[8090719 ms] UsbSnoop - MyInternalIOCTLCompletion(0dd57ddc) : fido=00000000, Irp=0de8a830, Context=09bd0440, IRQL=2
[8090719 ms]  <<<  URB 85 coming back  <<< 
-- URB_FUNCTION_CONTROL_TRANSFER:
  PipeHandle           = 0d567060
  TransferFlags        = 0000000a (USBD_TRANSFER_DIRECTION_OUT, USBD_SHORT_TRANSFER_OK)
  TransferBufferLength = 0000000d
  TransferBuffer       = 0e0b46d0
  TransferBufferMDL    = 0e021e40
  UrbLink              = 00000000
  SetupPacket          =
    00000000: 40 01 0b 00 00 00 0d 00
[8090719 ms] UsbSnoop - FilterDispatchAny(0dd57b90) : IRP_MJ_INTERNAL_DEVICE_CONTROL
[8090719 ms] UsbSnoop - FdoHookDispatchInternalIoctl(0dd57f8c) : fdo=0e0d7ab0, Irp=0de8a830, IRQL=0
[8090719 ms]  >>>  URB 86 going down  >>> 
-- URB_FUNCTION_VENDOR_DEVICE:
  TransferFlags          = 00000002 (USBD_TRANSFER_DIRECTION_OUT, USBD_SHORT_TRANSFER_OK)
  TransferBufferLength = 0000000d
  TransferBuffer       = 0e0b46d0
  TransferBufferMDL    = 00000000
    00000000: 0b 00 00 82 01 00 34 01 89 75 32 2f 00
  UrbLink                 = 00000000
  RequestTypeReservedBits = 00000000
  Request                 = 00000001
  Value                   = 0000000b
  Index                   = 00000000
[8090719 ms] UsbSnoop - MyInternalIOCTLCompletion(0dd57ddc) : fido=00000000, Irp=0de8a830, Context=09bd0440, IRQL=2
[8090719 ms]  <<<  URB 86 coming back  <<< 
-- URB_FUNCTION_CONTROL_TRANSFER:
  PipeHandle           = 0d567060
  TransferFlags        = 0000000a (USBD_TRANSFER_DIRECTION_OUT, USBD_SHORT_TRANSFER_OK)
  TransferBufferLength = 0000000d
  TransferBuffer       = 0e0b46d0
  TransferBufferMDL    = 0e021e40
  UrbLink              = 00000000
  SetupPacket          =
    00000000: 40 01 0b 00 00 00 0d 00
[8090719 ms] UsbSnoop - FilterDispatchAny(0dd57b90) : IRP_MJ_INTERNAL_DEVICE_CONTROL
[8090719 ms] UsbSnoop - FdoHookDispatchInternalIoctl(0dd57f8c) : fdo=0e0d7ab0, Irp=0de8a830, IRQL=0
[8090719 ms]  >>>  URB 87 going down  >>> 
-- URB_FUNCTION_VENDOR_DEVICE:
  TransferFlags          = 00000002 (USBD_TRANSFER_DIRECTION_OUT, USBD_SHORT_TRANSFER_OK)
  TransferBufferLength = 0000000d
  TransferBuffer       = 0e0b46d0
  TransferBufferMDL    = 00000000
    00000000: 0b 00 00 82 01 00 35 00 89 75 32 2f 00
  UrbLink                 = 00000000
  RequestTypeReservedBits = 00000000
  Request                 = 00000001
  Value                   = 0000000b
  Index                   = 00000000
[8090719 ms] UsbSnoop - MyInternalIOCTLCompletion(0dd57ddc) : fido=00000000, Irp=0de8a830, Context=09bd0440, IRQL=2
[8090719 ms]  <<<  URB 87 coming back  <<< 
-- URB_FUNCTION_CONTROL_TRANSFER:
  PipeHandle           = 0d567060
  TransferFlags        = 0000000a (USBD_TRANSFER_DIRECTION_OUT, USBD_SHORT_TRANSFER_OK)
  TransferBufferLength = 0000000d
  TransferBuffer       = 0e0b46d0
  TransferBufferMDL    = 0e021e40
  UrbLink              = 00000000
  SetupPacket          =
    00000000: 40 01 0b 00 00 00 0d 00
[8090744 ms] UsbSnoop - FilterDispatchAny(0dd57b90) : IRP_MJ_INTERNAL_DEVICE_CONTROL
[8090744 ms] UsbSnoop - FdoHookDispatchInternalIoctl(0dd57f8c) : fdo=0e0d7ab0, Irp=0de8a830, IRQL=0
[8090744 ms]  >>>  URB 88 going down  >>> 
-- URB_FUNCTION_VENDOR_DEVICE:
  TransferFlags          = 00000002 (USBD_TRANSFER_DIRECTION_OUT, USBD_SHORT_TRANSFER_OK)
  TransferBufferLength = 0000000d
  TransferBuffer       = 0e0b4248
  TransferBufferMDL    = 00000000
    00000000: 0b 00 20 82 01 30 80 1b 00 00 00 00 00
  UrbLink                 = 00000000
  RequestTypeReservedBits = 00000000
  Request                 = 00000001
  Value                   = 0000000b
  Index                   = 00000000
[8090744 ms] UsbSnoop - MyInternalIOCTLCompletion(0dd57ddc) : fido=00000000, Irp=0de8a830, Context=09bd0440, IRQL=2
[8090744 ms]  <<<  URB 88 coming back  <<< 
-- URB_FUNCTION_CONTROL_TRANSFER:
  PipeHandle           = 0d567060
  TransferFlags        = 0000000a (USBD_TRANSFER_DIRECTION_OUT, USBD_SHORT_TRANSFER_OK)
  TransferBufferLength = 0000000d
  TransferBuffer       = 0e0b4248
  TransferBufferMDL    = 0e021e40
  UrbLink              = 00000000
  SetupPacket          =
    00000000: 40 01 0b 00 00 00 0d 00
[8090744 ms] UsbSnoop - FilterDispatchAny(0dd57b90) : IRP_MJ_INTERNAL_DEVICE_CONTROL
[8090744 ms] UsbSnoop - FdoHookDispatchInternalIoctl(0dd57f8c) : fdo=0e0d7ab0, Irp=0de8a830, IRQL=0
[8090744 ms]  >>>  URB 89 going down  >>> 
-- URB_FUNCTION_VENDOR_DEVICE:
  TransferFlags          = 00000003 (USBD_TRANSFER_DIRECTION_IN, USBD_SHORT_TRANSFER_OK)
  TransferBufferLength = 0000000d
  TransferBuffer       = 0e0b4248
  TransferBufferMDL    = 00000000
  UrbLink                 = 00000000
  RequestTypeReservedBits = 00000000
  Request                 = 00000001
  Value                   = 0000000b
  Index                   = 00000000
[8090744 ms] UsbSnoop - MyInternalIOCTLCompletion(0dd57ddc) : fido=00000000, Irp=0de8a830, Context=09bd0440, IRQL=2
[8090744 ms]  <<<  URB 89 coming back  <<< 
-- URB_FUNCTION_CONTROL_TRANSFER:
  PipeHandle           = 0d567060
  TransferFlags        = 0000000b (USBD_TRANSFER_DIRECTION_IN, USBD_SHORT_TRANSFER_OK)
  TransferBufferLength = 0000000d
  TransferBuffer       = 0e0b4248
  TransferBufferMDL    = 0e021e40
    00000000: 0b 00 20 82 01 30 80 80 00 00 00 00 00
  UrbLink              = 00000000
  SetupPacket          =
    00000000: c0 01 0b 00 00 00 0d 00
[8090744 ms] UsbSnoop - FilterDispatchAny(0dd57b90) : IRP_MJ_INTERNAL_DEVICE_CONTROL
[8090744 ms] UsbSnoop - FdoHookDispatchInternalIoctl(0dd57f8c) : fdo=0e0d7ab0, Irp=0de8a830, IRQL=0
[8090744 ms]  >>>  URB 90 going down  >>> 
-- URB_FUNCTION_VENDOR_DEVICE:
  TransferFlags          = 00000002 (USBD_TRANSFER_DIRECTION_OUT, USBD_SHORT_TRANSFER_OK)
  TransferBufferLength = 0000000d
  TransferBuffer       = 0e0b4260
  TransferBufferMDL    = 00000000
    00000000: 0b 00 00 82 01 00 34 11 50 b3 df 02 00
  UrbLink                 = 00000000
  RequestTypeReservedBits = 00000000
  Request                 = 00000001
  Value                   = 0000000b
  Index                   = 00000000
[8090745 ms] UsbSnoop - MyInternalIOCTLCompletion(0dd57ddc) : fido=00000000, Irp=0de8a830, Context=09bd0440, IRQL=2
[8090745 ms]  <<<  URB 90 coming back  <<< 
-- URB_FUNCTION_CONTROL_TRANSFER:
  PipeHandle           = 0d567060
  TransferFlags        = 0000000a (USBD_TRANSFER_DIRECTION_OUT, USBD_SHORT_TRANSFER_OK)
  TransferBufferLength = 0000000d
  TransferBuffer       = 0e0b4260
  TransferBufferMDL    = 0e021e40
  UrbLink              = 00000000
  SetupPacket          =
    00000000: 40 01 0b 00 00 00 0d 00
[8090745 ms] UsbSnoop - FilterDispatchAny(0dd57b90) : IRP_MJ_INTERNAL_DEVICE_CONTROL
[8090745 ms] UsbSnoop - FdoHookDispatchInternalIoctl(0dd57f8c) : fdo=0e0d7ab0, Irp=0de8a830, IRQL=0
[8090745 ms]  >>>  URB 91 going down  >>> 
-- URB_FUNCTION_VENDOR_DEVICE:
  TransferFlags          = 00000002 (USBD_TRANSFER_DIRECTION_OUT, USBD_SHORT_TRANSFER_OK)
  TransferBufferLength = 0000000d
  TransferBuffer       = 0e0b4260
  TransferBufferMDL    = 00000000
    00000000: 0b 00 00 82 01 00 35 11 50 b3 df 02 00
  UrbLink                 = 00000000
  RequestTypeReservedBits = 00000000
  Request                 = 00000001
  Value                   = 0000000b
  Index                   = 00000000
[8090745 ms] UsbSnoop - MyInternalIOCTLCompletion(0dd57ddc) : fido=00000000, Irp=0de8a830, Context=09bd0440, IRQL=2
[8090745 ms]  <<<  URB 91 coming back  <<< 
-- URB_FUNCTION_CONTROL_TRANSFER:
  PipeHandle           = 0d567060
  TransferFlags        = 0000000a (USBD_TRANSFER_DIRECTION_OUT, USBD_SHORT_TRANSFER_OK)
  TransferBufferLength = 0000000d
  TransferBuffer       = 0e0b4260
  TransferBufferMDL    = 0e021e40
  UrbLink              = 00000000
  SetupPacket          =
    00000000: 40 01 0b 00 00 00 0d 00
[8090754 ms] UsbSnoop - FilterDispatchAny(0dd57b90) : IRP_MJ_INTERNAL_DEVICE_CONTROL
[8090754 ms] UsbSnoop - FdoHookDispatchInternalIoctl(0dd57f8c) : fdo=0e0d7ab0, Irp=0de8a830, IRQL=0
[8090754 ms]  >>>  URB 92 going down  >>> 
-- URB_FUNCTION_VENDOR_DEVICE:
  TransferFlags          = 00000002 (USBD_TRANSFER_DIRECTION_OUT, USBD_SHORT_TRANSFER_OK)
  TransferBufferLength = 0000000d
  TransferBuffer       = 0e0b4260
  TransferBufferMDL    = 00000000
    00000000: 0b 00 00 82 01 00 3a 80 98 fe 1f 0e 80
  UrbLink                 = 00000000
  RequestTypeReservedBits = 00000000
  Request                 = 00000001
  Value                   = 0000000b
  Index                   = 00000000
[8090755 ms] UsbSnoop - MyInternalIOCTLCompletion(0dd57ddc) : fido=00000000, Irp=0de8a830, Context=09bd0440, IRQL=2
[8090755 ms]  <<<  URB 92 coming back  <<< 
-- URB_FUNCTION_CONTROL_TRANSFER:
  PipeHandle           = 0d567060
  TransferFlags        = 0000000a (USBD_TRANSFER_DIRECTION_OUT, USBD_SHORT_TRANSFER_OK)
  TransferBufferLength = 0000000d
  TransferBuffer       = 0e0b4260
  TransferBufferMDL    = 0e021e40
  UrbLink              = 00000000
  SetupPacket          =
    00000000: 40 01 0b 00 00 00 0d 00
[8090755 ms] UsbSnoop - FilterDispatchAny(0dd57b90) : IRP_MJ_INTERNAL_DEVICE_CONTROL
[8090755 ms] UsbSnoop - FdoHookDispatchInternalIoctl(0dd57f8c) : fdo=0e0d7ab0, Irp=0de8a830, IRQL=0
[8090755 ms]  >>>  URB 93 going down  >>> 
-- URB_FUNCTION_VENDOR_DEVICE:
  TransferFlags          = 00000002 (USBD_TRANSFER_DIRECTION_OUT, USBD_SHORT_TRANSFER_OK)
  TransferBufferLength = 0000000d
  TransferBuffer       = 0e0b4260
  TransferBufferMDL    = 00000000
    00000000: 0b 00 00 82 01 00 3b 80 98 fe 1f 0e 80
  UrbLink                 = 00000000
  RequestTypeReservedBits = 00000000
  Request                 = 00000001
  Value                   = 0000000b
  Index                   = 00000000
[8090755 ms] UsbSnoop - MyInternalIOCTLCompletion(0dd57ddc) : fido=00000000, Irp=0de8a830, Context=09bd0440, IRQL=2
[8090755 ms]  <<<  URB 93 coming back  <<< 
-- URB_FUNCTION_CONTROL_TRANSFER:
  PipeHandle           = 0d567060
  TransferFlags        = 0000000a (USBD_TRANSFER_DIRECTION_OUT, USBD_SHORT_TRANSFER_OK)
  TransferBufferLength = 0000000d
  TransferBuffer       = 0e0b4260
  TransferBufferMDL    = 0e021e40
  UrbLink              = 00000000
  SetupPacket          =
    00000000: 40 01 0b 00 00 00 0d 00
[8090854 ms] UsbSnoop - FilterDispatchAny(0dd57b90) : IRP_MJ_INTERNAL_DEVICE_CONTROL
[8090854 ms] UsbSnoop - FdoHookDispatchInternalIoctl(0dd57f8c) : fdo=0e0d7ab0, Irp=0d89ab40, IRQL=0
[8090855 ms]  >>>  URB 94 going down  >>> 
-- URB_FUNCTION_VENDOR_DEVICE:
  TransferFlags          = 00000002 (USBD_TRANSFER_DIRECTION_OUT, USBD_SHORT_TRANSFER_OK)
  TransferBufferLength = 0000000d
  TransferBuffer       = 0e0b4260
  TransferBufferMDL    = 00000000
    00000000: 0b 00 00 82 01 00 3a 80 98 fe 1f 0e 80
  UrbLink                 = 00000000
  RequestTypeReservedBits = 00000000
  Request                 = 00000001
  Value                   = 0000000b
  Index                   = 00000000
[8090855 ms] UsbSnoop - MyInternalIOCTLCompletion(0dd57ddc) : fido=00000000, Irp=0d89ab40, Context=09bd0440, IRQL=2
[8090855 ms]  <<<  URB 94 coming back  <<< 
-- URB_FUNCTION_CONTROL_TRANSFER:
  PipeHandle           = 0d567060
  TransferFlags        = 0000000a (USBD_TRANSFER_DIRECTION_OUT, USBD_SHORT_TRANSFER_OK)
  TransferBufferLength = 0000000d
  TransferBuffer       = 0e0b4260
  TransferBufferMDL    = 0ed4da50
  UrbLink              = 00000000
  SetupPacket          =
    00000000: 40 01 0b 00 00 00 0d 00
[8090855 ms] UsbSnoop - FilterDispatchAny(0dd57b90) : IRP_MJ_INTERNAL_DEVICE_CONTROL
[8090855 ms] UsbSnoop - FdoHookDispatchInternalIoctl(0dd57f8c) : fdo=0e0d7ab0, Irp=0d89ab40, IRQL=0
[8090855 ms]  >>>  URB 95 going down  >>> 
-- URB_FUNCTION_VENDOR_DEVICE:
  TransferFlags          = 00000002 (USBD_TRANSFER_DIRECTION_OUT, USBD_SHORT_TRANSFER_OK)
  TransferBufferLength = 0000000d
  TransferBuffer       = 0e0b4260
  TransferBufferMDL    = 00000000
    00000000: 0b 00 00 82 01 00 3b 00 98 fe 1f 0e 80
  UrbLink                 = 00000000
  RequestTypeReservedBits = 00000000
  Request                 = 00000001
  Value                   = 0000000b
  Index                   = 00000000
[8090855 ms] UsbSnoop - MyInternalIOCTLCompletion(0dd57ddc) : fido=00000000, Irp=0d89ab40, Context=09bd0440, IRQL=2
[8090855 ms]  <<<  URB 95 coming back  <<< 
-- URB_FUNCTION_CONTROL_TRANSFER:
  PipeHandle           = 0d567060
  TransferFlags        = 0000000a (USBD_TRANSFER_DIRECTION_OUT, USBD_SHORT_TRANSFER_OK)
  TransferBufferLength = 0000000d
  TransferBuffer       = 0e0b4260
  TransferBufferMDL    = 0df70d30
  UrbLink              = 00000000
  SetupPacket          =
    00000000: 40 01 0b 00 00 00 0d 00
[8090968 ms] UsbSnoop - FilterDispatchAny(0dd57b90) : IRP_MJ_INTERNAL_DEVICE_CONTROL
[8090968 ms] UsbSnoop - FdoHookDispatchInternalIoctl(0dd57f8c) : fdo=0e0d7ab0, Irp=0de8a830, IRQL=0
[8090968 ms]  >>>  URB 96 going down  >>> 
-- URB_FUNCTION_VENDOR_DEVICE:
  TransferFlags          = 00000002 (USBD_TRANSFER_DIRECTION_OUT, USBD_SHORT_TRANSFER_OK)
  TransferBufferLength = 0000000d
  TransferBuffer       = 0e0b4550
  TransferBufferMDL    = 00000000
    00000000: 0b 4a c0 01 01 01 08 ff 06 00 00 00 00
  UrbLink                 = 00000000
  RequestTypeReservedBits = 00000000
  Request                 = 00000001
  Value                   = 0000000b
  Index                   = 00000000
[8090969 ms] UsbSnoop - MyInternalIOCTLCompletion(0dd57ddc) : fido=00000000, Irp=0de8a830, Context=09bd0440, IRQL=2
[8090969 ms]  <<<  URB 96 coming back  <<< 
-- URB_FUNCTION_CONTROL_TRANSFER:
  PipeHandle           = 0d567060
  TransferFlags        = 0000000a (USBD_TRANSFER_DIRECTION_OUT, USBD_SHORT_TRANSFER_OK)
  TransferBufferLength = 0000000d
  TransferBuffer       = 0e0b4550
  TransferBufferMDL    = 0df70d30
  UrbLink              = 00000000
  SetupPacket          =
    00000000: 40 01 0b 00 00 00 0d 00
[8090978 ms] UsbSnoop - FilterDispatchAny(0dd57b90) : IRP_MJ_INTERNAL_DEVICE_CONTROL
[8090978 ms] UsbSnoop - FdoHookDispatchInternalIoctl(0dd57f8c) : fdo=0e0d7ab0, Irp=0de8a830, IRQL=0
[8090979 ms]  >>>  URB 97 going down  >>> 
-- URB_FUNCTION_VENDOR_DEVICE:
  TransferFlags          = 00000002 (USBD_TRANSFER_DIRECTION_OUT, USBD_SHORT_TRANSFER_OK)
  TransferBufferLength = 0000000d
  TransferBuffer       = 0e0b4550
  TransferBufferMDL    = 00000000
    00000000: 0b 4a c0 01 01 02 c7 ff 06 00 00 00 00
  UrbLink                 = 00000000
  RequestTypeReservedBits = 00000000
  Request                 = 00000001
  Value                   = 0000000b
  Index                   = 00000000
[8090979 ms] UsbSnoop - MyInternalIOCTLCompletion(0dd57ddc) : fido=00000000, Irp=0de8a830, Context=09bd0440, IRQL=2
[8090979 ms]  <<<  URB 97 coming back  <<< 
-- URB_FUNCTION_CONTROL_TRANSFER:
  PipeHandle           = 0d567060
  TransferFlags        = 0000000a (USBD_TRANSFER_DIRECTION_OUT, USBD_SHORT_TRANSFER_OK)
  TransferBufferLength = 0000000d
  TransferBuffer       = 0e0b4550
  TransferBufferMDL    = 0e021e40
  UrbLink              = 00000000
  SetupPacket          =
    00000000: 40 01 0b 00 00 00 0d 00
[8090989 ms] UsbSnoop - FilterDispatchAny(0dd57b90) : IRP_MJ_INTERNAL_DEVICE_CONTROL
[8090989 ms] UsbSnoop - FdoHookDispatchInternalIoctl(0dd57f8c) : fdo=0e0d7ab0, Irp=0de8a830, IRQL=0
[8090989 ms]  >>>  URB 98 going down  >>> 
-- URB_FUNCTION_VENDOR_DEVICE:
  TransferFlags          = 00000002 (USBD_TRANSFER_DIRECTION_OUT, USBD_SHORT_TRANSFER_OK)
  TransferBufferLength = 0000000d
  TransferBuffer       = 0e0b4550
  TransferBufferMDL    = 00000000
    00000000: 0b 4a c0 01 01 03 33 ff 06 00 00 00 00
  UrbLink                 = 00000000
  RequestTypeReservedBits = 00000000
  Request                 = 00000001
  Value                   = 0000000b
  Index                   = 00000000
[8090989 ms] UsbSnoop - MyInternalIOCTLCompletion(0dd57ddc) : fido=00000000, Irp=0de8a830, Context=09bd0440, IRQL=2
[8090989 ms]  <<<  URB 98 coming back  <<< 
-- URB_FUNCTION_CONTROL_TRANSFER:
  PipeHandle           = 0d567060
  TransferFlags        = 0000000a (USBD_TRANSFER_DIRECTION_OUT, USBD_SHORT_TRANSFER_OK)
  TransferBufferLength = 0000000d
  TransferBuffer       = 0e0b4550
  TransferBufferMDL    = 0e021e40
  UrbLink              = 00000000
  SetupPacket          =
    00000000: 40 01 0b 00 00 00 0d 00
[8090999 ms] UsbSnoop - FilterDispatchAny(0dd57b90) : IRP_MJ_INTERNAL_DEVICE_CONTROL
[8090999 ms] UsbSnoop - FdoHookDispatchInternalIoctl(0dd57f8c) : fdo=0e0d7ab0, Irp=0de8a830, IRQL=0
[8090999 ms]  >>>  URB 99 going down  >>> 
-- URB_FUNCTION_VENDOR_DEVICE:
  TransferFlags          = 00000002 (USBD_TRANSFER_DIRECTION_OUT, USBD_SHORT_TRANSFER_OK)
  TransferBufferLength = 0000000d
  TransferBuffer       = 0e0b4550
  TransferBufferMDL    = 00000000
    00000000: 0b 4a c0 01 01 04 00 ff 06 00 00 00 00
  UrbLink                 = 00000000
  RequestTypeReservedBits = 00000000
  Request                 = 00000001
  Value                   = 0000000b
  Index                   = 00000000
[8090999 ms] UsbSnoop - MyInternalIOCTLCompletion(0dd57ddc) : fido=00000000, Irp=0de8a830, Context=09bd0440, IRQL=2
[8090999 ms]  <<<  URB 99 coming back  <<< 
-- URB_FUNCTION_CONTROL_TRANSFER:
  PipeHandle           = 0d567060
  TransferFlags        = 0000000a (USBD_TRANSFER_DIRECTION_OUT, USBD_SHORT_TRANSFER_OK)
  TransferBufferLength = 0000000d
  TransferBuffer       = 0e0b4550
  TransferBufferMDL    = 0e021e40
  UrbLink              = 00000000
  SetupPacket          =
    00000000: 40 01 0b 00 00 00 0d 00
[8091008 ms] UsbSnoop - FilterDispatchAny(0dd57b90) : IRP_MJ_INTERNAL_DEVICE_CONTROL
[8091008 ms] UsbSnoop - FdoHookDispatchInternalIoctl(0dd57f8c) : fdo=0e0d7ab0, Irp=0e1ffb40, IRQL=0
[8091008 ms]  >>>  URB 100 going down  >>> 
-- URB_FUNCTION_VENDOR_DEVICE:
  TransferFlags          = 00000002 (USBD_TRANSFER_DIRECTION_OUT, USBD_SHORT_TRANSFER_OK)
  TransferBufferLength = 0000000d
  TransferBuffer       = 0e0b4550
  TransferBufferMDL    = 00000000
    00000000: 0b 4a c0 01 01 05 00 ff 06 00 00 00 00
  UrbLink                 = 00000000
  RequestTypeReservedBits = 00000000
  Request                 = 00000001
  Value                   = 0000000b
  Index                   = 00000000
[8091009 ms] UsbSnoop - MyInternalIOCTLCompletion(0dd57ddc) : fido=00000000, Irp=0e1ffb40, Context=09bd0440, IRQL=2
[8091009 ms]  <<<  URB 100 coming back  <<< 
-- URB_FUNCTION_CONTROL_TRANSFER:
  PipeHandle           = 0d567060
  TransferFlags        = 0000000a (USBD_TRANSFER_DIRECTION_OUT, USBD_SHORT_TRANSFER_OK)
  TransferBufferLength = 0000000d
  TransferBuffer       = 0e0b4550
  TransferBufferMDL    = 0e021e40
  UrbLink              = 00000000
  SetupPacket          =
    00000000: 40 01 0b 00 00 00 0d 00
[8091019 ms] UsbSnoop - FilterDispatchAny(0dd57b90) : IRP_MJ_INTERNAL_DEVICE_CONTROL
[8091019 ms] UsbSnoop - FdoHookDispatchInternalIoctl(0dd57f8c) : fdo=0e0d7ab0, Irp=0e1ffb40, IRQL=0
[8091019 ms]  >>>  URB 101 going down  >>> 
-- URB_FUNCTION_VENDOR_DEVICE:
  TransferFlags          = 00000002 (USBD_TRANSFER_DIRECTION_OUT, USBD_SHORT_TRANSFER_OK)
  TransferBufferLength = 0000000d
  TransferBuffer       = 0e0b4550
  TransferBufferMDL    = 00000000
    00000000: 0b 4a c0 01 01 06 e9 ff 06 00 00 00 00
  UrbLink                 = 00000000
  RequestTypeReservedBits = 00000000
  Request                 = 00000001
  Value                   = 0000000b
  Index                   = 00000000
[8091019 ms] UsbSnoop - MyInternalIOCTLCompletion(0dd57ddc) : fido=00000000, Irp=0e1ffb40, Context=09bd0440, IRQL=2
[8091019 ms]  <<<  URB 101 coming back  <<< 
-- URB_FUNCTION_CONTROL_TRANSFER:
  PipeHandle           = 0d567060
  TransferFlags        = 0000000a (USBD_TRANSFER_DIRECTION_OUT, USBD_SHORT_TRANSFER_OK)
  TransferBufferLength = 0000000d
  TransferBuffer       = 0e0b4550
  TransferBufferMDL    = 0e021e40
  UrbLink              = 00000000
  SetupPacket          =
    00000000: 40 01 0b 00 00 00 0d 00
[8091029 ms] UsbSnoop - FilterDispatchAny(0dd57b90) : IRP_MJ_INTERNAL_DEVICE_CONTROL
[8091029 ms] UsbSnoop - FdoHookDispatchInternalIoctl(0dd57f8c) : fdo=0e0d7ab0, Irp=0e1ffb40, IRQL=0
[8091029 ms]  >>>  URB 102 going down  >>> 
-- URB_FUNCTION_VENDOR_DEVICE:
  TransferFlags          = 00000002 (USBD_TRANSFER_DIRECTION_OUT, USBD_SHORT_TRANSFER_OK)
  TransferBufferLength = 0000000d
  TransferBuffer       = 0e0b4550
  TransferBufferMDL    = 00000000
    00000000: 0b 4a c0 01 01 07 0d ff 06 00 00 00 00
  UrbLink                 = 00000000
  RequestTypeReservedBits = 00000000
  Request                 = 00000001
  Value                   = 0000000b
  Index                   = 00000000
[8091029 ms] UsbSnoop - MyInternalIOCTLCompletion(0dd57ddc) : fido=00000000, Irp=0e1ffb40, Context=09bd0440, IRQL=2
[8091029 ms]  <<<  URB 102 coming back  <<< 
-- URB_FUNCTION_CONTROL_TRANSFER:
  PipeHandle           = 0d567060
  TransferFlags        = 0000000a (USBD_TRANSFER_DIRECTION_OUT, USBD_SHORT_TRANSFER_OK)
  TransferBufferLength = 0000000d
  TransferBuffer       = 0e0b4550
  TransferBufferMDL    = 0e021e40
  UrbLink              = 00000000
  SetupPacket          =
    00000000: 40 01 0b 00 00 00 0d 00
[8091038 ms] UsbSnoop - FilterDispatchAny(0dd57b90) : IRP_MJ_INTERNAL_DEVICE_CONTROL
[8091038 ms] UsbSnoop - FdoHookDispatchInternalIoctl(0dd57f8c) : fdo=0e0d7ab0, Irp=0e1ffb40, IRQL=0
[8091039 ms]  >>>  URB 103 going down  >>> 
-- URB_FUNCTION_VENDOR_DEVICE:
  TransferFlags          = 00000002 (USBD_TRANSFER_DIRECTION_OUT, USBD_SHORT_TRANSFER_OK)
  TransferBufferLength = 0000000d
  TransferBuffer       = 0e0b4550
  TransferBufferMDL    = 00000000
    00000000: 0b 4a c0 01 01 08 98 ff 06 00 00 00 00
  UrbLink                 = 00000000
  RequestTypeReservedBits = 00000000
  Request                 = 00000001
  Value                   = 0000000b
  Index                   = 00000000
[8091039 ms] UsbSnoop - MyInternalIOCTLCompletion(0dd57ddc) : fido=00000000, Irp=0e1ffb40, Context=09bd0440, IRQL=2
[8091039 ms]  <<<  URB 103 coming back  <<< 
-- URB_FUNCTION_CONTROL_TRANSFER:
  PipeHandle           = 0d567060
  TransferFlags        = 0000000a (USBD_TRANSFER_DIRECTION_OUT, USBD_SHORT_TRANSFER_OK)
  TransferBufferLength = 0000000d
  TransferBuffer       = 0e0b4550
  TransferBufferMDL    = 0e021e40
  UrbLink              = 00000000
  SetupPacket          =
    00000000: 40 01 0b 00 00 00 0d 00
[8091048 ms] UsbSnoop - FilterDispatchAny(0dd57b90) : IRP_MJ_INTERNAL_DEVICE_CONTROL
[8091048 ms] UsbSnoop - FdoHookDispatchInternalIoctl(0dd57f8c) : fdo=0e0d7ab0, Irp=0d862b40, IRQL=0
[8091048 ms]  >>>  URB 104 going down  >>> 
-- URB_FUNCTION_VENDOR_DEVICE:
  TransferFlags          = 00000002 (USBD_TRANSFER_DIRECTION_OUT, USBD_SHORT_TRANSFER_OK)
  TransferBufferLength = 0000000d
  TransferBuffer       = 0e0b4550
  TransferBufferMDL    = 00000000
    00000000: 0b 4a c0 01 01 09 01 ff 06 00 00 00 00
  UrbLink                 = 00000000
  RequestTypeReservedBits = 00000000
  Request                 = 00000001
  Value                   = 0000000b
  Index                   = 00000000
[8091049 ms] UsbSnoop - MyInternalIOCTLCompletion(0dd57ddc) : fido=00000000, Irp=0d862b40, Context=09bd0440, IRQL=2
[8091049 ms]  <<<  URB 104 coming back  <<< 
-- URB_FUNCTION_CONTROL_TRANSFER:
  PipeHandle           = 0d567060
  TransferFlags        = 0000000a (USBD_TRANSFER_DIRECTION_OUT, USBD_SHORT_TRANSFER_OK)
  TransferBufferLength = 0000000d
  TransferBuffer       = 0e0b4550
  TransferBufferMDL    = 0e3c07f0
  UrbLink              = 00000000
  SetupPacket          =
    00000000: 40 01 0b 00 00 00 0d 00
[8091058 ms] UsbSnoop - FilterDispatchAny(0dd57b90) : IRP_MJ_INTERNAL_DEVICE_CONTROL
[8091058 ms] UsbSnoop - FdoHookDispatchInternalIoctl(0dd57f8c) : fdo=0e0d7ab0, Irp=0e5f6010, IRQL=0
[8091058 ms]  >>>  URB 105 going down  >>> 
-- URB_FUNCTION_VENDOR_DEVICE:
  TransferFlags          = 00000002 (USBD_TRANSFER_DIRECTION_OUT, USBD_SHORT_TRANSFER_OK)
  TransferBufferLength = 0000000d
  TransferBuffer       = 0e0b4550
  TransferBufferMDL    = 00000000
    00000000: 0b 4a c0 01 01 0a 80 ff 06 00 00 00 00
  UrbLink                 = 00000000
  RequestTypeReservedBits = 00000000
  Request                 = 00000001
  Value                   = 0000000b
  Index                   = 00000000
[8091059 ms] UsbSnoop - MyInternalIOCTLCompletion(0dd57ddc) : fido=00000000, Irp=0e5f6010, Context=09bd0440, IRQL=2
[8091059 ms]  <<<  URB 105 coming back  <<< 
-- URB_FUNCTION_CONTROL_TRANSFER:
  PipeHandle           = 0d567060
  TransferFlags        = 0000000a (USBD_TRANSFER_DIRECTION_OUT, USBD_SHORT_TRANSFER_OK)
  TransferBufferLength = 0000000d
  TransferBuffer       = 0e0b4550
  TransferBufferMDL    = 0ed4da50
  UrbLink              = 00000000
  SetupPacket          =
    00000000: 40 01 0b 00 00 00 0d 00
[8091068 ms] UsbSnoop - FilterDispatchAny(0dd57b90) : IRP_MJ_INTERNAL_DEVICE_CONTROL
[8091068 ms] UsbSnoop - FdoHookDispatchInternalIoctl(0dd57f8c) : fdo=0e0d7ab0, Irp=0e5f6010, IRQL=0
[8091068 ms]  >>>  URB 106 going down  >>> 
-- URB_FUNCTION_VENDOR_DEVICE:
  TransferFlags          = 00000002 (USBD_TRANSFER_DIRECTION_OUT, USBD_SHORT_TRANSFER_OK)
  TransferBufferLength = 0000000d
  TransferBuffer       = 0e0b4550
  TransferBufferMDL    = 00000000
    00000000: 0b 4a c0 01 01 0b 40 ff 06 00 00 00 00
  UrbLink                 = 00000000
  RequestTypeReservedBits = 00000000
  Request                 = 00000001
  Value                   = 0000000b
  Index                   = 00000000
[8091069 ms] UsbSnoop - MyInternalIOCTLCompletion(0dd57ddc) : fido=00000000, Irp=0e5f6010, Context=09bd0440, IRQL=2
[8091069 ms]  <<<  URB 106 coming back  <<< 
-- URB_FUNCTION_CONTROL_TRANSFER:
  PipeHandle           = 0d567060
  TransferFlags        = 0000000a (USBD_TRANSFER_DIRECTION_OUT, USBD_SHORT_TRANSFER_OK)
  TransferBufferLength = 0000000d
  TransferBuffer       = 0e0b4550
  TransferBufferMDL    = 0ed4da50
  UrbLink              = 00000000
  SetupPacket          =
    00000000: 40 01 0b 00 00 00 0d 00
[8091078 ms] UsbSnoop - FilterDispatchAny(0dd57b90) : IRP_MJ_INTERNAL_DEVICE_CONTROL
[8091078 ms] UsbSnoop - FdoHookDispatchInternalIoctl(0dd57f8c) : fdo=0e0d7ab0, Irp=0e1ffb40, IRQL=0
[8091078 ms]  >>>  URB 107 going down  >>> 
-- URB_FUNCTION_VENDOR_DEVICE:
  TransferFlags          = 00000002 (USBD_TRANSFER_DIRECTION_OUT, USBD_SHORT_TRANSFER_OK)
  TransferBufferLength = 0000000d
  TransferBuffer       = 0e0b4550
  TransferBufferMDL    = 00000000
    00000000: 0b 4a c0 01 01 0c 40 ff 06 00 00 00 00
  UrbLink                 = 00000000
  RequestTypeReservedBits = 00000000
  Request                 = 00000001
  Value                   = 0000000b
  Index                   = 00000000
[8091079 ms] UsbSnoop - MyInternalIOCTLCompletion(0dd57ddc) : fido=00000000, Irp=0e1ffb40, Context=09bd0440, IRQL=2
[8091079 ms]  <<<  URB 107 coming back  <<< 
-- URB_FUNCTION_CONTROL_TRANSFER:
  PipeHandle           = 0d567060
  TransferFlags        = 0000000a (USBD_TRANSFER_DIRECTION_OUT, USBD_SHORT_TRANSFER_OK)
  TransferBufferLength = 0000000d
  TransferBuffer       = 0e0b4550
  TransferBufferMDL    = 0ed4da50
  UrbLink              = 00000000
  SetupPacket          =
    00000000: 40 01 0b 00 00 00 0d 00
[8091088 ms] UsbSnoop - FilterDispatchAny(0dd57b90) : IRP_MJ_INTERNAL_DEVICE_CONTROL
[8091088 ms] UsbSnoop - FdoHookDispatchInternalIoctl(0dd57f8c) : fdo=0e0d7ab0, Irp=0e1ffb40, IRQL=0
[8091088 ms]  >>>  URB 108 going down  >>> 
-- URB_FUNCTION_VENDOR_DEVICE:
  TransferFlags          = 00000002 (USBD_TRANSFER_DIRECTION_OUT, USBD_SHORT_TRANSFER_OK)
  TransferBufferLength = 0000000d
  TransferBuffer       = 0e0b4550
  TransferBufferMDL    = 00000000
    00000000: 0b 4a c0 01 01 0d 00 ff 06 00 00 00 00
  UrbLink                 = 00000000
  RequestTypeReservedBits = 00000000
  Request                 = 00000001
  Value                   = 0000000b
  Index                   = 00000000
[8091089 ms] UsbSnoop - MyInternalIOCTLCompletion(0dd57ddc) : fido=00000000, Irp=0e1ffb40, Context=09bd0440, IRQL=2
[8091089 ms]  <<<  URB 108 coming back  <<< 
-- URB_FUNCTION_CONTROL_TRANSFER:
  PipeHandle           = 0d567060
  TransferFlags        = 0000000a (USBD_TRANSFER_DIRECTION_OUT, USBD_SHORT_TRANSFER_OK)
  TransferBufferLength = 0000000d
  TransferBuffer       = 0e0b4550
  TransferBufferMDL    = 0ed4da50
  UrbLink              = 00000000
  SetupPacket          =
    00000000: 40 01 0b 00 00 00 0d 00
[8091099 ms] UsbSnoop - FilterDispatchAny(0dd57b90) : IRP_MJ_INTERNAL_DEVICE_CONTROL
[8091099 ms] UsbSnoop - FdoHookDispatchInternalIoctl(0dd57f8c) : fdo=0e0d7ab0, Irp=0e1ffb40, IRQL=0
[8091099 ms]  >>>  URB 109 going down  >>> 
-- URB_FUNCTION_VENDOR_DEVICE:
  TransferFlags          = 00000002 (USBD_TRANSFER_DIRECTION_OUT, USBD_SHORT_TRANSFER_OK)
  TransferBufferLength = 0000000d
  TransferBuffer       = 0e0b4550
  TransferBufferMDL    = 00000000
    00000000: 0b 4a c0 01 01 0e 81 ff 06 00 00 00 00
  UrbLink                 = 00000000
  RequestTypeReservedBits = 00000000
  Request                 = 00000001
  Value                   = 0000000b
  Index                   = 00000000
[8091099 ms] UsbSnoop - MyInternalIOCTLCompletion(0dd57ddc) : fido=00000000, Irp=0e1ffb40, Context=09bd0440, IRQL=2
[8091099 ms]  <<<  URB 109 coming back  <<< 
-- URB_FUNCTION_CONTROL_TRANSFER:
  PipeHandle           = 0d567060
  TransferFlags        = 0000000a (USBD_TRANSFER_DIRECTION_OUT, USBD_SHORT_TRANSFER_OK)
  TransferBufferLength = 0000000d
  TransferBuffer       = 0e0b4550
  TransferBufferMDL    = 0ed4da50
  UrbLink              = 00000000
  SetupPacket          =
    00000000: 40 01 0b 00 00 00 0d 00
[8091109 ms] UsbSnoop - FilterDispatchAny(0dd57b90) : IRP_MJ_INTERNAL_DEVICE_CONTROL
[8091109 ms] UsbSnoop - FdoHookDispatchInternalIoctl(0dd57f8c) : fdo=0e0d7ab0, Irp=0ed1db40, IRQL=0
[8091109 ms]  >>>  URB 110 going down  >>> 
-- URB_FUNCTION_VENDOR_DEVICE:
  TransferFlags          = 00000002 (USBD_TRANSFER_DIRECTION_OUT, USBD_SHORT_TRANSFER_OK)
  TransferBufferLength = 0000000d
  TransferBuffer       = 0e0b4550
  TransferBufferMDL    = 00000000
    00000000: 0b 4a c0 01 01 0e 81 ff 06 00 00 00 00
  UrbLink                 = 00000000
  RequestTypeReservedBits = 00000000
  Request                 = 00000001
  Value                   = 0000000b
  Index                   = 00000000
[8091109 ms] UsbSnoop - MyInternalIOCTLCompletion(0dd57ddc) : fido=00000000, Irp=0ed1db40, Context=09bd0440, IRQL=2
[8091109 ms]  <<<  URB 110 coming back  <<< 
-- URB_FUNCTION_CONTROL_TRANSFER:
  PipeHandle           = 0d567060
  TransferFlags        = 0000000a (USBD_TRANSFER_DIRECTION_OUT, USBD_SHORT_TRANSFER_OK)
  TransferBufferLength = 0000000d
  TransferBuffer       = 0e0b4550
  TransferBufferMDL    = 0ed4da50
  UrbLink              = 00000000
  SetupPacket          =
    00000000: 40 01 0b 00 00 00 0d 00
[8091119 ms] UsbSnoop - FilterDispatchAny(0dd57b90) : IRP_MJ_INTERNAL_DEVICE_CONTROL
[8091119 ms] UsbSnoop - FdoHookDispatchInternalIoctl(0dd57f8c) : fdo=0e0d7ab0, Irp=0ed1db40, IRQL=0
[8091119 ms]  >>>  URB 111 going down  >>> 
-- URB_FUNCTION_VENDOR_DEVICE:
  TransferFlags          = 00000002 (USBD_TRANSFER_DIRECTION_OUT, USBD_SHORT_TRANSFER_OK)
  TransferBufferLength = 0000000d
  TransferBuffer       = 0e0b4550
  TransferBufferMDL    = 00000000
    00000000: 0b 4a c0 01 01 0e 81 ff 06 00 00 00 00
  UrbLink                 = 00000000
  RequestTypeReservedBits = 00000000
  Request                 = 00000001
  Value                   = 0000000b
  Index                   = 00000000
[8091119 ms] UsbSnoop - MyInternalIOCTLCompletion(0dd57ddc) : fido=00000000, Irp=0ed1db40, Context=09bd0440, IRQL=2
[8091119 ms]  <<<  URB 111 coming back  <<< 
-- URB_FUNCTION_CONTROL_TRANSFER:
  PipeHandle           = 0d567060
  TransferFlags        = 0000000a (USBD_TRANSFER_DIRECTION_OUT, USBD_SHORT_TRANSFER_OK)
  TransferBufferLength = 0000000d
  TransferBuffer       = 0e0b4550
  TransferBufferMDL    = 0ed4da50
  UrbLink              = 00000000
  SetupPacket          =
    00000000: 40 01 0b 00 00 00 0d 00
[8091129 ms] UsbSnoop - FilterDispatchAny(0dd57b90) : IRP_MJ_INTERNAL_DEVICE_CONTROL
[8091129 ms] UsbSnoop - FdoHookDispatchInternalIoctl(0dd57f8c) : fdo=0e0d7ab0, Irp=0ed1db40, IRQL=0
[8091129 ms]  >>>  URB 112 going down  >>> 
-- URB_FUNCTION_VENDOR_DEVICE:
  TransferFlags          = 00000002 (USBD_TRANSFER_DIRECTION_OUT, USBD_SHORT_TRANSFER_OK)
  TransferBufferLength = 0000000d
  TransferBuffer       = 0e0b4550
  TransferBufferMDL    = 00000000
    00000000: 0b 4a c0 01 01 0e 81 ff 06 00 00 00 00
  UrbLink                 = 00000000
  RequestTypeReservedBits = 00000000
  Request                 = 00000001
  Value                   = 0000000b
  Index                   = 00000000
[8091129 ms] UsbSnoop - MyInternalIOCTLCompletion(0dd57ddc) : fido=00000000, Irp=0ed1db40, Context=09bd0440, IRQL=2
[8091129 ms]  <<<  URB 112 coming back  <<< 
-- URB_FUNCTION_CONTROL_TRANSFER:
  PipeHandle           = 0d567060
  TransferFlags        = 0000000a (USBD_TRANSFER_DIRECTION_OUT, USBD_SHORT_TRANSFER_OK)
  TransferBufferLength = 0000000d
  TransferBuffer       = 0e0b4550
  TransferBufferMDL    = 0ed4da50
  UrbLink              = 00000000
  SetupPacket          =
    00000000: 40 01 0b 00 00 00 0d 00
[8091139 ms] UsbSnoop - FilterDispatchAny(0dd57b90) : IRP_MJ_INTERNAL_DEVICE_CONTROL
[8091139 ms] UsbSnoop - FdoHookDispatchInternalIoctl(0dd57f8c) : fdo=0e0d7ab0, Irp=0ed1db40, IRQL=0
[8091139 ms]  >>>  URB 113 going down  >>> 
-- URB_FUNCTION_VENDOR_DEVICE:
  TransferFlags          = 00000002 (USBD_TRANSFER_DIRECTION_OUT, USBD_SHORT_TRANSFER_OK)
  TransferBufferLength = 0000000d
  TransferBuffer       = 0e0b4550
  TransferBufferMDL    = 00000000
    00000000: 0b 4a c0 01 01 0e 81 ff 06 00 00 00 00
  UrbLink                 = 00000000
  RequestTypeReservedBits = 00000000
  Request                 = 00000001
  Value                   = 0000000b
  Index                   = 00000000
[8091139 ms] UsbSnoop - MyInternalIOCTLCompletion(0dd57ddc) : fido=00000000, Irp=0ed1db40, Context=09bd0440, IRQL=2
[8091139 ms]  <<<  URB 113 coming back  <<< 
-- URB_FUNCTION_CONTROL_TRANSFER:
  PipeHandle           = 0d567060
  TransferFlags        = 0000000a (USBD_TRANSFER_DIRECTION_OUT, USBD_SHORT_TRANSFER_OK)
  TransferBufferLength = 0000000d
  TransferBuffer       = 0e0b4550
  TransferBufferMDL    = 0ed4da50
  UrbLink              = 00000000
  SetupPacket          =
    00000000: 40 01 0b 00 00 00 0d 00
[8091149 ms] UsbSnoop - FilterDispatchAny(0dd57b90) : IRP_MJ_INTERNAL_DEVICE_CONTROL
[8091149 ms] UsbSnoop - FdoHookDispatchInternalIoctl(0dd57f8c) : fdo=0e0d7ab0, Irp=0ed1db40, IRQL=0
[8091149 ms]  >>>  URB 114 going down  >>> 
-- URB_FUNCTION_VENDOR_DEVICE:
  TransferFlags          = 00000002 (USBD_TRANSFER_DIRECTION_OUT, USBD_SHORT_TRANSFER_OK)
  TransferBufferLength = 0000000d
  TransferBuffer       = 0e0b4550
  TransferBufferMDL    = 00000000
    00000000: 0b 4a c0 01 01 0e 81 ff 06 00 00 00 00
  UrbLink                 = 00000000
  RequestTypeReservedBits = 00000000
  Request                 = 00000001
  Value                   = 0000000b
  Index                   = 00000000
[8091149 ms] UsbSnoop - MyInternalIOCTLCompletion(0dd57ddc) : fido=00000000, Irp=0ed1db40, Context=09bd0440, IRQL=2
[8091149 ms]  <<<  URB 114 coming back  <<< 
-- URB_FUNCTION_CONTROL_TRANSFER:
  PipeHandle           = 0d567060
  TransferFlags        = 0000000a (USBD_TRANSFER_DIRECTION_OUT, USBD_SHORT_TRANSFER_OK)
  TransferBufferLength = 0000000d
  TransferBuffer       = 0e0b4550
  TransferBufferMDL    = 0ed4da50
  UrbLink              = 00000000
  SetupPacket          =
    00000000: 40 01 0b 00 00 00 0d 00
[8091159 ms] UsbSnoop - FilterDispatchAny(0dd57b90) : IRP_MJ_INTERNAL_DEVICE_CONTROL
[8091159 ms] UsbSnoop - FdoHookDispatchInternalIoctl(0dd57f8c) : fdo=0e0d7ab0, Irp=0ed1db40, IRQL=0
[8091159 ms]  >>>  URB 115 going down  >>> 
-- URB_FUNCTION_VENDOR_DEVICE:
  TransferFlags          = 00000002 (USBD_TRANSFER_DIRECTION_OUT, USBD_SHORT_TRANSFER_OK)
  TransferBufferLength = 0000000d
  TransferBuffer       = 0e0b4550
  TransferBufferMDL    = 00000000
    00000000: 0b 4a c0 01 01 0e 81 ff 06 00 00 00 00
  UrbLink                 = 00000000
  RequestTypeReservedBits = 00000000
  Request                 = 00000001
  Value                   = 0000000b
  Index                   = 00000000
[8091159 ms] UsbSnoop - MyInternalIOCTLCompletion(0dd57ddc) : fido=00000000, Irp=0ed1db40, Context=09bd0440, IRQL=2
[8091159 ms]  <<<  URB 115 coming back  <<< 
-- URB_FUNCTION_CONTROL_TRANSFER:
  PipeHandle           = 0d567060
  TransferFlags        = 0000000a (USBD_TRANSFER_DIRECTION_OUT, USBD_SHORT_TRANSFER_OK)
  TransferBufferLength = 0000000d
  TransferBuffer       = 0e0b4550
  TransferBufferMDL    = 0ed4da50
  UrbLink              = 00000000
  SetupPacket          =
    00000000: 40 01 0b 00 00 00 0d 00
[8091169 ms] UsbSnoop - FilterDispatchAny(0dd57b90) : IRP_MJ_INTERNAL_DEVICE_CONTROL
[8091169 ms] UsbSnoop - FdoHookDispatchInternalIoctl(0dd57f8c) : fdo=0e0d7ab0, Irp=0ed1db40, IRQL=0
[8091169 ms]  >>>  URB 116 going down  >>> 
-- URB_FUNCTION_VENDOR_DEVICE:
  TransferFlags          = 00000002 (USBD_TRANSFER_DIRECTION_OUT, USBD_SHORT_TRANSFER_OK)
  TransferBufferLength = 0000000d
  TransferBuffer       = 0e0b4550
  TransferBufferMDL    = 00000000
    00000000: 0b 4a c0 01 01 0e 81 ff 06 00 00 00 00
  UrbLink                 = 00000000
  RequestTypeReservedBits = 00000000
  Request                 = 00000001
  Value                   = 0000000b
  Index                   = 00000000
[8091169 ms] UsbSnoop - MyInternalIOCTLCompletion(0dd57ddc) : fido=00000000, Irp=0ed1db40, Context=09bd0440, IRQL=2
[8091169 ms]  <<<  URB 116 coming back  <<< 
-- URB_FUNCTION_CONTROL_TRANSFER:
  PipeHandle           = 0d567060
  TransferFlags        = 0000000a (USBD_TRANSFER_DIRECTION_OUT, USBD_SHORT_TRANSFER_OK)
  TransferBufferLength = 0000000d
  TransferBuffer       = 0e0b4550
  TransferBufferMDL    = 0ed4da50
  UrbLink              = 00000000
  SetupPacket          =
    00000000: 40 01 0b 00 00 00 0d 00
[8091178 ms] UsbSnoop - FilterDispatchAny(0dd57b90) : IRP_MJ_INTERNAL_DEVICE_CONTROL
[8091178 ms] UsbSnoop - FdoHookDispatchInternalIoctl(0dd57f8c) : fdo=0e0d7ab0, Irp=0ed1db40, IRQL=0
[8091178 ms]  >>>  URB 117 going down  >>> 
-- URB_FUNCTION_VENDOR_DEVICE:
  TransferFlags          = 00000002 (USBD_TRANSFER_DIRECTION_OUT, USBD_SHORT_TRANSFER_OK)
  TransferBufferLength = 0000000d
  TransferBuffer       = 0e0b4550
  TransferBufferMDL    = 00000000
    00000000: 0b 4a c0 01 01 0e 81 ff 06 00 00 00 00
  UrbLink                 = 00000000
  RequestTypeReservedBits = 00000000
  Request                 = 00000001
  Value                   = 0000000b
  Index                   = 00000000
[8091179 ms] UsbSnoop - MyInternalIOCTLCompletion(0dd57ddc) : fido=00000000, Irp=0ed1db40, Context=09bd0440, IRQL=2
[8091179 ms]  <<<  URB 117 coming back  <<< 
-- URB_FUNCTION_CONTROL_TRANSFER:
  PipeHandle           = 0d567060
  TransferFlags        = 0000000a (USBD_TRANSFER_DIRECTION_OUT, USBD_SHORT_TRANSFER_OK)
  TransferBufferLength = 0000000d
  TransferBuffer       = 0e0b4550
  TransferBufferMDL    = 071820d0
  UrbLink              = 00000000
  SetupPacket          =
    00000000: 40 01 0b 00 00 00 0d 00
[8091189 ms] UsbSnoop - FilterDispatchAny(0dd57b90) : IRP_MJ_INTERNAL_DEVICE_CONTROL
[8091189 ms] UsbSnoop - FdoHookDispatchInternalIoctl(0dd57f8c) : fdo=0e0d7ab0, Irp=0ed1db40, IRQL=0
[8091189 ms]  >>>  URB 118 going down  >>> 
-- URB_FUNCTION_VENDOR_DEVICE:
  TransferFlags          = 00000002 (USBD_TRANSFER_DIRECTION_OUT, USBD_SHORT_TRANSFER_OK)
  TransferBufferLength = 0000000d
  TransferBuffer       = 0e0b4550
  TransferBufferMDL    = 00000000
    00000000: 0b 4a c0 01 01 0e 81 ff 06 00 00 00 00
  UrbLink                 = 00000000
  RequestTypeReservedBits = 00000000
  Request                 = 00000001
  Value                   = 0000000b
  Index                   = 00000000
[8091189 ms] UsbSnoop - MyInternalIOCTLCompletion(0dd57ddc) : fido=00000000, Irp=0ed1db40, Context=09bd0440, IRQL=2
[8091189 ms]  <<<  URB 118 coming back  <<< 
-- URB_FUNCTION_CONTROL_TRANSFER:
  PipeHandle           = 0d567060
  TransferFlags        = 0000000a (USBD_TRANSFER_DIRECTION_OUT, USBD_SHORT_TRANSFER_OK)
  TransferBufferLength = 0000000d
  TransferBuffer       = 0e0b4550
  TransferBufferMDL    = 071820d0
  UrbLink              = 00000000
  SetupPacket          =
    00000000: 40 01 0b 00 00 00 0d 00
[8091198 ms] UsbSnoop - FilterDispatchAny(0dd57b90) : IRP_MJ_INTERNAL_DEVICE_CONTROL
[8091198 ms] UsbSnoop - FdoHookDispatchInternalIoctl(0dd57f8c) : fdo=0e0d7ab0, Irp=0ed1db40, IRQL=0
[8091198 ms]  >>>  URB 119 going down  >>> 
-- URB_FUNCTION_VENDOR_DEVICE:
  TransferFlags          = 00000002 (USBD_TRANSFER_DIRECTION_OUT, USBD_SHORT_TRANSFER_OK)
  TransferBufferLength = 0000000d
  TransferBuffer       = 0e0b4550
  TransferBufferMDL    = 00000000
    00000000: 0b 4a c0 01 01 0f 2a ff 06 00 00 00 00
  UrbLink                 = 00000000
  RequestTypeReservedBits = 00000000
  Request                 = 00000001
  Value                   = 0000000b
  Index                   = 00000000
[8091199 ms] UsbSnoop - MyInternalIOCTLCompletion(0dd57ddc) : fido=00000000, Irp=0ed1db40, Context=09bd0440, IRQL=2
[8091199 ms]  <<<  URB 119 coming back  <<< 
-- URB_FUNCTION_CONTROL_TRANSFER:
  PipeHandle           = 0d567060
  TransferFlags        = 0000000a (USBD_TRANSFER_DIRECTION_OUT, USBD_SHORT_TRANSFER_OK)
  TransferBufferLength = 0000000d
  TransferBuffer       = 0e0b4550
  TransferBufferMDL    = 071820d0
  UrbLink              = 00000000
  SetupPacket          =
    00000000: 40 01 0b 00 00 00 0d 00
[8091209 ms] UsbSnoop - FilterDispatchAny(0dd57b90) : IRP_MJ_INTERNAL_DEVICE_CONTROL
[8091209 ms] UsbSnoop - FdoHookDispatchInternalIoctl(0dd57f8c) : fdo=0e0d7ab0, Irp=0ed1db40, IRQL=0
[8091209 ms]  >>>  URB 120 going down  >>> 
-- URB_FUNCTION_VENDOR_DEVICE:
  TransferFlags          = 00000002 (USBD_TRANSFER_DIRECTION_OUT, USBD_SHORT_TRANSFER_OK)
  TransferBufferLength = 0000000d
  TransferBuffer       = 0e0b4550
  TransferBufferMDL    = 00000000
    00000000: 0b 4a c0 01 01 10 40 ff 06 00 00 00 00
  UrbLink                 = 00000000
  RequestTypeReservedBits = 00000000
  Request                 = 00000001
  Value                   = 0000000b
  Index                   = 00000000
[8091209 ms] UsbSnoop - MyInternalIOCTLCompletion(0dd57ddc) : fido=00000000, Irp=0ed1db40, Context=09bd0440, IRQL=2
[8091209 ms]  <<<  URB 120 coming back  <<< 
-- URB_FUNCTION_CONTROL_TRANSFER:
  PipeHandle           = 0d567060
  TransferFlags        = 0000000a (USBD_TRANSFER_DIRECTION_OUT, USBD_SHORT_TRANSFER_OK)
  TransferBufferLength = 0000000d
  TransferBuffer       = 0e0b4550
  TransferBufferMDL    = 071820d0
  UrbLink              = 00000000
  SetupPacket          =
    00000000: 40 01 0b 00 00 00 0d 00
[8091219 ms] UsbSnoop - FilterDispatchAny(0dd57b90) : IRP_MJ_INTERNAL_DEVICE_CONTROL
[8091219 ms] UsbSnoop - FdoHookDispatchInternalIoctl(0dd57f8c) : fdo=0e0d7ab0, Irp=0ed1db40, IRQL=0
[8091219 ms]  >>>  URB 121 going down  >>> 
-- URB_FUNCTION_VENDOR_DEVICE:
  TransferFlags          = 00000002 (USBD_TRANSFER_DIRECTION_OUT, USBD_SHORT_TRANSFER_OK)
  TransferBufferLength = 0000000d
  TransferBuffer       = 0e0b4550
  TransferBufferMDL    = 00000000
    00000000: 0b 4a c0 01 01 11 0c ff 06 00 00 00 00
  UrbLink                 = 00000000
  RequestTypeReservedBits = 00000000
  Request                 = 00000001
  Value                   = 0000000b
  Index                   = 00000000
[8091219 ms] UsbSnoop - MyInternalIOCTLCompletion(0dd57ddc) : fido=00000000, Irp=0ed1db40, Context=09bd0440, IRQL=2
[8091219 ms]  <<<  URB 121 coming back  <<< 
-- URB_FUNCTION_CONTROL_TRANSFER:
  PipeHandle           = 0d567060
  TransferFlags        = 0000000a (USBD_TRANSFER_DIRECTION_OUT, USBD_SHORT_TRANSFER_OK)
  TransferBufferLength = 0000000d
  TransferBuffer       = 0e0b4550
  TransferBufferMDL    = 071820d0
  UrbLink              = 00000000
  SetupPacket          =
    00000000: 40 01 0b 00 00 00 0d 00
[8091229 ms] UsbSnoop - FilterDispatchAny(0dd57b90) : IRP_MJ_INTERNAL_DEVICE_CONTROL
[8091229 ms] UsbSnoop - FdoHookDispatchInternalIoctl(0dd57f8c) : fdo=0e0d7ab0, Irp=0ed1db40, IRQL=0
[8091229 ms]  >>>  URB 122 going down  >>> 
-- URB_FUNCTION_VENDOR_DEVICE:
  TransferFlags          = 00000002 (USBD_TRANSFER_DIRECTION_OUT, USBD_SHORT_TRANSFER_OK)
  TransferBufferLength = 0000000d
  TransferBuffer       = 0e0b4550
  TransferBufferMDL    = 00000000
    00000000: 0b 4a c0 01 01 12 01 ff 06 00 00 00 00
  UrbLink                 = 00000000
  RequestTypeReservedBits = 00000000
  Request                 = 00000001
  Value                   = 0000000b
  Index                   = 00000000
[8091229 ms] UsbSnoop - MyInternalIOCTLCompletion(0dd57ddc) : fido=00000000, Irp=0ed1db40, Context=09bd0440, IRQL=2
[8091229 ms]  <<<  URB 122 coming back  <<< 
-- URB_FUNCTION_CONTROL_TRANSFER:
  PipeHandle           = 0d567060
  TransferFlags        = 0000000a (USBD_TRANSFER_DIRECTION_OUT, USBD_SHORT_TRANSFER_OK)
  TransferBufferLength = 0000000d
  TransferBuffer       = 0e0b4550
  TransferBufferMDL    = 071820d0
  UrbLink              = 00000000
  SetupPacket          =
    00000000: 40 01 0b 00 00 00 0d 00
[8091239 ms] UsbSnoop - FilterDispatchAny(0dd57b90) : IRP_MJ_INTERNAL_DEVICE_CONTROL
[8091239 ms] UsbSnoop - FdoHookDispatchInternalIoctl(0dd57f8c) : fdo=0e0d7ab0, Irp=0ed1db40, IRQL=0
[8091239 ms]  >>>  URB 123 going down  >>> 
-- URB_FUNCTION_VENDOR_DEVICE:
  TransferFlags          = 00000002 (USBD_TRANSFER_DIRECTION_OUT, USBD_SHORT_TRANSFER_OK)
  TransferBufferLength = 0000000d
  TransferBuffer       = 0e0b4550
  TransferBufferMDL    = 00000000
    00000000: 0b 4a c0 01 01 13 80 ff 06 00 00 00 00
  UrbLink                 = 00000000
  RequestTypeReservedBits = 00000000
  Request                 = 00000001
  Value                   = 0000000b
  Index                   = 00000000
[8091239 ms] UsbSnoop - MyInternalIOCTLCompletion(0dd57ddc) : fido=00000000, Irp=0ed1db40, Context=09bd0440, IRQL=2
[8091239 ms]  <<<  URB 123 coming back  <<< 
-- URB_FUNCTION_CONTROL_TRANSFER:
  PipeHandle           = 0d567060
  TransferFlags        = 0000000a (USBD_TRANSFER_DIRECTION_OUT, USBD_SHORT_TRANSFER_OK)
  TransferBufferLength = 0000000d
  TransferBuffer       = 0e0b4550
  TransferBufferMDL    = 071820d0
  UrbLink              = 00000000
  SetupPacket          =
    00000000: 40 01 0b 00 00 00 0d 00
[8091249 ms] UsbSnoop - FilterDispatchAny(0dd57b90) : IRP_MJ_INTERNAL_DEVICE_CONTROL
[8091249 ms] UsbSnoop - FdoHookDispatchInternalIoctl(0dd57f8c) : fdo=0e0d7ab0, Irp=0ed1db40, IRQL=0
[8091249 ms]  >>>  URB 124 going down  >>> 
-- URB_FUNCTION_VENDOR_DEVICE:
  TransferFlags          = 00000002 (USBD_TRANSFER_DIRECTION_OUT, USBD_SHORT_TRANSFER_OK)
  TransferBufferLength = 0000000d
  TransferBuffer       = 0e0b4550
  TransferBufferMDL    = 00000000
    00000000: 0b 4a c0 01 01 14 00 ff 06 00 00 00 00
  UrbLink                 = 00000000
  RequestTypeReservedBits = 00000000
  Request                 = 00000001
  Value                   = 0000000b
  Index                   = 00000000
[8091249 ms] UsbSnoop - MyInternalIOCTLCompletion(0dd57ddc) : fido=00000000, Irp=0ed1db40, Context=09bd0440, IRQL=2
[8091249 ms]  <<<  URB 124 coming back  <<< 
-- URB_FUNCTION_CONTROL_TRANSFER:
  PipeHandle           = 0d567060
  TransferFlags        = 0000000a (USBD_TRANSFER_DIRECTION_OUT, USBD_SHORT_TRANSFER_OK)
  TransferBufferLength = 0000000d
  TransferBuffer       = 0e0b4550
  TransferBufferMDL    = 071820d0
  UrbLink              = 00000000
  SetupPacket          =
    00000000: 40 01 0b 00 00 00 0d 00
[8091259 ms] UsbSnoop - FilterDispatchAny(0dd57b90) : IRP_MJ_INTERNAL_DEVICE_CONTROL
[8091259 ms] UsbSnoop - FdoHookDispatchInternalIoctl(0dd57f8c) : fdo=0e0d7ab0, Irp=0ed1db40, IRQL=0
[8091259 ms]  >>>  URB 125 going down  >>> 
-- URB_FUNCTION_VENDOR_DEVICE:
  TransferFlags          = 00000002 (USBD_TRANSFER_DIRECTION_OUT, USBD_SHORT_TRANSFER_OK)
  TransferBufferLength = 0000000d
  TransferBuffer       = 0e0b4550
  TransferBufferMDL    = 00000000
    00000000: 0b 4a c0 01 01 15 00 ff 06 00 00 00 00
  UrbLink                 = 00000000
  RequestTypeReservedBits = 00000000
  Request                 = 00000001
  Value                   = 0000000b
  Index                   = 00000000
[8091259 ms] UsbSnoop - MyInternalIOCTLCompletion(0dd57ddc) : fido=00000000, Irp=0ed1db40, Context=09bd0440, IRQL=2
[8091259 ms]  <<<  URB 125 coming back  <<< 
-- URB_FUNCTION_CONTROL_TRANSFER:
  PipeHandle           = 0d567060
  TransferFlags        = 0000000a (USBD_TRANSFER_DIRECTION_OUT, USBD_SHORT_TRANSFER_OK)
  TransferBufferLength = 0000000d
  TransferBuffer       = 0e0b4550
  TransferBufferMDL    = 071820d0
  UrbLink              = 00000000
  SetupPacket          =
    00000000: 40 01 0b 00 00 00 0d 00
[8091269 ms] UsbSnoop - FilterDispatchAny(0dd57b90) : IRP_MJ_INTERNAL_DEVICE_CONTROL
[8091269 ms] UsbSnoop - FdoHookDispatchInternalIoctl(0dd57f8c) : fdo=0e0d7ab0, Irp=0ed1db40, IRQL=0
[8091269 ms]  >>>  URB 126 going down  >>> 
-- URB_FUNCTION_VENDOR_DEVICE:
  TransferFlags          = 00000002 (USBD_TRANSFER_DIRECTION_OUT, USBD_SHORT_TRANSFER_OK)
  TransferBufferLength = 0000000d
  TransferBuffer       = 0e0b4550
  TransferBufferMDL    = 00000000
    00000000: 0b 4a c0 01 01 16 00 ff 06 00 00 00 00
  UrbLink                 = 00000000
  RequestTypeReservedBits = 00000000
  Request                 = 00000001
  Value                   = 0000000b
  Index                   = 00000000
[8091269 ms] UsbSnoop - MyInternalIOCTLCompletion(0dd57ddc) : fido=00000000, Irp=0ed1db40, Context=09bd0440, IRQL=2
[8091269 ms]  <<<  URB 126 coming back  <<< 
-- URB_FUNCTION_CONTROL_TRANSFER:
  PipeHandle           = 0d567060
  TransferFlags        = 0000000a (USBD_TRANSFER_DIRECTION_OUT, USBD_SHORT_TRANSFER_OK)
  TransferBufferLength = 0000000d
  TransferBuffer       = 0e0b4550
  TransferBufferMDL    = 071820d0
  UrbLink              = 00000000
  SetupPacket          =
    00000000: 40 01 0b 00 00 00 0d 00
[8091279 ms] UsbSnoop - FilterDispatchAny(0dd57b90) : IRP_MJ_INTERNAL_DEVICE_CONTROL
[8091279 ms] UsbSnoop - FdoHookDispatchInternalIoctl(0dd57f8c) : fdo=0e0d7ab0, Irp=0ed1db40, IRQL=0
[8091279 ms]  >>>  URB 127 going down  >>> 
-- URB_FUNCTION_VENDOR_DEVICE:
  TransferFlags          = 00000002 (USBD_TRANSFER_DIRECTION_OUT, USBD_SHORT_TRANSFER_OK)
  TransferBufferLength = 0000000d
  TransferBuffer       = 0e0b4550
  TransferBufferMDL    = 00000000
    00000000: 0b 4a c0 01 01 17 00 ff 06 00 00 00 00
  UrbLink                 = 00000000
  RequestTypeReservedBits = 00000000
  Request                 = 00000001
  Value                   = 0000000b
  Index                   = 00000000
[8091279 ms] UsbSnoop - MyInternalIOCTLCompletion(0dd57ddc) : fido=00000000, Irp=0ed1db40, Context=09bd0440, IRQL=2
[8091279 ms]  <<<  URB 127 coming back  <<< 
-- URB_FUNCTION_CONTROL_TRANSFER:
  PipeHandle           = 0d567060
  TransferFlags        = 0000000a (USBD_TRANSFER_DIRECTION_OUT, USBD_SHORT_TRANSFER_OK)
  TransferBufferLength = 0000000d
  TransferBuffer       = 0e0b4550
  TransferBufferMDL    = 071820d0
  UrbLink              = 00000000
  SetupPacket          =
    00000000: 40 01 0b 00 00 00 0d 00
[8091289 ms] UsbSnoop - FilterDispatchAny(0dd57b90) : IRP_MJ_INTERNAL_DEVICE_CONTROL
[8091289 ms] UsbSnoop - FdoHookDispatchInternalIoctl(0dd57f8c) : fdo=0e0d7ab0, Irp=0ed1db40, IRQL=0
[8091289 ms]  >>>  URB 128 going down  >>> 
-- URB_FUNCTION_VENDOR_DEVICE:
  TransferFlags          = 00000002 (USBD_TRANSFER_DIRECTION_OUT, USBD_SHORT_TRANSFER_OK)
  TransferBufferLength = 0000000d
  TransferBuffer       = 0e0b4550
  TransferBufferMDL    = 00000000
    00000000: 0b 4a c0 01 01 40 02 ff 06 00 00 00 00
  UrbLink                 = 00000000
  RequestTypeReservedBits = 00000000
  Request                 = 00000001
  Value                   = 0000000b
  Index                   = 00000000
[8091289 ms] UsbSnoop - MyInternalIOCTLCompletion(0dd57ddc) : fido=00000000, Irp=0ed1db40, Context=09bd0440, IRQL=2
[8091289 ms]  <<<  URB 128 coming back  <<< 
-- URB_FUNCTION_CONTROL_TRANSFER:
  PipeHandle           = 0d567060
  TransferFlags        = 0000000a (USBD_TRANSFER_DIRECTION_OUT, USBD_SHORT_TRANSFER_OK)
  TransferBufferLength = 0000000d
  TransferBuffer       = 0e0b4550
  TransferBufferMDL    = 071820d0
  UrbLink              = 00000000
  SetupPacket          =
    00000000: 40 01 0b 00 00 00 0d 00
[8091298 ms] UsbSnoop - FilterDispatchAny(0dd57b90) : IRP_MJ_INTERNAL_DEVICE_CONTROL
[8091299 ms] UsbSnoop - FdoHookDispatchInternalIoctl(0dd57f8c) : fdo=0e0d7ab0, Irp=0ed1db40, IRQL=0
[8091299 ms]  >>>  URB 129 going down  >>> 
-- URB_FUNCTION_VENDOR_DEVICE:
  TransferFlags          = 00000002 (USBD_TRANSFER_DIRECTION_OUT, USBD_SHORT_TRANSFER_OK)
  TransferBufferLength = 0000000d
  TransferBuffer       = 0e0b4550
  TransferBufferMDL    = 00000000
    00000000: 0b 4a c0 01 01 58 00 ff 06 00 00 00 00
  UrbLink                 = 00000000
  RequestTypeReservedBits = 00000000
  Request                 = 00000001
  Value                   = 0000000b
  Index                   = 00000000
[8091299 ms] UsbSnoop - MyInternalIOCTLCompletion(0dd57ddc) : fido=00000000, Irp=0ed1db40, Context=09bd0440, IRQL=2
[8091299 ms]  <<<  URB 129 coming back  <<< 
-- URB_FUNCTION_CONTROL_TRANSFER:
  PipeHandle           = 0d567060
  TransferFlags        = 0000000a (USBD_TRANSFER_DIRECTION_OUT, USBD_SHORT_TRANSFER_OK)
  TransferBufferLength = 0000000d
  TransferBuffer       = 0e0b4550
  TransferBufferMDL    = 071820d0
  UrbLink              = 00000000
  SetupPacket          =
    00000000: 40 01 0b 00 00 00 0d 00
[8091308 ms] UsbSnoop - FilterDispatchAny(0dd57b90) : IRP_MJ_INTERNAL_DEVICE_CONTROL
[8091308 ms] UsbSnoop - FdoHookDispatchInternalIoctl(0dd57f8c) : fdo=0e0d7ab0, Irp=0e1ffb40, IRQL=0
[8091309 ms]  >>>  URB 130 going down  >>> 
-- URB_FUNCTION_VENDOR_DEVICE:
  TransferFlags          = 00000002 (USBD_TRANSFER_DIRECTION_OUT, USBD_SHORT_TRANSFER_OK)
  TransferBufferLength = 0000000d
  TransferBuffer       = 0e0b4550
  TransferBufferMDL    = 00000000
    00000000: 0b 4a c0 01 01 59 54 ff 06 00 00 00 00
  UrbLink                 = 00000000
  RequestTypeReservedBits = 00000000
  Request                 = 00000001
  Value                   = 0000000b
  Index                   = 00000000
[8091309 ms] UsbSnoop - MyInternalIOCTLCompletion(0dd57ddc) : fido=00000000, Irp=0e1ffb40, Context=09bd0440, IRQL=2
[8091309 ms]  <<<  URB 130 coming back  <<< 
-- URB_FUNCTION_CONTROL_TRANSFER:
  PipeHandle           = 0d567060
  TransferFlags        = 0000000a (USBD_TRANSFER_DIRECTION_OUT, USBD_SHORT_TRANSFER_OK)
  TransferBufferLength = 0000000d
  TransferBuffer       = 0e0b4550
  TransferBufferMDL    = 071820d0
  UrbLink              = 00000000
  SetupPacket          =
    00000000: 40 01 0b 00 00 00 0d 00
[8091319 ms] UsbSnoop - FilterDispatchAny(0dd57b90) : IRP_MJ_INTERNAL_DEVICE_CONTROL
[8091319 ms] UsbSnoop - FdoHookDispatchInternalIoctl(0dd57f8c) : fdo=0e0d7ab0, Irp=0e1ffb40, IRQL=0
[8091319 ms]  >>>  URB 131 going down  >>> 
-- URB_FUNCTION_VENDOR_DEVICE:
  TransferFlags          = 00000002 (USBD_TRANSFER_DIRECTION_OUT, USBD_SHORT_TRANSFER_OK)
  TransferBufferLength = 0000000d
  TransferBuffer       = 0e0b4550
  TransferBufferMDL    = 00000000
    00000000: 0b 4a c0 01 01 5a 07 ff 06 00 00 00 00
  UrbLink                 = 00000000
  RequestTypeReservedBits = 00000000
  Request                 = 00000001
  Value                   = 0000000b
  Index                   = 00000000
[8091319 ms] UsbSnoop - MyInternalIOCTLCompletion(0dd57ddc) : fido=00000000, Irp=0e1ffb40, Context=09bd0440, IRQL=2
[8091319 ms]  <<<  URB 131 coming back  <<< 
-- URB_FUNCTION_CONTROL_TRANSFER:
  PipeHandle           = 0d567060
  TransferFlags        = 0000000a (USBD_TRANSFER_DIRECTION_OUT, USBD_SHORT_TRANSFER_OK)
  TransferBufferLength = 0000000d
  TransferBuffer       = 0e0b4550
  TransferBufferMDL    = 071820d0
  UrbLink              = 00000000
  SetupPacket          =
    00000000: 40 01 0b 00 00 00 0d 00
[8091329 ms] UsbSnoop - FilterDispatchAny(0dd57b90) : IRP_MJ_INTERNAL_DEVICE_CONTROL
[8091329 ms] UsbSnoop - FdoHookDispatchInternalIoctl(0dd57f8c) : fdo=0e0d7ab0, Irp=0e1ffb40, IRQL=0
[8091329 ms]  >>>  URB 132 going down  >>> 
-- URB_FUNCTION_VENDOR_DEVICE:
  TransferFlags          = 00000002 (USBD_TRANSFER_DIRECTION_OUT, USBD_SHORT_TRANSFER_OK)
  TransferBufferLength = 0000000d
  TransferBuffer       = 0e0b4550
  TransferBufferMDL    = 00000000
    00000000: 0b 4a c0 01 01 5b 03 ff 06 00 00 00 00
  UrbLink                 = 00000000
  RequestTypeReservedBits = 00000000
  Request                 = 00000001
  Value                   = 0000000b
  Index                   = 00000000
[8091329 ms] UsbSnoop - MyInternalIOCTLCompletion(0dd57ddc) : fido=00000000, Irp=0e1ffb40, Context=09bd0440, IRQL=2
[8091329 ms]  <<<  URB 132 coming back  <<< 
-- URB_FUNCTION_CONTROL_TRANSFER:
  PipeHandle           = 0d567060
  TransferFlags        = 0000000a (USBD_TRANSFER_DIRECTION_OUT, USBD_SHORT_TRANSFER_OK)
  TransferBufferLength = 0000000d
  TransferBuffer       = 0e0b4550
  TransferBufferMDL    = 09972170
  UrbLink              = 00000000
  SetupPacket          =
    00000000: 40 01 0b 00 00 00 0d 00
[8091339 ms] UsbSnoop - FilterDispatchAny(0dd57b90) : IRP_MJ_INTERNAL_DEVICE_CONTROL
[8091339 ms] UsbSnoop - FdoHookDispatchInternalIoctl(0dd57f8c) : fdo=0e0d7ab0, Irp=0d88cb40, IRQL=0
[8091339 ms]  >>>  URB 133 going down  >>> 
-- URB_FUNCTION_VENDOR_DEVICE:
  TransferFlags          = 00000002 (USBD_TRANSFER_DIRECTION_OUT, USBD_SHORT_TRANSFER_OK)
  TransferBufferLength = 0000000d
  TransferBuffer       = 0e0b4550
  TransferBufferMDL    = 00000000
    00000000: 0b 4a c0 01 01 5e 00 ff 06 00 00 00 00
  UrbLink                 = 00000000
  RequestTypeReservedBits = 00000000
  Request                 = 00000001
  Value                   = 0000000b
  Index                   = 00000000
[8091339 ms] UsbSnoop - MyInternalIOCTLCompletion(0dd57ddc) : fido=00000000, Irp=0d88cb40, Context=09bd0440, IRQL=2
[8091339 ms]  <<<  URB 133 coming back  <<< 
-- URB_FUNCTION_CONTROL_TRANSFER:
  PipeHandle           = 0d567060
  TransferFlags        = 0000000a (USBD_TRANSFER_DIRECTION_OUT, USBD_SHORT_TRANSFER_OK)
  TransferBufferLength = 0000000d
  TransferBuffer       = 0e0b4550
  TransferBufferMDL    = 071820d0
  UrbLink              = 00000000
  SetupPacket          =
    00000000: 40 01 0b 00 00 00 0d 00
[8091349 ms] UsbSnoop - FilterDispatchAny(0dd57b90) : IRP_MJ_INTERNAL_DEVICE_CONTROL
[8091349 ms] UsbSnoop - FdoHookDispatchInternalIoctl(0dd57f8c) : fdo=0e0d7ab0, Irp=075cab40, IRQL=0
[8091349 ms]  >>>  URB 134 going down  >>> 
-- URB_FUNCTION_VENDOR_DEVICE:
  TransferFlags          = 00000002 (USBD_TRANSFER_DIRECTION_OUT, USBD_SHORT_TRANSFER_OK)
  TransferBufferLength = 0000000d
  TransferBuffer       = 0e0b45d0
  TransferBufferMDL    = 00000000
    00000000: 0b 4a c0 01 01 02 c0 ff d0 00 00 00 00
  UrbLink                 = 00000000
  RequestTypeReservedBits = 00000000
  Request                 = 00000001
  Value                   = 0000000b
  Index                   = 00000000
[8091349 ms] UsbSnoop - MyInternalIOCTLCompletion(0dd57ddc) : fido=00000000, Irp=075cab40, Context=09bd0440, IRQL=2
[8091349 ms]  <<<  URB 134 coming back  <<< 
-- URB_FUNCTION_CONTROL_TRANSFER:
  PipeHandle           = 0d567060
  TransferFlags        = 0000000a (USBD_TRANSFER_DIRECTION_OUT, USBD_SHORT_TRANSFER_OK)
  TransferBufferLength = 0000000d
  TransferBuffer       = 0e0b45d0
  TransferBufferMDL    = 071820d0
  UrbLink              = 00000000
  SetupPacket          =
    00000000: 40 01 0b 00 00 00 0d 00
[8091349 ms] UsbSnoop - FilterDispatchAny(0dd57b90) : IRP_MJ_INTERNAL_DEVICE_CONTROL
[8091349 ms] UsbSnoop - FdoHookDispatchInternalIoctl(0dd57f8c) : fdo=0e0d7ab0, Irp=0d88cb40, IRQL=0
[8091349 ms]  >>>  URB 135 going down  >>> 
-- URB_FUNCTION_VENDOR_DEVICE:
  TransferFlags          = 00000002 (USBD_TRANSFER_DIRECTION_OUT, USBD_SHORT_TRANSFER_OK)
  TransferBufferLength = 0000000d
  TransferBuffer       = 0e0b45d0
  TransferBufferMDL    = 00000000
    00000000: 0b 4a c0 01 01 0a 80 ff d0 00 00 00 00
  UrbLink                 = 00000000
  RequestTypeReservedBits = 00000000
  Request                 = 00000001
  Value                   = 0000000b
  Index                   = 00000000
[8091350 ms] UsbSnoop - MyInternalIOCTLCompletion(0dd57ddc) : fido=00000000, Irp=0d88cb40, Context=09bd0440, IRQL=2
[8091350 ms]  <<<  URB 135 coming back  <<< 
-- URB_FUNCTION_CONTROL_TRANSFER:
  PipeHandle           = 0d567060
  TransferFlags        = 0000000a (USBD_TRANSFER_DIRECTION_OUT, USBD_SHORT_TRANSFER_OK)
  TransferBufferLength = 0000000d
  TransferBuffer       = 0e0b45d0
  TransferBufferMDL    = 071820d0
  UrbLink              = 00000000
  SetupPacket          =
    00000000: 40 01 0b 00 00 00 0d 00
[8091350 ms] UsbSnoop - FilterDispatchAny(0dd57b90) : IRP_MJ_INTERNAL_DEVICE_CONTROL
[8091350 ms] UsbSnoop - FdoHookDispatchInternalIoctl(0dd57f8c) : fdo=0e0d7ab0, Irp=0d88cb40, IRQL=0
[8091350 ms]  >>>  URB 136 going down  >>> 
-- URB_FUNCTION_VENDOR_DEVICE:
  TransferFlags          = 00000002 (USBD_TRANSFER_DIRECTION_OUT, USBD_SHORT_TRANSFER_OK)
  TransferBufferLength = 0000000d
  TransferBuffer       = 0e0b45d0
  TransferBufferMDL    = 00000000
    00000000: 0b 4a c0 01 01 0b 40 ff d0 00 00 00 00
  UrbLink                 = 00000000
  RequestTypeReservedBits = 00000000
  Request                 = 00000001
  Value                   = 0000000b
  Index                   = 00000000
[8091350 ms] UsbSnoop - MyInternalIOCTLCompletion(0dd57ddc) : fido=00000000, Irp=0d88cb40, Context=09bd0440, IRQL=2
[8091350 ms]  <<<  URB 136 coming back  <<< 
-- URB_FUNCTION_CONTROL_TRANSFER:
  PipeHandle           = 0d567060
  TransferFlags        = 0000000a (USBD_TRANSFER_DIRECTION_OUT, USBD_SHORT_TRANSFER_OK)
  TransferBufferLength = 0000000d
  TransferBuffer       = 0e0b45d0
  TransferBufferMDL    = 071820d0
  UrbLink              = 00000000
  SetupPacket          =
    00000000: 40 01 0b 00 00 00 0d 00
[8091350 ms] UsbSnoop - FilterDispatchAny(0dd57b90) : IRP_MJ_INTERNAL_DEVICE_CONTROL
[8091350 ms] UsbSnoop - FdoHookDispatchInternalIoctl(0dd57f8c) : fdo=0e0d7ab0, Irp=0d88cb40, IRQL=0
[8091351 ms]  >>>  URB 137 going down  >>> 
-- URB_FUNCTION_VENDOR_DEVICE:
  TransferFlags          = 00000002 (USBD_TRANSFER_DIRECTION_OUT, USBD_SHORT_TRANSFER_OK)
  TransferBufferLength = 0000000d
  TransferBuffer       = 0e0b45d0
  TransferBufferMDL    = 00000000
    00000000: 0b 4a c0 01 01 0d 00 ff d0 00 00 00 00
  UrbLink                 = 00000000
  RequestTypeReservedBits = 00000000
  Request                 = 00000001
  Value                   = 0000000b
  Index                   = 00000000
[8091351 ms] UsbSnoop - MyInternalIOCTLCompletion(0dd57ddc) : fido=00000000, Irp=0d88cb40, Context=09bd0440, IRQL=2
[8091351 ms]  <<<  URB 137 coming back  <<< 
-- URB_FUNCTION_CONTROL_TRANSFER:
  PipeHandle           = 0d567060
  TransferFlags        = 0000000a (USBD_TRANSFER_DIRECTION_OUT, USBD_SHORT_TRANSFER_OK)
  TransferBufferLength = 0000000d
  TransferBuffer       = 0e0b45d0
  TransferBufferMDL    = 071820d0
  UrbLink              = 00000000
  SetupPacket          =
    00000000: 40 01 0b 00 00 00 0d 00
[8091351 ms] UsbSnoop - FilterDispatchAny(0dd57b90) : IRP_MJ_INTERNAL_DEVICE_CONTROL
[8091351 ms] UsbSnoop - FdoHookDispatchInternalIoctl(0dd57f8c) : fdo=0e0d7ab0, Irp=0d88cb40, IRQL=0
[8091351 ms]  >>>  URB 138 going down  >>> 
-- URB_FUNCTION_VENDOR_DEVICE:
  TransferFlags          = 00000002 (USBD_TRANSFER_DIRECTION_OUT, USBD_SHORT_TRANSFER_OK)
  TransferBufferLength = 0000000d
  TransferBuffer       = 0e0b45d0
  TransferBufferMDL    = 00000000
    00000000: 0b 4a c0 01 01 0c 40 ff d0 00 00 00 00
  UrbLink                 = 00000000
  RequestTypeReservedBits = 00000000
  Request                 = 00000001
  Value                   = 0000000b
  Index                   = 00000000
[8091352 ms] UsbSnoop - MyInternalIOCTLCompletion(0dd57ddc) : fido=00000000, Irp=0d88cb40, Context=09bd0440, IRQL=2
[8091352 ms]  <<<  URB 138 coming back  <<< 
-- URB_FUNCTION_CONTROL_TRANSFER:
  PipeHandle           = 0d567060
  TransferFlags        = 0000000a (USBD_TRANSFER_DIRECTION_OUT, USBD_SHORT_TRANSFER_OK)
  TransferBufferLength = 0000000d
  TransferBuffer       = 0e0b45d0
  TransferBufferMDL    = 071820d0
  UrbLink              = 00000000
  SetupPacket          =
    00000000: 40 01 0b 00 00 00 0d 00
[8091352 ms] UsbSnoop - FilterDispatchAny(0dd57b90) : IRP_MJ_INTERNAL_DEVICE_CONTROL
[8091352 ms] UsbSnoop - FdoHookDispatchInternalIoctl(0dd57f8c) : fdo=0e0d7ab0, Irp=0d88cb40, IRQL=0
[8091352 ms]  >>>  URB 139 going down  >>> 
-- URB_FUNCTION_VENDOR_DEVICE:
  TransferFlags          = 00000002 (USBD_TRANSFER_DIRECTION_OUT, USBD_SHORT_TRANSFER_OK)
  TransferBufferLength = 0000000d
  TransferBuffer       = 0e0b4580
  TransferBufferMDL    = 00000000
    00000000: 0b 4a c0 01 01 09 01 00 00 00 5a 12 a0
  UrbLink                 = 00000000
  RequestTypeReservedBits = 00000000
  Request                 = 00000001
  Value                   = 0000000b
  Index                   = 00000000
[8091352 ms] UsbSnoop - MyInternalIOCTLCompletion(0dd57ddc) : fido=00000000, Irp=0d88cb40, Context=09bd0440, IRQL=2
[8091352 ms]  <<<  URB 139 coming back  <<< 
-- URB_FUNCTION_CONTROL_TRANSFER:
  PipeHandle           = 0d567060
  TransferFlags        = 0000000a (USBD_TRANSFER_DIRECTION_OUT, USBD_SHORT_TRANSFER_OK)
  TransferBufferLength = 0000000d
  TransferBuffer       = 0e0b4580
  TransferBufferMDL    = 071820d0
  UrbLink              = 00000000
  SetupPacket          =
    00000000: 40 01 0b 00 00 00 0d 00
[8091353 ms] UsbSnoop - FilterDispatchAny(0dd57b90) : IRP_MJ_INTERNAL_DEVICE_CONTROL
[8091353 ms] UsbSnoop - FdoHookDispatchInternalIoctl(0dd57f8c) : fdo=0e0d7ab0, Irp=0e1ffb40, IRQL=0
[8091353 ms]  >>>  URB 140 going down  >>> 
-- URB_FUNCTION_VENDOR_DEVICE:
  TransferFlags          = 00000002 (USBD_TRANSFER_DIRECTION_OUT, USBD_SHORT_TRANSFER_OK)
  TransferBufferLength = 0000000d
  TransferBuffer       = 0e0b45d0
  TransferBufferMDL    = 00000000
    00000000: 0b 4a c0 01 01 02 c0 ff 0d 61 fc 02 00
  UrbLink                 = 00000000
  RequestTypeReservedBits = 00000000
  Request                 = 00000001
  Value                   = 0000000b
  Index                   = 00000000
[8091354 ms] UsbSnoop - MyInternalIOCTLCompletion(0dd57ddc) : fido=00000000, Irp=0e1ffb40, Context=09bd0440, IRQL=2
[8091354 ms]  <<<  URB 140 coming back  <<< 
-- URB_FUNCTION_CONTROL_TRANSFER:
  PipeHandle           = 0d567060
  TransferFlags        = 0000000a (USBD_TRANSFER_DIRECTION_OUT, USBD_SHORT_TRANSFER_OK)
  TransferBufferLength = 0000000d
  TransferBuffer       = 0e0b45d0
  TransferBufferMDL    = 071820d0
  UrbLink              = 00000000
  SetupPacket          =
    00000000: 40 01 0b 00 00 00 0d 00
[8091354 ms] UsbSnoop - FilterDispatchAny(0dd57b90) : IRP_MJ_INTERNAL_DEVICE_CONTROL
[8091354 ms] UsbSnoop - FdoHookDispatchInternalIoctl(0dd57f8c) : fdo=0e0d7ab0, Irp=0e1ffb40, IRQL=0
[8091354 ms]  >>>  URB 141 going down  >>> 
-- URB_FUNCTION_VENDOR_DEVICE:
  TransferFlags          = 00000002 (USBD_TRANSFER_DIRECTION_OUT, USBD_SHORT_TRANSFER_OK)
  TransferBufferLength = 0000000d
  TransferBuffer       = 0e0b45d0
  TransferBufferMDL    = 00000000
    00000000: 0b 4a c0 01 01 0e 01 ff 0d 61 fc 02 00
  UrbLink                 = 00000000
  RequestTypeReservedBits = 00000000
  Request                 = 00000001
  Value                   = 0000000b
  Index                   = 00000000
[8091354 ms] UsbSnoop - MyInternalIOCTLCompletion(0dd57ddc) : fido=00000000, Irp=0e1ffb40, Context=09bd0440, IRQL=2
[8091354 ms]  <<<  URB 141 coming back  <<< 
-- URB_FUNCTION_CONTROL_TRANSFER:
  PipeHandle           = 0d567060
  TransferFlags        = 0000000a (USBD_TRANSFER_DIRECTION_OUT, USBD_SHORT_TRANSFER_OK)
  TransferBufferLength = 0000000d
  TransferBuffer       = 0e0b45d0
  TransferBufferMDL    = 071820d0
  UrbLink              = 00000000
  SetupPacket          =
    00000000: 40 01 0b 00 00 00 0d 00
[8091364 ms] UsbSnoop - FilterDispatchAny(0dd57b90) : IRP_MJ_INTERNAL_DEVICE_CONTROL
[8091364 ms] UsbSnoop - FdoHookDispatchInternalIoctl(0dd57f8c) : fdo=0e0d7ab0, Irp=0d862b40, IRQL=0
[8091364 ms]  >>>  URB 142 going down  >>> 
-- URB_FUNCTION_VENDOR_DEVICE:
  TransferFlags          = 00000002 (USBD_TRANSFER_DIRECTION_OUT, USBD_SHORT_TRANSFER_OK)
  TransferBufferLength = 0000000d
  TransferBuffer       = 0e0b45a0
  TransferBufferMDL    = 00000000
    00000000: 0b 4a 84 00 01 40 00 00 20 00 00 00 00
  UrbLink                 = 00000000
  RequestTypeReservedBits = 00000000
  Request                 = 00000001
  Value                   = 0000000b
  Index                   = 00000000
[8091364 ms] UsbSnoop - MyInternalIOCTLCompletion(0dd57ddc) : fido=00000000, Irp=0d862b40, Context=09bd0440, IRQL=2
[8091364 ms]  <<<  URB 142 coming back  <<< 
-- URB_FUNCTION_CONTROL_TRANSFER:
  PipeHandle           = 0d567060
  TransferFlags        = 0000000a (USBD_TRANSFER_DIRECTION_OUT, USBD_SHORT_TRANSFER_OK)
  TransferBufferLength = 0000000d
  TransferBuffer       = 0e0b45a0
  TransferBufferMDL    = 071820d0
  UrbLink              = 00000000
  SetupPacket          =
    00000000: 40 01 0b 00 00 00 0d 00
[8091382 ms] UsbSnoop - FilterDispatchAny(0dd57b90) : IRP_MJ_INTERNAL_DEVICE_CONTROL
[8091382 ms] UsbSnoop - FdoHookDispatchInternalIoctl(0dd57f8c) : fdo=0e0d7ab0, Irp=0d862b40, IRQL=0
[8091382 ms]  >>>  URB 143 going down  >>> 
-- URB_FUNCTION_VENDOR_DEVICE:
  TransferFlags          = 00000002 (USBD_TRANSFER_DIRECTION_OUT, USBD_SHORT_TRANSFER_OK)
  TransferBufferLength = 0000000d
  TransferBuffer       = 0e0b4548
  TransferBufferMDL    = 00000000
    00000000: 0b 4a a0 00 01 60 ff ff 45 41 0e 78 ce
  UrbLink                 = 00000000
  RequestTypeReservedBits = 00000000
  Request                 = 00000001
  Value                   = 0000000b
  Index                   = 00000000
[8091382 ms] UsbSnoop - MyInternalIOCTLCompletion(0dd57ddc) : fido=00000000, Irp=0d862b40, Context=09bd0440, IRQL=2
[8091382 ms]  <<<  URB 143 coming back  <<< 
-- URB_FUNCTION_CONTROL_TRANSFER:
  PipeHandle           = 0d567060
  TransferFlags        = 0000000a (USBD_TRANSFER_DIRECTION_OUT, USBD_SHORT_TRANSFER_OK)
  TransferBufferLength = 0000000d
  TransferBuffer       = 0e0b4548
  TransferBufferMDL    = 071820d0
  UrbLink              = 00000000
  SetupPacket          =
    00000000: 40 01 0b 00 00 00 0d 00
[8091382 ms] UsbSnoop - FilterDispatchAny(0dd57b90) : IRP_MJ_INTERNAL_DEVICE_CONTROL
[8091382 ms] UsbSnoop - FdoHookDispatchInternalIoctl(0dd57f8c) : fdo=0e0d7ab0, Irp=0d862b40, IRQL=0
[8091382 ms]  >>>  URB 144 going down  >>> 
-- URB_FUNCTION_VENDOR_DEVICE:
  TransferFlags          = 00000003 (USBD_TRANSFER_DIRECTION_IN, USBD_SHORT_TRANSFER_OK)
  TransferBufferLength = 0000000d
  TransferBuffer       = 0e0b4548
  TransferBufferMDL    = 00000000
  UrbLink                 = 00000000
  RequestTypeReservedBits = 00000000
  Request                 = 00000001
  Value                   = 0000000b
  Index                   = 00000000
[8091383 ms] UsbSnoop - MyInternalIOCTLCompletion(0dd57ddc) : fido=00000000, Irp=0d862b40, Context=09bd0440, IRQL=2
[8091383 ms]  <<<  URB 144 coming back  <<< 
-- URB_FUNCTION_CONTROL_TRANSFER:
  PipeHandle           = 0d567060
  TransferFlags        = 0000000b (USBD_TRANSFER_DIRECTION_IN, USBD_SHORT_TRANSFER_OK)
  TransferBufferLength = 0000000d
  TransferBuffer       = 0e0b4548
  TransferBufferMDL    = 071820d0
    00000000: 0b 4a a0 00 01 00 ff ff 45 41 0e 78 ce
  UrbLink              = 00000000
  SetupPacket          =
    00000000: c0 01 0b 00 00 00 0d 00
[8091402 ms] UsbSnoop - FilterDispatchAny(0dd57b90) : IRP_MJ_INTERNAL_DEVICE_CONTROL
[8091402 ms] UsbSnoop - FdoHookDispatchInternalIoctl(0dd57f8c) : fdo=0e0d7ab0, Irp=0d862b40, IRQL=0
[8091402 ms]  >>>  URB 145 going down  >>> 
-- URB_FUNCTION_VENDOR_DEVICE:
  TransferFlags          = 00000002 (USBD_TRANSFER_DIRECTION_OUT, USBD_SHORT_TRANSFER_OK)
  TransferBufferLength = 0000000d
  TransferBuffer       = 0e0b45a0
  TransferBufferMDL    = 00000000
    00000000: 0b 4a 84 00 01 5b 00 00 20 00 00 00 00
  UrbLink                 = 00000000
  RequestTypeReservedBits = 00000000
  Request                 = 00000001
  Value                   = 0000000b
  Index                   = 00000000
[8091402 ms] UsbSnoop - MyInternalIOCTLCompletion(0dd57ddc) : fido=00000000, Irp=0d862b40, Context=09bd0440, IRQL=2
[8091402 ms]  <<<  URB 145 coming back  <<< 
-- URB_FUNCTION_CONTROL_TRANSFER:
  PipeHandle           = 0d567060
  TransferFlags        = 0000000a (USBD_TRANSFER_DIRECTION_OUT, USBD_SHORT_TRANSFER_OK)
  TransferBufferLength = 0000000d
  TransferBuffer       = 0e0b45a0
  TransferBufferMDL    = 071820d0
  UrbLink              = 00000000
  SetupPacket          =
    00000000: 40 01 0b 00 00 00 0d 00
[8091412 ms] UsbSnoop - FilterDispatchAny(0dd57b90) : IRP_MJ_INTERNAL_DEVICE_CONTROL
[8091412 ms] UsbSnoop - FdoHookDispatchInternalIoctl(0dd57f8c) : fdo=0e0d7ab0, Irp=0e1ffb40, IRQL=0
[8091412 ms]  >>>  URB 146 going down  >>> 
-- URB_FUNCTION_VENDOR_DEVICE:
  TransferFlags          = 00000002 (USBD_TRANSFER_DIRECTION_OUT, USBD_SHORT_TRANSFER_OK)
  TransferBufferLength = 0000000d
  TransferBuffer       = 0e0b4548
  TransferBufferMDL    = 00000000
    00000000: 0b 4a a0 00 01 00 ff ff aa 0d 14 78 ce
  UrbLink                 = 00000000
  RequestTypeReservedBits = 00000000
  Request                 = 00000001
  Value                   = 0000000b
  Index                   = 00000000
[8091412 ms] UsbSnoop - MyInternalIOCTLCompletion(0dd57ddc) : fido=00000000, Irp=0e1ffb40, Context=09bd0440, IRQL=2
[8091412 ms]  <<<  URB 146 coming back  <<< 
-- URB_FUNCTION_CONTROL_TRANSFER:
  PipeHandle           = 0d567060
  TransferFlags        = 0000000a (USBD_TRANSFER_DIRECTION_OUT, USBD_SHORT_TRANSFER_OK)
  TransferBufferLength = 0000000d
  TransferBuffer       = 0e0b4548
  TransferBufferMDL    = 071820d0
  UrbLink              = 00000000
  SetupPacket          =
    00000000: 40 01 0b 00 00 00 0d 00
[8091412 ms] UsbSnoop - FilterDispatchAny(0dd57b90) : IRP_MJ_INTERNAL_DEVICE_CONTROL
[8091412 ms] UsbSnoop - FdoHookDispatchInternalIoctl(0dd57f8c) : fdo=0e0d7ab0, Irp=0e1ffb40, IRQL=0
[8091412 ms]  >>>  URB 147 going down  >>> 
-- URB_FUNCTION_VENDOR_DEVICE:
  TransferFlags          = 00000003 (USBD_TRANSFER_DIRECTION_IN, USBD_SHORT_TRANSFER_OK)
  TransferBufferLength = 0000000d
  TransferBuffer       = 0e0b4548
  TransferBufferMDL    = 00000000
  UrbLink                 = 00000000
  RequestTypeReservedBits = 00000000
  Request                 = 00000001
  Value                   = 0000000b
  Index                   = 00000000
[8091413 ms] UsbSnoop - MyInternalIOCTLCompletion(0dd57ddc) : fido=00000000, Irp=0e1ffb40, Context=09bd0440, IRQL=2
[8091413 ms]  <<<  URB 147 coming back  <<< 
-- URB_FUNCTION_CONTROL_TRANSFER:
  PipeHandle           = 0d567060
  TransferFlags        = 0000000b (USBD_TRANSFER_DIRECTION_IN, USBD_SHORT_TRANSFER_OK)
  TransferBufferLength = 0000000d
  TransferBuffer       = 0e0b4548
  TransferBufferMDL    = 071820d0
    00000000: 0b 4a a0 00 01 00 ff ff aa 0d 14 78 ce
  UrbLink              = 00000000
  SetupPacket          =
    00000000: c0 01 0b 00 00 00 0d 00
[8091433 ms] UsbSnoop - FilterDispatchAny(0dd57b90) : IRP_MJ_INTERNAL_DEVICE_CONTROL
[8091433 ms] UsbSnoop - FdoHookDispatchInternalIoctl(0dd57f8c) : fdo=0e0d7ab0, Irp=0d806b40, IRQL=0
[8091433 ms]  >>>  URB 148 going down  >>> 
-- URB_FUNCTION_VENDOR_DEVICE:
  TransferFlags          = 00000002 (USBD_TRANSFER_DIRECTION_OUT, USBD_SHORT_TRANSFER_OK)
  TransferBufferLength = 0000000d
  TransferBuffer       = 0e0b45a0
  TransferBufferMDL    = 00000000
    00000000: 0b 4a 84 00 01 10 00 00 20 00 00 00 00
  UrbLink                 = 00000000
  RequestTypeReservedBits = 00000000
  Request                 = 00000001
  Value                   = 0000000b
  Index                   = 00000000
[8091433 ms] UsbSnoop - MyInternalIOCTLCompletion(0dd57ddc) : fido=00000000, Irp=0d806b40, Context=09bd0440, IRQL=2
[8091433 ms]  <<<  URB 148 coming back  <<< 
-- URB_FUNCTION_CONTROL_TRANSFER:
  PipeHandle           = 0d567060
  TransferFlags        = 0000000a (USBD_TRANSFER_DIRECTION_OUT, USBD_SHORT_TRANSFER_OK)
  TransferBufferLength = 0000000d
  TransferBuffer       = 0e0b45a0
  TransferBufferMDL    = 071820d0
  UrbLink              = 00000000
  SetupPacket          =
    00000000: 40 01 0b 00 00 00 0d 00
[8091443 ms] UsbSnoop - FilterDispatchAny(0dd57b90) : IRP_MJ_INTERNAL_DEVICE_CONTROL
[8091443 ms] UsbSnoop - FdoHookDispatchInternalIoctl(0dd57f8c) : fdo=0e0d7ab0, Irp=075cab40, IRQL=0
[8091443 ms]  >>>  URB 149 going down  >>> 
-- URB_FUNCTION_VENDOR_DEVICE:
  TransferFlags          = 00000002 (USBD_TRANSFER_DIRECTION_OUT, USBD_SHORT_TRANSFER_OK)
  TransferBufferLength = 0000000d
  TransferBuffer       = 0e0b4548
  TransferBufferMDL    = 00000000
    00000000: 0b 4a a0 00 01 00 ff ff a6 c8 18 78 ce
  UrbLink                 = 00000000
  RequestTypeReservedBits = 00000000
  Request                 = 00000001
  Value                   = 0000000b
  Index                   = 00000000
[8091443 ms] UsbSnoop - MyInternalIOCTLCompletion(0dd57ddc) : fido=00000000, Irp=075cab40, Context=09bd0440, IRQL=2
[8091443 ms]  <<<  URB 149 coming back  <<< 
-- URB_FUNCTION_CONTROL_TRANSFER:
  PipeHandle           = 0d567060
  TransferFlags        = 0000000a (USBD_TRANSFER_DIRECTION_OUT, USBD_SHORT_TRANSFER_OK)
  TransferBufferLength = 0000000d
  TransferBuffer       = 0e0b4548
  TransferBufferMDL    = 071820d0
  UrbLink              = 00000000
  SetupPacket          =
    00000000: 40 01 0b 00 00 00 0d 00
[8091443 ms] UsbSnoop - FilterDispatchAny(0dd57b90) : IRP_MJ_INTERNAL_DEVICE_CONTROL
[8091443 ms] UsbSnoop - FdoHookDispatchInternalIoctl(0dd57f8c) : fdo=0e0d7ab0, Irp=0d806b40, IRQL=0
[8091443 ms]  >>>  URB 150 going down  >>> 
-- URB_FUNCTION_VENDOR_DEVICE:
  TransferFlags          = 00000003 (USBD_TRANSFER_DIRECTION_IN, USBD_SHORT_TRANSFER_OK)
  TransferBufferLength = 0000000d
  TransferBuffer       = 0e0b4548
  TransferBufferMDL    = 00000000
  UrbLink                 = 00000000
  RequestTypeReservedBits = 00000000
  Request                 = 00000001
  Value                   = 0000000b
  Index                   = 00000000
[8091444 ms] UsbSnoop - MyInternalIOCTLCompletion(0dd57ddc) : fido=00000000, Irp=0d806b40, Context=09bd0440, IRQL=2
[8091444 ms]  <<<  URB 150 coming back  <<< 
-- URB_FUNCTION_CONTROL_TRANSFER:
  PipeHandle           = 0d567060
  TransferFlags        = 0000000b (USBD_TRANSFER_DIRECTION_IN, USBD_SHORT_TRANSFER_OK)
  TransferBufferLength = 0000000d
  TransferBuffer       = 0e0b4548
  TransferBufferMDL    = 071820d0
    00000000: 0b 4a a0 00 01 40 ff ff a6 c8 18 78 ce
  UrbLink              = 00000000
  SetupPacket          =
    00000000: c0 01 0b 00 00 00 0d 00
[8091454 ms] UsbSnoop - FilterDispatchAny(0dd57b90) : IRP_MJ_INTERNAL_DEVICE_CONTROL
[8091454 ms] UsbSnoop - FdoHookDispatchInternalIoctl(0dd57f8c) : fdo=0e0d7ab0, Irp=0d862b40, IRQL=0
[8091454 ms]  >>>  URB 151 going down  >>> 
-- URB_FUNCTION_VENDOR_DEVICE:
  TransferFlags          = 00000002 (USBD_TRANSFER_DIRECTION_OUT, USBD_SHORT_TRANSFER_OK)
  TransferBufferLength = 0000000d
  TransferBuffer       = 0e0b45a0
  TransferBufferMDL    = 00000000
    00000000: 0b 4a c0 01 01 5a 07 00 20 00 00 00 00
  UrbLink                 = 00000000
  RequestTypeReservedBits = 00000000
  Request                 = 00000001
  Value                   = 0000000b
  Index                   = 00000000
[8091454 ms] UsbSnoop - MyInternalIOCTLCompletion(0dd57ddc) : fido=00000000, Irp=0d862b40, Context=09bd0440, IRQL=2
[8091454 ms]  <<<  URB 151 coming back  <<< 
-- URB_FUNCTION_CONTROL_TRANSFER:
  PipeHandle           = 0d567060
  TransferFlags        = 0000000a (USBD_TRANSFER_DIRECTION_OUT, USBD_SHORT_TRANSFER_OK)
  TransferBufferLength = 0000000d
  TransferBuffer       = 0e0b45a0
  TransferBufferMDL    = 09972170
  UrbLink              = 00000000
  SetupPacket          =
    00000000: 40 01 0b 00 00 00 0d 00
[8091454 ms] UsbSnoop - FilterDispatchAny(0dd57b90) : IRP_MJ_INTERNAL_DEVICE_CONTROL
[8091454 ms] UsbSnoop - FdoHookDispatchInternalIoctl(0dd57f8c) : fdo=0e0d7ab0, Irp=0d806b40, IRQL=0
[8091454 ms]  >>>  URB 152 going down  >>> 
-- URB_FUNCTION_VENDOR_DEVICE:
  TransferFlags          = 00000002 (USBD_TRANSFER_DIRECTION_OUT, USBD_SHORT_TRANSFER_OK)
  TransferBufferLength = 0000000d
  TransferBuffer       = 0e0b45a0
  TransferBufferMDL    = 00000000
    00000000: 0b 4a c0 01 01 59 54 00 20 00 00 00 00
  UrbLink                 = 00000000
  RequestTypeReservedBits = 00000000
  Request                 = 00000001
  Value                   = 0000000b
  Index                   = 00000000
[8091455 ms] UsbSnoop - MyInternalIOCTLCompletion(0dd57ddc) : fido=00000000, Irp=0d806b40, Context=09bd0440, IRQL=2
[8091455 ms]  <<<  URB 152 coming back  <<< 
-- URB_FUNCTION_CONTROL_TRANSFER:
  PipeHandle           = 0d567060
  TransferFlags        = 0000000a (USBD_TRANSFER_DIRECTION_OUT, USBD_SHORT_TRANSFER_OK)
  TransferBufferLength = 0000000d
  TransferBuffer       = 0e0b45a0
  TransferBufferMDL    = 071820d0
  UrbLink              = 00000000
  SetupPacket          =
    00000000: 40 01 0b 00 00 00 0d 00
[8091455 ms] UsbSnoop - FilterDispatchAny(0dd57b90) : IRP_MJ_INTERNAL_DEVICE_CONTROL
[8091455 ms] UsbSnoop - FdoHookDispatchInternalIoctl(0dd57f8c) : fdo=0e0d7ab0, Irp=0d806b40, IRQL=0
[8091455 ms]  >>>  URB 153 going down  >>> 
-- URB_FUNCTION_VENDOR_DEVICE:
  TransferFlags          = 00000002 (USBD_TRANSFER_DIRECTION_OUT, USBD_SHORT_TRANSFER_OK)
  TransferBufferLength = 0000000d
  TransferBuffer       = 0e0b45a0
  TransferBufferMDL    = 00000000
    00000000: 0b 4a c0 01 01 5b 83 00 20 00 00 00 00
  UrbLink                 = 00000000
  RequestTypeReservedBits = 00000000
  Request                 = 00000001
  Value                   = 0000000b
  Index                   = 00000000
[8091456 ms] UsbSnoop - MyInternalIOCTLCompletion(0dd57ddc) : fido=00000000, Irp=0d806b40, Context=09bd0440, IRQL=2
[8091456 ms]  <<<  URB 153 coming back  <<< 
-- URB_FUNCTION_CONTROL_TRANSFER:
  PipeHandle           = 0d567060
  TransferFlags        = 0000000a (USBD_TRANSFER_DIRECTION_OUT, USBD_SHORT_TRANSFER_OK)
  TransferBufferLength = 0000000d
  TransferBuffer       = 0e0b45a0
  TransferBufferMDL    = 071820d0
  UrbLink              = 00000000
  SetupPacket          =
    00000000: 40 01 0b 00 00 00 0d 00
[8091456 ms] UsbSnoop - FilterDispatchAny(0dd57b90) : IRP_MJ_INTERNAL_DEVICE_CONTROL
[8091456 ms] UsbSnoop - FdoHookDispatchInternalIoctl(0dd57f8c) : fdo=0e0d7ab0, Irp=0d806b40, IRQL=0
[8091456 ms]  >>>  URB 154 going down  >>> 
-- URB_FUNCTION_VENDOR_DEVICE:
  TransferFlags          = 00000002 (USBD_TRANSFER_DIRECTION_OUT, USBD_SHORT_TRANSFER_OK)
  TransferBufferLength = 0000000d
  TransferBuffer       = 0e0b45a0
  TransferBufferMDL    = 00000000
    00000000: 0b 4a c0 01 01 10 48 00 20 00 00 00 00
  UrbLink                 = 00000000
  RequestTypeReservedBits = 00000000
  Request                 = 00000001
  Value                   = 0000000b
  Index                   = 00000000
[8091457 ms] UsbSnoop - MyInternalIOCTLCompletion(0dd57ddc) : fido=00000000, Irp=0d806b40, Context=09bd0440, IRQL=2
[8091457 ms]  <<<  URB 154 coming back  <<< 
-- URB_FUNCTION_CONTROL_TRANSFER:
  PipeHandle           = 0d567060
  TransferFlags        = 0000000a (USBD_TRANSFER_DIRECTION_OUT, USBD_SHORT_TRANSFER_OK)
  TransferBufferLength = 0000000d
  TransferBuffer       = 0e0b45a0
  TransferBufferMDL    = 071820d0
  UrbLink              = 00000000
  SetupPacket          =
    00000000: 40 01 0b 00 00 00 0d 00
[8091458 ms] UsbSnoop - FilterDispatchAny(0dd57b90) : IRP_MJ_INTERNAL_DEVICE_CONTROL
[8091458 ms] UsbSnoop - FdoHookDispatchInternalIoctl(0dd57f8c) : fdo=0e0d7ab0, Irp=0e1ffb40, IRQL=0
[8091458 ms]  >>>  URB 155 going down  >>> 
-- URB_FUNCTION_VENDOR_DEVICE:
  TransferFlags          = 00000002 (USBD_TRANSFER_DIRECTION_OUT, USBD_SHORT_TRANSFER_OK)
  TransferBufferLength = 0000000d
  TransferBuffer       = 0e0b45a0
  TransferBufferMDL    = 00000000
    00000000: 0b 4a c0 01 01 41 77 00 20 00 00 00 00
  UrbLink                 = 00000000
  RequestTypeReservedBits = 00000000
  Request                 = 00000001
  Value                   = 0000000b
  Index                   = 00000000
[8091458 ms] UsbSnoop - MyInternalIOCTLCompletion(0dd57ddc) : fido=00000000, Irp=0e1ffb40, Context=09bd0440, IRQL=2
[8091458 ms]  <<<  URB 155 coming back  <<< 
-- URB_FUNCTION_CONTROL_TRANSFER:
  PipeHandle           = 0d567060
  TransferFlags        = 0000000a (USBD_TRANSFER_DIRECTION_OUT, USBD_SHORT_TRANSFER_OK)
  TransferBufferLength = 0000000d
  TransferBuffer       = 0e0b45a0
  TransferBufferMDL    = 071820d0
  UrbLink              = 00000000
  SetupPacket          =
    00000000: 40 01 0b 00 00 00 0d 00
[8091459 ms] UsbSnoop - FilterDispatchAny(0dd57b90) : IRP_MJ_INTERNAL_DEVICE_CONTROL
[8091459 ms] UsbSnoop - FdoHookDispatchInternalIoctl(0dd57f8c) : fdo=0e0d7ab0, Irp=0d806b40, IRQL=0
[8091459 ms]  >>>  URB 156 going down  >>> 
-- URB_FUNCTION_VENDOR_DEVICE:
  TransferFlags          = 00000002 (USBD_TRANSFER_DIRECTION_OUT, USBD_SHORT_TRANSFER_OK)
  TransferBufferLength = 0000000d
  TransferBuffer       = 0e0b45a0
  TransferBufferMDL    = 00000000
    00000000: 0b 4a c0 01 01 42 77 00 20 00 00 00 00
  UrbLink                 = 00000000
  RequestTypeReservedBits = 00000000
  Request                 = 00000001
  Value                   = 0000000b
  Index                   = 00000000
[8091459 ms] UsbSnoop - MyInternalIOCTLCompletion(0dd57ddc) : fido=00000000, Irp=0d806b40, Context=09bd0440, IRQL=2
[8091459 ms]  <<<  URB 156 coming back  <<< 
-- URB_FUNCTION_CONTROL_TRANSFER:
  PipeHandle           = 0d567060
  TransferFlags        = 0000000a (USBD_TRANSFER_DIRECTION_OUT, USBD_SHORT_TRANSFER_OK)
  TransferBufferLength = 0000000d
  TransferBuffer       = 0e0b45a0
  TransferBufferMDL    = 071820d0
  UrbLink              = 00000000
  SetupPacket          =
    00000000: 40 01 0b 00 00 00 0d 00
[8091460 ms] UsbSnoop - FilterDispatchAny(0dd57b90) : IRP_MJ_INTERNAL_DEVICE_CONTROL
[8091460 ms] UsbSnoop - FdoHookDispatchInternalIoctl(0dd57f8c) : fdo=0e0d7ab0, Irp=075cab40, IRQL=0
[8091460 ms]  >>>  URB 157 going down  >>> 
-- URB_FUNCTION_VENDOR_DEVICE:
  TransferFlags          = 00000002 (USBD_TRANSFER_DIRECTION_OUT, USBD_SHORT_TRANSFER_OK)
  TransferBufferLength = 0000000d
  TransferBuffer       = 0e0b45a0
  TransferBufferMDL    = 00000000
    00000000: 0b 4a c0 01 01 43 77 00 20 00 00 00 00
  UrbLink                 = 00000000
  RequestTypeReservedBits = 00000000
  Request                 = 00000001
  Value                   = 0000000b
  Index                   = 00000000
[8091460 ms] UsbSnoop - MyInternalIOCTLCompletion(0dd57ddc) : fido=00000000, Irp=075cab40, Context=09bd0440, IRQL=2
[8091460 ms]  <<<  URB 157 coming back  <<< 
-- URB_FUNCTION_CONTROL_TRANSFER:
  PipeHandle           = 0d567060
  TransferFlags        = 0000000a (USBD_TRANSFER_DIRECTION_OUT, USBD_SHORT_TRANSFER_OK)
  TransferBufferLength = 0000000d
  TransferBuffer       = 0e0b45a0
  TransferBufferMDL    = 071820d0
  UrbLink              = 00000000
  SetupPacket          =
    00000000: 40 01 0b 00 00 00 0d 00
[8091461 ms] UsbSnoop - FilterDispatchAny(0dd57b90) : IRP_MJ_INTERNAL_DEVICE_CONTROL
[8091461 ms] UsbSnoop - FdoHookDispatchInternalIoctl(0dd57f8c) : fdo=0e0d7ab0, Irp=075cab40, IRQL=0
[8091461 ms]  >>>  URB 158 going down  >>> 
-- URB_FUNCTION_VENDOR_DEVICE:
  TransferFlags          = 00000002 (USBD_TRANSFER_DIRECTION_OUT, USBD_SHORT_TRANSFER_OK)
  TransferBufferLength = 0000000d
  TransferBuffer       = 0e0b45a0
  TransferBufferMDL    = 00000000
    00000000: 0b 4a c0 01 01 44 77 00 20 00 00 00 00
  UrbLink                 = 00000000
  RequestTypeReservedBits = 00000000
  Request                 = 00000001
  Value                   = 0000000b
  Index                   = 00000000
[8091461 ms] UsbSnoop - MyInternalIOCTLCompletion(0dd57ddc) : fido=00000000, Irp=075cab40, Context=09bd0440, IRQL=2
[8091461 ms]  <<<  URB 158 coming back  <<< 
-- URB_FUNCTION_CONTROL_TRANSFER:
  PipeHandle           = 0d567060
  TransferFlags        = 0000000a (USBD_TRANSFER_DIRECTION_OUT, USBD_SHORT_TRANSFER_OK)
  TransferBufferLength = 0000000d
  TransferBuffer       = 0e0b45a0
  TransferBufferMDL    = 071820d0
  UrbLink              = 00000000
  SetupPacket          =
    00000000: 40 01 0b 00 00 00 0d 00
[8091462 ms] UsbSnoop - FilterDispatchAny(0dd57b90) : IRP_MJ_INTERNAL_DEVICE_CONTROL
[8091462 ms] UsbSnoop - FdoHookDispatchInternalIoctl(0dd57f8c) : fdo=0e0d7ab0, Irp=075cab40, IRQL=0
[8091462 ms]  >>>  URB 159 going down  >>> 
-- URB_FUNCTION_VENDOR_DEVICE:
  TransferFlags          = 00000002 (USBD_TRANSFER_DIRECTION_OUT, USBD_SHORT_TRANSFER_OK)
  TransferBufferLength = 0000000d
  TransferBuffer       = 0e0b45a0
  TransferBufferMDL    = 00000000
    00000000: 0b 4a c0 01 01 45 77 00 20 00 00 00 00
  UrbLink                 = 00000000
  RequestTypeReservedBits = 00000000
  Request                 = 00000001
  Value                   = 0000000b
  Index                   = 00000000
[8091462 ms] UsbSnoop - MyInternalIOCTLCompletion(0dd57ddc) : fido=00000000, Irp=075cab40, Context=09bd0440, IRQL=2
[8091462 ms]  <<<  URB 159 coming back  <<< 
-- URB_FUNCTION_CONTROL_TRANSFER:
  PipeHandle           = 0d567060
  TransferFlags        = 0000000a (USBD_TRANSFER_DIRECTION_OUT, USBD_SHORT_TRANSFER_OK)
  TransferBufferLength = 0000000d
  TransferBuffer       = 0e0b45a0
  TransferBufferMDL    = 071820d0
  UrbLink              = 00000000
  SetupPacket          =
    00000000: 40 01 0b 00 00 00 0d 00
[8091463 ms] UsbSnoop - FilterDispatchAny(0dd57b90) : IRP_MJ_INTERNAL_DEVICE_CONTROL
[8091463 ms] UsbSnoop - FdoHookDispatchInternalIoctl(0dd57f8c) : fdo=0e0d7ab0, Irp=075cab40, IRQL=0
[8091463 ms]  >>>  URB 160 going down  >>> 
-- URB_FUNCTION_VENDOR_DEVICE:
  TransferFlags          = 00000002 (USBD_TRANSFER_DIRECTION_OUT, USBD_SHORT_TRANSFER_OK)
  TransferBufferLength = 0000000d
  TransferBuffer       = 0e0b45a0
  TransferBufferMDL    = 00000000
    00000000: 0b 4a c0 01 01 46 77 00 20 00 00 00 00
  UrbLink                 = 00000000
  RequestTypeReservedBits = 00000000
  Request                 = 00000001
  Value                   = 0000000b
  Index                   = 00000000
[8091463 ms] UsbSnoop - MyInternalIOCTLCompletion(0dd57ddc) : fido=00000000, Irp=075cab40, Context=09bd0440, IRQL=2
[8091463 ms]  <<<  URB 160 coming back  <<< 
-- URB_FUNCTION_CONTROL_TRANSFER:
  PipeHandle           = 0d567060
  TransferFlags        = 0000000a (USBD_TRANSFER_DIRECTION_OUT, USBD_SHORT_TRANSFER_OK)
  TransferBufferLength = 0000000d
  TransferBuffer       = 0e0b45a0
  TransferBufferMDL    = 071820d0
  UrbLink              = 00000000
  SetupPacket          =
    00000000: 40 01 0b 00 00 00 0d 00
[8091464 ms] UsbSnoop - FilterDispatchAny(0dd57b90) : IRP_MJ_INTERNAL_DEVICE_CONTROL
[8091464 ms] UsbSnoop - FdoHookDispatchInternalIoctl(0dd57f8c) : fdo=0e0d7ab0, Irp=075cab40, IRQL=0
[8091464 ms]  >>>  URB 161 going down  >>> 
-- URB_FUNCTION_VENDOR_DEVICE:
  TransferFlags          = 00000002 (USBD_TRANSFER_DIRECTION_OUT, USBD_SHORT_TRANSFER_OK)
  TransferBufferLength = 0000000d
  TransferBuffer       = 0e0b45a0
  TransferBufferMDL    = 00000000
    00000000: 0b 4a c0 01 01 47 77 00 20 00 00 00 00
  UrbLink                 = 00000000
  RequestTypeReservedBits = 00000000
  Request                 = 00000001
  Value                   = 0000000b
  Index                   = 00000000
[8091464 ms] UsbSnoop - MyInternalIOCTLCompletion(0dd57ddc) : fido=00000000, Irp=075cab40, Context=09bd0440, IRQL=2
[8091464 ms]  <<<  URB 161 coming back  <<< 
-- URB_FUNCTION_CONTROL_TRANSFER:
  PipeHandle           = 0d567060
  TransferFlags        = 0000000a (USBD_TRANSFER_DIRECTION_OUT, USBD_SHORT_TRANSFER_OK)
  TransferBufferLength = 0000000d
  TransferBuffer       = 0e0b45a0
  TransferBufferMDL    = 071820d0
  UrbLink              = 00000000
  SetupPacket          =
    00000000: 40 01 0b 00 00 00 0d 00
[8091465 ms] UsbSnoop - FilterDispatchAny(0dd57b90) : IRP_MJ_INTERNAL_DEVICE_CONTROL
[8091465 ms] UsbSnoop - FdoHookDispatchInternalIoctl(0dd57f8c) : fdo=0e0d7ab0, Irp=0d95c010, IRQL=0
[8091465 ms]  >>>  URB 162 going down  >>> 
-- URB_FUNCTION_VENDOR_DEVICE:
  TransferFlags          = 00000002 (USBD_TRANSFER_DIRECTION_OUT, USBD_SHORT_TRANSFER_OK)
  TransferBufferLength = 0000000d
  TransferBuffer       = 0e0b45a0
  TransferBufferMDL    = 00000000
    00000000: 0b 4a c0 01 01 48 77 00 20 00 00 00 00
  UrbLink                 = 00000000
  RequestTypeReservedBits = 00000000
  Request                 = 00000001
  Value                   = 0000000b
  Index                   = 00000000
[8091465 ms] UsbSnoop - MyInternalIOCTLCompletion(0dd57ddc) : fido=00000000, Irp=0d95c010, Context=09bd0440, IRQL=2
[8091465 ms]  <<<  URB 162 coming back  <<< 
-- URB_FUNCTION_CONTROL_TRANSFER:
  PipeHandle           = 0d567060
  TransferFlags        = 0000000a (USBD_TRANSFER_DIRECTION_OUT, USBD_SHORT_TRANSFER_OK)
  TransferBufferLength = 0000000d
  TransferBuffer       = 0e0b45a0
  TransferBufferMDL    = 071820d0
  UrbLink              = 00000000
  SetupPacket          =
    00000000: 40 01 0b 00 00 00 0d 00
[8091466 ms] UsbSnoop - FilterDispatchAny(0dd57b90) : IRP_MJ_INTERNAL_DEVICE_CONTROL
[8091466 ms] UsbSnoop - FdoHookDispatchInternalIoctl(0dd57f8c) : fdo=0e0d7ab0, Irp=0d95c010, IRQL=0
[8091466 ms]  >>>  URB 163 going down  >>> 
-- URB_FUNCTION_VENDOR_DEVICE:
  TransferFlags          = 00000002 (USBD_TRANSFER_DIRECTION_OUT, USBD_SHORT_TRANSFER_OK)
  TransferBufferLength = 0000000d
  TransferBuffer       = 0e0b45a0
  TransferBufferMDL    = 00000000
    00000000: 0b 4a c0 01 01 49 77 00 20 00 00 00 00
  UrbLink                 = 00000000
  RequestTypeReservedBits = 00000000
  Request                 = 00000001
  Value                   = 0000000b
  Index                   = 00000000
[8091466 ms] UsbSnoop - MyInternalIOCTLCompletion(0dd57ddc) : fido=00000000, Irp=0d95c010, Context=09bd0440, IRQL=2
[8091466 ms]  <<<  URB 163 coming back  <<< 
-- URB_FUNCTION_CONTROL_TRANSFER:
  PipeHandle           = 0d567060
  TransferFlags        = 0000000a (USBD_TRANSFER_DIRECTION_OUT, USBD_SHORT_TRANSFER_OK)
  TransferBufferLength = 0000000d
  TransferBuffer       = 0e0b45a0
  TransferBufferMDL    = 071820d0
  UrbLink              = 00000000
  SetupPacket          =
    00000000: 40 01 0b 00 00 00 0d 00
[8091467 ms] UsbSnoop - FilterDispatchAny(0dd57b90) : IRP_MJ_INTERNAL_DEVICE_CONTROL
[8091467 ms] UsbSnoop - FdoHookDispatchInternalIoctl(0dd57f8c) : fdo=0e0d7ab0, Irp=075cab40, IRQL=0
[8091467 ms]  >>>  URB 164 going down  >>> 
-- URB_FUNCTION_VENDOR_DEVICE:
  TransferFlags          = 00000002 (USBD_TRANSFER_DIRECTION_OUT, USBD_SHORT_TRANSFER_OK)
  TransferBufferLength = 0000000d
  TransferBuffer       = 0e0b45a0
  TransferBufferMDL    = 00000000
    00000000: 0b 4a c0 01 01 4a 77 00 20 00 00 00 00
  UrbLink                 = 00000000
  RequestTypeReservedBits = 00000000
  Request                 = 00000001
  Value                   = 0000000b
  Index                   = 00000000
[8091467 ms] UsbSnoop - MyInternalIOCTLCompletion(0dd57ddc) : fido=00000000, Irp=075cab40, Context=09bd0440, IRQL=2
[8091467 ms]  <<<  URB 164 coming back  <<< 
-- URB_FUNCTION_CONTROL_TRANSFER:
  PipeHandle           = 0d567060
  TransferFlags        = 0000000a (USBD_TRANSFER_DIRECTION_OUT, USBD_SHORT_TRANSFER_OK)
  TransferBufferLength = 0000000d
  TransferBuffer       = 0e0b45a0
  TransferBufferMDL    = 071820d0
  UrbLink              = 00000000
  SetupPacket          =
    00000000: 40 01 0b 00 00 00 0d 00
[8091468 ms] UsbSnoop - FilterDispatchAny(0dd57b90) : IRP_MJ_INTERNAL_DEVICE_CONTROL
[8091468 ms] UsbSnoop - FdoHookDispatchInternalIoctl(0dd57f8c) : fdo=0e0d7ab0, Irp=075cab40, IRQL=0
[8091468 ms]  >>>  URB 165 going down  >>> 
-- URB_FUNCTION_VENDOR_DEVICE:
  TransferFlags          = 00000002 (USBD_TRANSFER_DIRECTION_OUT, USBD_SHORT_TRANSFER_OK)
  TransferBufferLength = 0000000d
  TransferBuffer       = 0e0b45a0
  TransferBufferMDL    = 00000000
    00000000: 0b 4a c0 01 01 4b 77 00 20 00 00 00 00
  UrbLink                 = 00000000
  RequestTypeReservedBits = 00000000
  Request                 = 00000001
  Value                   = 0000000b
  Index                   = 00000000
[8091468 ms] UsbSnoop - MyInternalIOCTLCompletion(0dd57ddc) : fido=00000000, Irp=075cab40, Context=09bd0440, IRQL=2
[8091468 ms]  <<<  URB 165 coming back  <<< 
-- URB_FUNCTION_CONTROL_TRANSFER:
  PipeHandle           = 0d567060
  TransferFlags        = 0000000a (USBD_TRANSFER_DIRECTION_OUT, USBD_SHORT_TRANSFER_OK)
  TransferBufferLength = 0000000d
  TransferBuffer       = 0e0b45a0
  TransferBufferMDL    = 071820d0
  UrbLink              = 00000000
  SetupPacket          =
    00000000: 40 01 0b 00 00 00 0d 00
[8091469 ms] UsbSnoop - FilterDispatchAny(0dd57b90) : IRP_MJ_INTERNAL_DEVICE_CONTROL
[8091469 ms] UsbSnoop - FdoHookDispatchInternalIoctl(0dd57f8c) : fdo=0e0d7ab0, Irp=075cab40, IRQL=0
[8091469 ms]  >>>  URB 166 going down  >>> 
-- URB_FUNCTION_VENDOR_DEVICE:
  TransferFlags          = 00000002 (USBD_TRANSFER_DIRECTION_OUT, USBD_SHORT_TRANSFER_OK)
  TransferBufferLength = 0000000d
  TransferBuffer       = 0e0b45a0
  TransferBufferMDL    = 00000000
    00000000: 0b 4a c0 01 01 4c 77 00 20 00 00 00 00
  UrbLink                 = 00000000
  RequestTypeReservedBits = 00000000
  Request                 = 00000001
  Value                   = 0000000b
  Index                   = 00000000
[8091469 ms] UsbSnoop - MyInternalIOCTLCompletion(0dd57ddc) : fido=00000000, Irp=075cab40, Context=09bd0440, IRQL=2
[8091469 ms]  <<<  URB 166 coming back  <<< 
-- URB_FUNCTION_CONTROL_TRANSFER:
  PipeHandle           = 0d567060
  TransferFlags        = 0000000a (USBD_TRANSFER_DIRECTION_OUT, USBD_SHORT_TRANSFER_OK)
  TransferBufferLength = 0000000d
  TransferBuffer       = 0e0b45a0
  TransferBufferMDL    = 071820d0
  UrbLink              = 00000000
  SetupPacket          =
    00000000: 40 01 0b 00 00 00 0d 00
[8091470 ms] UsbSnoop - FilterDispatchAny(0dd57b90) : IRP_MJ_INTERNAL_DEVICE_CONTROL
[8091470 ms] UsbSnoop - FdoHookDispatchInternalIoctl(0dd57f8c) : fdo=0e0d7ab0, Irp=075cab40, IRQL=0
[8091470 ms]  >>>  URB 167 going down  >>> 
-- URB_FUNCTION_VENDOR_DEVICE:
  TransferFlags          = 00000002 (USBD_TRANSFER_DIRECTION_OUT, USBD_SHORT_TRANSFER_OK)
  TransferBufferLength = 0000000d
  TransferBuffer       = 0e0b45a0
  TransferBufferMDL    = 00000000
    00000000: 0b 4a c0 01 01 4d 77 00 20 00 00 00 00
  UrbLink                 = 00000000
  RequestTypeReservedBits = 00000000
  Request                 = 00000001
  Value                   = 0000000b
  Index                   = 00000000
[8091470 ms] UsbSnoop - MyInternalIOCTLCompletion(0dd57ddc) : fido=00000000, Irp=075cab40, Context=09bd0440, IRQL=2
[8091470 ms]  <<<  URB 167 coming back  <<< 
-- URB_FUNCTION_CONTROL_TRANSFER:
  PipeHandle           = 0d567060
  TransferFlags        = 0000000a (USBD_TRANSFER_DIRECTION_OUT, USBD_SHORT_TRANSFER_OK)
  TransferBufferLength = 0000000d
  TransferBuffer       = 0e0b45a0
  TransferBufferMDL    = 071820d0
  UrbLink              = 00000000
  SetupPacket          =
    00000000: 40 01 0b 00 00 00 0d 00
[8091471 ms] UsbSnoop - FilterDispatchAny(0dd57b90) : IRP_MJ_INTERNAL_DEVICE_CONTROL
[8091471 ms] UsbSnoop - FdoHookDispatchInternalIoctl(0dd57f8c) : fdo=0e0d7ab0, Irp=075cab40, IRQL=0
[8091471 ms]  >>>  URB 168 going down  >>> 
-- URB_FUNCTION_VENDOR_DEVICE:
  TransferFlags          = 00000002 (USBD_TRANSFER_DIRECTION_OUT, USBD_SHORT_TRANSFER_OK)
  TransferBufferLength = 0000000d
  TransferBuffer       = 0e0b45a0
  TransferBufferMDL    = 00000000
    00000000: 0b 4a c0 01 01 4e 77 00 20 00 00 00 00
  UrbLink                 = 00000000
  RequestTypeReservedBits = 00000000
  Request                 = 00000001
  Value                   = 0000000b
  Index                   = 00000000
[8091471 ms] UsbSnoop - MyInternalIOCTLCompletion(0dd57ddc) : fido=00000000, Irp=075cab40, Context=09bd0440, IRQL=2
[8091471 ms]  <<<  URB 168 coming back  <<< 
-- URB_FUNCTION_CONTROL_TRANSFER:
  PipeHandle           = 0d567060
  TransferFlags        = 0000000a (USBD_TRANSFER_DIRECTION_OUT, USBD_SHORT_TRANSFER_OK)
  TransferBufferLength = 0000000d
  TransferBuffer       = 0e0b45a0
  TransferBufferMDL    = 071820d0
  UrbLink              = 00000000
  SetupPacket          =
    00000000: 40 01 0b 00 00 00 0d 00
[8091472 ms] UsbSnoop - FilterDispatchAny(0dd57b90) : IRP_MJ_INTERNAL_DEVICE_CONTROL
[8091472 ms] UsbSnoop - FdoHookDispatchInternalIoctl(0dd57f8c) : fdo=0e0d7ab0, Irp=0d806b40, IRQL=0
[8091472 ms]  >>>  URB 169 going down  >>> 
-- URB_FUNCTION_VENDOR_DEVICE:
  TransferFlags          = 00000002 (USBD_TRANSFER_DIRECTION_OUT, USBD_SHORT_TRANSFER_OK)
  TransferBufferLength = 0000000d
  TransferBuffer       = 0e0b45a0
  TransferBufferMDL    = 00000000
    00000000: 0b 4a c0 01 01 4f 77 00 20 00 00 00 00
  UrbLink                 = 00000000
  RequestTypeReservedBits = 00000000
  Request                 = 00000001
  Value                   = 0000000b
  Index                   = 00000000
[8091472 ms] UsbSnoop - MyInternalIOCTLCompletion(0dd57ddc) : fido=00000000, Irp=0d806b40, Context=09bd0440, IRQL=2
[8091472 ms]  <<<  URB 169 coming back  <<< 
-- URB_FUNCTION_CONTROL_TRANSFER:
  PipeHandle           = 0d567060
  TransferFlags        = 0000000a (USBD_TRANSFER_DIRECTION_OUT, USBD_SHORT_TRANSFER_OK)
  TransferBufferLength = 0000000d
  TransferBuffer       = 0e0b45a0
  TransferBufferMDL    = 071820d0
  UrbLink              = 00000000
  SetupPacket          =
    00000000: 40 01 0b 00 00 00 0d 00
[8091473 ms] UsbSnoop - FilterDispatchAny(0dd57b90) : IRP_MJ_INTERNAL_DEVICE_CONTROL
[8091473 ms] UsbSnoop - FdoHookDispatchInternalIoctl(0dd57f8c) : fdo=0e0d7ab0, Irp=0d806b40, IRQL=0
[8091473 ms]  >>>  URB 170 going down  >>> 
-- URB_FUNCTION_VENDOR_DEVICE:
  TransferFlags          = 00000002 (USBD_TRANSFER_DIRECTION_OUT, USBD_SHORT_TRANSFER_OK)
  TransferBufferLength = 0000000d
  TransferBuffer       = 0e0b45a0
  TransferBufferMDL    = 00000000
    00000000: 0b 4a c0 01 01 50 77 00 20 00 00 00 00
  UrbLink                 = 00000000
  RequestTypeReservedBits = 00000000
  Request                 = 00000001
  Value                   = 0000000b
  Index                   = 00000000
[8091473 ms] UsbSnoop - MyInternalIOCTLCompletion(0dd57ddc) : fido=00000000, Irp=0d806b40, Context=09bd0440, IRQL=2
[8091473 ms]  <<<  URB 170 coming back  <<< 
-- URB_FUNCTION_CONTROL_TRANSFER:
  PipeHandle           = 0d567060
  TransferFlags        = 0000000a (USBD_TRANSFER_DIRECTION_OUT, USBD_SHORT_TRANSFER_OK)
  TransferBufferLength = 0000000d
  TransferBuffer       = 0e0b45a0
  TransferBufferMDL    = 071820d0
  UrbLink              = 00000000
  SetupPacket          =
    00000000: 40 01 0b 00 00 00 0d 00
[8091474 ms] UsbSnoop - FilterDispatchAny(0dd57b90) : IRP_MJ_INTERNAL_DEVICE_CONTROL
[8091474 ms] UsbSnoop - FdoHookDispatchInternalIoctl(0dd57f8c) : fdo=0e0d7ab0, Irp=0d806b40, IRQL=0
[8091474 ms]  >>>  URB 171 going down  >>> 
-- URB_FUNCTION_VENDOR_DEVICE:
  TransferFlags          = 00000002 (USBD_TRANSFER_DIRECTION_OUT, USBD_SHORT_TRANSFER_OK)
  TransferBufferLength = 0000000d
  TransferBuffer       = 0e0b45a0
  TransferBufferMDL    = 00000000
    00000000: 0b 4a c0 01 01 51 77 00 20 00 00 00 00
  UrbLink                 = 00000000
  RequestTypeReservedBits = 00000000
  Request                 = 00000001
  Value                   = 0000000b
  Index                   = 00000000
[8091474 ms] UsbSnoop - MyInternalIOCTLCompletion(0dd57ddc) : fido=00000000, Irp=0d806b40, Context=09bd0440, IRQL=2
[8091474 ms]  <<<  URB 171 coming back  <<< 
-- URB_FUNCTION_CONTROL_TRANSFER:
  PipeHandle           = 0d567060
  TransferFlags        = 0000000a (USBD_TRANSFER_DIRECTION_OUT, USBD_SHORT_TRANSFER_OK)
  TransferBufferLength = 0000000d
  TransferBuffer       = 0e0b45a0
  TransferBufferMDL    = 071820d0
  UrbLink              = 00000000
  SetupPacket          =
    00000000: 40 01 0b 00 00 00 0d 00
[8091475 ms] UsbSnoop - FilterDispatchAny(0dd57b90) : IRP_MJ_INTERNAL_DEVICE_CONTROL
[8091475 ms] UsbSnoop - FdoHookDispatchInternalIoctl(0dd57f8c) : fdo=0e0d7ab0, Irp=0d806b40, IRQL=0
[8091475 ms]  >>>  URB 172 going down  >>> 
-- URB_FUNCTION_VENDOR_DEVICE:
  TransferFlags          = 00000002 (USBD_TRANSFER_DIRECTION_OUT, USBD_SHORT_TRANSFER_OK)
  TransferBufferLength = 0000000d
  TransferBuffer       = 0e0b45a0
  TransferBufferMDL    = 00000000
    00000000: 0b 4a c0 01 01 52 77 00 20 00 00 00 00
  UrbLink                 = 00000000
  RequestTypeReservedBits = 00000000
  Request                 = 00000001
  Value                   = 0000000b
  Index                   = 00000000
[8091475 ms] UsbSnoop - MyInternalIOCTLCompletion(0dd57ddc) : fido=00000000, Irp=0d806b40, Context=09bd0440, IRQL=2
[8091475 ms]  <<<  URB 172 coming back  <<< 
-- URB_FUNCTION_CONTROL_TRANSFER:
  PipeHandle           = 0d567060
  TransferFlags        = 0000000a (USBD_TRANSFER_DIRECTION_OUT, USBD_SHORT_TRANSFER_OK)
  TransferBufferLength = 0000000d
  TransferBuffer       = 0e0b45a0
  TransferBufferMDL    = 071820d0
  UrbLink              = 00000000
  SetupPacket          =
    00000000: 40 01 0b 00 00 00 0d 00
[8091476 ms] UsbSnoop - FilterDispatchAny(0dd57b90) : IRP_MJ_INTERNAL_DEVICE_CONTROL
[8091476 ms] UsbSnoop - FdoHookDispatchInternalIoctl(0dd57f8c) : fdo=0e0d7ab0, Irp=0d806b40, IRQL=0
[8091476 ms]  >>>  URB 173 going down  >>> 
-- URB_FUNCTION_VENDOR_DEVICE:
  TransferFlags          = 00000002 (USBD_TRANSFER_DIRECTION_OUT, USBD_SHORT_TRANSFER_OK)
  TransferBufferLength = 0000000d
  TransferBuffer       = 0e0b45a0
  TransferBufferMDL    = 00000000
    00000000: 0b 4a c0 01 01 53 77 00 20 00 00 00 00
  UrbLink                 = 00000000
  RequestTypeReservedBits = 00000000
  Request                 = 00000001
  Value                   = 0000000b
  Index                   = 00000000
[8091476 ms] UsbSnoop - MyInternalIOCTLCompletion(0dd57ddc) : fido=00000000, Irp=0d806b40, Context=09bd0440, IRQL=2
[8091476 ms]  <<<  URB 173 coming back  <<< 
-- URB_FUNCTION_CONTROL_TRANSFER:
  PipeHandle           = 0d567060
  TransferFlags        = 0000000a (USBD_TRANSFER_DIRECTION_OUT, USBD_SHORT_TRANSFER_OK)
  TransferBufferLength = 0000000d
  TransferBuffer       = 0e0b45a0
  TransferBufferMDL    = 071820d0
  UrbLink              = 00000000
  SetupPacket          =
    00000000: 40 01 0b 00 00 00 0d 00
[8091477 ms] UsbSnoop - FilterDispatchAny(0dd57b90) : IRP_MJ_INTERNAL_DEVICE_CONTROL
[8091477 ms] UsbSnoop - FdoHookDispatchInternalIoctl(0dd57f8c) : fdo=0e0d7ab0, Irp=0d806b40, IRQL=0
[8091477 ms]  >>>  URB 174 going down  >>> 
-- URB_FUNCTION_VENDOR_DEVICE:
  TransferFlags          = 00000002 (USBD_TRANSFER_DIRECTION_OUT, USBD_SHORT_TRANSFER_OK)
  TransferBufferLength = 0000000d
  TransferBuffer       = 0e0b45a0
  TransferBufferMDL    = 00000000
    00000000: 0b 4a c0 01 01 54 77 00 20 00 00 00 00
  UrbLink                 = 00000000
  RequestTypeReservedBits = 00000000
  Request                 = 00000001
  Value                   = 0000000b
  Index                   = 00000000
[8091477 ms] UsbSnoop - MyInternalIOCTLCompletion(0dd57ddc) : fido=00000000, Irp=0d806b40, Context=09bd0440, IRQL=2
[8091477 ms]  <<<  URB 174 coming back  <<< 
-- URB_FUNCTION_CONTROL_TRANSFER:
  PipeHandle           = 0d567060
  TransferFlags        = 0000000a (USBD_TRANSFER_DIRECTION_OUT, USBD_SHORT_TRANSFER_OK)
  TransferBufferLength = 0000000d
  TransferBuffer       = 0e0b45a0
  TransferBufferMDL    = 071820d0
  UrbLink              = 00000000
  SetupPacket          =
    00000000: 40 01 0b 00 00 00 0d 00
[8091478 ms] UsbSnoop - FilterDispatchAny(0dd57b90) : IRP_MJ_INTERNAL_DEVICE_CONTROL
[8091478 ms] UsbSnoop - FdoHookDispatchInternalIoctl(0dd57f8c) : fdo=0e0d7ab0, Irp=0d806b40, IRQL=0
[8091478 ms]  >>>  URB 175 going down  >>> 
-- URB_FUNCTION_VENDOR_DEVICE:
  TransferFlags          = 00000002 (USBD_TRANSFER_DIRECTION_OUT, USBD_SHORT_TRANSFER_OK)
  TransferBufferLength = 0000000d
  TransferBuffer       = 0e0b45a0
  TransferBufferMDL    = 00000000
    00000000: 0b 4a c0 01 01 55 77 00 20 00 00 00 00
  UrbLink                 = 00000000
  RequestTypeReservedBits = 00000000
  Request                 = 00000001
  Value                   = 0000000b
  Index                   = 00000000
[8091478 ms] UsbSnoop - MyInternalIOCTLCompletion(0dd57ddc) : fido=00000000, Irp=0d806b40, Context=09bd0440, IRQL=2
[8091478 ms]  <<<  URB 175 coming back  <<< 
-- URB_FUNCTION_CONTROL_TRANSFER:
  PipeHandle           = 0d567060
  TransferFlags        = 0000000a (USBD_TRANSFER_DIRECTION_OUT, USBD_SHORT_TRANSFER_OK)
  TransferBufferLength = 0000000d
  TransferBuffer       = 0e0b45a0
  TransferBufferMDL    = 071820d0
  UrbLink              = 00000000
  SetupPacket          =
    00000000: 40 01 0b 00 00 00 0d 00
[8091478 ms] UsbSnoop - FilterDispatchAny(0dd57b90) : IRP_MJ_INTERNAL_DEVICE_CONTROL
[8091478 ms] UsbSnoop - FdoHookDispatchInternalIoctl(0dd57f8c) : fdo=0e0d7ab0, Irp=0d806b40, IRQL=0
[8091478 ms]  >>>  URB 176 going down  >>> 
-- URB_FUNCTION_VENDOR_DEVICE:
  TransferFlags          = 00000002 (USBD_TRANSFER_DIRECTION_OUT, USBD_SHORT_TRANSFER_OK)
  TransferBufferLength = 0000000d
  TransferBuffer       = 0e0b45d0
  TransferBufferMDL    = 00000000
    00000000: 0b 4a c0 01 01 0a 80 00 00 40 89 0e 80
  UrbLink                 = 00000000
  RequestTypeReservedBits = 00000000
  Request                 = 00000001
  Value                   = 0000000b
  Index                   = 00000000
[8091479 ms] UsbSnoop - MyInternalIOCTLCompletion(0dd57ddc) : fido=00000000, Irp=0d806b40, Context=09bd0440, IRQL=2
[8091479 ms]  <<<  URB 176 coming back  <<< 
-- URB_FUNCTION_CONTROL_TRANSFER:
  PipeHandle           = 0d567060
  TransferFlags        = 0000000a (USBD_TRANSFER_DIRECTION_OUT, USBD_SHORT_TRANSFER_OK)
  TransferBufferLength = 0000000d
  TransferBuffer       = 0e0b45d0
  TransferBufferMDL    = 071820d0
  UrbLink              = 00000000
  SetupPacket          =
    00000000: 40 01 0b 00 00 00 0d 00
[8091479 ms] UsbSnoop - FilterDispatchAny(0dd57b90) : IRP_MJ_INTERNAL_DEVICE_CONTROL
[8091479 ms] UsbSnoop - FdoHookDispatchInternalIoctl(0dd57f8c) : fdo=0e0d7ab0, Irp=0d806b40, IRQL=0
[8091479 ms]  >>>  URB 177 going down  >>> 
-- URB_FUNCTION_VENDOR_DEVICE:
  TransferFlags          = 00000002 (USBD_TRANSFER_DIRECTION_OUT, USBD_SHORT_TRANSFER_OK)
  TransferBufferLength = 0000000d
  TransferBuffer       = 0e0b45d0
  TransferBufferMDL    = 00000000
    00000000: 0b 4a c0 01 01 0b 40 00 00 40 89 0e 80
  UrbLink                 = 00000000
  RequestTypeReservedBits = 00000000
  Request                 = 00000001
  Value                   = 0000000b
  Index                   = 00000000
[8091479 ms] UsbSnoop - MyInternalIOCTLCompletion(0dd57ddc) : fido=00000000, Irp=0d806b40, Context=09bd0440, IRQL=2
[8091479 ms]  <<<  URB 177 coming back  <<< 
-- URB_FUNCTION_CONTROL_TRANSFER:
  PipeHandle           = 0d567060
  TransferFlags        = 0000000a (USBD_TRANSFER_DIRECTION_OUT, USBD_SHORT_TRANSFER_OK)
  TransferBufferLength = 0000000d
  TransferBuffer       = 0e0b45d0
  TransferBufferMDL    = 071820d0
  UrbLink              = 00000000
  SetupPacket          =
    00000000: 40 01 0b 00 00 00 0d 00
[8091480 ms] UsbSnoop - FilterDispatchAny(0dd57b90) : IRP_MJ_INTERNAL_DEVICE_CONTROL
[8091480 ms] UsbSnoop - FdoHookDispatchInternalIoctl(0dd57f8c) : fdo=0e0d7ab0, Irp=0d806b40, IRQL=0
[8091480 ms]  >>>  URB 178 going down  >>> 
-- URB_FUNCTION_VENDOR_DEVICE:
  TransferFlags          = 00000002 (USBD_TRANSFER_DIRECTION_OUT, USBD_SHORT_TRANSFER_OK)
  TransferBufferLength = 0000000d
  TransferBuffer       = 0e0b45d0
  TransferBufferMDL    = 00000000
    00000000: 0b 4a c0 01 01 0d 00 00 00 40 89 0e 80
  UrbLink                 = 00000000
  RequestTypeReservedBits = 00000000
  Request                 = 00000001
  Value                   = 0000000b
  Index                   = 00000000
[8091480 ms] UsbSnoop - MyInternalIOCTLCompletion(0dd57ddc) : fido=00000000, Irp=0d806b40, Context=09bd0440, IRQL=2
[8091480 ms]  <<<  URB 178 coming back  <<< 
-- URB_FUNCTION_CONTROL_TRANSFER:
  PipeHandle           = 0d567060
  TransferFlags        = 0000000a (USBD_TRANSFER_DIRECTION_OUT, USBD_SHORT_TRANSFER_OK)
  TransferBufferLength = 0000000d
  TransferBuffer       = 0e0b45d0
  TransferBufferMDL    = 071820d0
  UrbLink              = 00000000
  SetupPacket          =
    00000000: 40 01 0b 00 00 00 0d 00
[8091480 ms] UsbSnoop - FilterDispatchAny(0dd57b90) : IRP_MJ_INTERNAL_DEVICE_CONTROL
[8091480 ms] UsbSnoop - FdoHookDispatchInternalIoctl(0dd57f8c) : fdo=0e0d7ab0, Irp=0d806b40, IRQL=0
[8091480 ms]  >>>  URB 179 going down  >>> 
-- URB_FUNCTION_VENDOR_DEVICE:
  TransferFlags          = 00000002 (USBD_TRANSFER_DIRECTION_OUT, USBD_SHORT_TRANSFER_OK)
  TransferBufferLength = 0000000d
  TransferBuffer       = 0e0b45d0
  TransferBufferMDL    = 00000000
    00000000: 0b 4a c0 01 01 0c 40 00 00 40 89 0e 80
  UrbLink                 = 00000000
  RequestTypeReservedBits = 00000000
  Request                 = 00000001
  Value                   = 0000000b
  Index                   = 00000000
[8091481 ms] UsbSnoop - MyInternalIOCTLCompletion(0dd57ddc) : fido=00000000, Irp=0d806b40, Context=09bd0440, IRQL=2
[8091481 ms]  <<<  URB 179 coming back  <<< 
-- URB_FUNCTION_CONTROL_TRANSFER:
  PipeHandle           = 0d567060
  TransferFlags        = 0000000a (USBD_TRANSFER_DIRECTION_OUT, USBD_SHORT_TRANSFER_OK)
  TransferBufferLength = 0000000d
  TransferBuffer       = 0e0b45d0
  TransferBufferMDL    = 071820d0
  UrbLink              = 00000000
  SetupPacket          =
    00000000: 40 01 0b 00 00 00 0d 00
[8091481 ms] UsbSnoop - FilterDispatchAny(0dd57b90) : IRP_MJ_INTERNAL_DEVICE_CONTROL
[8091481 ms] UsbSnoop - FdoHookDispatchInternalIoctl(0dd57f8c) : fdo=0e0d7ab0, Irp=0d806b40, IRQL=0
[8091481 ms]  >>>  URB 180 going down  >>> 
-- URB_FUNCTION_VENDOR_DEVICE:
  TransferFlags          = 00000002 (USBD_TRANSFER_DIRECTION_OUT, USBD_SHORT_TRANSFER_OK)
  TransferBufferLength = 0000000d
  TransferBuffer       = 0e0b4580
  TransferBufferMDL    = 00000000
    00000000: 0b 4a c0 01 01 09 01 00 00 00 d6 09 80
  UrbLink                 = 00000000
  RequestTypeReservedBits = 00000000
  Request                 = 00000001
  Value                   = 0000000b
  Index                   = 00000000
[8091481 ms] UsbSnoop - MyInternalIOCTLCompletion(0dd57ddc) : fido=00000000, Irp=0d806b40, Context=09bd0440, IRQL=2
[8091481 ms]  <<<  URB 180 coming back  <<< 
-- URB_FUNCTION_CONTROL_TRANSFER:
  PipeHandle           = 0d567060
  TransferFlags        = 0000000a (USBD_TRANSFER_DIRECTION_OUT, USBD_SHORT_TRANSFER_OK)
  TransferBufferLength = 0000000d
  TransferBuffer       = 0e0b4580
  TransferBufferMDL    = 071820d0
  UrbLink              = 00000000
  SetupPacket          =
    00000000: 40 01 0b 00 00 00 0d 00
